"id","character","source","translatedstr"
"main_0004_D_04_00_029(0)","美希","……あはっ☆
このおにぎり、すっごくおいしいの♪","...... A-ha☆
These onigiri are so delicious!"
"main_0004_D_04_00_030(0)","甘奈","本当だねっ！　塩加減もちょうどいい感じ！
これならいくらでも食べられるかもっ！","It's true! The saltiness is just right!
I could eat this as much as I wanted!"
"main_0004_D_04_00_031(0)","春香","私も少しだけどお菓子を作ってきたんだ。
よかったら食べてみて♪","I've been baking a few treats myself.
Try it if you like..."
"main_0004_D_04_00_032(0)","凛世","春香さん……ありがとうございます……。
……おいしい……","Thank you Haruka for ....... ......
...... Delicious ......"
"main_0004_D_04_00_033(0)","美嘉","アタシも、もーらい★
……うんっ、メッチャおいしい！","I, too, want to be a part of it.
......Yeah, it's really good!"
"main_0004_D_04_00_034(0)","春香","……よかった～！
みんなの口に合うか、ちょっと心配だったんだ～","...... Thank goodness!
I was a little worried about whether it would be good for everyone's palate."
"main_0004_D_04_00_035(0)","美希","春香の作ったお菓子は、とってもおいしいの☆
ミキ、どんどん食べちゃうのー♪","The sweets made by Haruka are very delicious.
Miki, you keep eating more and more!"
"main_0004_D_04_00_036(0)","心白","……飲み物より、食べるものが
足りなくなりそうですね","...... more food to eat than beverages.
I'm afraid we're going to run out."
"main_0004_D_04_00_037(0)","心白","何か買い出しに……あっ。
この近くに、クレープ屋さんが……","I went to ...... to buy something.
Near here, there is a crepe shop ......"
"main_0004_D_04_00_038(0)","蘭子","甘美なる饗宴。
我が魔力を満たす贄に相応しい！","A sweet feast.
It is worthy of the sacrifice that satisfies my magic!"
"main_0004_D_04_00_039(0)","（蘭子ログ）","（わぁ～、クレープいいですね！）","(Wow, crepes sound good!)"
"main_0004_D_04_00_040(0)","心白","えっと……つまり、食べたいってことですか？
蘭子さん、一緒に買いに行きましょう","Let's see... ...... So you mean you want to eat it?
Ranko, let's go buy it together."
"main_0004_D_04_00_041(0)","蘭子","うむ！　贄なる供物の数々……。
ほとばしる魔力がうねり乱れているわ！","Mm! Sacrificial offerings: .......
It's a swirling mess of surging magic!"
"main_0004_D_04_00_042(0)","（蘭子ログ）","（はい！　いろんな味を食べ比べてみたいですっ！）","（I want to compare different flavors!)"
"main_0004_D_04_00_043(0)","心白","そうですね。
少しずつ分け合いながら、別の味を楽しみましょう","Yes, it is.
Share a little and enjoy different tastes!"
"main_0004_D_04_00_044(0)","伊織","……心白、すごいわね。
あそこまで蘭子と会話できるなんて","...... Kohaku, that's great.
I can't believe you can talk to Ranko that well."
"main_0004_D_04_00_045(0)","未来","私も、もっと蘭子ちゃんと喋りたいです！","I, too, would like to talk more with Ranko!"
"main_0004_D_04_00_046(0)","伊織","この人数分だと、ふたりだけじゃ持ちきれないわ。
未来、私たちも手伝いましょ！","We can't hold this many people with just the two of us.
Let us help you Mirai!"
"main_0004_D_04_00_047(0)","響","へー！
果穂って、ヒーローが好きなんだ！","Heh!
Kaho likes heroes!"
"main_0004_D_04_00_048(0)","果穂","はいっ！
正義の味方ってカッコいいですよねっ！","Yes, sir!
It's cool to be on the side of justice!"
"main_0004_D_04_00_049(0)","響","うんうん、分かるぞ！
やっぱり憧れるよねー！","Yeah, yeah, I know what you mean!
I still long for it, don't you?"
"main_0004_D_04_00_050(0)","翼","わたしは、カッコよく戦うより、
カワイく戦うほうが好みですね～","I am more than a cool fighter,
I prefer to fight cute!"
"main_0004_D_04_00_051(0)","菜々","ナナは、やっぱり魔法少女系がいいですね！
衣装もかわいいし、変身シーンも最高ですから♪","Nana is still a good magical girl type!
Because the costumes are cute and the transformation scenes are great♪"
"main_0004_D_04_00_052(0)","菜々","ウサミンパワーで、メルヘンチェーンジ！
……なんちゃって♪","Usamin power, mercurial chainage!
...... What the heck♪"
"main_0004_D_04_00_053(0)","真","うん！　ヒーローアクションもカッコイイけど、
プリプリのヒロイン衣装は外せないよね！","Yeah! Heroic action is cool, though,
You can't miss the pre-prepared heroine costumes!"
"main_0004_D_04_00_054(0)","果穂","そうだ！　みんなでヒーローごっこ、しませんか？
名付けて、アイドルヒーロー『ルミナス』です！","That's right! Why don't we all play hero?
The name is ""Luminous,"" an idol hero!"
"main_0004_D_04_00_055(0)","響","アイドルヒーロー『ルミナス』……！
なんだか、かっこいいぞ！","Idol Hero ""Luminous"" ......!
That's kind of cool!"
"main_0004_D_04_00_056(0)","菜々","いいですね！
みんなでやりましょう！","Nice!
Let's do it together!"
"main_0004_D_04_00_057(0)","翼","あっ！　私も参加したいー！
ダメですか～？","Oh! I want to participate too!
No good~?"
"main_0004_D_04_00_058(0)","果穂","はい！　翼さんもやりましょう！","Yes! Let's do it, Tsubasa-san!"
"main_0004_D_04_00_059(0)","菜々","ヒーローってことは、
まずはみんなの色を決めないとですね！","Heroes, you mean,
First we need to decide on the colors for everyone!"
"main_0004_D_04_00_060(0)","果穂","あたし、レッドがいいですっ！
――情熱の、ルミナスレッド、参上ですっ！","I like red!
--Passionate, luminous red, here we come!"
"main_0004_D_04_00_061(0)","翼","私、イエローがいいな～♪
――いえーい！　ルミナスイエローで～す♪","Me, I'd like yellow...Â
--Luminous yellow...."
"main_0004_D_04_00_062(0)","響","果穂がレッドで、翼がイエローと……。
自分は……うん！　ライトブルーがいいぞ","Kaho is red and Tsubasa is yellow and .......
I'm ...... yeah! Light blue is good!"
"main_0004_D_04_00_063(0)","響","――ルミナスライトブルー、なんくるないさー！","--Luminous Light Blue, what a surprise!"
"main_0004_D_04_00_064(0)","真","それならボクは、ブラックにしよっと。
ルミナスブラック、華麗に決めるっ！","Then I'll go with black.
Luminous Black, you decide brilliantly!"
"main_0004_D_04_00_065(0)","菜々","ナナはピンクでお願いしますっ♪
――愛と正義のルミナスピンク参上です！　ぶいっ！","Nana in pink, please... ♪
--Here comes the Luminous Pink of love and justice!"
"main_0004_D_04_00_066(0)","あずさ","まぁ、みんな楽しそうね。
なんの話をしているのかしら","Well, everyone seems to be having fun.
I don't know what you're talking about."
"main_0004_D_04_00_067(0)","雪歩","よかったら、私たちも混ぜてくださいー","If you'd like, we'd be happy to join you!"
"main_0004_D_04_00_068(0)","果穂","真さんと、響さんと、菜々さんと、翼さんと
どんな色のヒーローをやるか決めていました！","Makoto, Hibiki, Nana, Tsubasa, and
I had to decide what color hero I would play!"
"main_0004_D_04_00_069(0)","果穂","あずささんと雪歩さんは
何色にしますかっ","Azusa and Yukiho are
what color shall we choose?"
"main_0004_D_04_00_070(0)","あずさ","そうね。私はパープルにしようかしら？
うふふっ、私はルミナスパープルよ～！","Yes, I think I'll go with purple.
Ummm, I'm a luminous purple!"
"main_0004_D_04_00_071(0)","雪歩","じゃあ、私はホワイトがいいかな？
えっと……ルミナスホワイト、参上しましたぁ！","Okay, I guess I'll go with white then.
Let's see, ...... Luminous White, here I come!"
"main_0004_D_04_00_072(0)","果穂","わぁっ！　パープルもホワイトもカッコいいです！
それじゃあ……全員でとつげきですー！","Wow! Both purple and white are cool!
Then it's a ...... all together in a fight!"
"main_0004_D_04_00_073(0)","杏","昼間からお仕事もせず、お菓子を食べながら
ゲームできるなんて……幸せ……","No work during the day, eating sweets.
I'm so ...... happy ...... to be able to play games!"
"main_0004_D_04_00_074(0)","歌織","杏ちゃん、何のゲームをしているの？
……まぁ。動物の絵がかわいいわね♪","Anzu, what game are you playing?
...... Well...the animal drawings are adorable...Â"
"main_0004_D_04_00_075(0)","甜花","甜花も……これ、好き……。
かわいいけど……戦略性があって、面白い……","Tenka are also ...... this, I like .......
Cute but ...... strategic and interesting ......"
"main_0004_D_04_00_076(0)","亜美","あー！　そのゲーム、亜美と真美もやってるよ！
オンライン対戦できるのがいいよね～♪","Ah! Ami and Mami play that game too!
It would be nice to be able to play online...Â"
"main_0004_D_04_00_077(0)","真美","でも、ふたり対戦までだったよね？
せっかくだし、大人数でやれるゲームやろうよ♪","But we were up to two against each other, right?
Since we're here, let's play a game that can be played by a large group of people."
"main_0004_D_04_00_078(0)","やよい","だったら、トランプをやりましょう！　みんなで
遊びたいって思って、事務所から持ってきましたー♪","Then let's play cards! All of us!
I wanted to play with it, so I brought it from the office."
"main_0004_D_04_00_079(0)","律子","ナイスアイディアね、やよい。
トランプなら、みんなで楽しめるし","Nice idea, Yayoi.
With cards, it's fun for everyone."
"main_0004_D_04_00_080(0)","律子","さて、どんな遊びがいいかしら？　みんなは何か
リクエストある？","Well, what kind of fun would you like to have? What do you everyone have in mind?
Do you have a request?"
"main_0004_D_04_00_081(0)","杏","この人数で、トランプか～。
だったら、杏は大富豪がやりたいな～","With this number of people, trumps it!
If that's the case, I'd like to play millionaire!"
"main_0004_D_04_00_082(0)","甜花","大富豪……楽しそう……。
甜花も、賛成……","The millionaire ...... looks like fun .......
Tenka also agrees: ......"
"main_0004_D_04_00_083(0)","真美","じゃあじゃあ、負けた人は罰ゲームってことで！","Okay, then, let's say the loser is the punisher!"
"main_0004_D_04_00_084(0)","亜美","おっ、いいね！　んっふっふ～♪
すっごい罰ゲーム、考えちゃうかんね～♪","Oh, that's good!
I'm going to think of a great punishment game!"
"main_0004_D_04_00_085(0)","甜花","ひぃっ！　ふ、双海さんと、双海さん……
お、お手柔らかに……！","Hii! Fu, Futami-san and Futami-san ......
Oh, please take it easy on us at ......!"
"main_0004_D_04_00_086(0)","真美","もう、テンテン！　『双海さん』じゃ、
亜美と真美どっちのことか、わかんないじゃん！","Oh, my God, Tenten! It's ""Futami-san,
You don't know whether I'm talking about Ami or Mami!"
"main_0004_D_04_00_087(0)","亜美","そうだそうだ！　お気軽に、亜美は『亜美ちゃん』で
真美は『真美ちゃん』、ってことでよろよろ～！","Yes, yes, yes! Feel free to call Ami ""Ami-chan"".
Mami is ""Mami-chan"", so yoyoyoro~!"
"main_0004_D_04_00_088(0)","甜花","て、テンテンって……甜花……？
えと、それじゃ……亜美ちゃん……真美ちゃん……","Teh, ten-ten is ...... Tenka ......?
Let's see, then: ...... Ami ...... Mami ......"
"main_0004_D_04_00_089(0)","甜花","にへへ……よろしく、ね……","Nhehehehe ...... nice to meet you, right? ......"
"main_0004_D_04_00_090(0)","未来","みんな、楽しそうですね。
無事に開催できてよかったです！","Everyone seems to be having a good time.
I am glad that the event was held safely!"
"main_0004_D_04_00_091(0)","心白","未来さんありがとうございます。
みなさんと準備が出来て、すごく楽しかったです","Thank you, Mirai.
It was a lot of fun getting ready with you all!"
"main_0004_D_04_00_092(0)","心白","ルミナスのメンバーとも、お話が出来ました……。
みんなと舞台に立つことが出来そうです","I was also able to speak with members of the Luminous team at .......
I will be able to be on stage with everyone!"
"main_0004_D_04_00_093(0)","未来","私の方こそ、ありがとうございます！　
心白さん、一緒に最高のステージにしましょう！","Thank you very much for my part!
Kohaku-san, let's make this the best stage together!"
"main_0004_D_04_00_094(0)","Ｐ","（心白、未来、良かったな……！）","(Good for you, Kohaku, Mirai, ......!)"
"main_0004_D_04_00_095(0)","静香","そろそろかしらね","Maybe it's time."
"main_0004_D_04_00_096(0)","紬","はい、私もそう思います","Yes, I agree."
"main_0004_D_04_00_097(0)","翼","そうだね～、そろそろ行こっか？","I guess so - should we get going?"
"main_0004_D_04_00_098(0)","歌織","ふふっ……。
未来ちゃん、そろそろ例のアレ、始めましょうか♪","Phew. .......
Mirai, let's get started on that thing..."
"main_0004_D_04_00_099(0)","未来","はい！　みんなー、注目してくださーい！
これから一緒に屋上に行きましょう！","Yes!
Let's go to the rooftop together from now on!"
"main_0004_D_04_00(101)","紬","見てもらいたいものがあるんです！","I have something I want you to see!"
"main_0004_D_04_00(102)","Ｐ","よし、みんな行ってみよう！","Okay, let's all go!"
"main_0004_D_04_00(103)","春香","わぁ……♪","Wow. ......♪"
"main_0004_D_04_00(104)","美希","……すっごい、桜なの！","...... is amazing, it's cherry blossoms!"
"main_0004_D_04_00(105)","千早","キレイね……","Beautiful. ......"
"main_0004_D_04_00(106)","雪歩","わぁ……本物みたいですぅ！","Wow ...... looks so real!"
"main_0004_D_04_00(107)","甜花","本物より……キレイ、かも……","More ...... beautiful than the real thing, maybe ......"
"main_0004_D_04_00(108)","凛世","これを……
凛世たちが……","You can find this at ......
Rinze and her colleagues ......"
"main_0004_D_04_00(109)","杏","うん、労働に見合った対価を感じるよ","Yeah, I feel like I'm getting my money's worth for my labor."
"main_0004_D_04_00(110)","きらり","わぁ～……とってもキレイ……！
きらりん、キュンキュン☆","Wow ...... very beautiful ......!
Kirarin, kyun kyun☆."
"main_0004_D_04_00(111)","Ｐ","（静香たちは最後にこれを仕込んでいたのか……）","(Did Shizuka and the others plant this one at the end: ......)"
"main_0004_D_04_00(112)","律子","小鳥さんが、知り合いの大道具さんからレンタル
したみたいですよ","A little bird rented from a props company I know.
It looks like he did."
"main_0004_D_04_00(113)","Ｐ","律子が静香たちにアドバイスしてくれたのか？","Did Ritsuko advise Shizuka and the others?"
"main_0004_D_04_00(114)","律子","それは秘密です。
ご自由に推測してください","It is a secret.
Feel free to speculate."
"main_0004_D_04_00(115)","未来","じゃじゃーん！　この短冊に注目してくださ～い！","Please pay attention to this strip of paper!"
"main_0004_D_04_00(116)","貴音","はて、花見で短冊とはどういうことでしょう？","Haha, what do you mean by ""tanzaku"" in hanami?"
"main_0004_D_04_00(117)","未来","今から、みなさんにこの短冊を配ります。
ここに、みなさんの想いや願いを書いてください！","I will now hand out these strips of paper to everyone.
Please write your thoughts and wishes here!"
"main_0004_D_04_00(118)","静香","短冊で何をするかと思ったら……。
七夕じゃないのよ、未来","If you are wondering what to do with the strips of paper, you can go to .......
It's not Tanabata, Tsubasa."
"main_0004_D_04_00(119)","未来","うん！　知ってるよ。
だけど、みんなで書きたいの！","Yeah! I know.
But we all want to write!"
"main_0004_D_04_00(120)","未来","『スターリットシーズン』って、選抜戦なんだよね。
最後までいけるか、分からないじゃない？","The ""Starlit Season"" is a selective competition.
You don't know if you can make it to the end."
"main_0004_D_04_00(121)","未来","だから、最後までいけたときに、
この短冊を見て、自分のお願いがかなったか――","So, when you can get to the end,
I look at these strips of paper and wonder if my request has been fulfilled--"
"main_0004_D_04_00(122)","未来","みんなで確かめたいの！","We all want to be sure!"
"main_0004_D_04_00(123)","春香","未来ちゃん……","Mirai: ......"
"main_0004_D_04_00(124)","咲耶","素晴らしいアイディアだね。
ぜひ、書かせてくれないか","Great idea.
By all means, let me write about it."
"main_0004_D_04_00(125)","菜々","ナナも☆","Nana ☆"
"main_0004_D_04_00(126)","果穂","あたしも……っ！","I also have a ......!"
"main_0004_D_04_00(127)","蘭子","我も！","Me too!"
"main_0004_D_04_00(128)","（蘭子ログ）","（私も）","(Me too.)"
"main_0004_D_04_00(129)","未来","みんな、ありがとうございます！","Thank you all!"
"main_0004_D_04_00(130)","Ｐ","（みんな何を願い、何を想っているのかな……）","(What do they all wish and think about? ......)"
"main_0004_D_04_00(131)","未来","プロデューサーさんも書いてください！","Producers should also write!"
"main_0004_D_04_00(132)","Ｐ","お、俺か？","Oh, is that me?"
"main_0004_D_04_00(133)","未来","自分だけ書かないなんてずるいですよー","It's not fair that you are the only one not writing!"
"main_0004_D_04_00(134)","未来","最後に『スターリットドーム』にいった時に、
あとの楽しみがなくなっちゃうじゃないですかぁ～","The last time I went to ""Starlit Dome"",
I'm going to miss out on the rest of the fun!"
"main_0004_D_04_00(135)","Ｐ","わかった。短冊をくれ","All right, give me a strip of paper."
"main_0004_D_04_00(136)","未来","はい！
よろしくお願いします、プロデューサーさん！","Yes!
Nice to meet you, producer!"
"main_0004_D_04_00(137)","Ｐ","（俺の願いか……。
――それは、決まっているな……）","(My wish or .......
--That's a given. ......)"
"main_0004_D_04_00(138)","響","プロデューサー、なにをボーっとしてるの？
お花見はまだまだこれからだぞー","Producers, what are you dawdling about?
Cherry blossom viewing is still to come!"
"main_0004_D_04_00(139)","Ｐ","ああ、そうだな。響こそ、はしゃぎすぎて
ステージに影響が出ないようにするんだぞ","Yeah, well, Hibiki's the one who got too excited.
You don't want it to affect the stage."
"main_0004_D_04_00(140)","響","それなら大丈夫だぞ！　
自分、元気は自信あるからね！","Then you'll be fine!
I'm confident in my energy!"
"main_0004_D_04_00(141)","Ｐ","そうだったな！　響には心配無用だった。
さあ、みんなのところに行くぞ！","That's right! There was no need to worry about the sound.
Come on, let's go to the everyone!"
"main_0004_D_05_00_001(0)","Ｐ","（みんな、いい感じに打ち解けているな。
さて、俺も誰かと話そうか……）","(You everyone are hitting it off nicely.
Well, I'll talk to someone too (......)"
"main_0004_D_05_00_002(0)","Ｐ","（よし、今回の歌唱メンバーの子と
話をしてみよう。そうだな……）","(Okay, with a child who is a member of this singing group.
Let's talk about it...yes ......)"
"main_0004_D_05_00_003(0)","選択肢","心白","Kohaku"
"main_0004_D_05_00_004(0)","選択肢","春香","Haruka"
"main_0004_D_05_00_005(0)","選択肢","伊織","Iori"
"main_0004_D_05_00_006(0)","選択肢","真","Makoto"
"main_0004_D_05_00_007(0)","選択肢","響","Hibiki"
"main_0004_D_05_00_008(0)","選択肢","未来","Mirai"
"main_0004_D_05_00_009(0)","選択肢","菜々","Nana"
"main_0004_D_05_00_010(0)","選択肢","杏","Anzu"
"main_0004_D_05_00_011(0)","選択肢","甘奈","Amana"
"main_0004_D_05_00_012(0)","選択肢","甜花","Tenka"
"main_0004_D_05_00_013(0)","Ｐ","心白、親睦会は楽しんでいるか？","Kohaku, are you enjoying the party?"
"main_0004_D_05_00_014(0)","心白","はい。みなさんとたくさんお話ができて、
とても楽しいです！","Yes, I had a lot of fun talking with everyone,
It is very enjoyable!"
"main_0004_D_05_00_015(0)","心白","レッスン中や帰り道だと、
お話できる時間が限られていますから","During a lesson or on the way home,
We have limited time to talk to you."
"main_0004_D_05_00_016(0)","Ｐ","よかったな、みんなと話が出来て。
これも、心白や未来たちが頑張ってくれたからだな","Good for you, I got to talk to all of you.
This is all thanks to the hard work of Kohaku, Mirai's group."
"main_0004_D_05_00_017(0)","心白","はい！　素敵な場を設けてくれた、
未来さんたちに感謝ですね","Yes! You have set up a wonderful place,
Thanks to Mirai's group."
"main_0004_D_05_00_018(0)","Ｐ","春香、親睦会は楽しんでいるか？","Haruka, are you enjoying the party?"
"main_0004_D_05_00_019(0)","春香","あ、プロデューサーさん！　えへへっ♪
みんなと一緒に過ごせて、とっても楽しいです！","Oh, producer!
It is great fun to spend time with everyone!"
"main_0004_D_05_00_020(0)","春香","おしゃべりも楽しいし、食べ物もおいしいし……","The chats are fun and the food is delicious. ......"
"main_0004_D_05_00_021(0)","Ｐ","春香たちが、サポートしてくれたおかげだ。
みんなにとっていい親睦会になったな","Haruka and her colleagues have been very supportive.
Nice get-together for all of us."
"main_0004_D_05_00_022(0)","春香","こうしてゆっくり話せる時間って、
とっても大切だって、改めて思いました！","I can't believe we have the time to talk like this,
I was reminded that it is very important!"
"main_0004_D_05_00_023(0)","Ｐ","伊織、親睦会は楽しんでいるか？","Iori, are you enjoying the party?"
"main_0004_D_05_00_024(0)","伊織","ええ、楽しんでるわ♪
他のみんなも、気兼ねなく話せてるみたいだし","Yeah, I'm having fun.
Everyone else seems to be able to talk without hesitation."
"main_0004_D_05_00_025(0)","Ｐ","そうだな、他の事務所のメンバーが集まって
ひとつになる機会なんて、なかったからな","Yes, members of other firms got together.
We never had a chance to be as one."
"main_0004_D_05_00_026(0)","伊織","ふふっ♪　この伊織ちゃんのサポートで、
親睦会は大成功ってところね♪","Hmmm...with this Iori's support,
The party was a great success."
"main_0004_D_05_00_027(0)","伊織","ルミナスは個性的なメンバーばかりなんだから、
困ったら、私に頼りなさいよ？","Luminous is full of unique members,
If you need help, you can count on me, okay?"
"main_0004_D_05_00_028(0)","Ｐ","真、親睦会は楽しんでいるか？","True, are you enjoying the party?"
"main_0004_D_05_00_029(0)","真","はいっ！　もうサイコーですっ！","Yes!"
"main_0004_D_05_00_030(0)","真","やっぱり、仕事やレッスンだけじゃなくて
こういった機会も大切ですよね","After all, it's not just about work and lessons.
These opportunities are important, too."
"main_0004_D_05_00_031(0)","Ｐ","『スターリットシーズン』は始まったばかりだ。
真の活躍、期待しているぞ","The ""Starlit Season"" has just begun.
True success, I'm counting on you!"
"main_0004_D_05_00_032(0)","真","まだまだ、ガンガン盛り上げていきますよ！
プロデューサーも一緒に楽しみましょう！","We are still gung-ho about it!
Producers are welcome to join in the fun!"
"main_0004_D_05_00_033(0)","Ｐ","響、親睦会は楽しんでいるか？","Hibiki, are you enjoying the party?"
"main_0004_D_05_00_034(0)","響","あ、プロデューサー！
もちろん、楽しんでるさー！","Oh, producer!
Of course I'm having fun!"
"main_0004_D_05_00_035(0)","Ｐ","よかった。
だいぶ盛り上がっているみたいだな","Good.
Sounds like a lot of excitement."
"main_0004_D_05_00_036(0)","響","楽しすぎて、全然時間が足りないぞ！
あ～、一日がもっと長かったらよかったのに～！","You're having too much fun and not enough time at all!
Oh, I wish the day had been longer!"
"main_0004_D_05_00_037(0)","響","こうなったら残り時間も全力で楽しむぞ！
自分、もっとみんなと話してくるね！","If this happens, I'll do my best to enjoy the remaining time!
I'm going to go talk to everyone more!"
"main_0004_D_05_00_038(0)","Ｐ","未来、親睦会は楽しんでいるか？","Mirai, are you enjoying the party?"
