"id","character","source","translatedstr"
"main_0009_X_00_00_001(0)","Ｐ","（先月は忙しかったな……。
こうして街中を歩くのも、久しぶりな気がする）","(You were busy last month. .......
(I feel like it's been a long time since I've walked around town like this.)"
"main_0009_X_00_00_002(0)","男子学生Ａ","今年の『アイドルサマー』のネット中継も、
アツかったね","There will also be a webcast of this year's ""Idol Summer,
That was hot."
"main_0009_X_00_00_003(0)","男子学生Ｂ","ああ、ルミナスのステージなんか、
最高に盛り上がってたよな","Oh, something about the Luminous stage,
It was the best of the best, wasn't it?"
"main_0009_X_00_00_004(0)","男子学生Ａ","『アイドルサマー』で初めて知ったんだけど、
ルミナスって半端ナイ一体感だったね","I first heard about it in ""Idol Summer.""
Luminous was a half-assed experience."
"main_0009_X_00_00_005(0)","Ｐ","（ルミナスの名前を聞くなんて……。
この夏の成果を、肌で感じるな）","(I can't believe I heard the name Luminous at .......
(Don't feel the results of this summer on your skin)"
"main_0009_X_00_00_006(0)","Ｐ","（今日から９月、
社長が話があると言っていたけど――）","(Today is September,
The president said she wanted to talk to you--)"
"main_0009_X_00_00_007(0)","Ｐ","失礼します","excuse me"
"main_0009_X_00_00_008(0)","高木","いやー、お疲れ様！
奥空君の問題解決、よく頑張ったね！","Well, thank you for your hard work!
Good job on solving your problem, Okuzora!"
"main_0009_X_00_00_009(0)","Ｐ","俺だけの力ではありません。
ルミナスのメンバーみんなのおかげです","It's not just me.
Thanks to all the members of Luminous!"
"main_0009_X_00_00_010(0)","高木","君のことだ、そう言うと思ったよ","I knew you would say that."
"main_0009_X_00_00_011(0)","小鳥","実はさきほど、奥空眞弓さんから、
社長にお礼の連絡があったんです","Actually, I just received this from Mayumi Okuzora,
I got a call from the president thanking me."
"main_0009_X_00_00_012(0)","高木","君のことを、ずいぶんと褒めていたよ","She was very complimentary of you."
"main_0009_X_00_00_013(0)","高木","そして、『ルミナスは、もっと輝くでしょう』
とも言っていた","And 'Luminous will shine brighter.'
She also said."
"main_0009_X_00_00_014(0)","Ｐ","……ありがとうございます","Thank you ......"
"main_0009_X_00_00_015(0)","高木","眞弓君の言葉、私もその通りだと思う。
それに、あの新しいパフォーマンス……","Mayumi, what you said, I agree with you.
Plus, that new performance ......"
"main_0009_X_00_00_016(0)","高木","また１歩、先の世界に踏み込めたようだね","Looks like you've taken another step into the world ahead of you."
"main_0009_X_00_00_017(0)","Ｐ","はい、プロデューサー冥利につきます","Yes, it's a producer's dream!"
"main_0009_X_00_00_018(0)","高木","うむ、そうだね。しかし、まだまだ君は、
ルミナスの活動の幅を広げられるはずだ","Mm, yes, but you're not there yet,
That should broaden the scope of Luminous's activities."
"main_0009_X_00_00_019(0)","高木","そこで、新生ルミナスの宣伝も兼ねて、
積極的に巡業にでるのはどうかね？","So, we are also promoting the new Luminous,
How about actively going on tour?"
"main_0009_X_00_00_020(0)","高木","地方でのライブやイベントで、新しいファン層を
獲得しても、いい頃じゃないかな","New fan base with local gigs and events.
It's about time we got it."
"main_0009_X_00_00_021(0)","Ｐ","巡業……ですか。確かに活動の幅を広げて、
新しいファン層を発掘することを考えていました","Are you a touring ......? Certainly broaden the scope of your activities,
We were thinking about finding a new fan base."
"main_0009_X_00_00_022(0)","高木","それは良かった。ああ、それと、君に見せて
おきたいものがあるんだ。音無君、いいかな","That's good to know. oh, and let me show you.
I have something I want to show you, OTONASHI-kun, if you don't mind."
"main_0009_X_00_00_023(0)","小鳥","はい、こちらをご覧ください。
『スターリットドーム』の案内がきました","Yes, please see here.
I received a guide to ""Starlit Dome."
"main_0009_X_00_00_024(0)","Ｐ","（これが『スターリットドーム』……）","(This is the ""Starlit Dome"" ......)"
"main_0009_X_00_00_025(0)","小鳥","『星々の輝きの集う場所――
月に届く想い――』","""Where the stars shine together...
Thoughts reaching the moon..."""
"main_0009_X_00_00_026(0)","小鳥","それが、『スターリットドーム』
のコンセプトみたいですね","That is the ""Starlit Dome.
It sounds like the concept of"
"main_0009_X_00_00_027(0)","高木","ドームが月の半球を意識しているようだが、
全ては明かされてないようだね","The dome seems to be aware of the hemisphere of the moon,
I guess all is not revealed."
"main_0009_X_00_00_028(0)","高木","ここから『スターリットシーズン』も後半戦だ","Here comes the second half of the ""Starlit Season."""
"main_0009_X_00_00_029(0)","高木","ルミナスがこれからどうなっていくのか、
楽しみにしているよ","What will happen to Luminous in the future?
Looking forward to it."
"main_0009_X_00_00_030(0)","Ｐ","はい！　俺も楽しみです！","Yes! I'm looking forward to it too!"
"main_0009_B_02_00_001(0)","Ｐ","『スターリットシーズン』も後半戦だ。
残す祭典のステージは２つ","It's the second half of the ""Starlit Season.
Two stages of the celebration remain"
"main_0009_B_02_00_002(0)","Ｐ","１０月の『ハロウィンオータム』","Halloween Autumn"" in October"
"main_0009_B_02_00_003(0)","Ｐ","そして１２月の『クリスタルウィンター』。
場所は『スターリットドーム』だ","And ""Crystal Winter"" in December.
The place is the ""Starlit Dome."""
"main_0009_B_02_00_004(0)","Ｐ","みんな。心機一転して、
今月も、気を引き締めていこう！","A fresh start, everyone,
Let's keep our spirits up this month!"
"main_0009_B_02_00_005(0)","春香","はいっ、プロデューサーさん！
任せてくださいっ","Yes, Producer-san!
I'll take care of it!"
"main_0009_B_02_00_006(0)","やよい","今月も、一生懸命がんばりまーすっ！
ですよね、心白さん！","I will do my best again this month!
Right, Kohaku-san?"
"main_0009_B_02_00_007(0)","心白","はい。
みなさんと一緒なら、どこまでも行けそうです！","Yes.
With all of you, I can go anywhere!"
"main_0009_B_02_00_008(0)","律子","ふふっ。心白の件も解決して、
ユニットの雰囲気が良くなったわね","Phew...and Kohaku thing is resolved too,
You've really improved the vibe of the unit."
"main_0009_B_02_00_009(0)","あずさ","そうですね。
今月はルミナスの新たな門出になりそうです","Yes, it is.
This month will be a new beginning for Luminous!"
"main_0009_B_02_00_010(0)","雪歩","はい！　これからがすごく楽しみです♪","Yes! I'm really looking forward to the future."
"main_0009_B_02_00_011(0)","凛世","はい……","Yes ......"
"main_0009_B_02_00_012(0)","Ｐ","先々のことを見据えながら、
９月はしっかりとファンを増やしていきたい","While looking ahead,
We want to make sure we have a strong fan base in September."
"main_0009_B_02_00_013(0)","千早","そうですね……。
具体的にはどのような方法で？","Yes, .......
In what specific way?"
"main_0009_B_02_00_014(0)","菜々","きっと、ウサミン星人もびっくりな秘策で
集めるんじゃないですか？","I'm sure that even the Usamin aliens are amazed at the secret plan.
I think you're going to collect."
"main_0009_B_02_00_015(0)","紬","なるほど……なにか妙案があるというのですね。
どのようなものでしょうか？","I see that ...... has some strange ideas.
What is it like?"
"main_0009_B_02_00_016(0)","Ｐ","い、いや……秘策とか妙案ってほどの
ものじゃないんだけど","No, no, ...... not so much a secret or strange idea.
it's not what one expects"
"main_0009_B_02_00_017(0)","Ｐ","この夏を乗り切った結果、団結も深まった。
ここからは――新生ルミナスだ！","As a result of surviving this summer, unity has deepened.
From here - it's the new Luminous!"
"main_0009_B_02_00_018(0)","Ｐ","この力がどこまで通用するか、
改めてルミナスの単独ライブを行おうと思う！","How far will this power go?
Once again, I would like to do a solo show for Luminous!"
"main_0009_B_02_00_019(0)","亜美","お～！　単独ライブですと？
こりゃまた大きく出ましたね、兄ちゃんさんや","Oh~! A solo live concert?
Well, you've come up big again, brother."
"main_0009_B_02_00_020(0)","真美","そうじゃのう。しかし今の真美たちなら、
ドンとコイ、ドンドンパフパフですのう！","Yes, but Mami and her friends now can do it,
Don and Coy, it's Don Don Puff Puff!"
"main_0009_B_02_00_021(0)","杏","単独ライブかー。うまく成功できれば、
たくさんファンを集められるよね","A solo show...if it goes well,
You're going to get a lot of fans."
"main_0009_B_02_00_022(0)","美嘉","５月の時よりもめっちゃ成長してるし、
今のアタシたちなら絶対いけるっしょ★","It's grown so much more than it was in May,
I'm sure we can do it now."
"main_0009_B_02_00_023(0)","Ｐ","みんなの連携が力になることは、
『アイドルサマー』で証明できたからな","That everyone's collaboration is a force to be reckoned with,
I've got ""Idol Summer"" to prove it."
"main_0009_B_02_00_024(0)","きらり","うぇへへ♪　この前のライブ、
す～っごく盛り上がったにぃ☆","Wohehee♪ Live performance the other day,
It was so much fun!"
"main_0009_B_02_00_025(0)","美希","ねぇ、プロデューサー。
今度のライブは、何の曲を歌うの？","Hey, producer.
What song are you going to sing at the upcoming concert?"
"main_0009_B_02_00_026(0)","Ｐ","ああ、そうだな。
楽曲の件も話しておこう","Oh, yes.
Let's talk about the music, too."
"main_0009_B_02_00_027(0)","Ｐ","新曲は『ハロウィンオータム』向けに準備中だ","New music is being prepared for ""Halloween Autumn."""
"main_0009_B_02_00_028(0)","貴音","なるほど……久方振りの新曲ですね","I see. ...... It's been a long time since I've heard a new song."
"main_0009_B_02_00_029(0)","甘奈","えっと……それじゃあ、
今月末の単独ライブはどうするの？","Let's see, ...... then,
What about the solo show at the end of this month?"
"main_0009_B_02_00_030(0)","Ｐ","単独ライブの方は、
『ＲＥＡＤＹ！！』でいこうと考えている","For the solo show,
I'm thinking of going with ""READY!"
"main_0009_B_02_00_031(0)","Ｐ","『ＲＥＡＤＹ！！』は始まりの歌だ。
新生ルミナスの門出に相応しいと思って選曲した","READY!"" is a song of beginnings.
I selected this song because I thought it was appropriate for the start of the new Luminous."
"main_0009_B_02_00_032(0)","真","いいですねっ。あの曲なら、
ライブで絶対に盛り上がりますよ！","That song is good,
It will definitely be a lot of fun at a live concert!"
"main_0009_B_02_00_033(0)","菜々","はいっ！　ゼッタイに盛り上がると思いますっ！
ナナも大好きな曲なんです～っ☆","Yes! I am sure it will be a great success!
Nana loves this song too!"
"main_0009_B_02_00_034(0)","静香","じゃあ、今回は春香さんたちが
メインになるんですか？","Then, this time, Haruka's group.
Will it be the main one?"
"main_0009_B_02_00_035(0)","Ｐ","そういうことだな。
あとは、誰がコラボするかだけど……","That's what I'm talking about.
Now we just need to see who will collaborate. ......"
"main_0009_B_02_00_036(0)","甘奈","はい！　甘奈、やりたいです！
この曲、前から歌ってみたかったんだ☆","Yes! Amana, I want to do it!
I've always wanted to sing this song."
"main_0009_B_02_00_037(0)","甜花","て、甜花も……！","You can also visit ......!"
"main_0009_B_02_00_038(0)","咲耶","どうだろう、プロデューサー。
私たちに任せてはもらえないかな？","I don't know, producer.
Could you leave it to us?"
"main_0009_B_02_00_039(0)","Ｐ","咲耶たちが積極的だな……。
なにか理由でもあるのか？","Sakuya and her team are very aggressive. ......
Is there a reason?"
"main_0009_B_02_00_040(0)","咲耶","フフ、６月の時とは逆に、私たちにぜひ、
色々と教えてもらいたいと、そう思っているんだ","Huh, contrary to what happened in June, we would love to have you with us,
I'm hoping to learn a lot from you, that's all I'm asking."
"main_0009_B_02_00_041(0)","Ｐ","なるほど、そういうことか","I see. So that's how it is."
"main_0009_B_02_00_042(0)","甘奈","甘奈たちが揃って歌唱メンバーになって、
月末ライブをやったのは６月だけだったでしょ？","Amana and her friends all became singing members,
You only did end-of-month gigs in June, right?"
"main_0009_B_02_00_043(0)","甘奈","それに、オーディション形式だったから","Besides, it was an audition format."
"main_0009_B_02_00_044(0)","甘奈","今度は、直接ファンのみんなに向けた
ライブをしてみたいかなって","This time, directly to all the fans.
I was wondering if you would like to do a live show."
"main_0009_B_02_00_045(0)","果穂","なので、ファンのみなさんの前で、
ライブがしたいですっ！　お願いしますっ！","So, in front of all the fans,
I want to do a live concert!"
"main_0009_B_02_00_046(0)","咲耶","私たちだけ、経験が不足しているよりは、
その方がルミナスのためにもいいかと思ってね","Only us, than we lack experience,
I just thought it would be better for Luminous."
"main_0009_B_02_00_047(0)","凛世","良き……経験に……","For a good ...... experience ......"
"main_0009_B_02_00_048(0)","甜花","て、甜花も……
なーちゃんたちと、一緒なら……","Te and Tenka are also available at ......
Nachan and her friends can be found at ......"
"main_0009_B_02_00_049(0)","Ｐ","（自分たちのことだけじゃなく、ルミナスとしての
今後もにらんだ提案か……ありがたいな）","(Not just for ourselves, but as luminous
(I'd appreciate any suggestions for the future at .......)"
"main_0009_B_02_00_050(0)","Ｐ","みんなどうかな？","How about you everyone?"
"main_0009_B_02_00_051(0)","菜々","はいっ☆　すっごくイイと思います！
咲耶さんたちのライブ、楽しみですっ！","Yes☆ I think it is very good!
I am looking forward to seeing Sakuya and her group live!"
"main_0009_B_02_00_052(0)","静香","私も賛成です。
とてもいいライブになると思います","I agree.
I think it will be a very good show."
"main_0009_B_02_00_053(0)","春香","私も咲耶さんたちと一緒に、
ライブで歌ってみたいです！","I'm with Sakuya's group,
I would like to sing it live!"
"main_0009_B_02_00_054(0)","Ｐ","よし、歌唱メンバーは春香たち１３名と、
咲耶たちの５名で決定だ！","Okay, the singing members are Haruka and 13 others,
The decision was made by Sakuya and her team of five!"
"main_0009_B_02_00_055(0)","Ｐ","新生ルミナスは『ＲＥＡＤＹ！！』で始めよう！","Let's start the new Luminous with ""READY!"
"main_0009_B_02_00_056(0)","蘭子","フム……汝らの選択に、祝福あれ！","Hm ...... Blessed be thy choice!"
"main_0009_B_02_00_057(0)","（蘭子ログ）","（素敵なコラボになると思います！）","(Would be a great collaboration!)"
"main_0009_B_02_00_058(0)","果穂","がんばりますっ！
みなさん、よろしくお願いします！","I'll do my best!
Best regards, everyone!"
"main_0009_B_02_00_059(0)","凛世","凛世も……
頑張ります……","Rinze also ......
I'll do my best. ......"
"main_0009_B_02_00_060(0)","伊織","にひひっ♪　伊織ちゃんたちに任せなさい♪","Nahihihi♪ Leave it to Iori and the others♪"
"main_0009_B_02_00_061(0)","響","よーし！　みんなで一緒に、
新生ルミナスを引っ張っていくさー！","Alright, everyone together,
I'll be leading the new Luminous!"
"main_0009_B_02_00_062(0)","Ｐ","（始めよう、やれば出来る。きっと、絶対。
夢は叶うモノ……だよな）","(Start, you can do it, I'm sure, I'm sure.
(Dreams do come true. ......, right?)"
"main_0009_X_01_00_038(0)","Ｐ","（みんな、すでに歌と踊りは習得しつつある。
だが、もっと上を目指せるはずだ……）","(Everyone is already learning to sing and dance.
But we can do better (......)"
"main_0009_X_01_00_001(0)","Ｐ","（早速、歌唱メンバーに集まってもらい、
改めて、今後のレッスンの方針を話すことにした）","(As soon as possible, I asked the singing members to gather together,
(Once again, we decided to talk about future lesson plans.)"
"main_0009_X_01_00_002(0)","咲耶","６月の時とは逆だね。
どうだい、果穂。今の心境は？","That's the opposite of what happened in June.
How are you feeling now, Kaho?"
"main_0009_X_01_00_003(0)","果穂","大好きな曲なので、
スッゴく楽しみですっ！","It's my favorite song,
I'm really looking forward to it!"
"main_0009_X_01_00_004(0)","響","うんうん♪　最高の曲だぞ！
それじゃ、曲をかけてレッスンを始めるさー！","Yeah, yeah... ♪ It's the best song I've ever heard!
Well then, I'll put on a song and start the lesson!"
"main_0009_X_01_00_005(0)","律子","響、そう急がないの。まずはレッスンの
やり方について、話し合いましょう","Hibiki, don't be in such a hurry, we need to start with the lesson.
Let's discuss how to do it."
"main_0009_X_01_00_039(0)","Ｐ","ああ、よろしく頼む。
まずはみんなの意見を聞かせてくれ","Yeah, nice to meet you.
First, let me hear what everyone has to say."
"main_0009_X_01_00_006(0)","響","うー、じゃあどうする、みんな？","Woo, what then, everyone?"
"main_0009_X_01_00_007(0)","あずさ","ん～、せっかく一緒にやるんだから、
なにか新しいことがしたいわね～","Hmmm...since we're going to be doing this together,
I want to do something new."
"main_0009_X_01_00_008(0)","春香","……いいですね。
今のルミナスなら、何でもできそうな気がします！","I like .......
I feel like anything is possible with Luminous now!"
"main_0009_X_01_00_009(0)","Ｐ","確かにな……。みんなも、特に咲耶たちも
頼もしく成長してるし、大丈夫だと思うぞ","Indeed. ....... Everyone and especially Sakuya's group.
She's growing up to be reliable, and I think she'll be fine."
"main_0009_X_01_00_010(0)","春香","えへへ、受け売りみたいですけど……。
でも、その通りだなと思って","Ehehe, I know it sounds like a takeaway, but you can find it at .......
But I thought you were right."
"main_0009_X_01_00_011(0)","美希","咲耶たちなら、
すぐにダンスも歌も覚えてくれそうなの☆","Sakuya's group would,
I'm sure she'll learn to dance and sing in no time."
"main_0009_X_01_00_012(0)","真","うん、ボクもそう思うな。
みんな、レッスンやステージもレベルが高いからね！","Yeah, I don't think so either.
They all have high Levels of lessons and stages!"
"main_0009_X_01_00_013(0)","甘奈","ありがと、美希ちゃんに真ちゃん。
甘奈たち、頑張るね！","Thanks, Miki and Makoto.
Amana and the others, good luck!"
"main_0009_X_01_00_014(0)","甜花","……甜花、できるかな……","...... Tenka, can you do it? ......"
"main_0009_X_01_00_015(0)","Ｐ","（『Ｓｐｒｅａｄ ｔｈｅ Ｗｉｎｇｓ！！』は、
このメンバー全員で一緒にレッスンをしたが……）","(""Spread the Wings!
(All of these members had lessons together, but ......)"
"main_0009_X_01_00_016(0)","Ｐ","（今回は、通常のレッスン以外に、
小人数のグループレッスンもありかもしれない……）","(This time, in addition to the regular lessons,
(Small group lessons may also be available: ......)"
"main_0009_X_01_00_017(0)","Ｐ","（今なら、ルミナスとして全体の連携も強まってる。
ちょっと提案してみるか）","(Now, as a luminous, the whole collaboration is getting stronger.
(Let me make a suggestion.)"
"main_0009_X_01_00_018(0)","Ｐ","みんな、ちょっとアイディアがあるんだ。
少人数でのグループレッスンはどうだ？","Hey everyone, I have an idea.
How about a small group lesson?"
"main_0009_X_01_00_019(0)","凛世","少人数……","Small group: ......"
"main_0009_X_01_00_020(0)","Ｐ","例えば果穂と一緒に、
亜美、真美が組んで教えるとかな","For example, with Kaho,
Maybe Ami and Mami could team up and teach."
"main_0009_X_01_00_021(0)","果穂","亜美さんと真美さんとレッスン……っ！
あたし、やりたいです！","Ami and Mami and their lesson: ......!
I want to do it!"
"main_0009_X_01_00_022(0)","亜美","やったね、果穂ちん！　マンジューマンだよ！","You did it, Kaho! It's Manjuman!"
"main_0009_X_01_00_023(0)","真美","だったら、真美はニクマンジューマンの方がいい！
ボリュームもあって、ジューシーだし！","Then Mami is better off with Nikumanjuman!
It's hearty and juicy!"
"main_0009_X_01_00_024(0)","律子","亜美、真美、違うでしょ……。マンツーマン、
『１対１』でレッスンするってことよ","Ami, Mami, no you're not. ....... one-on-one,
It means ""one-on-one"" lessons."
"main_0009_X_01_00_025(0)","律子","プロデューサー、いいアイディアだと思います。
ただ、私も果穂の組に、入れてもらえませんか？","Producer, I think it's a great idea.
However, I would like to join Kaho's group."
"main_0009_X_01_00_026(0)","律子","亜美と真美だけだと、心配なので","If it's just Ami and Mami, I'm worried about them."
"main_0009_X_01_00_027(0)","Ｐ","もちろんだ。あと、やよいもいた方がいいな","Of course, and Yayoi should be there too."
"main_0009_X_01_00_028(0)","やよい","はーい、分かりましたっ！
果穂ちゃん、よろしくお願いしますっ！","Yes, I understand!
Kaho, I look forward to working with you!"
"main_0009_X_01_00_029(0)","千早","プロデューサー、私はだれと……","Producers, with whom I ......"
"main_0009_X_01_00_030(0)","Ｐ","そうだな……。
千早は、春香と貴音と一緒に凛世と組んでくれ","Yes, .......
Chihaya, you and Haruka and Takane should work with Rinze."
"main_0009_X_01_00_031(0)","Ｐ","あずささんと雪歩は甜花をお願いします。
美希と伊織は甘奈とだ","Azusa and Yukiho, please give me Tenka.
Miki and Iori are with Amana."
"main_0009_X_01_00_032(0)","Ｐ","そして、真と響は咲耶と組む、
というのはどうかな？","Then, Makoto and Hibiki team up with Sakuya,
How about ""How about that?"
"main_0009_X_01_00_033(0)","咲耶","ありがとう、プロデューサー。
これまでよりも、効率的なレッスンができそうだ","Thanks, producer.
I'll be able to give you lessons more efficiently than ever before."
"main_0009_X_01_00_034(0)","凛世","心強く……
感じます……","Reassuringly ......
I feel ......"
"main_0009_X_01_00_035(0)","響","よーし！　早速、レッスンを始めるさー！","Okay! I'll start the lesson right away!"
"main_0009_X_01_00_036(0)","Ｐ","よし、じゃあこの方式でいこう。
月末の単独ライブを目指して頑張ろう！","Okay, let's use this method then.
Let's work hard for a solo show at the end of March!"
"main_0009_X_01_00_037(0)","Ｐ","（今のルミナスなら、このぐらい個性にまかせて
連携していく方が、面白くなりそうだ！）","(With today's Luminous, you can let your personality take care of this much.
(It's going to be more interesting to work together!)"
"main_0009_X_02_00_001(0)","Ｐ","（ルミナスを知ってもらうには、ＳＮＳが重要だ。
地方イベントはＳＮＳのネタにもよさそうだな……）","(SNS is important to get people to know Luminous.
(Local events look like good social media fodder: ......)"
"main_0009_X_02_00_002(0)","Ｐ","（みんな頑張ってくれているんだ、
俺にできることをやっていかないと……）","(They're all doing their best,
I need to do what I can to help (......)"
"main_0009_X_02_00_003(0)","","ガチャッ","(with a) slamming noise (door, telephone receiver)"
"main_0009_X_02_00_004(0)","心白","プロデューサーさん、
相談があるんですけど……少しいいですか？","Producer,
I need to talk to you about something. ...... Can I have a minute?"
"main_0009_X_02_00_005(0)","Ｐ","ああ、大丈夫だ。どうしたんだ、心白","Yeah, I'm fine, what's up, Kohaku?"
