"id","character","source","translatedstr"
"main_0004_X_01_00_005(0)","小鳥","みんなの活躍が嬉しかったので、
先にご報告させていただきました♪","I was so happy to see everyone's success,
We have reported earlier that â"
"main_0004_X_01_00_006(0)","Ｐ","いつも、ありがとうございます！
よろしくお願いします","Thank you, as always, for your support!
please remember me"
"main_0004_X_01_00_007(0)","Ｐ","（プロジェクトルミナス……
いよいよ本格始動だな……頑張るぞ！）","(Project Luminous ......)
(Finally, we're in full swing. ...... Let's go for it!)"
"main_0004_C_03_00_001(0)",,"――活動終了後――","--After the activity is over--"
"main_0004_C_03_00_002(0)","美嘉","んじゃ、お疲れさま～！　先に上がるね♪","Well, good work~! I'll go up first."
"main_0004_C_03_00_003(0)","果穂","みなさん、お疲れ様でしたっ！","Thank you all for your hard work!"
"main_0004_C_03_00_004(0)","静香","お疲れ様です。
私は、もう少し残って自主レッスンを……","Thanks for your time.
I'm going to stay a little longer and give a self-guided lesson at ......"
"main_0004_C_03_00_005(0)","紬","……もっと頑張らないと
……私も……","...... I need to work harder.
...... I also ......"
"main_0004_C_03_00_006(0)","翼","みんな、お疲れさま～。
わたしは帰りま～す！","Good job, everyone!
I'm going home!"
"main_0004_C_03_00_007(0)","未来","……あ、みんなちょっと待って！","...... Oh, wait a minute everyone!"
"main_0004_C_03_00_008(0)","翼","え、なになに？","Eh, what what what?"
"main_0004_C_03_00_009(0)","歌織","どうかしたの、未来ちゃん？","What's wrong, Mirai?"
"main_0004_C_03_00_010(0)","未来","えっと……私たち以外は、
誰も残ってないよね……？","Let's see, ...... except for us,
There's no one left, is there ......?"
"main_0004_C_03_00_011(0)","未来","実は……月末のライブまでに
お花見パーティーをすることにしたんです！","Actually ...... by the end of the month live.
We decided to have a hanami party!"
"main_0004_C_03_00_012(0)","紬","お花見パーティー……ですか？","Cherry blossom viewing party ......?"
"main_0004_C_03_00_013(0)","未来","えっと……ほら……まだ、みんなと少し
距離感があるっていうか","Let's see, ...... look, ...... still a little bit with everyone.
I mean, there's a sense of distance."
"main_0004_C_03_00_014(0)","未来","レッスンとかは、特に問題ないんだけど……。
もっといろいろ知って、仲良くなりたいなって！","I don't have a problem with lessons or anything like that. ......
I wanted to know more about them and get to know them better!"
"main_0004_C_03_00_015(0)","翼","あ～、なんか分かるかも。
ちょっとお互いに遠慮してるってカンジだよね～？","Ahhh, I think I know what you mean.
It's a little bit like we're reserved for each other, isn't it?"
"main_0004_C_03_00_016(0)","静香","なるほど。お花見パーティーで、
親睦を深めようってことね","I see...at a hanami party,
I guess we'll just have to get to know each other better."
"main_0004_C_03_00_017(0)","歌織","お互いのことを知る、いい機会になると思うわ。
いい考えね、未来ちゃん","I think it would be a great opportunity for us to get to know each other.
Good idea, Mirai."
"main_0004_C_03_00_018(0)","未来","えへへ。どうせならサプライズがいいかなって……。
だから、みんなに相談したんです！","Hehe, I thought a surprise would be nice anyway. ......
So I talked to everyone about it!"
"main_0004_C_03_00_019(0)","紬","あの、とても楽しそうなのですが、
レッスンに支障は出ないでしょうか？","Um, it looks like a lot of fun,
Will it interfere with my lessons?"
"main_0004_C_03_00_020(0)","未来","もちろん！　ちゃんとルミナスの
スケジュールも考えて計画するから大丈夫だよ！","Of course!
I'll think about the schedule and plan accordingly, don't worry!"
"main_0004_C_03_00_021(0)","Ｐ","今回の懇親会の計画は、未来に任せるつもりだ","I'm going to leave the planning of this get-together to the future."
"main_0004_C_03_00_022(0)","Ｐ","でも、未来ひとりじゃ大変だろうし……。
できればみんなも、協力してくれないかな","But it will be hard for the future alone. ......
If possible, I need everyone's help, too."
"main_0004_C_03_00_023(0)","未来","お願いしますっ！
５人でいいお花見を計画しましょうっ！","Please!
Let's plan a nice hanami for the five of us!"
"main_0004_C_03_00_024(0)","紬","そういうことでしたら……私も協力します","If that's the case, ...... I'd be happy to help."
"main_0004_C_03_00_025(0)","静香","もちろん、私も協力するわ。
もっと早く相談してくれればよかったのに","Of course I'm willing to help.
You should have consulted me sooner."
"main_0004_C_03_00_026(0)","歌織","私も大賛成です。
素敵なお花見パーティーにしましょうね♪","I am all for it.
Let's make it a nice hanami party♪"
"main_0004_C_03_00_027(0)","翼","うん、サイコーのパーティーにしよ♪
わたしも協力するからさ☆","Yeah, let's make it a great party!
I'll help you, too."
"main_0004_C_03_00_028(0)","未来","みんな、ありがとう！","Thank you all!"
"main_0004_C_03_00_029(0)","Ｐ","（この５人なら、気心の知れた仲だろうし、
安心して任せられそうだ）","(The five of them must know each other very well,
(I feel safe in your hands.)"
"main_0004_C_03_00_030(0)","心白","お疲れ様です、プロデューサーさん。
あの、お話というのは……？","Thanks for your help, producer.
Well, I mean, the story is at ......?"
"main_0004_C_03_00_031(0)","Ｐ","心白、いいところに来た！
そうなんだ、心白にも協力してもらいたくてな","Kohaku, you've come to the right place!
Yes, I wanted to get some help from Kohaku."
"main_0004_C_03_00_032(0)","心白","協力……？","Cooperation ......?"
"main_0004_C_03_00_033(0)","未来","はいっ！　みんなと仲良くなるために、
お花見パーティーしたいなと思ってるんです","Yes! To get along with everyone,
I'm thinking of having a hanami party."
"main_0004_C_03_00_034(0)","未来","心白さんも一緒に、手伝ってくれませんか？","Would you like to join us and help us, Kohaku-san?"
"main_0004_C_03_00_035(0)","心白","お花見パーティーですか……私でよければ、喜んで。
誘っていただきありがとうございます！","Is it a hanami party? ...... If it's ok with me, I'd be happy to.
Thank you for the invitation!"
"main_0004_C_03_00_036(0)","Ｐ","よし、これで親睦会の企画メンバーが全員決まったな","Okay, now you've got all the planning members for the party."
"main_0004_C_03_00_037(0)","Ｐ","それで未来、いつやるんだ？　みんなに伝えて、
予定を押さえておかないといけないだろ","So future, when are you going to do it? Tell everyone,
You'd have to hold the schedule."
"main_0004_C_03_00_038(0)","未来","そうですねぇ～、月末はライブですから……。
来週末でしょうか？","Yes - the end of the month is live at .......
Next weekend?"
"main_0004_C_03_00_039(0)","Ｐ","４月２２日か。善は急げだな……。
音無さんからみんなに連絡を入れてもらおう","April 22nd. goodness knows what. ......
Let's have Otonashi-san contact everyone."
"main_0004_C_03_00_040(0)","Ｐ","場所はどこにする？","Where do you want the location?"
"main_0004_C_03_00_041(0)","紬","そういえば、春日さん……。
お花見とは、あの桜を見るお花見のことでしょうか？","By the way, Kasuga-san .......
By hanami, do you mean that cherry blossom viewing?"
"main_0004_C_03_00_042(0)","未来","うん、そうだよっ！","Yeah, that's right!"
"main_0004_C_03_00_043(0)","未来","桜がぱぁーって、いっぱい咲いてる公園がいいよね！
そんな場所、近くにないかな～♪","It would be nice to go to a park with lots of cherry blossoms!
I wonder if there's a place like that near me..."
"main_0004_C_03_00_044(0)","紬","あの……桜はもう、東京では散っていますが","That ...... cherry blossoms have already fallen in Tokyo."
"main_0004_C_03_00_045(0)","未来","えーっ！　そうなの？　最近私、桜が舞っているの
見てキレイだなぁって感動したんだよ！","Oh, really? I've been a bit of a cherry blossom dancer lately.
I was impressed by how beautiful it looked!"
"main_0004_C_03_00_046(0)","静香","……それは紬さんの言うとおりね。
花びらが散っていたのがキレイだったんでしょう……","...... You're right about that, Tsumugi.
It must have been beautiful to see the petals falling: ......"
"main_0004_C_03_00_047(0)","未来","あっ！　なるほど……","Ah! I see: ......"
"main_0004_C_03_00_048(0)","心白","あの、ニュースの天気予報で桜前線は、
北東エリアに向かっていると言っていましたけど……","Um, the cherry blossom front in the news weather forecast,
You said you were heading to the northeast area though: ......"
"main_0004_C_03_00_049(0)","未来","それなら……プロデューサーさん！
みんなで北海道に行けませんか！","Then you're a ...... producer!
Can we all go to Hokkaido?"
"main_0004_C_03_00_050(0)","Ｐ","それは、無理だろ……","That's not going to happen. ......"
"main_0004_C_03_00_051(0)","Ｐ","ルミナスはまだ、
お披露目の月末ステージすらしていないんだぞ","Luminous still,
We haven't even done the end-of-month stage of the unveiling."
"main_0004_C_03_00_052(0)","未来","そ、それもそうですよね……。
うう～っ。どうしようー！？","Yes, that's true too. ......
Ughhhh...what should I do!"
"main_0004_C_03_00_053(0)","静香","桜じゃなきゃダメなの？
今なら他にも綺麗な花が咲いているけど……","Does it have to be cherry blossoms?
There are other beautiful flowers blooming now, but ......"
"main_0004_C_03_00_054(0)","Ｐ","みんなと仲良くなることが目的なら
それもありだな","If your goal is to get along with everyone.
That's possible."
"main_0004_C_03_00_055(0)","未来","でもでも、桜の季節にみんなと会えたんですよ！
それを想い出にしたかったのに……","But I got to meet everyone during the cherry blossom season!
I wanted to remember that. ......"
"main_0004_C_03_00_056(0)","未来","だから、桜を見るお花見がしたいです！","So I would like to have a hanami (cherry blossom viewing)!"
"main_0004_C_03_00_057(0)","翼","そうだよね～。
みんなで桜が見れたら、楽しそう♪","That's right!
It would be fun to see the cherry blossoms together♪"
"main_0004_C_03_00_058(0)","歌織","……あ、ねぇ、未来ちゃん。
例えばなんだけど","...... Oh, hey, Mirai.
for example"
"main_0004_C_03_00_059(0)","Ｐ","例えば？","For example?"
"main_0004_C_03_00_060(0)","歌織","作っちゃうっていうのはどう？","How about making it?"
"main_0004_C_03_00_061(0)","静香","作っちゃう……ですか！？","Is it ...... that makes it!"
"main_0004_C_03_00_062(0)","未来","作っちゃうって、どんな風に……。
っていうか、なにを作るんですか？","How do you think you'll make it? ......
I mean, what are you going to make?"
"main_0004_C_03_00_063(0)","歌織","桜の花を作るの。花は、折り紙で折ることが
出来るし、花びらも、１枚ずつ切れば用意できるわ♪","We will make cherry blossoms, which can be folded with origami.
You can do it, and you can prepare the petals by cutting them one at a time."
"main_0004_C_03_00_064(0)","翼","あっ、それいいかも～♪
みんなで、お花を作っちゃいましょ～！","Oh, that's a good one!
Let's make flowers together!"
"main_0004_C_03_00_065(0)","紬","手作りですか……。
素敵だと思います","Is it handmade? .......
I think it's lovely."
"main_0004_C_03_00_066(0)","未来","うん、うん！
それで、新しい事務所を飾っちゃおう！","Yeah, yeah!
So let's decorate our new office!"
"main_0004_C_03_00_067(0)","静香","プロデューサー。
事務所をお借りすることは可能でしょうか？","Producer.
Is it possible to rent an office?"
"main_0004_C_03_00_068(0)","Ｐ","みんなの事務所だ、
俺に聞くまでもなくもちろん大丈夫だ！","It's everyone's office,
You don't have to ask me, of course it's fine!"
"main_0004_C_03_00_069(0)","翼","なんだか、楽しそう！
そんなお花見、初めてかも～♪","It looks kind of fun!
I think I've never seen cherry blossom viewing like that before!"
"main_0004_C_03_00_070(0)","心白","私も、初めてです！","I, too, am new to this!"
"main_0004_C_03_00_071(0)","Ｐ","俺もだよ","Me too."
"main_0004_C_03_00_072(0)","未来","それじゃあ、手作りお花見計画、開始～っ！","Well then, let the homemade cherry blossom viewing plans begin~!"
"main_0004_C_03_00_073(0)","未来","最初は、作戦その１なんだけど
部屋を飾る桜の装飾を作るでしょ……","At first, it's strategy #1.
You would make a cherry blossom decoration to decorate a room. ......"
"main_0004_C_03_00_074(0)","未来","それから、作戦その２！
桜の花びらを作って……。あとは、うーんと……","Then, strategy #2!
Make cherry blossom petals ....... The rest is, um, ......"
"main_0004_C_03_00_075(0)","未来","あ、作戦その３！　短冊を作ろう！","Oh, strategy #3! Let's make strips of paper!"
"main_0004_C_03_00_076(0)","Ｐ","短冊……？　花見にか？","Tanzaku ......? For cherry blossom viewing?"
"main_0004_C_03_00_077(0)","未来","以上っ！　では、明日から作戦を決行します！
仕事の後に集合！　みんないいですかっ？","That's all! Then, we will start the operation tomorrow!
Meet up after work!"
"main_0004_C_03_00_078(0)","心白","はい、ついていきます隊長！","Yes, I will follow you, captain!"
"main_0004_C_03_00_079(0)","Ｐ","心白、なんで隊長なんだ？","Kohaku, why are you the captain?"
"main_0004_C_03_00_080(0)","心白","昔、母と見た番組で、村に遊び場をつくる企画で、
隊長と呼ばれる人が作戦を連呼してました","I used to watch a program with my mother, a project to build a playground in a village,
Someone called the captain was calling out the plan."
"main_0004_C_03_00_081(0)","心白","あの元気で、明るい声が未来さんみたいだなって。
すみません、ついつい思い出してしまいました","That energetic, cheerful voice sounded like Mirai.
Sorry, I'm just remembering."
"main_0004_C_03_00_082(0)","歌織","ふふっ♪　いつも元気で明るい未来ちゃんに、
隊長ってあだ名はぴったりかもしれないわね","Hmmm...to Mirai, who is always cheerful and bright,
Maybe the nickname ""Captain"" is fitting."
"main_0004_C_03_00_083(0)","静香","はい、そうですね","Yes, we should."
"main_0004_C_03_00_084(0)","Ｐ","ちょっと待った。隊長についても気になるが、
未来、短冊ってなんなんだ？","Wait a minute...I'm curious about the captain as well,
What's the Mirai, strips of paper?"
"main_0004_C_03_00_085(0)","未来","内緒ですっ！
ねー、心白さん♪","Don't tell anyone!
Hey, Ms. Kohaku♪"
"main_0004_C_03_00_086(0)","心白","は、はい。隊長、了解であります","Yes, sir, you got it."
"main_0004_C_03_00_087(0)","翼","あははっ、なんだか楽しくなってきたかも～。
隊長、よろしくね～♪","Haha, I think I'm starting to enjoy it somewhat!
Captain, nice to meet you~♪"
"main_0004_C_03_00_088(0)","紬","……隊長
よろしくであります……","Captain ......
Best regards ......"
"main_0004_C_03_00_090(0)","静香","未来、隊長としてしっかり頼むわね","Mirai, as captain, I'm counting on you to be strong."
"main_0004_C_03_00_089(0)","未来","みんな、任せてっ！
紙や道具は用意しておくから、よろしくねっ！","I'll take care of it, everyone!
I'll have paper and tools ready for you, thank you!"
"main_0004_C_03_00_091(0)","Ｐ","（みんな仲間想いだな。
この想いがあれば、出来ないことはないだろう……）","(Everyone is so friendly.
With this thought, there's nothing you can't do. ......)"
"main_0004_C_03_00_092(0)","Ｐ","それじゃあ、４月２２日、場所はこの事務所。
親睦会の連絡、音無さんにお願いしておくからな","Well then, April 22, the place is this office.
I'll ask Otonashi-san to contact you about the party."
"main_0004_C_03_00_093(0)","未来","ありがとうございます！
よろしくお願いします！","Thank you very much!"
"main_0004_C_04_00_001(0)","美希","みんな、お疲れさまなの～。ミキ的には
レッスン、いい感じになってきたって思うな☆","Thanks for all your hard work, everyone~ Miki's point of view.
Don't think the lessons are getting better."
"main_0004_C_04_00_002(0)","甘奈","うんうん♪
デビューライブにはなんとか間に合いそうだね！","Mm-hmm. ♪
I guess I'll manage to make it to my debut live show!"
"main_0004_C_04_00_003(0)","美嘉","せっかくのスペシャルなユニットなんだし、
デビューライブ、バシっと成功させたいよね～★","It's a very special unit,
We want to make our debut live show a success, don't we?"
"main_0004_C_04_00_004(0)","心白","そうですね。
みなさん、これからも頑張っていきましょう！","Yes, it is.
Let's all keep up the good work!"
"main_0004_C_04_00_005(0)","Ｐ","（最初に比べれば、メンバー同士の会話も、
ぎこちない感じではなくなってきたようだ）","(Compared to the beginning, the members talk to each other,
(It seems less awkward.)"
"main_0004_C_04_00_006(0)","Ｐ","（だけど、もう少し仲良くなってもらいたいな。
親睦会でもっと交流を活発化できれば……）","(But I'd like them to get to know each other a little better.
(If we could stimulate more interaction at party, ......)"
"main_0004_C_04_00_007(0)","Ｐ","よし、じゃあ今日は終わりだ。
各自、解散してくれてかまわないぞ","Okay, well, I'm done for the day.
Each of you may disperse."
"main_0004_C_04_00_008(0)","千早","はい、プロデューサー。
お疲れさまでした","Yes, producer.
thank you for your hard work"
"main_0004_C_04_00_009(0)","亜美","兄ちゃんもみなの衆も、
レッスン大義であった～！","Both my brother and everyone else,
It was a lesson great cause~!"
"main_0004_C_04_00_010(0)","真美","んっふっふ～♪　それじゃあみなの衆、
また来週、よろしくお願いするでゴザルよ～！","Well then, all of you,
See you next week!"
"main_0004_C_04_00_011(0)","蘭子","我が魔力も枯渇気味……。
また闇へと潜り、力を蓄える必要があるわね","My magic power is also depleted. ......
We need to go back into the darkness and build up our strength."
"main_0004_C_04_00_012(0)","（蘭子ログ）","（疲れたぁ……。帰ってゆっくり休まないと）","(I'm tired ....... I need to go home and get some rest.)"
"main_0004_C_04_00_013(0)","Ｐ","さてと……残った作業をやるか","Now let's go to ...... and do the rest of the work."
"main_0004_C_04_00_014(0)",,"ガチャッ　スタスタ……","clack, stutter ......"
"main_0004_C_04_00_015(0)","Ｐ","（ん？　誰かやってきたのか？）","（Who's coming?)"
"main_0004_C_04_00_016(0)","未来","手作りお花見計画、開始～っ！
作戦その１、部屋を飾る桜の装飾の作成っ！","Start planning for homemade hanami!
Strategy #1: Create cherry blossom decorations to decorate the room!"
"main_0004_C_04_00_017(0)","心白","はいっ、隊長！","Yes, Captain!"
"main_0004_C_04_00_018(0)","静香","未来、隊長気分はもうそれくらいでいいんじゃない？","Mirai, I think that's enough to get you in the captain's mood, don't you?"
"main_0004_C_04_00_019(0)","未来","でへへ～♪　そうだね！
じゃあ、折り紙でお花をつくろう～","Dehehe~♪ Yes, that's right!
Then, let's make origami flowers!"
"main_0004_C_04_00_020(0)","紬","あの、これを使ってください……。
金沢から送ってもらいました","Um, please use this: .......
I had it sent from Kanazawa."
"main_0004_C_04_00_021(0)","翼","わぁ、キレイな模様～♪　金沢の折り紙って、
大人っぽくてモテモテってカンジですね！","Wow, beautiful patterns...Kanazawa origami,
It's like being mature and irresistible!"
"main_0004_C_04_00_023(0)","歌織","まぁ、素敵な折り紙♪
心を込めて、キレイな桜を折らなくちゃ","Well, nice origami ♪
I must fold beautiful cherry blossoms with all my heart."
"main_0004_C_04_00_022(0)","静香","これは……和紙ですね。
貴重なものを、ありがとうございます","This is ...... Washi.
Thank you very much for this valuable thing!"
"main_0004_C_04_00_024(0)","紬","そ、そうですか？
気に入ってもらえたなら、良かったです","Oh, really?
I'm glad you liked it."
"main_0004_C_04_00_025(0)","歌織","ふふっ、みんなで頑張りましょうね♪
あっ、未来ちゃん。折り方は分かる？","Hmmm... Let's all do our best...
Oh, Mirai, do you know how to fold it?"
"main_0004_C_04_00_026(0)","未来","……ああっ！？
紙とハサミしか用意してなかった！","...... Ah!
I only had paper and scissors ready!"
"main_0004_C_04_00_027(0)","静香","はぁ……そうだと思って、用意しておいたわ。
はい、桜の折り方のプリント、それと完成品の見本よ","Huh. ...... I thought so, and I've got it ready for you.
Here's a printout of how to fold the cherry blossoms, and a sample of the finished product."
"main_0004_C_04_00_028(0)","未来","えへへっ……。ありがとう静香ちゃんっ！","Hehehe. ....... Thanks Shizuka-chan!"
"main_0004_C_04_00_029(0)","Ｐ","（絶妙なコンビネーションだな……。
彼女たちで培ってきたものか……）","(That's an exquisite combination. .......
(Or cultivated by these girl: ......)"
"main_0004_C_04_00_030(0)",,"ガチャッ　スタスタ……","clack, stutter ......"
"main_0004_C_04_00_031(0)","伊織","まだ灯りがついているわ……
あら、あんたたち何やってるの？","The lights are still on. ......
Oh, what are you everyone doing?"
"main_0004_C_04_00_032(0)","未来","えっ……？　……ああぁあ～っ！？
見ちゃダメですっ！　見ないでください～！","What, ......? ...... ahhhhh!
Don't look at it! Don't look at it~!"
"main_0004_C_04_00_033(0)","春香","ええっ！？
ご、ごめんなさい！　急に部屋に入っちゃって……","Eh?
I'm sorry, I'm sorry! I'm sorry, I didn't mean to come into your room so suddenly. ......"
"main_0004_C_04_00_034(0)","未来","あ、あの、手作りお花見計画は極秘なので、
え、えーっと……","Oh, um, the homemade hanami plan is top secret,
Let's see... ......"
"main_0004_C_04_00_035(0)","静香","未来、全部言った気がするわよ……","Mirai, I think I said it all: ......"
"main_0004_C_04_00_036(0)","響","手作りお花見計画？　あ、折り紙で花を作るの？
面白そうだね♪","Handmade hanami plans? Oh, making flowers with origami?
Sounds interesting... ♪"
"main_0004_C_04_00_037(0)","伊織","やっぱりね。親睦会の話を聞いて、
もしやと思ってきてみたのよ","I knew it...I heard about the party,
I just thought I'd come by and see if you might be interested."
"main_0004_C_04_00_038(0)","歌織","あら？
どこで親睦会のことを知ったの？","Oh?
Where did you hear about the Party?"
"main_0004_C_04_00_039(0)","春香","実行委員としてみんなの、
名前が活動日誌に書いてあったから……","Everyone's as a member of the executive committee,
Because her name was written in the activity journal: ......"
"main_0004_C_04_00_040(0)","未来","な、なんでそれだけで分かったんですか！？
サプライズのはずだったのに～","Hey, how did you know all that!
It was supposed to be a surprise."
"main_0004_C_04_00_041(0)","Ｐ","そういえば、俺も見たが……。
今日の日付に作戦初日って書いてあったような","Well, I saw that, too, at .......
I think today's date says first day of operation."
"main_0004_C_04_00_042(0)","未来","ええっ～！？
みんな、それだけで分かるんですか！？","Eh~!
You everyone, that's all you need to know!"
"main_0004_C_04_00_043(0)","Ｐ","それで、３人で様子を見に来てくれたってわけか","So the three of you came to check on me."
"main_0004_C_04_00_044(0)","春香","はい！　親睦会、すごくステキだなって。それで、
私たちも、なにかできることがないかと思ったんです","Yes! I thought the party was very nice,
We thought there was something we could do as well."
