"id","character","source","translatedstr"
"main_0009_X_08_00_052(0)","菜々","おいしくなーれ、おいしくなーれ♪
って魔法の言葉を言いながら、振りかけるんですっ！","Taste good, taste good♪
I sprinkle it on while saying the magic words!"
"main_0009_X_08_00_053(0)","心白","それなら、甘くておいしいお団子ができそうですね","Then it would make sweet and tasty dumplings!"
"main_0009_X_08_00_054(0)","菜々","はいっ☆　みんなに、おいしいって
言ってもらえるように頑張りますっ！","Yes☆ Tell everyone it's delicious!
I will do my best to make people say that!"
"main_0009_X_08_00_055(0)","眞弓","言葉には想いが宿るもの……。
菜々さん、できるわね","Words are thoughts. ......
Nana, you can do it."
"main_0009_X_08_00_056(0)","心白","お母さん……！
菜々さん、邪魔してすみません","Mother ......!
Nana, sorry to interrupt."
"main_0009_X_08_00_057(0)","心白","そろそろ、いい感じですね。
では、こねた粉をお団子の形に丸めていきましょう","It's about time.
Now, let's roll the kneaded flour into dumplings!"
"main_0009_X_08_00_058(0)","美希","こねてこねて……よいしょっと♪
はい、こんな感じで完成なの☆","Knead and knead ......
Yes, this is how it's done."
"main_0009_X_08_00_059(0)","心白","ずいぶんと大きいですね……","It's a lot bigger. ......"
"main_0009_X_08_00_060(0)","美希","お団子おにぎりだよ♪
おにぎりを串に刺して、食べやすくしたの！","Dumpling rice balls.
I skewered the rice balls to make them easier to eat!"
"main_0009_X_08_00_061(0)","心白","それはお団子……？
それとも、おにぎりなのでしょうか……","Is that a dumpling ......?
Or is it a rice ball? ......"
"main_0009_X_08_00_062(0)","眞弓","面白い発想ね。おにぎりもお団子も、
戦国武将が好んでいた、戦飯なのよ","Interesting idea, both onigiri and dumplings,
It was a favorite of the warlords."
"main_0009_X_08_00_063(0)","眞弓","いつ何時でも、食べられる、寝られるは
優れた武士の証だわ","Whenever and however you can eat and sleep is
That's the mark of a good warrior."
"main_0009_X_08_00_064(0)","美希","ん～……よく分かんないけど、
ほめてくれたんだよね♪　あはっ☆","Hmmm... I'm not sure about ......,
You gave me a compliment.......haha☆."
"main_0009_X_08_00_065(0)","美希","それじゃ、ミキはお団子作りが終わったから、
お昼寝してるね。あふぅ……","Well then, Miki has finished making dumplings,
You're napping. ah......"
"main_0009_X_08_00_066(0)","眞弓","恐ろしい……。
美希さんの才能は恐ろしいほどね……","Terrifying. .......
Miki's talent is formidable. ......"
"main_0009_X_08_00_067(0)","心白","美希さん、起きてください。
お母さん、女優目線で品定めしないで！","Miki, please wake up.
Mom, don't judge the product from an actress's point of view!"
"main_0009_X_08_00_068(0)","眞弓","そうね、私としたことが……。ルミナスの皆さんが
あまりにも才ある人が多すぎて、ついついと……","Well, I guess it's just me and .......
There are too many talented people to keep track of and ......"
"main_0009_X_08_00_069(0)","眞弓","心白、あなたは作らないの？","Kohaku, you don't make it?"
"main_0009_X_08_00_070(0)","心白","もちろん、作るために考えてきたよ。
お母さんのお団子の先を行ってみせるんだから","Of course, I've been thinking about making it.
I'm going to get ahead of your mother's dumplings."
"main_0009_X_08_00_071(0)","眞弓","それでこそ、我が娘。
このお団子には、決まった型などないのが秘訣――","That's my girl.
The secret to this bun is that there is no set shape--it's all about the shape of the bun."
"main_0009_X_08_00_072(0)","眞弓","もちろん、受けて立つわ","Sure, I'll take it."
"main_0009_X_08_00_073(0)","心白","うんっ。
私の想いをこめたお団子、食べてみて！","Yeah.
Try the dumplings that I put my heart and soul into!"
"main_0009_X_08_00_074(0)","Ｐ","すごい量の団子だ……しかも色とりどりだな","That's a lot of dumplings ...... and they're so colorful."
"main_0009_X_08_00_075(0)","心白","みんなの想いの数だけ、
色とりどりなお団子になりました","As many as the number of everyone's thoughts,
The dumplings are now colorful and multicolored!"
"main_0009_X_08_00_076(0)","Ｐ","そうだな、食べるのが楽しみだ","Yes, I'm looking forward to eating it."
"main_0009_X_08_00_077(0)","心白","『十五夜の謎、黄金白玉うさぎ伝説作戦』
その３、お月見団子試食を開始します","The Mystery of the Fifteen Nights, Operation Legend of the Golden White Rabbit.""
No.3, Otsukimi Dango Tasting will begin."
"main_0009_X_08_00_078(0)","全員","はいっ","hello (on phone, replying to ""moshimoshi"")"
"main_0009_X_08_00_079(0)","全員","はいっ","hello (on phone, replying to ""moshimoshi"")"
"main_0009_X_08_00_080(0)","全員","はいっ","hello (on phone, replying to ""moshimoshi"")"
"main_0009_X_08_00_081(0)","全員","はいっ","hello (on phone, replying to ""moshimoshi"")"
"main_0009_X_08_00_082(0)","全員","はいっ","hello (on phone, replying to ""moshimoshi"")"
"main_0009_X_08_00_083(0)","全員","はいっ","hello (on phone, replying to ""moshimoshi"")"
"main_0009_X_08_00_084(0)","全員","はいっ","hello (on phone, replying to ""moshimoshi"")"
"main_0009_X_08_00_085(0)","全員","はいっ","hello (on phone, replying to ""moshimoshi"")"
"main_0009_X_08_00_086(0)","未来","うわ～。金箔お団子！
キラキラしてて、すっごくきれいだね！","Wow~ gold leaf dumplings!
It's so sparkly and beautiful!"
"main_0009_X_08_00_087(0)","紬","春日さんの生クリームお団子も、とてもおいしいです","Kasuga's fresh cream dumplings are also very delicious!"
"main_0009_X_08_00_088(0)","菜々","おいしくなーれ、おいしくなーれ♪
はいっ、咲耶さん！　お召し上がりくださいっ！","Taste good, taste good♪
Yes, Sakuya-san! Please enjoy your meal!"
"main_0009_X_08_00_089(0)","咲耶","ありがとう、愛くるしいピンク色のお団子さんだ。
……名前はなんというんだい？","Thank you, lovely pink dumpling.
...... What's your name?"
"main_0009_X_08_00_090(0)","菜々","お団子の名前！？　そ、そうですね……。
『奥空家直伝☆ウサミンまんまるお団子』にします！","The name of the dumpling! Yes, that's right. ......
I'm going to make ""Usamin Manmururu Dumpling,"" which is directly from the Okukauke family!"
"main_0009_X_08_00_091(0)","咲耶","フフ、素敵な名前だね。宵の月を眺めながら、
菜々と一緒に食べるのに相応しい……","Huh, that's a lovely name, looking at the evening moon,
It deserves to be served with Nana: ......"
"main_0009_X_08_00_092(0)","菜々","さ、咲耶さんっ！　急に距離が近くなったような！
ナナ、ドキドキしちゃいます～！","Sakuya-san! Suddenly, the distance seems to have become closer!
Nana, I'm so nervous!"
"main_0009_X_08_00_093(0)","果穂","わぁっ！　美希さんのお団子、
スッゴく大きいですね！","Wow! Miki's dumplings,
It is very big!"
"main_0009_X_08_00_094(0)","美希","果穂も食べる？　ミキのお団子を食べたら、
武士になれるんだって。あはっ☆","Would you eat Kaho too? If you eat Miki's dumplings,
She said she can become a samurai."
"main_0009_X_08_00_095(0)","果穂","本当ですかっ！？
武士……なってみたいです！","Really?
I would like to become a warrior ......!"
"main_0009_X_08_00_096(0)","心白","お母さん、私の作ったお団子食べてみて！","Mom, try the dumplings I made!"
"main_0009_X_08_00_097(0)","眞弓","見たところ、
我が家のいつものお団子と相違はなさそうね","As seen in,
They don't seem to be any different from our regular dumplings."
"main_0009_X_08_00_098(0)","眞弓","いただきます………","Bon appétit: ........."
"main_0009_X_08_00_099(0)","眞弓","これは……温かい……","This is ...... warm ......"
"main_0009_X_08_00(101)","心白","素材は同じで、温度を少し変えてみたの。
どうかな？","I used the same ingredients and changed the temperature a bit.
I don't know."
"main_0009_X_08_00(102)","眞弓","同じようで、同じじゃないのね。
あなたの想い……美味しく受け止めたわ","So they are the same, but not the same.
Your thoughts ...... were deliciously received."
"main_0009_X_08_00(103)","心白","ふふっ……よかった。
じゃあ、次はお母さんのお団子だね。いただきます！","Phew ...... good.
Then, next is your mother's dumplings!"
"main_0009_X_08_00(104)","心白","……いつもより、甘味を感じる。
だけど、そこまで口に甘さが残らないなんて……","...... I feel a sweeter taste than usual.
But I can't believe it doesn't leave that much sweetness in your mouth: ......"
"main_0009_X_08_00(105)","眞弓","少し、苦みを感じるものを入れてみたわ。
カロリー控えめ、それでも甘味は感じたいもの","I put a little bit of bitterness in there, just to give it a little bit of a kick.
Low in calories, but still want to feel the sweetness"
"main_0009_X_08_00(106)","心白","……やっぱり、お母さんってすごいなぁ","...... I knew your mom was amazing!"
"main_0009_X_08_00(107)","心白","私のために、このメニューを考えてくれたんでしょ？","You came up with this menu for me, didn't you?"
"main_0009_X_08_00(108)","眞弓","……甘い物には魅かれる年頃だから。
私も昔は、こっそり食べたりしたの","I'm at an age where I'm fascinated by ...... sweet things.
I used to sneak a bite to eat, too."
"main_0009_X_08_00(109)","眞弓","あなたはこれからもアイドル。ステージに立つ以上、
カロリーコントロールは自己管理の基礎だから……","You will continue to be an idol, as long as you are on stage,
Calorie control is the foundation of self-management. ......"
"main_0009_X_08_00(110)","心白","伝わってきた。
そう想って作ってくれたんじゃないかって……","It was conveyed.
I thought you made it with that in mind. ......"
"main_0009_X_08_00(111)","眞弓","少しの工夫をこらすことで、少しでも前に進む。
そうして日々を精進していくのよ","A little ingenuity goes a long way.
That's how we devote our days."
"main_0009_X_08_00(112)","心白","うんっ","grrr"
"main_0009_X_08_00(113)","心白","ありがとう、お母さん。
ごちそうさまでした","Thanks, Mom.
That was a delicious meal (said after meals)"
"main_0009_X_08_00(114)","眞弓","私もよ、心白。
ごちそうさま","Me too, Kohaku.
word used after one has been treated (esp. used after a meal)"
"main_0009_X_08_00(115)","Ｐ","（奥空さん、心白……ふたりは母娘であり、
そして今は、ともに歩む仲間になったんだな……）","(Oku Kuu and Kohaku ...... are mother and daughter,
And now you've become friends to walk with. ......)"
"main_0009_X_08_00(116)","Ｐ","（お団子を食べ終わり、みんな楽しそうに帰った。
これならばお月見当日もスムーズにできそうだ）","(After finishing the dumplings, everyone left happily.
(This would make the day of tsukimi a smooth one.)"
"main_0009_E_02_00_001(0)","Ｐ","（いよいよ今日は、お月見パーティーだ。
１日の活動を終え、みんなで集まっている……）","(Finally, today is the moon-viewing party.
After a day of activities, everyone is gathering together ......)"
"main_0009_E_02_00_002(0)","心白","晴れてくれてよかったです。
月も綺麗に見えていますね♪","I'm glad it cleared up.
The moon is looking beautiful too... ♪"
"main_0009_E_02_00_003(0)","咲耶","みんな、ジュースは行き渡ったかな？
……心白、乾杯の音頭をお願いしてもいいだろうか？","Did everyone get their juices flowing?
...... Kohaku, may I ask for a toast?"
"main_0009_E_02_00_004(0)","心白","は、はいっ。……みなさん、
今日はまん丸のお月さまが出ています","Ha, yes. ...... everyone,
The moon is round and round today."
"main_0009_E_02_00_005(0)","心白","ルミナスのメンバー全員で、
お月見パーティーが開催できて、とても嬉しいです","All members of Luminous,
We are so happy to host the moon party!"
"main_0009_E_02_00_006(0)","心白","今宵は月を見て、
楽しいひと時を過ごせればと思います","Tonight, look at the moon,
I hope you have a good time!"
"main_0009_E_02_00_007(0)","心白","では、ルミナスに……乾杯！","Well, here's to ...... cheers to Luminous!"
"main_0009_E_02_00_008(0)","全員","かんぱーいっ♪","â™ª"
"main_0009_E_02_00_009(0)","全員","かんぱーいっ♪","â™ª"
"main_0009_E_02_00_010(0)","全員","かんぱーいっ♪","â™ª"
"main_0009_E_02_00_011(0)","全員","かんぱーいっ♪","â™ª"
"main_0009_E_02_00_012(0)","全員","かんぱーいっ♪","â™ª"
"main_0009_E_02_00_013(0)","全員","かんぱーいっ♪","â™ª"
"main_0009_E_02_00_014(0)","全員","かんぱーいっ♪","â™ª"
"main_0009_E_02_00_015(0)","全員","かんぱーいっ♪","â™ª"
"main_0009_E_02_00_016(0)","全員","かんぱーいっ♪","â™ª"
"main_0009_E_02_00_017(0)","全員","かんぱーいっ♪","â™ª"
"main_0009_E_02_00_018(0)","全員","かんぱーいっ♪","â™ª"
"main_0009_E_02_00_019(0)","全員","かんぱーいっ♪","â™ª"
"main_0009_E_02_00_020(0)","全員","かんぱーいっ♪","â™ª"
"main_0009_E_02_00_021(0)","全員","かんぱーいっ♪","â™ª"
"main_0009_E_02_00_022(0)","全員","かんぱーいっ♪","â™ª"
"main_0009_E_02_00_023(0)","全員","かんぱーいっ♪","â™ª"
"main_0009_E_02_00_024(0)","全員","かんぱーいっ♪","â™ª"
"main_0009_E_02_00_025(0)","全員","かんぱーいっ♪","â™ª"
"main_0009_E_02_00_026(0)","全員","かんぱーいっ♪","â™ª"
"main_0009_E_02_00_027(0)","全員","かんぱーいっ♪","â™ª"
"main_0009_E_02_00_028(0)","全員","かんぱーいっ♪","â™ª"
"main_0009_E_02_00_029(0)","全員","かんぱーいっ♪","â™ª"
"main_0009_E_02_00_030(0)","全員","かんぱーいっ♪","â™ª"
"main_0009_E_02_00_031(0)","全員","かんぱーいっ♪","â™ª"
"main_0009_E_02_00_032(0)","全員","かんぱーいっ♪","â™ª"
"main_0009_E_02_00_033(0)","全員","かんぱーいっ♪","â™ª"
"main_0009_E_02_00_034(0)","全員","かんぱーいっ♪","â™ª"
"main_0009_E_02_00_035(0)","全員","かんぱーいっ♪","â™ª"
"main_0009_E_02_00_036(0)","全員","かんぱーいっ♪","â™ª"
"main_0009_E_02_00_037(0)","Ｐ","（みんな、思い思いに楽しんでいるようだ。
ちょっと、様子を見て回ろうかな……）","(Everyone seems to be enjoying themselves to their heart's content.
Let's just take a look around and see what's going on. ......)"
"main_0009_E_02_00_038(0)","貴音","秋の月は、真、美しくもあり……。
それでいて、あの遠い輝きに孤独を覚えます","The autumn moon, true, is also beautiful. ......
And yet, I feel lonely in that distant glow."
"main_0009_E_02_00_039(0)","美希","ミキ、難しい話は分からないけど……。
お月さまは、キレイだって思うな","Miki, I don't know how hard it is, but you can find out more at .......
Don't think the moon is beautiful."
"main_0009_E_02_00_040(0)","美希","こうやって見上げて、のんびりしていると……。
なんだか眠く……あふぅ","You can look up like this and relax at .......
I'm kind of sleepy ...... ah"
"main_0009_E_02_00_041(0)","蘭子","フフフ……。
アルテミスの加護が、我らを照らす……","Hmph. .......
Artemis' blessing shines upon us: ......"
"main_0009_E_02_00_042(0)","（蘭子ログ）","（月を見ていると、
なんだか気持ちが落ち着きますね～）","(Looking at the moon,
It's kind of calming~)"
"main_0009_E_02_00_043(0)","静香","忙しくしていると、こうして月を眺めることも、
忘れてしまいますよね","When we are busy, we can look at the moon in this way,
You forget."
"main_0009_E_02_00_044(0)","甘奈","そうだね～
えへへ、のんびり～","Yes...
Hehehe, relax~!"
"main_0009_E_02_00_045(0)","Ｐ","（きらりたちは、お団子を食べて
盛り上がっているみたいだな）","(Kirari and her friends ate dumplings.
(Sounds like you're on a roll.)"
"main_0009_E_02_00_046(0)","Ｐ","（色も大きさもトッピングも様々で、
個性的なお月見団子が集結してるぞ）","(They come in a variety of colors, sizes, and toppings,
(There's a collection of unique tsukimi dango (moon-viewing dumplings)."
"main_0009_E_02_00_047(0)","きらり","にょっわー！
このお団子、すっごくおいしいにぃ～☆","Nyowa!
These dumplings are so delicious!"
"main_0009_E_02_00_048(0)","やよい","はい！　ほっぺたが落ちちゃいそうですっ！","Yes! My cheeks are about to fall off!"
"main_0009_E_02_00_049(0)","歌織","このお団子……とってもきれいな黄色で、
まるでお月様みたいね","This dumpling ...... is very beautiful and yellow,
You look like the moon."
"main_0009_E_02_00_050(0)","春香","たぶん、お団子にカボチャを練り込んで、
黄色くしてあるんだと思います♪","Maybe knead pumpkin into the dumplings,
I think it's yellowed.Â"
"main_0009_E_02_00_051(0)","あずさ","さすが春香ちゃん。
お菓子のこと、詳しいわね～","That's Haruka-chan.
You know so much about sweets!"
"main_0009_E_02_00_052(0)","春香","えへへ♪
ありがとうございます！","Heh heh heh ♪
Thank you very much!"
"main_0009_E_02_00_053(0)","Ｐ","春香たちにも好評じゃないか。
この前のお団子試作会の成果が出ているな","I think Haruka's group like it too.
I see the results of the last dumpling prototyping session are showing."
"main_0009_E_02_00_054(0)","心白","はい。本当ならみなさんの都合が合う時に、
試作会を開ければよかったのですが……","Yes, when it is convenient for everyone, if that is the case,
I wish I could have held a prototype meeting: ......"
"main_0009_E_02_00_055(0)","春香","ううん。気にしなくていいよ。かわいくて
おいしいお団子、いっぱい食べられたからね♪","No, don't worry about it, it's cute.
Delicious dumplings, I could eat a lot of dumplings... ♪"
"main_0009_E_02_00_056(0)","春香","心白ちゃん、また今度、お団子の作り方教えてね♪","Kohaku, next time, please teach me how to make dumplings... ♪"
"main_0009_E_02_00_057(0)","心白","はい！　よろこんで","Yes! With pleasure."
"main_0009_E_02_00_058(0)","春香","私も今度、秋っぽいお菓子作りに
チャレンジしてみようかな～？","I'm going to try my hand at baking autumnal sweets next time!
Let's take the challenge!"
"main_0009_E_02_00_059(0)","凛世","凛世にも……
作れましょうか……","Rinze also: ......
Can we make it? ......"
"main_0009_E_02_00_060(0)","春香","うん、簡単だし、大丈夫だよ。
一緒に作ってみる？","Yeah, it's easy and it's fine.
Do you want to make it together?"
"main_0009_E_02_00_061(0)","凛世","ふふ……
ぜひ……","Hmmm... ......
Please visit ......"
"main_0009_E_02_00_062(0)","あずさ","まぁ、いいわね～。
お菓子作り、私も参加しようかしら～♪","Well, that's nice!
I wonder if I should join in on the baking!"
"main_0009_E_02_00_063(0)","やよい","私も参加したいです！　
それじゃあ、みんなで一緒に作りましょー！","I would like to participate too!
Then, let's make it together!"
"main_0009_E_02_00_064(0)","Ｐ","（こっちの方も盛り上がっているな。
何の話をしているんだろう？）","(It's a lot of fun over here, too.
(What am I talking about?)"
"main_0009_E_02_00_065(0)","果穂","菜々さん！
ウサミン星のお月見って、どんな感じなんですか？","Nana!
What is moon viewing like on the planet Usamin?"
"main_0009_E_02_00_066(0)","菜々","そうですね～。ウサミン印のお団子を食べながら、
美味しいジュースを飲むって感じですねっ！","Yes - while eating dumplings with the Usamin mark,
It's like drinking a good juice!"
"main_0009_E_02_00_067(0)","果穂","お団子とジュース……！
ウサミン星のお月見、地球と似てるんですねっ！","Dumplings and juice. ......
Moon viewing on the planet Usamin, it's so similar to Earth!"
"main_0009_E_02_00_068(0)","菜々","あはは……そうですね！　でも、ウサミン星と、
月のウサギさんは、とっても仲良しですから","Haha ...... yes, but with the Usaminster,
Because the Moon Rabbit is a very good friend."
"main_0009_E_02_00_069(0)","菜々","電波でピピッと交信すれば、
お月見団子をすぐにお届けしてくれますよ♪","If you communicate with a beep on the airwaves,
They will deliver the otsukimi dumplings right away♪"
"main_0009_E_02_00_070(0)","亜美","ほうほう。最近の月のウサギは、
めっちゃサービス満点なのですな～","Well, well, well...the moon rabbits these days,
You are so full of service!"
"main_0009_E_02_00_071(0)","真美","それなら、真美たちの家にも、
電話１本でお届けしてくれないかな～？","Then, you can go to Mami and her family's house,
Can you deliver with just one phone call!"
"main_0009_E_02_00_072(0)","亜美","……ねぇ、真美。そのウサギにお願いしたら、
亜美たちも月に行けるんじゃない？","...... Hey, Mami, why don't you ask that rabbit to do it for you,
Maybe Ami and her friends can go to the moon too?"
"main_0009_E_02_00_073(0)","真美","亜美、それ超名案だよー！
月か～。生きているうちに１５回は行きたいよね！","Ami, that's a super idea!
I want to go 15 times while I'm still alive!"
"main_0009_E_02_00_074(0)","果穂","亜美さんと真美さん、
お月様に行くんですか？","Ami and Mami,
Are you going to the moon?"
"main_0009_E_02_00_075(0)","亜美","モチのロンだよー。
でも、さすがにすぐにはムリっぽいかな～","It's a motif!
But I don't think that's going to happen anytime soon."
"main_0009_E_02_00_076(0)","真美","そうそう！　アイドルで超成功して、
お金をめっちゃ貯めて、ドドーンと行きたいよねっ！","Yes, yes, yes!
I want to save up a lot of money and go with a bang!"
"main_0009_E_02_00_077(0)","紬","あの……おふたりは、
月に行ってなにをするのでしょうか？","That ...... you two are,
What will you do when you go to the moon?"
"main_0009_E_02_00_078(0)","亜美","それはもちろん……ん～とん～と……あ、そうだ、
月面ライブ！　超盛り上がるっしょ！","That is, of course, ...... n~ton~ and ...... ah, yes,
Live on the moon! It will be super exciting!"
"main_0009_E_02_00_079(0)","紬","なるほど……月の上でライブですか。
アイドルとしては、間違いなく偉業ですね","I see. ...... Live on the moon?
A feat for an idol, no doubt."
"main_0009_E_02_00_080(0)","真美","亜美、ナイスアイディアだよ！　んっふっふ～。
真美たち、歴史に名前を残しちゃうかも！","Ami, nice idea!
Mami and her friends may leave their names in history!"
"main_0009_E_02_00_081(0)","菜々","な、なんだかすごい方向に、
話が飛躍しちゃってますっ……！","What a great direction,
I'm jumping the gun. ......"
"main_0009_E_02_00_082(0)","Ｐ","（律子たちは、
なぜか、しりとりで盛り上がっているな）","(Ritsuko and others,
(Somehow, you're getting all excited about shiritori.)"
"main_0009_E_02_00_083(0)","律子","じゃあ、アイドルしりとりを始めるわよ。
アイドルに関係のある言葉縛り、ってことで","Okay, let's start playing Idol Shiritori.
Word bindings related to idols, I mean."
"main_0009_E_02_00_084(0)","律子","まずは私から……。
アイドルの『ル』から始めて、『ルミナス』♪","I will start with me at .......
Start with the ""le"" in ""idol"" and then ""luminous. ""Â"
"main_0009_E_02_00_085(0)","未来","えーっと、えーっと……。
それじゃあ、『ステージ』で！","Let's see, let's see... .......
Okay, then, on ""The Stage""!"
"main_0009_E_02_00_086(0)","千早","そうね……『自己管理』かしら","Yes. ...... ""self-discipline"" I guess."
"main_0009_E_02_00_087(0)","未来","えーっ！？
それって、アイドル関係なんですか？","Eh!
Is that related to idols?"
"main_0009_E_02_00_088(0)","千早","ええ……。自己管理は、アイドルにとって、
とても大切なことだと思うわ","Yes, ....... Self-discipline is for idols,
I think it's very important."
"main_0009_E_02_00_089(0)","美嘉","千早ちゃんの言う通りだと思うな。
だから、オッケーってことでいいんじゃない？","Don't think Chihaya is right.
So, I guess that means ok, right?"
