"id","character","source","translatedstr"
"main_0004_B_06_00_002(0)","Ｐ","まずは基礎的なことを、みんなでやっていこう。
歌唱メンバーはそのあとで集中してやるからな！","Let's start with the fundamentals, together.
The singing members will concentrate on that afterwards!"
"main_0004_B_06_00_003(0)","ボイストレーナー","みんな注目～！
声の調子はどう？　レッスン方法は覚えてきた？","Everyone's attention~!
How's your voice? Are you learning how to give lessons?"
"main_0004_B_06_00_004(0)","美嘉","もちろん♪　バッチリ覚えてきました★","Of course... I learned everything I needed to know."
"main_0004_B_06_00_005(0)","ボイストレーナー","うん、良い返事だね。じゃあ、早速……。
ひとりずつ、歌ってもらおうかな","Yeah, that's a good response, then I'll get right back to you at .......
I'll have them sing one at a time."
"main_0004_B_06_00_006(0)","ボイストレーナー","最初は、天海さんにお願いしよう。
ビシっと見本を見せてあげて","Let's start with Amami.
Show them by example."
"main_0004_B_06_00_007(0)","春香","わ、私ですかっ！？　わ、分かりました！
……それじゃ、天海春香、歌います！","Wow, it's me? Wow, I understand!
......Then, Haruka Amami, I will sing!"
"main_0004_B_06_00_008(0)","Ｐ","（さすがだな。春香の成長を感じる……）","(As expected, I sense Haruka's growth: ......)"
"main_0004_B_06_00_009(0)","ボイストレーナー","うん、とっても天海さんらしい音色だったよ。
自分の個性をよく分かっている、いい歌声だったね","Yes, it sounded very Amami.
You had a nice singing voice, knowing your own personality."
"main_0004_B_06_00_010(0)","咲耶","うん、さすがだね。
綻ぶ花の姿が脳裏に浮かぶような、そんな歌声だ","Yeah, that's as good as it gets.
It's the kind of song that brings to mind the image of a flower breaking into pieces."
"main_0004_B_06_00_011(0)","雪歩","春香ちゃん、お疲れさま。春香ちゃんらしい
明るい歌声で、とっても素敵だったよ","Good job, Haruka-chan, that's very Haruka-chan.
You had a very nice, bright singing voice."
"main_0004_B_06_00_012(0)","春香","咲耶さん、雪歩、ありがとう！
でも、私なんてまだまだだよ。もっと頑張らないと！","Thank you, Sakuya and Yukiho!
But I'm not ready yet, I have to work harder!"
"main_0004_B_06_00_013(0)","心白","…………","…………"
"main_0004_B_06_00_014(0)","ボイストレーナー","じゃあ、次は……。
白石さん、いってみよっか","Okay, next, we're going to go to .......
Ms. Shiraishi, let's try it."
"main_0004_B_06_00_015(0)","紬","は、はい！","Ha, yes!"
"main_0004_B_06_00_016(0)","ボイストレーナー","なるほど……。
うん、綺麗な歌声だね……","I see. .......
Yeah, you have a beautiful voice. ......"
"main_0004_B_06_00_017(0)","ボイストレーナー","……でも、緊張してる？
少しだけ声に力が入ってたかな","Are you nervous about ...... though?
I guess I had a little bit of power in my voice."
"main_0004_B_06_00_018(0)","紬","は、はい……少しだけ……","is yes ...... a little bit ......"
"main_0004_B_06_00_019(0)","ボイストレーナー","歌い方に迷いがなかったから、
しっかりとレッスンして、歌詞を覚えてきてるね","Because there was no hesitation in the way I sang,
You've been taking lessons well and learning the lyrics."
"main_0004_B_06_00_020(0)","ボイストレーナー","次はもう少し自分に自信を持って歌うと、
もっとよくなると思うよ","Next time, he said, he would sing with a little more confidence in himself,
I think it could be better."
"main_0004_B_06_00_021(0)","紬","……はい！
ありがとうございます！","...... Yes!
Thank you very much!"
"main_0004_B_06_00_022(0)","Ｐ","（的確なアドバイスだ。
俺が言うことはないな）","(Sound advice.
(Not that I have anything to say about that.)"
"main_0004_B_06_00_023(0)","ボイストレーナー","次は……奥空さん！","Next up is ...... Okuora!"
"main_0004_B_06_00_024(0)","心白","はいっ！　では……","Yes! Well then, ......"
"main_0004_B_06_00_025(0)","Ｐ","（へぇ。心白、春香みたいに歌えるのか……。
アイドルとしての素養は優れてるな……）","(Heh...can you sing like Haruka, Kohaku? .......
You have an excellent idol background. ......)"
"main_0004_B_06_00_026(0)","ボイストレーナー","……なるほど。
うん……すっごく良かったと思う","...... I see.
Yeah, I think ...... was really good."
"main_0004_B_06_00_027(0)","ボイストレーナー","ええと、プロデューサーさん、聞いていいかな。
奥空さんって、どこかで活動してたことあるの？","Um, can I ask you something, Producer-san?
Has Okuzora-san ever been active anywhere?"
"main_0004_B_06_00_028(0)","Ｐ","はい、そうです。
以前にもアイドルをしていたことがありました","Yes, it is.
I had been idle before."
"main_0004_B_06_00_029(0)","ボイストレーナー","そうなんだ……。いやぁ、すごい才能だね。
彼女からは、何とも言えない貫禄を感じたよ！","Yes, ....... Well, that's a great talent.
I felt an indescribable dignity from her!"
"main_0004_B_06_00_030(0)","ボイストレーナー","想像以上によくできていたので、特にアドバイスは
ないかな……。プロデューサーさんはなにかある？","It was done better than I could have imagined, so I have no particular advice.
I don't think so. ....... Do you have anything for the producer?"
"main_0004_B_06_00_031(0)","Ｐ","（完成度は高かった。さすが、というべきか……）","(It was perfect, as expected, or should I say, ......)"
"main_0004_B_06_00_032(0)","Ｐ","……いえ、大丈夫です。
とってもよかったと思います","...... No, it's fine.
I think it was very good."
"main_0004_B_06_00_033(0)","ボイストレーナー","奥空さん、その調子でこれからもお願いね","Okuzora, please keep up the good work."
"main_0004_B_06_00_034(0)","心白","はいっ！
ありがとうございますっ！","Yes, sir!
Thank you very much!"
"main_0004_B_06_00_035(0)","美嘉","へぇ～、心白ちゃんの歌声、しっかりと聞いたのは
初めてだけど……すっごくイケてるじゃん♪","Wow, I've never heard Kohaku's singing voice so well.
I'm new to this, but ...... is really cool!"
"main_0004_B_06_00_036(0)","春香","うんうん！
すごかったよ、心白ちゃん！","Mm-hmm!
That was amazing, Kohaku!"
"main_0004_B_06_00_037(0)","あずさ","そうね、とっても素敵な歌声……","Yes, you have a very nice voice. ......"
"main_0004_B_06_00_038(0)","心白","い、いえ……私なんて……。
みなさんの歌声のほうが、とっても綺麗です","No, no, ...... I'm not .......
Your voices are so much more beautiful!"
"main_0004_B_06_00_039(0)","ボイストレーナー","はーい。みんな、再開するよ～。
じゃあ、次の人は……","Yes, everyone, we are back in business!
Okay, the next one is ......"
"main_0004_B_06_00_040(0)","Ｐ","（レッスンは順調のようだな……
よし！　もっと、みんなの個性を見極めるぞ……！）","(Looks like the lesson is going well: ......
Okay, more, let's see what everyone's personality is ......!)"
"main_0004_B_05_00_001(0)","Ｐ","（今日は、ダンスレッスンか……。
みんな熱心に取り組んでいるな！）","(Today is either a dance lesson or .......
(You're all so enthusiastic about this!)"
"main_0004_B_05_00_002(0)","Ｐ","（まずは、メンバーみんなの動きを見てみるか）","(First, let's see how all the members are doing.)"
"main_0004_B_05_00_003(0)","響","よっと……ここでターンをして……っと！","Alright, ...... let's make a turn here and go to ......!"
"main_0004_B_05_00_004(0)","未来","わぁ～、さっすが響さん！
ダンスがキレッキレですね！","Wow, that's great Hibiki!
The dance is kick-ass!"
"main_0004_B_05_00_005(0)","響","えへへっ、ありがと。
でも、未来……腕の動きが逆になってたぞ","Hehehe, thank you.
But, Mirai... the arm movements were reversed."
"main_0004_B_05_00_006(0)","未来","ええっ！？　そ、そうですか？
あれ～、おかしいなぁ……","Eh? Is that so?
That's not right. ......"
"main_0004_B_05_00_007(0)","杏","ああ、ついにレッスンが始まってしまった……。
杏、休憩時間が恋しいよ……","Ah, the lessons have finally begun: .......
Anzu, I miss the breaks. ......"
"main_0004_B_05_00_008(0)","あずさ","えっと……。このリズムで、手を動かして……。
あらあら、足がうまく動かないわ","Let's see... ......... This is the rhythm... ...... with your hands.
Oh my gosh, my legs don't work right."
"main_0004_B_05_00_009(0)","Ｐ","…………。
よし、そのまま次のパートの動きをやってみようか",".............
Okay, let's go straight to the next part of the movement."
"main_0004_B_05_00_010(0)","静香","横に３歩動いて、１歩下がる……。
次は、隣の人に近づいて……","Move three steps sideways and one step back. ......
Next, approach your neighbor: ......"
"main_0004_B_05_00_011(0)","果穂","よいしょっ、と……。
この次の動きが……こうなってるから……","Good to know. .......
This next move is ...... because it looks like this: ......"
"main_0004_B_05_00_012(0)","美嘉","このくらいなら、まだまだいけそうかな★
どんどんスピード上げていいよー！","I think I can still make it this far.
You can go faster and faster!"
"main_0004_B_05_00_013(0)","心白","足は……このまま……。
その次は、腕の力を抜きながら……ターンして……","The legs are ...... as they are .......
Next, while relaxing your arms, turn ...... and ......"
"main_0004_B_05_00_014(0)","美希","うーん。ミキ、動きはだいたい覚えたけど、
なんだかいつもと違う感じがするの","Well, Miki, I've learned most of the moves,
There's something about it that just feels different."
"main_0004_B_05_00_015(0)","響","うがーっ！　なかなかうまくいかないぞ～。
やり方が悪いのかなぁ……","Ugh! It's not going well!
I wonder if it's not the right way to do it: ......"
"main_0004_B_05_00_016(0)","Ｐ","（響はダンスが得意だから、
比較的、周りを見る余裕があるみたいだな）","(Hibiki is good at dancing,
(Relatively speaking, it sounds like you've got plenty of time to look around.)"
"main_0004_B_05_00_017(0)","未来","なんか、うまく合わないですよね～","It doesn't quite fit together!"
"main_0004_B_05_00_018(0)","甜花","あ、あぅ……ご、ごめんなさい……！","Oh, oh ...... sorry ......!"
"main_0004_B_05_00_019(0)","未来","え、甜花さんのことじゃないよ！
そんなつもりで言ったんじゃないから！","Eh, I'm not talking about Tenka-san!
I didn't mean it that way!"
"main_0004_B_05_00_020(0)","Ｐ","う～ん、いきなり合わせるのは厳しかったか……","Hmmm... I guess it was tough to match them out of the blue. ......"
"main_0004_B_05_00_021(0)","真","どうしますか、プロデューサー。
歌のレッスンに切り替えますか？","What do you want to do, producer?
Switch to singing lessons?"
"main_0004_B_05_00_022(0)","Ｐ","いや、今日はダンスのトレーナーさんも
来てもらっているしな……","No, I have a dance trainer today.
And we're having them come to us. ......"
"main_0004_B_05_00_023(0)","律子","ということは、ダンスのレッスンに、
集中したほうがいいわよね","So, to dance lessons,
We'd better focus."
"main_0004_B_05_00_024(0)","春香","その方がいいかも。あとは……グループに分かれて、
ダンスを一通りレッスンしてから合わせる、とか？","Maybe that would be better, then we can split into ...... groups,
Maybe a whole series of dance lessons and then matching them up?"
"main_0004_B_05_00_025(0)","歌織","確かに……。合唱でも、全体練習の前にパート別の
レッスンをして、それから合わせたりしますし","Certainly ....... Even in chorus, before the whole practice, part by part.
I give lessons, and then we match them up."
"main_0004_B_05_00_026(0)","律子","いいですね。プロデューサー、このアイディア、
試す価値はありますよ","I like this idea, producer,
It's worth a try."
"main_0004_B_05_00_027(0)","律子","まとめ役を選んで少数のグループで
レッスンをするのはどうですか？","A small group of people can choose to put together a group.
How about giving lessons?"
"main_0004_B_05_00_028(0)","律子","今日のまとめ役は、春香、響、美希、
そして私あたりが適任かと思うんですけど","Today's summarizers are Haruka, Hibiki, and Miki,
And I think I'm the right person for the job."
"main_0004_B_05_00_029(0)","Ｐ","ありがとう、律子。よし、やってみるか！
早速、レッスン用のグループ分けを決めよう","Thanks, Ritsuko...okay, I'll give it a shot!
Let's decide on a grouping for the lesson as soon as possible."
"main_0004_B_05_00_030(0)","Ｐ","……それじゃあ、しばらくの間は
４つのグループに分かれてレッスンしてもらう","...... then it's been a while.
You'll be divided into four groups for lessons."
"main_0004_B_05_00_031(0)","Ｐ","まずは春香、雪歩、あずささん、紬、美嘉、咲耶、
そして、心白のグループ","First, Haruka, Yukiho, Azusa, Tsumugi, Mika, and Sakuya,
And a group of Kohaku"
"main_0004_B_05_00_032(0)","春香","はいっ！","Yes!"
"main_0004_B_05_00_033(0)","雪歩","はいっ！","Yes!"
"main_0004_B_05_00_034(0)","あずさ","はいっ！","Yes!"
"main_0004_B_05_00_035(0)","紬","はいっ！","Yes!"
"main_0004_B_05_00_036(0)","美嘉","はいっ！","Yes!"
"main_0004_B_05_00_037(0)","咲耶","はいっ！","Yes!"
"main_0004_B_05_00_038(0)","心白","はいっ！","Yes!"
"main_0004_B_05_00_039(0)","Ｐ","続いて、響、やよい、貴音、歌織さん、
蘭子、甘奈、甜花のグループ","Then Hibiki, Yayoi, Takane, and Kaori,
Group of Ranko, Amana, and Tenka-chan"
"main_0004_B_05_00_040(0)","やよい","はいっ！","Yes!"
"main_0004_B_05_00_041(0)","響","はいっ！","Yes!"
"main_0004_B_05_00_042(0)","貴音","はいっ！","Yes!"
"main_0004_B_05_00_043(0)","歌織","はいっ！","Yes!"
"main_0004_B_05_00_044(0)","蘭子","はいっ！","Yes!"
"main_0004_B_05_00_045(0)","甘奈","はいっ！","Yes!"
"main_0004_B_05_00_046(0)","甜花","はいっ！","Yes!"
"main_0004_B_05_00_047(0)","Ｐ","それから、美希、千早、真、未来、
杏、きらり、凛世のグループ","Then Miki, Chihaya, Makoto, and Mirai,
Group of Anzu, Kirari, Rinze"
"main_0004_B_05_00_048(0)","千早","はいっ！","Yes!"
"main_0004_B_05_00_049(0)","真","はいっ！","Yes!"
"main_0004_B_05_00_050(0)","美希","はいっ！","Yes!"
"main_0004_B_05_00_051(0)","未来","はいっ！","Yes!"
"main_0004_B_05_00_052(0)","杏","はいっ！","Yes!"
"main_0004_B_05_00_053(0)","きらり","はいっ！","Yes!"
"main_0004_B_05_00_054(0)","凛世","はいっ！","Yes!"
"main_0004_B_05_00_055(0)","Ｐ","最後は、律子、伊織、亜美、真美、静香、翼、
菜々、果穂だ","Lastly, Ritsuko, Iori, Ami, Mami, Shizuka, and Tsubasa,
Nana, Kaho."
"main_0004_B_05_00_056(0)","律子","はいっ！","Yes!"
"main_0004_B_05_00_057(0)","伊織","はいっ！","Yes!"
"main_0004_B_05_00_058(0)","亜美","はいっ！","Yes!"
"main_0004_B_05_00_059(0)","真美","はいっ！","Yes!"
"main_0004_B_05_00_060(0)","静香","はいっ！","Yes!"
"main_0004_B_05_00_061(0)","翼","はいっ！","Yes!"
"main_0004_B_05_00_062(0)","菜々","はいっ！","Yes!"
"main_0004_B_05_00_063(0)","果穂","はいっ！","Yes!"
"main_0004_B_05_00_064(0)","響","じゃあ、早速レッスン始めよう！
みんな、はりきっていくぞー！","Well, let's get on with the lesson!
Let's get going!"
"main_0004_B_05_00_065(0)","甘奈","うんっ☆　みんなで頑張っていこうね！","Yeah☆ Let's all do our best!"
"main_0004_B_05_00_066(0)","Ｐ","（急遽、小グループを作る事になったが
この分け方なら事務所間の交流もできそうだ！）","(We had to form small groups in a hurry.
(This division would allow for interoffice interaction!)"
"main_0004_B_05_00_067(0)","Ｐ","（よし、そろそろ今月末のライブに立つ、
歌唱メンバーのダンスレッスンをしないとな……）","(Okay, I'm about to stand in for a gig at the end of this month,
I'll have to give the singing members dance lessons (......)."
"main_0004_B_07_00_001(0)","Ｐ","（今日は、ビジュアルレッスンの初日か……
みんなどんな感じかな？）","(Today is the first day of visual lessons or ......
(How do you everyone feel about that?)"
"main_0004_B_07_00_002(0)","響","それじゃ、早速ポージングしてみるぞ！","Well then, let's get to posing!"
"main_0004_B_07_00_003(0)","歌織","あら、指先までピシッときまって、
とっても綺麗♪　笑顔もバッチリね","Oh, my, it's so tight right down to the tips of my fingers,
You look so beautiful... and your smile is perfect."
"main_0004_B_07_00_004(0)","響","へへっ、頑張ってレッスンしたからね♪","Hehe, I worked hard on my lessons... ♪"
"main_0004_B_07_00_005(0)","やよい","さすが響さんです！
私も負けてられないですっ！","That's what Hibiki is all about!
I can't lose either!"
"main_0004_B_07_00_006(0)","甜花","て、甜花も……が、頑張らないと……っ！
あうっ……！　し……舌、かんじゃった……","Well, Tenka too... but I have to do my best...!
Oh...! I... I bit my tongue..."
"main_0004_B_07_00_007(0)","甘奈","て、甜花ちゃん、お口の中見せて！
痛いところはない？","T-Tenka-chan, show me the inside of your mouth!
Is there any pain?"
"main_0004_B_07_00_008(0)","甜花","うぅ……だ、大丈夫。
痛いの……ちょっとだけ、だから……","Ugh ......, it's okay.
It hurts ...... a little bit, so ......"
"main_0004_B_07_00_009(0)","蘭子","無事に魔の手からは逃れたようね","Looks like you're out of the clutches of evil for good."
"main_0004_B_07_00_010(0)","（蘭子ログ）","（ケガがなくてよかったです～）","(I'm glad you weren't hurt~)"
"main_0004_B_07_00_011(0)","甘奈","甜花ちゃん、肩に力が入っちゃってるかも？
……大丈夫、焦らずにいこう！","Tenka, maybe you've got a bit of a chip on your shoulder?
...... It's okay, let's not be hasty!"
"main_0004_B_07_00_012(0)","甘奈","もし、困ってることがあったら言ってね！
甘奈、いつでも手伝うからっ！","If you have any problems, let me know!
Amana, I'm always here to help!"
"main_0004_B_07_00_013(0)","甜花","なーちゃん……
あ、ありがと……","Nachan ......
Oh, thanks ......"
"main_0004_B_07_00_014(0)","甜花","で、でも……
甜花も、頑張らなきゃ……","B-but...
Tenka must do her best too..."
"main_0004_B_07_00_015(0)","響","レッスンの初日なんだから、
うまくいかなくて当たり前さー！","It's the first day of lessons,
It's no wonder it didn't work out!"
"main_0004_B_07_00_016(0)","やよい","そうですよ、甜花さん！　自分のペースで
ゆっくりやっていけばいいって思います！","That's right, Tenka-san! at your own pace
I think you should take it slow!"
"main_0004_B_07_00_017(0)","やよい","最初のうちは、失敗しても気にしない！
って気持ちでいいんじゃないかなーって！","In the beginning, I don't care if I fail!
I thought it would be a good feeling to be able to do that!"
"main_0004_B_07_00_018(0)","甜花","え……？
で、でも……失敗したら、みんな、迷惑……","What, ......?
And, but if ...... fails, everyone, annoy ......"
"main_0004_B_07_00_019(0)","貴音","多くの成功者は、失敗を繰り返して
前へと進んでいくもの……","Many successful people repeatedly fail.
What's moving forward: ......"
"main_0004_B_07_00_020(0)","貴音","甜花、誰も迷惑などとは思いませんよ","Tenka, no one will think you are a nuisance or anything like that."
"main_0004_B_07_00_021(0)","歌織","そうね。
支え合ってこそ、仲間なんだから","Yes, I think so.
We are friends only if we support each other."
"main_0004_B_07_00_022(0)","甜花","に、にへへ……
み、みんな……ありがと……","Ni, Nihehe...
Thank you, everyone..."
"main_0004_B_07_00_023(0)","甘奈","それじゃ、レッスン再開だね☆
甜花ちゃん、ゆっくりやっていくよ！","Then let's resume the lesson!
Tenka-chan, I'm going slowly!"
"main_0004_B_07_00_024(0)","響","分からないところがあったら、
どんどん聞いてね","If you have any questions,
Keep asking!"
"main_0004_B_07_00_025(0)","甜花","うん……！
にへへ……みんな、優しい……","Yes……!
Nihehe...everyone is kind..."
"main_0004_B_07_00_026(0)","Ｐ","（甜花、いい笑顔だな！　この笑顔が生まれるように
なれば、ビジュアルレッスンは成功だ……)","(Tenka, you have a nice smile! If your smile can be born again,
the visual lesson will be a success...)"
"main_0004_B_07_00_027(0)","Ｐ","（さてと、歌唱メンバーのビジュアルレッスンを
そろそろ始める時間だな……）","(Okay, now for a visual lesson for the singing members.
(It's time to get started. ......)"
"main_0004_C_01_00_001(0)","Ｐ","（今日から歌唱メンバーは、ステージレッスンだ！
さて、みんなどんな感じかな……）","(Singing members will have stage lessons starting today!
Well, let's see how they all feel ......)"
"main_0004_C_01_00_002(0)","杏","はぁ……やる気がでない……","Huh ...... I don't have the motivation ......"
"main_0004_C_01_00_003(0)","杏","どうやったらレッスンをやる気になるか、
ぜひ、みんなに教えてほしいよ","How can I motivate myself to do lessons?
I'd love to hear from you everyone."
"main_0004_C_01_00_004(0)","Ｐ","レッスンを頑張ることで、将来的には、
すごいアイドルになる……とかではダメか？","By working hard in lessons, in the future,
Can't you just go to ...... or something like that to be an awesome idol?"
"main_0004_C_01_00_005(0)","杏","目標がふわっとしてるっていうか……
もっと目先の喜びが欲しいんだよねー","I mean, the goal is fluffy. ......
I'm just looking for more immediate pleasure!"
"main_0004_C_01_00_006(0)","杏","そりゃ、今回の曲の歌唱メンバーなわけだし、
少しは頑張らないとー、とは思ってるけどさ","That's because they are the singing members of this song,
I know I have to work a little harder, but..."
"main_0004_C_01_00_007(0)","千早","それなら……レッスンが終わるたびに、自分に何か
プレゼントする……、というのはどうかしら？","Then ...... every time I finish a lesson, I'll give myself something to do.
How about ......, which I will present to you?"
"main_0004_C_01_00_008(0)","未来","私はレッスンが終わったあとは、
おいしいごはんが食べたいです！","After I finish my lessons,
I want to eat good food!"
"main_0004_C_01_00_009(0)","真","ボクなら休みの日に買い物かな～。女の子らしく、
ウィンドウショッピングとかいいよね！","I'd probably go shopping on my day off, just like a girl,
Window shopping would be nice!"
"main_0004_C_01_00_010(0)","杏","うーん……イマイチそそられないなぁ～。
わざわざ出かけるのが面倒だよ……","Hmmm ...... im not really intrigued!
I can't be bothered to go out of my way. ......"
"main_0004_C_01_00_011(0)","美希","ミキ的にはレッスンが終わってからすぐに
寝ちゃえばいいって思うな……あふぅ","From Miki's point of view, right after the lesson is over.
Don't think you'll fall asleep. ......"
"main_0004_C_01_00_012(0)","美希","……ミキ、なんだか眠くなってきちゃったの……","......Miki, I'm getting kind of sleepy......"
"main_0004_C_01_00_013(0)","杏","ふぁぁ～。そう言われたら……
杏も眠くなってきたかも……","Huh, if you say so: ......
Maybe Anzu are getting sleepy too: ......"
"main_0004_C_01_00_014(0)","きらり","杏ちゃーん♪
レッスンが終わったら、飴あげゆ☆","Anzu-chan ♪
When the lesson is over, I'll give you a candy bar."
"main_0004_C_01_00_015(0)","杏","飴？","Candy?"
"main_0004_C_01_00_016(0)","きらり","うん！　苺味に～桃味、特別にチョコレート味も！
みんなのために、いろんな飴、持ってきてるんだぁ♪","Yes! Strawberry flavor, - peach flavor, and a special chocolate flavor!
I'm bringing all kinds of candy for everyone!"
"main_0004_C_01_00_017(0)","きらり","杏ちゃんが、レッスン頑張ったら、
ご褒美あげるにぃ～☆","Anzu-chan, if you work hard on your lessons,
I'll give you a prize."
