"id","character","source","translatedstr"
"ConnectionNpc_1209_B_03_00_0005(0)","盛上　泰菜","……今日はこれを届けにきたわ。
はいっ、ステージ盛り上げテクよ","...... I'm here today to deliver this.
Yes, I'm a stage tech."
"ConnectionNpc_1209_B_03_00_0006(0)","P","これは……","This is......"
"ConnectionNpc_1209_B_03_00_0007(0)","盛上　泰菜","これなら、ライブの雰囲気が変わったりして、
盛り上がる気がしない？","This could change the atmosphere of the live show,
Don't you feel like getting excited?"
"ConnectionNpc_1209_B_03_00_0008(0)","P","なるほど！
さっそく取り入れさせてもらいますね","I see!
I'll take it in right away."
"ConnectionNpc_1209_B_03_00_0009(0)","盛上　泰菜","べ、別にアンタのためじゃ……。
ルミナスのためだから！","It's not for you. ......
Because it's for luminous!"
"ConnectionNpc_1209_B_03_00_0010(0)","P","はい、ありがとうございました！","Yes, thank you very much!"
"ConnectionNpc_1209_B_04_00_0001(0)","P","あ、盛上さん！　お疲れ様です！","Ah, Morigami-san! Thank you for your hard work!"
"ConnectionNpc_1209_B_04_00_0002(0)","盛上　泰菜","この事務所に
ようやく、来てもいい気がしてきたわ……","In this office.
Finally, I'm starting to feel like I can come ......"
"ConnectionNpc_1209_B_04_00_0003(0)","P","大丈夫です。
ここにいるのがすごく自然に見えますよ！","It's okay.
It looks so natural to be here!"
"ConnectionNpc_1209_B_04_00_0004(0)","盛上　泰菜","褒められてもね……。
いいんだか、なんだか……","You can get a complimentary copy at .......
I don't know if it's good or not: ......"
"ConnectionNpc_1209_B_04_00_0005(0)","盛上　泰菜","ま、いっか。
……はいっ、課題クリアのステージ盛り上げテクよ","Oh well.
...... is the stage for the task to be completed."
"ConnectionNpc_1209_B_04_00_0006(0)","P","これは……","This is......"
"ConnectionNpc_1209_B_04_00_0007(0)","盛上　泰菜","どうよ、これ！
これなら確実に盛り上がるわ！","What do you think?
This would definitely be a lot of fun!"
"ConnectionNpc_1209_B_04_00_0008(0)","P","た、確かに……！
何度もありがとうございます","You can certainly check out ......!
Thank you again and again."
"ConnectionNpc_1209_B_04_00_0009(0)","盛上　泰菜","じゃあ、アタシはこれでね。
ルミナス、頼んだわよ！","Well, I'll take this one.
Luminous, I'm asking you!"
"ConnectionNpc_1209_B_04_00_0010(0)","P","もちろんです！
任せてください！","Of course!
We'll take care of it!"
"ConnectionNpc_1209_B_05_00_0001(0)","P","あ、盛上さん！　お疲れ様です！","Ah, Morigami-san! Thank you for your hard work!"
"ConnectionNpc_1209_B_05_00_0002(0)","盛上　泰菜","ルミナスも大分、盛り上がってきてるみたいね","Luminous seems to be getting a lot of traction."
"ConnectionNpc_1209_B_05_00_0003(0)","P","盛上さんのおかげですよ。
本当にありがとうございます！","It's all thanks to Morigami-san.
Thank you so much!"
"ConnectionNpc_1209_B_05_00_0004(0)","盛上　泰菜","そういうのはいいの","That's okay."
"ConnectionNpc_1209_B_05_00_0005(0)","盛上　泰菜","ここまで来たのは、アンタの成果。
……はいっ、課題クリアのステージ盛り上げテクよ","It is your achievement to have come this far.
...... is the stage for the task to be completed."
"ConnectionNpc_1209_B_05_00_0006(0)","P","こ、これは……","This is ......"
"ConnectionNpc_1209_B_05_00_0007(0)","盛上　泰菜","ステージ盛り上げテクは
これ以上、アンタに教える事はないわ","The technique to liven up the stage is
I have nothing more to teach you."
"ConnectionNpc_1209_B_05_00_0008(0)","盛上　泰菜","アタシがアンタを認めたんだからね！
これで、盛り上げなさいよ！","I recognized you!
Here, get it going!"
"ConnectionNpc_1209_B_05_00_0009(0)","P","はい、ありがとうございます！","Yes, thank you!"
"ConnectionNpc_1209_B_05_00_0010(0)","盛上　泰菜","それとルミナスが輝くところ、見たくなったわ","Oh, and I'd love to see Luminous shine."
"ConnectionNpc_1209_B_05_00_0011(0)","P","俺と一緒にですか？","With me?"
"ConnectionNpc_1209_B_05_00_0012(0)","盛上　泰菜","そういうところが、アンタ、バカなのよ","That's what's so stupid about you."
"ConnectionNpc_1209_B_05_00_0013(0)","盛上　泰菜","……ま、いいけど","...... Well, okay."
"ConnectionNpc_1209_B_05_00_0014(0)","P","盛上さんから教えて頂いたノウハウやテクニック、
ルミナスのために活用させていただきます！","The know-how and techniques taught by Morigami-san,
We will make use of it for Luminous!"
"ConnectionNpc_1209_B_05_00_0015(0)","盛上　泰菜","当たり前でしょ、
これからは仲間なんだから","It's obvious,
We're all friends from now on."
"ConnectionNpc_1209_B_05_00_0016(0)","P","仲間……はい、そうですよね。
俺、盛上さんと仲間になれて、嬉しいです！","Fellow ...... yes, that's right.
I'm glad to be a part of your group, Morigami-san!"
"ConnectionNpc_1209_B_05_00_0017(0)","盛上　泰菜","……って、あ、やばっ！　もう、こんな時間！
じゃあ、またね♪","...... is, oh no! It's already that time of the day!
See you later... ♪"
"ConnectionNpc_1209_B_05_00_0018(0)","P","はいっ！
色々と、ありがとうございました！","Yes, sir!
Thank you for everything!"
