"id","character","source","translatedstr"
"Unity_03_0106_00_002(0)","真","……準備運動終わりっと！　よーし、それじゃ
何から始めようか？　二人の意見を聞いてもいい？","...... Preparation is over! All right, then!
Where do we start? Can I ask you both for your input?"
"Unity_03_0106_00_003(0)","伊織","そうね、ホットヨガなんてどうかしら？
アイドルは、内側からもキレイになるべきだわ","Well, how about hot yoga?
Idols should be beautiful from the inside out."
"Unity_03_0106_00_004(0)","真","いいね！　伊織はヨガ、詳しいの？
ボク、あまりやったことなくて……","Great! Iori is a yoga expert?
I've never done much ......"
"Unity_03_0106_00_005(0)","蘭子","フム……、
太古より伝承されし輪廻へ至る儀式、か……","Hm. ......,
A ritual leading to reincarnation, handed down from time immemorial, or ......"
"Unity_03_0106_00_006(0)","（蘭子ログ）","（私もヨガ、やってみたいです！）","（I'd like to try yoga, too!)"
"Unity_03_0106_00_007(0)","伊織","このスーパーセレブ伊織ちゃんに任せなさい！
それじゃ、さっそく始めましょう","Leave it to this super celebrity Iori!
Well, then, let's get started."
"Unity_03_0106_00_008(0)","真","よしっ、バリバリ気合入ってきた！
二人とも、よろしくね！","Okay, I'm getting into the spirit of the ballyhoo!
Nice to meet you both!"
"Unity_03_0106_00_009(0)","蘭子","いざ、儀式の始まり……。
同胞よ、心するがよい！","Now the ritual begins. ......
Take heart, my fellow countrymen!"
"Unity_03_0106_00_010(0)","（蘭子ログ）","（伊織ちゃん、真さん
よろしくお願いしますー！）","(Iori, true)
(Best regards!!!!)"
"Unity_03_0106_00_011(0)","真","いやぁ、いい汗かいたよ！
それに、なんだかすごく体が軽いや！","Well, I worked up a good sweat!
Besides, I feel very light!"
"Unity_03_0106_00_012(0)","蘭子","我が翼が重力の楔から解き放たれる……
ククク、今なら天高く神々の庭まで手が届きそうね！","My wings are released from the wedge of gravity: ......
Kukuku, now I can reach the garden of the gods high in the sky!"
"Unity_03_0106_00_013(0)","（蘭子ログ）","（心も体も軽くなって、
すごくリフレッシュできましたー）","(I feel lighter in mind and body,
It was very refreshing.)"
"Unity_03_0106_00_014(0)","伊織","そうね、今度は別の子も誘いましょうか。
杏とか、いいんじゃないかしら？　にひひっ♪","Yes, let's invite another girl this time.
Maybe an apricot would be a good choice."
"Unity_03_0106_00_015(0)","Ｐ","（ヨガに挑戦した３人。
心身ともに充実したオフになったようだ！）","(The three of us tried yoga.
(Sounds like you had a great off day, both physically and mentally!)"
"Unity_02_0107_00_001(0)","Ｐ","（今日は真美の提案で、
肝試しツアーをすることになった……）","(Mami's suggestion today,
(We're going to do a liver tour: ......)"
"Unity_02_0107_00_002(0)","真美","んっふっふ～。『恐怖病院肝試しツアー』
はっじめるよー！　いざ、出発進行～♪","The ""Fear Hospital Liver Test Tour
Let's get started! Let's get going!"
"Unity_02_0107_00_003(0)","雪歩","こ、怖いよう……ひゃっ！？
い、今、首に何かが落ちて……も、もう嫌ですぅ～","This is scary. ......Hyah!
I hate it when something falls on my neck and ...... now~!"
"Unity_02_0107_00_004(0)","伊織","幽霊なんて、迷信よ。
ほら、真美、はやく行きましょ……！","Ghosts are a superstition.
Come on, Mami, let's get going. ......"
"Unity_02_0107_00_005(0)","美嘉","ユーレイなんているわけないって！
って、あれ？　真美ちゃん、ど、どこ行ったの？","There is no such thing as a Yurei!
What do you mean? Mami, where did you go?"
"Unity_02_0107_00_006(0)","杏","幽霊かー。も、もし遭遇しちゃったら……。
絶対写真撮って、出版社に売りつけよう！","Ghosts...but if you run into one, please contact .......
Definitely take pictures and sell them to the publishers!"
"Unity_02_0107_00_007(0)","果穂","出発進行！　です！
真美さんっ！　どんどん行きましょう！","Let's go!
Mami! Let's keep going!"
"Unity_02_0107_00_008(0)","Ｐ","（みんな、オフを楽しく過ごしたようだな。
これでさらに団結力が養われたはずだ！）","(Looks like everyone had a good time off.
(This should have fostered even more unity!)"
"Unity_03_0107_00_001(0)","Ｐ","（今日は真美の提案で、
肝試しツアーをすることになった……）","(Mami's suggestion today,
(We're going to do a liver tour: ......)"
"Unity_03_0107_00_002(0)","真美","んっふっふ～。『恐怖病院肝試しツアー』
はっじめるよー！　いざ、出発進行～♪","The ""Fear Hospital Liver Test Tour
Let's get started! Let's get going!"
"Unity_03_0107_00_003(0)","美嘉","果穂ちゃんは、
こういうホラー系って怖くないの？","Kaho is,
Aren't these horror stories scary?"
"Unity_03_0107_00_004(0)","果穂","はい！　真美さんと美嘉さんと一緒で楽しいですっ！
美嘉さんは苦手なんですか？","Yes! I'm having fun with Mami and Mika!
Are you not good at Mika?"
"Unity_03_0107_00_005(0)","美嘉","アタシは普通かなー。それより、さっきから
真美ちゃんが妙に静かなのが気になるんだけど……","I think I'm normal.
I'm not sure why Mami is being so strangely quiet: ......"
"Unity_03_0107_00_006(0)","果穂","あれ……？　真美さーん！　どこですかーっ！
……うーん、どこに行っちゃったんでしょうか？","Oh, ......? Mami, where are you?
...... Hmmm, where did it go?"
"Unity_03_0107_00_007(0)","美嘉","……ふーん、なるほどね。ねぇ、果穂ちゃん。
逆にアタシらで、真美ちゃんを驚かせない？","...... Hmmm, I see...hey, Kaho.
On the contrary, why don't we surprise Mami?"
"Unity_03_0107_00_008(0)","果穂","……？　逆に……ですか……？","Is it ......? On the contrary, is it ...... or ......?"
"Unity_03_0107_00_009(0)","美嘉","真美ちゃん、アタシたちを驚かそうとしてる。
ほら、あっち見て","Mami, you are trying to surprise us.
Here, look over there."
"Unity_03_0107_00_010(0)","果穂","……あっ、ほんとですっ","...... Oh, really!"
"Unity_03_0107_00_011(0)","美嘉","だから逆に、ね♪","So, on the contrary,Â"
"Unity_03_0107_00_012(0)","果穂","はいっ","hello (on phone, replying to ""moshimoshi"")"
"Unity_03_0107_00_013(0)","真美","う～ら～め～し～や～！
う～ら～め～し～や～！！","I~ra~me~ya~!
I~ra~me~ya~!"
"Unity_03_0107_00_014(0)","真美","……ってアリ？　なんで反応がないの？
……ねぇねぇ、みかぴょん、果穂ちん、大丈夫？","Is ...... ants? Why no response?
...... Hey, hey, hey, Mika-pin, Kaho-chan, are you okay?"
"Unity_03_0107_00_015(0)","美嘉","う～ら～め～し～や～！","I~ra~me~ya~!"
"Unity_03_0107_00_016(0)","果穂","う～ら～め～し～や～！","I~ra~me~ya~!"
"Unity_03_0107_00_017(0)","真美","うあうあ～っ！？　……はぁ……はぁ。
き、急に脅かすなんてひどいよ～！！","Uhhhhhhh!!! ...... haha ...... haha.
Ki, it's terrible that you suddenly threatened me~!"
"Unity_03_0107_00_018(0)","美嘉","あはは、ゴメン！　けど、最初にアタシたちを
驚かそうとしたのは、真美ちゃんじゃん！","But first, let's get us out of here.
You tried to surprise me, Mami!"
"Unity_03_0107_00_019(0)","真美","う、そ、それを言われると、言い返せない……。
ごめんなさーい！","Ugh, well, when you say it, I can't say it back. ......
Sorry!"
"Unity_03_0107_00_020(0)","果穂","それじゃあ、きも試しをやり直しましょう！
今度は３人一緒に！","Then let's redo the Kimo test!
Now the three of us together!"
"Unity_03_0107_00_021(0)","真美","果穂ちん、オッケーだよ！
それじゃ、真美探検隊、もっかいしゅっぱーつ！","Kaho, it's okay!
Well then, Mami Expedition, mokkaishuppatsu!"
"Unity_03_0107_00_022(0)","Ｐ","（肝試しツアーはその後も続き、終わるころには
３人に強い一体感が生まれたようだ！）","(The test of courage tour continued, and by the time it was over
(Seems to have created a strong sense of unity among the three!)"
"Unity_02_0108_00_001(0)","Ｐ","（今日は貴音の提案で、
近くの神社に行くことになった……）","(Today, at the suggestion of Takayuki,
(We're going to a nearby shrine: ......)"
"Unity_02_0108_00_002(0)","貴音","真、風情のある場所で、心が落ち着きます","True, it is a quaint place and calming!"
"Unity_02_0108_00_003(0)","心白","はい、私もそう思います。……見てください、
狛犬がありますよ。なんだか、可愛いですね！","Yes, I agree, see ......,
There are komainu, which are kind of cute!"
"Unity_02_0108_00_004(0)","千早","ええ。
せっかくだから、写真を撮ろうかと","Yes.
Since we're here, I thought I'd take a picture."
"Unity_02_0108_00_005(0)","歌織","……すごく静かな所ね。こんな場所があるなんて
知らなかったわ。都会の喧騒が嘘みたい","......It's so quiet here, I didn't know such a place existed.
I didn't know that...all the hustle and bustle of the city just doesn't seem real."
"Unity_02_0108_00_006(0)","杏","はぁ……はぁ…‥石段……登るの……疲れたぁ！
貴音さーん、あっちの木陰で休憩しようよー","I'm tired of climbing ...... the stone steps!
Takane-san, let's take a rest in the shade of the tree over there!"
"Unity_02_0108_00_007(0)","凛世","小鳥のさえずり……
趣が……あります……","A Little Bird's Chirp: ......
There is a quaint ...... ......"
"Unity_02_0108_00_008(0)","Ｐ","（みんな、オフを楽しく過ごしたようだな。
これでさらに団結力が養われたはずだ！）","(Looks like everyone had a good time off.
(This should have fostered even more unity!)"
"Unity_03_0108_00_001(0)","Ｐ","（今日は貴音の提案で、
近くの神社に行くことになった……）","(Today, at the suggestion of Takayuki,
(We're going to a nearby shrine: ......)"
"Unity_03_0108_00_002(0)","貴音","真、風情のある場所で、心が落ち着きます","True, it is a quaint place and calming!"
"Unity_03_0108_00_003(0)","歌織","事務所の近くにこんな場所があるなんて
知らなかったわ。けど、階段が少し大変だったわね","I can't believe there is a place like this so close to my office.
I didn't know that, but the stairs were a little daunting."
"Unity_03_0108_00_004(0)","凛世","凛世も……","Rinsei also ......"
"Unity_03_0108_00_005(0)","凛世","ですが……
風が心地よく……","But ......
Breezy and comfortable ......"
"Unity_03_0108_00_006(0)","貴音","ええ。疲れた体によい風あたりです。
おや？　あそこにあるのは、手水でしょうか","Yes, it is a good windfall for a tired body.
Oh? Is that a handbasin over there?"
"Unity_03_0108_00_007(0)","歌織","そうみたい……。ひんやりしていて気持ちいい……。
凛世ちゃんも、一緒にやらない？","It looks so ....... It's nice and cool .......
Rinyo, why don't you join us?"
"Unity_03_0108_00_008(0)","凛世","はい……
歌織さん……","Yes ......
Kaori-san: ......"
"Unity_03_0108_00_009(0)","凛世","ふふ……冷たくて……
気持ちいいです……","Hmmm ...... cold ......
It feels good. ......"
"Unity_03_0108_00_010(0)","貴音","しばし世俗のことを忘れ、
自然に身を任せるのもよいでしょう","Forget about the world for a while,
Let nature take its course."
"Unity_03_0108_00_011(0)","歌織","そうね。もう少しだけ、
ここでのんびり過ごしましょうか","Yes, just a little more,
Shall we just relax here?"
"Unity_03_0108_00_012(0)","Ｐ","（貴音が教えてくれた場所で、長閑な時間を過ごす
３人。心身ともにリフレッシュできたみたいだな！）","(Spend a long and quiet time in the place that Takayune taught me about.
(Three...looks like you've refreshed yourself both mentally and physically!)"
"Unity_02_0109_00_001(0)","Ｐ","（今日は響の提案で、
ボウリングをすることになった……）","(Hibiki's suggestion today,
(We're going bowling: ......)"
"Unity_02_0109_00_002(0)","響","ルミナス対抗ボウリング大会だぞ！　自分、
ボウリングは得意だから、絶対に負けないさー！","It's the Luminous Intercollegiate Bowling Tournament! Myself,
I'm good at bowling, so I'll never lose!"
"Unity_02_0109_00_003(0)","律子","なかなかうまくいかないわね。
投球フォームか、球の重さか……改善が必要だわ","It's not going so well.
It's either the pitching form, or the weight of the pitch. ...... needs improvement."
"Unity_02_0109_00_004(0)","真","へへっ、やーりぃ！　またストライクだ！
今日はなんだか調子がいいみたい！","Hehehe, yay! Another strike!
She's feeling kind of good today!"
"Unity_02_0109_00_005(0)","美嘉","あれ？　ちょっとミスしちゃった。うーん、
スプリットかぁ……。よし、集中してもう一度！","Oh, I made a mistake,
Split. ....... Okay, let's concentrate again!"
"Unity_02_0109_00_006(0)","咲耶","……またスペア、か。
今日はなかなか１回で決められないね","...... Spare again, huh?
It's hard to make a single decision today."
"Unity_02_0109_00_007(0)","凛世","ボウリングは……奥深く……
また……ガター……","Bowling is ...... deep ......
Also ...... gutter ......"
"Unity_02_0109_00_008(0)","Ｐ","（みんな、オフを楽しく過ごしたようだな。
これでさらに団結力が養われたはずだ！）","(Looks like everyone had a good time off.
(This should have fostered even more unity!)"
"Unity_03_0109_00_001(0)","Ｐ","（今日は響の提案で、
ボウリングをすることになった……）","(Hibiki's suggestion today,
(We're going bowling: ......)"
"Unity_03_0109_00_002(0)","響","ルミナス対抗ボウリング大会だぞ！　自分、
ボウリングは得意だから、絶対に負けないさー！","It's the Luminous Intercollegiate Bowling Tournament! Myself,
I'm good at bowling, so I'll never lose!"
"Unity_03_0109_00_003(0)","律子","やるからには、勝利あるのみね。
ボウリングが頭脳戦だってこと、教えてあげるわ","We have to win, because we're going to do it.
I'll show you that bowling is a brain game."
"Unity_03_0109_00_004(0)","咲耶","抜群の運動神経を誇る響と、
頭脳明晰な律子……","With Hibiki, who boasts of her outstanding athleticism,
Ritsuko with a clear head: ......"
"Unity_03_0109_00_005(0)","咲耶","栄えあるふたりと対戦できるとは光栄の極みだ。
けど、負けるわけにはいかない","It is a great honor to be able to play against these two honored individuals.
But we can't lose."
"Unity_03_0109_00_006(0)","響","それじゃ、さっそく自分から行くぞ！
うおりゃあ～！！！","Well, then, let's get on with it and go from there myself!
Oooooooooooooooooooooooooooooooooooooooooooooooooooooooooooooo!"
"Unity_03_0109_00_007(0)","律子","今回は私の勝ちのようね。
事前に投球フォームを見直していてよかったわ","Looks like I win this time.
Good thing I reviewed my pitching form beforehand."
"Unity_03_0109_00_008(0)","咲耶","フフ、私も今回は調子が良かったようだ。
……だけど響、少し力みすぎなんじゃないか","Huh, I guess I was in better shape this time too.
...... but Hibiki, I think you're putting a little too much effort into this."
"Unity_03_0109_00_009(0)","響","たしかに絶対に負けないぞって気持ちが
先走っちゃった気もするけど……","It's true that I'm determined not to lose.
I feel like I'm getting ahead of myself. ......"
"Unity_03_0109_00_010(0)","響","うがー、納得いかないぞー！
ふたりとも、もう１回勝負だっ！","Ugh, I'm not convinced!
Both of us had to play one more game!"
"Unity_03_0109_00_011(0)","咲耶","フフ、それでこそ響だよ……！
ではここからが本当の勝負かな","Huh, that's how it sounds. ......
Well, then, I guess this is where the real fight begins."
"Unity_03_0109_00_012(0)","律子","そうね。体も温まってきたことだし、
勝負はこれからね。響、咲耶、どんどん行きましょ？","Yes, my body is warming up,
The game is just beginning, Hibiki, Sakuya, let's keep it moving, shall we?"
"Unity_03_0109_00_013(0)","響","自分も、まだまだ本気出してないからね！
よーし、どんどん行くぞー！","I, too, haven't really gotten into it yet!
Okay, let's keep going!"
"Unity_03_0109_00_014(0)","咲耶","楽しい時間はまだこれからというわけだね。
フフ、今日はよい１日になりそうだ","So the good times are yet to come.
Well, today is going to be a good day."
"Unity_03_0109_00_015(0)","律子","ええ、咲耶。
とことん楽しみましょう♪","Yes, Sakuya.
Enjoy it as much as you can..."
"Unity_03_0109_00_016(0)","Ｐ","（その後も一進一退、熱いゲームが続いた。勝負を
終えた３人は、とても充実した表情をしていたぞ！）","（The game went back and forth, and the game continued to heat up.
(The three of you looked so content when you finished!)"
"Unity_02_0110_00_001(0)","Ｐ","（今日は伊織の提案で、
食べ歩きをすることになった……）","(Iori's suggestion today,
(We're going to eat our way through the food: ......)"
"Unity_02_0110_00_002(0)","伊織","いろんなお店があって迷うわね……。
みんなのオススメを教えてもらえるかしら？","There are so many different stores to choose from. ......
Can I get everyone's recommendations?"
"Unity_02_0110_00_003(0)","春香","たい焼きはどうかな？
色々な味があって、選ぶのも楽しいと思うよ","How about taiyaki?
There are so many different flavors to choose from!"
"Unity_02_0110_00_004(0)","菜々","うわぁ、焼き鳥のいい匂い……。
悩みますけど～……ナナはスイーツが食べたいです！","Wow, smells good of grilled chicken. ......
I'm having trouble though - ...... Nana wants to eat sweets!"
"Unity_02_0110_00_005(0)","蘭子","我は禁断の果実を所望するわ！　フフッ、果実に纏う
黄金の霊薬が、生命を潤すわね……","I desire the forbidden fruit!
That golden elixir of life. ......"
"Unity_02_0110_00_006(0)","（蘭子ログ）","（あのハンバーガーを食べてみたいです。
チーズたっぷりですごく美味しそうー♪）","(I would love to try that hamburger.
It looks so delicious with lots of cheese!)"
"Unity_02_0110_00_007(0)","凛世","凛世は……
チョコレートの、飲み物を……","Rinsei can be found at ......
Chocolate's, drink at ......"
"Unity_02_0110_00_008(0)","甘奈","あ！　あそこのクレープ屋さん！
この前テレビに出てたとこだ！　行ってみない！？","Ah! That crepe shop over there!
I saw this place on TV the other day!"
"Unity_02_0110_00_009(0)","Ｐ","（みんな、オフを楽しく過ごしたようだな。
これでさらに団結力が養われたはずだ！）","(Looks like everyone had a good time off.
(This should have fostered even more unity!)"
"Unity_03_0110_00_001(0)","Ｐ","（今日は伊織の提案で、
食べ歩きをすることになった……）","(Iori's suggestion today,
(We're going to eat our way through the food: ......)"
"Unity_03_0110_00_002(0)","伊織","いろんなお店があって迷うわね……。
みんなのオススメを教えてもらえるかしら？","There are so many different stores to choose from. ......
Can I get everyone's recommendations?"
"Unity_03_0110_00_003(0)","菜々","食べ歩きといえば、お肉屋さんのコロッケとか、
焼き鳥なんて、すっごく美味しいですよね！","Speaking of eating out, I'm thinking of croquettes from a butcher shop,
Yakitori is soooo delicious!"
"Unity_03_0110_00_004(0)","甘奈","えへへ、片手で食べられるし、いいよね！
あ！　あのお店のコロッケ、美味しそう☆","Ehehe, I can eat with one hand!
Oh! The croquettes at that restaurant look delicious☆!"
"Unity_03_0110_00_005(0)","甘奈","コロッケ食べた後、クレープとかどうかな？
食事とデザートって感じで！","After eating croquettes, how about crepes?
It's like a meal and dessert!"
"Unity_03_0110_00_006(0)","菜々","クレープ、甘くておいしいですよね～。
あっ！　タ、タピオカドリンクも売ってますよ！！","Crepes, sweet and delicious!
Oh! They also sell tapioca drinks!"
"Unity_03_0110_00_007(0)","伊織","ち、ちょっと菜々、
急にテンション上がったけど、どうしたの？","Hey, hey Nana,
You suddenly got excited, what's going on?"
"Unity_03_0110_00_008(0)","菜々","伊織ちゃん！　タピオカと言えば、ナウでヤングな
ＪＫの必需品じゃないですかっ！","Iori! Speaking of tapioca, the young and young-at-heart
Isn't it a necessity for JK?"
"Unity_03_0110_00_009(0)","甘奈","ナウで、ヤング？
菜々ちゃん、面白い言葉使うんだねっ☆","Now, Young?
Nana, you use such interesting words☆."
"Unity_03_0110_00_010(0)","菜々","い、いやぁ～、あはは……
最近のマイブームでして、キャハッ！","No, no, haha ......
It's my boom these days, cahaha!"
"Unity_03_0110_00_011(0)","伊織","タピオカドリンクね。クレープと一緒に買えば
いいんじゃない？　さっそく買いに行きましょ♪","Tapioca drink, if you buy it with the crepe.
Let's go out and buy it!"
"Unity_03_0110_00_012(0)","甘奈","ねぇ、伊織ちゃん。食べた後でいいんだけど、
甜花ちゃんやみんなにお土産買っていこうよ☆","Hey, Iori, it's okay after you eat,
Let's buy souvenirs for Tetuka and everyone else☆."
"Unity_03_0110_00_013(0)","伊織","あら、名案ね。にひひっ♪　せっかくだからメニュー
にある商品、全種類買っていってあげようかしら？","Oh, that's a good idea.
I'll buy you all kinds of products in the ""I'll buy you all kinds of products in the"
"Unity_03_0110_00_014(0)","Ｐ","（お土産のクレープとタピオカドリンクは、
みんな大喜びで、大好評だったようだ）","(Souvenir crepes and tapioca drinks are,
(Everyone was overjoyed, and it seemed to be a big hit.)"
"Unity_02_0111_00_001(0)","Ｐ","（今日は亜美の提案で、
日帰りキャンプをすることになった……）","(Today was Ami's suggestion,
(We are going to do a day camp ......)"
"Unity_02_0111_00_002(0)","亜美","亜美キャンプ隊隊員の諸君！　ズバリ、
何をして遊びたいか、意見を聞かせてくれたまえ！","Ami campers!
Let me know what you want to play with and I'll give you my opinion!"
"Unity_02_0111_00_003(0)","千早","風景や、皆の様子を撮影するのはどうかしら？","How about taking pictures of the scenery and the people?"
"Unity_02_0111_00_004(0)","やよい","山菜採りとか、どうかな？
妹や弟たちへのお土産にもなるかなーって！","How about picking wild vegetables?
I thought it would be a good souvenir for my sister and brothers!"
"Unity_02_0111_00_005(0)","貴音","都会の喧騒を離れ、ただ風に身を委ねる……。
たまには、そのような時間もよいかと","Leave the hustle and bustle of the city and just surrender to the breeze. ......
I thought it would be good to have such a time once in a while."
"Unity_02_0111_00_006(0)","菜々","ナナは、近くの川原とかで遊びたいです！
石切りとか、懐かしいですよね～","Nana would like to play at a nearby riverbank or something!
I miss stone cutting and all that!"
"Unity_02_0111_00_007(0)","咲耶","山頂までハイキングする、というのはどうだろう？
きっと素晴らしい景色が見れると思うよ","How about hiking to the top of the mountain?
I'm sure you'll get some great views."
"Unity_02_0111_00_008(0)","Ｐ","（みんな、オフを楽しく過ごしたようだな。
これでさらに団結力が養われたはずだ！）","(Looks like everyone had a good time off.
(This should have fostered even more unity!)"
"Unity_03_0111_00_001(0)","Ｐ","（今日は亜美の提案で、
日帰りキャンプをすることになった……）","(Today was Ami's suggestion,
(We are going to do a day camp ......)"
"Unity_03_0111_00_002(0)","亜美","亜美キャンプ隊隊員の諸君！　ズバリ、
何をして遊びたいか、意見を聞かせてくれたまえ！","Ami campers!
Let me know what you want to play with and I'll give you my opinion!"
"Unity_03_0111_00_003(0)","千早","遊び……と言われても、特に思いつかないのだけど。
そういう亜美は、何かいい案があるの？","I can't think of anything in particular when you say play .......
Do you have any good ideas for such an Ami?"
