"id","character","source","translatedstr"
"Unity_02_0101_00_001(0)","Ｐ","（今日は春香の提案で、
映画を見に行くことになった……）","(Haruka's suggestion today,
(We're going to the movies: ......)"
"Unity_02_0101_00_002(0)","春香","わぁ、色々な映画があって、迷っちゃうな～。
みんなは見たい映画ってあるかな？","Wow, so many different movies, I'm lost!
Do you guys have any movies you want to see?"
"Unity_02_0101_00_003(0)","心白","春香さん、あのドキュメンタリー映画にしませんか？
今、ＳＮＳですごく流行ってるんですよ","Haruka, why don't we make that documentary film?
It's very popular on social media right now."
"Unity_02_0101_00_004(0)","未来","あ！　あのアクション映画、
すっごく面白そうですよ！　あれにしませんか？","Ah! That action movie,
It looks really interesting!"
"Unity_02_0101_00_005(0)","歌織","このミュージカル映画、話題になっているのよね。
ねぇ、春香ちゃん、よかったらこれにしない？","There's a lot of talk about this musical film.
Hey, Haruka-chan, if you want, we can do this."
"Unity_02_0101_00_006(0)","杏","杏は別に何でもいーよ。……ん？
あのゲーム、映画化したんだー。へぇ～","Anzu are fine with anything. ...... hmm?
I didn't know that game was made into a movie."
"Unity_02_0101_00_007(0)","咲耶","フフ……私はどの映画でも。
今日はみんなが見たいものを一緒に楽しみたいよ","Huff ...... me in any movie.
I hope we can all enjoy what we want to see today together."
"Unity_02_0101_00_008(0)","Ｐ","（映画を見終えたみんなは、口々に感想を言い合って
いる。どうやら楽しい時間を過ごせたようだ！）","(After watching the movie, everyone was talking to each other about their impressions.
(I'm here; apparently we had a good time!)"
"Unity_03_0101_00_001(0)","Ｐ","（今日は春香の提案で、
映画を見に行くことになった……）","(Haruka's suggestion today,
(We're going to the movies: ......)"
"Unity_03_0101_00_002(0)","春香","わぁ、色々な映画があって、迷っちゃうな～。
みんなは見たい映画ってあるかな？","Wow, so many different movies, I'm lost!
Do you guys have any movies you want to see?"
"Unity_03_0101_00_003(0)","未来","春香さん！　あのアクション映画、
すっごく面白そうですよ！","Haruka! That action movie,
It looks very interesting!"
"Unity_03_0101_00_004(0)","春香","ええと、『ビッグバンスペースドライブ』？
なんだか、すごそうなタイトルだね……","Uh, ""Big Bang Space Drive""?
That sounds like an awesome title: ......"
"Unity_03_0101_00_005(0)","杏","それ、人気のゲームが映画化したやつだよ。
へぇ～、公開されてたんだ","That's a popular game that's been made into a movie.
Wow, it was published."
"Unity_03_0101_00_006(0)","杏","えっと……ゲームの再現度が半端ないって感じで、
好評みたいだね。特に爆発のシーンがすごいって","Let's see, it's like ...... game reproduction is halfway done,
I heard it was well received, especially the explosion scene."
"Unity_03_0101_00_007(0)","未来","爆発シーン？　それ、ＣＭで見たことあるかも！
かっこいい車で宇宙を駆け巡るやつですよね？","Explosion scene? I might have seen that in a commercial!
You know, the one where you drive around the universe in a cool car?"
"Unity_03_0101_00_008(0)","杏","そうそう。もともとは普通のレースゲームだったん
だけど、気が付いたら宇宙進出してたんだよね","Yes, yes, it was originally a regular racing game.
But then I realized we were expanding into space."
"Unity_03_0101_00_009(0)","未来","さすが杏さん、詳しいです！　あの……
私、この映画、すっごく見たいです！","You're right, Anzu, you know a lot about it! That ......
I want to see this movie so badly!"
"Unity_03_0101_00_010(0)","春香","うん、いいよ♪
杏ちゃんはどうかな？","Yeah, okay. ♪
What about Anzu?"
"Unity_03_0101_00_011(0)","杏","杏も興味あるし、さんせーい","Anzu is interested, too, and sansei!"
"Unity_03_0101_00_012(0)","未来","春香さん、杏さん、ありがとうございます！
それじゃ、さっそく見に行きましょう♪","Thank you, Haruka and Anzu!
Well then, let's get on with it... ♪"
"Unity_03_0101_00_013(0)","春香","み、未来ちゃん、そんなに急いだら転んじゃうよ！","Mirai, you'll fall down if you hurry so much!"
"Unity_03_0101_00_014(0)","Ｐ","（その後、アクション映画を堪能した３人は、カフェ
で映画の感想を言い合い、大いに盛り上がった）","(Afterwards, after enjoying the action movie, the three of them went to a café
(They had a lot of fun discussing their impressions of the film at the)"
"Unity_02_0102_00_001(0)","Ｐ","（今日は美希の提案で、
おにぎりを作ることになった……）","(Miki's suggestion today,
(I'm supposed to make onigiri (rice balls) ......)"
"Unity_02_0102_00_002(0)","美希","ねぇねぇ、どんなおにぎりを作ろっか？","Hey, hey, what kind of rice balls shall we make?"
"Unity_02_0102_00_003(0)","やよい","私は、みんなで食べれるように、小さいおにぎりを
たくさん作りたいです！　","I have a small onigiri for everyone to eat.
I want to make a lot of them!"
"Unity_02_0102_00_004(0)","翼","私は、カラフルなおにぎりを作りたいな。
美希先輩、どうですか～？","I would love to make some colorful rice balls.
How about you, Miki-senpai~?"
"Unity_02_0102_00_005(0)","紬","そうですね……私は、
鮭とか昆布などが良いかと……","Yes, ...... I am,
I was thinking salmon, kelp, etc. ......"
"Unity_02_0102_00_006(0)","蘭子","我が求めるは、純白に抱かれし禁断の果実！
ククク……まさに神と悪魔の出会いね","I seek the forbidden fruit embraced in pure white!
Kukuku...... is truly the meeting of God and the Devil."
"Unity_02_0102_00_007(0)","（蘭子ログ）","（ハンバーグが入ったおにぎりが食べたいです！
絶対美味しいと思いまーす♪）","(I want to eat a rice ball with a hamburger steak in it!
I'm sure it will be delicious!)"
"Unity_02_0102_00_008(0)","甘奈","色んなおにぎりができそうだね☆
えへへ、食べるの楽しみ～","I'm sure you can make all kinds of onigiri.
I'm looking forward to eating it!"
"Unity_02_0102_00_009(0)","Ｐ","（みんな、楽しくオフを過ごしたようだな。
これでさらに団結力が養われたはずだ！）","(Looks like everyone had a good time off.
(This should have fostered even more unity!)"
"Unity_03_0102_00_001(0)","Ｐ","（今日は美希の提案で、
おにぎりを作ることになった……）","(Miki's suggestion today,
(I'm supposed to make onigiri (rice balls) ......)"
"Unity_03_0102_00_002(0)","美希","ねぇねぇ、どんなおにぎりを作ろっか？","Hey, hey, what kind of rice balls shall we make?"
"Unity_03_0102_00_003(0)","翼","はーい！
わたし、カラフルなおにぎりが作りたいでーす！","Hai!
I want to make colorful rice balls!"
"Unity_03_0102_00_004(0)","やよい","カラフル？　……あ、いろんな味の
おにぎりを作れば、カラフルになるかも！","Colorful? ...... Oh, all kinds of flavors.
If you make rice balls, they could be colorful!"
"Unity_03_0102_00_005(0)","美希","ミキ的には、美味しくて、たくさん食べられるなら、
大歓迎ってカンジかな☆","Miki's way, if it's tasty and you can eat a lot of it,
I guess you're more than welcome."
"Unity_03_0102_00_006(0)","やよい","はい！　それじゃあ、
みんなでどんな味がいいか考えましょー！","Okay, then,
Let's think about what kind of flavor we all want!"
"Unity_03_0102_00_007(0)","美希","定番どころは外せないよね？
ツナに梅干しに、昆布、鮭、明太子も必要なの！","You can't miss the classic ones, can you?
I need tuna, pickled plums, kelp, salmon, and cod roe!"
"Unity_03_0102_00_008(0)","やよい","あ、天かすをいれたおにぎりって、知ってますか？
安くって、とってもおいしいんですよ～","Oh, you know those rice balls with tenkasu in them?
It's cheap and very tasty!"
"Unity_03_0102_00_009(0)","翼","わたしは、もっと面白いおにぎりも欲しいな～。
お肉入りとか、すっごく辛いやつなんか、楽しそう！","I want more interesting rice balls, too!
Something with meat or very spicy would be fun!"
"Unity_03_0102_00_010(0)","やよい","はわっ、お肉が入ってるなんて、贅沢です！
辛いのは、苦手な人には大変かもです……","Hah, what a luxury to have meat in it!
Spicy can be hard for those who don't like it. ......"
"Unity_03_0102_00_011(0)","やよい","そうだ、具に合わせて形を変えませんか？
中身を間違えなくっていいかなーって！","Yes, why not change the shape to match the ingredients?
I thought it would be nice not to make a mistake on what's inside!"
"Unity_03_0102_00_012(0)","翼","それいいかも。
やよいちゃん、ナイスアイディアだね！","That might be good.
Yayoi, nice idea!"
"Unity_03_0102_00_013(0)","翼","……あ！　わたし、全部の具を入れた、
特大おにぎりを作ろっかな～♪","I put all the ingredients in,
Let's make extra large onigiri!"
"Unity_03_0102_00_014(0)","美希","ミキもすっごいおにぎりを作るの！
翼、勝負しよっ！","Miki also makes amazing rice balls!
Wings, let's play!"
"Unity_03_0102_00_015(0)","翼","わかりました！
美希先輩、負けませんよ～！","I understand!
Miki-senpai, I won't lose!"
"Unity_03_0102_00_016(0)","Ｐ","（その後、３人はたくさんのおにぎりを作った。
みんなにも好評で、すごく喜んでもらえたようだ）","(The three then made many rice balls.
(Everyone seemed to like it and be very pleased with it.)"
"Unity_02_0103_00_001(0)","Ｐ","（今日は千早の提案で、
ＣＤショップに行くことになった……）","(Chihaya's suggestion today,
(I'm going to the CD store: ......)"
"Unity_02_0103_00_002(0)","千早","そういえば、
みんなはどんな音楽を聴くのかしら？","Speaking of which,
What kind of music do people listen to?"
"Unity_02_0103_00_003(0)","貴音","最近は、『らっぷ』なるものを聴いています。
音楽とは真、奥深きものですね","Recently, I have been listening to something called ""Rappu"".
Music is a true and profound thing."
"Unity_02_0103_00_004(0)","静香","アイドルの曲全般を聴いています。
研究のため、ですね","I listen to idol music in general.
For research, yes."
"Unity_02_0103_00_005(0)","歌織","私は子どもたち向けの曲や、合唱曲かしら。
つい、昔と同じように聴いちゃうのよね","I think I'd like to play songs for children and choral music.
I just end up listening to it the same way I used to."
"Unity_02_0103_00_006(0)","美嘉","最近の曲は、一通り聴くかな。アイドルたるもの、
やっぱ流行にはしっかり乗らないとね★","I'll listen to all the recent songs,
We have to keep up with the latest fads."
"Unity_02_0103_00_007(0)","きらり","きらりんは、みーんなの曲を聴いてるにぃ♪
とってもハピハピな気持ちになるんだぁ～","Kirarin is listening to everyone's music.
I feel so happy-happy!"
"Unity_02_0103_00_008(0)","Ｐ","（みんな、楽しくオフを過ごしたようだな。
これでさらに団結力が養われたはずだ！）","(Looks like everyone had a good time off.
(This should have fostered even more unity!)"
"Unity_03_0103_00_001(0)","Ｐ","（今日は千早の提案で、
ＣＤショップに行くことになった……）","(Chihaya's suggestion today,
(I'm going to the CD store: ......)"
"Unity_03_0103_00_002(0)","千早","そういえば、
みんなはどんな音楽を聴くのかしら？","Speaking of which,
What kind of music do people listen to?"
"Unity_03_0103_00_003(0)","静香","私はアイドル全般の曲を聴きますね。
歌織さんはどうですか？","I listen to idols in general.
How about you, Kaori-san?"
"Unity_03_0103_00_004(0)","歌織","私は、子どもたち向けの曲や、合唱曲かしら。
みんなで一緒に歌える歌が好きなの","I think I'd like to play songs for children and choral music.
I like songs we can all sing together."
"Unity_03_0103_00_005(0)","歌織","……そうだ！　今度３人で一緒に歌いましょう？
みんなと一緒なら、きっと楽しいと思うわ","...... Yes! The three of us should sing together sometime.
I'm sure it'll be fun with you guys."
"Unity_03_0103_00_006(0)","静香","歌織さんと千早さんと……はい、是非お願いします！
あの、千早さんはどうですか？","Kaori and Chihaya and ...... Yes, please do!
Um, how about Chihaya-san?"
"Unity_03_0103_00_007(0)","千早","そうね……とてもいいと思う。
二人とのセッション、楽しみです","Yes. ...... I think it's very good.
I'm looking forward to the session with you two!"
"Unity_03_0103_00_008(0)","静香","私もです。ふふっ、早く歌いたいですね。
今から待ちきれないです！","Me too...phew, I can't wait to sing.
I can't wait to see it now!"
"Unity_03_0103_00_009(0)","歌織","よかった♪　それじゃあ、ふたりに
迷惑をかけないように、しっかり準備しなきゃ","Good... then I'll leave you two to it.
I have to make sure I'm prepared so I don't cause any trouble."
"Unity_03_0103_00_010(0)","千早","あの……レッスンでもご一緒してますから、
そこまで大げさにしなくても","I'm also with you on that ...... lesson,
You don't have to make such a big deal about it."
"Unity_03_0103_00_011(0)","Ｐ","（今度セッションをする約束をした３人。その後も、
充実したオフを過ごしたようでなによりだ！）","(The three of us promised to have another session,
Glad to see you had a good time off!)"
"Unity_02_0104_00_001(0)","Ｐ","（今日はやよいの提案で、
特売セールに行くことになった……）","(Today, at Yayoi's suggestion,
(I'm going to a special sale: ......)"
"Unity_02_0104_00_002(0)","やよい","たくさんのお客さんで、すごく盛り上がってますね！
私、なんだかウズウズしてきちゃいましたー！","So many customers, so much excitement!
I'm kind of itching to get started!"
"Unity_02_0104_00_003(0)","紬","こ、こんなに大勢の人たちがひしめき合って……。
すごい迫力ですね……","This, such a large crowd of people crowded into .......
It's very powerful. ......"
"Unity_02_0104_00_004(0)","きらり","うっきゃー！　やよいちゃん、すーっごくパワーが
みなぎってるにぃ！　きらりんも、頑張るよぉ～♪","Yayoi-chan, you have so much power!
I'm so excited! I'm going to do my best, Kirari!"
"Unity_02_0104_00_005(0)","果穂","わぁっ！　色んなものが売ってます！
スッゴくワクワクしてきましたー！","Wow! All kinds of things are for sale!
I am so excited!"
"Unity_02_0104_00_006(0)","甘奈","上手に買うコツとかってあるのかな？
やよいちゃん、よかったら教えて～☆","Do you have any tips on how to buy well?
Yayoi, let me know if you want to know~☆☆☆."
"Unity_02_0104_00_007(0)","甜花","お、お客さん……いっぱい……。
特売……早い者勝ち……て、甜花も、頑張る！","Oh, customers ...... full of .......
Special sales...... early birds win,...... and Tenka, too, do their best!"
"Unity_02_0104_00_008(0)","Ｐ","（みんな、楽しくオフを過ごしたようだな。
これでさらに団結力が養われたはずだ！）","(Looks like everyone had a good time off.
(This should have fostered even more unity!)"
"Unity_03_0104_00_001(0)","Ｐ","（今日はやよいの提案で、
特売セールに行くことになった……）","(Today, at Yayoi's suggestion,
(I'm going to a special sale: ......)"
"Unity_03_0104_00_002(0)","やよい","たくさんのお客さんで、すごく盛り上がってますね！
私、なんだかウズウズしてきちゃいましたー！","So many customers, so much excitement!
I'm kind of itching to get started!"
"Unity_03_0104_00_003(0)","紬","た、高槻さん……特売って、こんなにたくさんの人が
殺到するものなんですか？","Takatsuki-san ...... special sale, so many people!
Is it something that floods in?"
"Unity_03_0104_00_004(0)","やよい","はい！　でもいつもと比べると、
今日はちょっと少ないかなーって","Yes! But compared to usual,
I was thinking maybe a little less today."
"Unity_03_0104_00_005(0)","紬","これ以上に大勢の人が……！","Many more than this can be found at ......!"
"Unity_03_0104_00_006(0)","甜花","すごい……熱気……
ゲームのイベントみたい……","Awesome ...... hot ......
Looks like a game event: ......"
"Unity_03_0104_00_007(0)","やよい","紬さんも甜花さんも、欲しいものを見つけたら
しっかり手に取って、絶対に離さないでくださいね！","If you find what you want, both Tsumugi and Tetuka...
Take it firmly in your hand and never let it go!"
"Unity_03_0104_00_008(0)","甜花","う、うん……！","Umm, yeah. ......!"
"Unity_03_0104_00_009(0)","やよい","よーしっ！　紬さん、甜花さん！
張り切っていきましょー！","Yo, Tsumugi and Tetuka!
Let's get going!"
"Unity_03_0104_00_010(0)","甜花","ん……！
甜花……突撃……！","N. ......!
Beet flower ...... assault ......!"
"Unity_03_0104_00_011(0)","紬","て、甜花さん、そんなに急ぐと危ないですよ……。
高槻さんまで！　お、置いていかないでください！","Te, Tenka, it's dangerous to be in such a hurry. ......
Even Takatsuki-san! Oh, please don't leave me!"
"Unity_03_0104_00_012(0)","Ｐ","（３人とも、ともに特売を体験したことで、
より結束が深められたみたいだな！）","(All three, having experienced the special sale together,
(Looks like we're more united!)"
"Unity_02_0105_00_001(0)","Ｐ","（今日は雪歩の提案で、
本屋に行くことになった……）","(Today, at the suggestion of a snowflake,
(I'm going to the bookstore: ......)"
"Unity_02_0105_00_002(0)","雪歩","色々な本があるね……。
みんなは、気になる本ってあるかな？","You have a variety of books at .......
Do you guys have any books you are interested in?"
"Unity_02_0105_00_003(0)","心白","ええと、『全日本不思議キャラ一覧』ですか……。
ふふっ、ちょっとだけ気になります","Well, is it the ""List of All Japanese Wonder Characters"" .......
Hmmm... I'm just a little curious."
"Unity_02_0105_00_004(0)","美希","ミキは……あ！　おにぎりの本なの！　へぇ……
ミキが知らないおにぎりがいっぱいで、面白いの♪","Miki is ...... Oh! It's a book about onigiri! Hehe ......
There are so many onigiri that Miki doesn't know about, it's funny.Â"
"Unity_02_0105_00_005(0)","菜々","ピピッ、ウサミン星から電波を受信！　実は
ここに超有名声優アイドルのサイン本がっ……！","Beep, I'm receiving a radio signal from the planet Usamin! Actually...
Here is a book signed by a very famous voice-over idol: ......!"
"Unity_02_0105_00_006(0)","美嘉","あれ？　このファッション雑誌、リニューアル
したんだ。ネイル特集か……いいカンジじゃん★","Huh? This fashion magazine was renewed.
I did, I've got a nail art feature on .........looks great!"
"Unity_02_0105_00_007(0)","甜花","あっ、これ……！
ゲーム雑誌の……最新刊……！","Oh, here it is: ......!
The latest issue of the gaming magazine ...... is available at ......!"
"Unity_02_0105_00_008(0)","Ｐ","（みんな、楽しくオフを過ごしたようだな。
これでさらに団結力が養われたはずだ！）","(Looks like everyone had a good time off.
(This should have fostered even more unity!)"
"Unity_03_0105_00_001(0)","Ｐ","（今日は雪歩の提案で、
本屋に行くことになった……）","(Today, at the suggestion of a snowflake,
(I'm going to the bookstore: ......)"
"Unity_03_0105_00_002(0)","雪歩","色々な本があるね……。
みんなは、気になる本ってあるかな？","You have a variety of books at .......
Do you guys have any books you are interested in?"
"Unity_03_0105_00_003(0)","美嘉","ねぇ、雪歩ちゃん！　この雑誌に載ってる服、
心白ちゃんに似合うと思うんだけど、どうかな？","Hey, Yukiho! The clothes in this magazine,
I think it would look good on Shinbaku."
"Unity_03_0105_00_004(0)","雪歩","あ、本当だ。心白ちゃんの雰囲気に合っていて、
よく似合うと思うよ","Oh, it's true, it fits with the atmosphere of Shinbaku-chan,
I think they look good together."
"Unity_03_0105_00_005(0)","心白","私に、ですか？　ありがとうございます。
あ、このページの服、雪歩さんにピッタリですよ♪","To me, sir? Thank you very much.
Oh, the clothes on this page are perfect for you, Yukiho!"
"Unity_03_0105_00_006(0)","雪歩","ええっ！　そ、そんなことないと思うけど……
えへへ、似合う、かな？","Eek! Well, I don't think so. ......
Ehehe, does it look good on me?"
"Unity_03_0105_00_007(0)","美嘉","アタシもバッチリだと思うよ！　ねぇ、せっかく
だから、この後、みんなで服も見に行かない？","I think it's perfect too!
So, why don't we all go look at clothes too, after this?"
"Unity_03_0105_00_008(0)","雪歩","あ、いいかも……。
心白ちゃんはどう？","Oh, that could be good. ......
How about you, Shinbaku?"
"Unity_03_0105_00_009(0)","心白","はい。せっかくの機会ですし、
ご一緒させていただきます！","Yes, it's a great opportunity,
We will be happy to join you!"
"Unity_03_0105_00_010(0)","雪歩","それじゃ、行こっか。
美嘉ちゃんと心白ちゃんと一緒なんて、すごく楽しみ","Let's go, then.
I'm so excited to be with Mika and Shinbaku!"
"Unity_03_0105_00_011(0)","美嘉","そうだ！　どうせなら、雪歩ちゃんにバッチリ似合う
新しいコーデも探してみよっか？","That's right! If you're going to go for it, it would look perfect on Yukiho.
Shall we look for a new coordinator too?"
"Unity_03_0105_00_012(0)","雪歩","え、い、いいの……？
あの、それじゃ、お願いしますぅ～","What, no, no... ......?
Well, then, please..."
"Unity_03_0105_00_013(0)","心白","私も手伝います。ふたりで雪歩さんの新しい魅力を
引き出しましょう♪","I'll help you, too, and we'll both help you find new charms for Yukiho-san.
Let's bring it out.Â"
"Unity_03_0105_00_014(0)","Ｐ","（その後、買い物を楽しんだ３人。
充実したオフを過ごしたようでなによりだ！）","(The three of us then enjoyed shopping.
Glad to see you had a good time off!)"
"Unity_02_0106_00_001(0)","Ｐ","（今日は真の提案で、
体を動かすことになった……）","(Today with a true proposal,
(......) that got the body moving."
"Unity_02_0106_00_002(0)","真","……準備運動終わりっと！　よーし、それじゃ
何から始めようか？　二人の意見を聞いてもいい？","...... Preparation is over! All right, then!
Where do we start? Can I ask you both for your input?"
"Unity_02_0106_00_003(0)","伊織","ホットヨガなんてどうかしら？
スーパーセレブな伊織ちゃんに相応しいと思わない？","How about hot yoga?
Don't you think it's appropriate for super-celebrity Iori?"
"Unity_02_0106_00_004(0)","亜美","亜美、持ち上げるやつやってみたい！
んっふっふ～。目指せ、ムキムキレディだね♪","Ami, I want to try the lifting thing!
Aim for the muscular lady...."
"Unity_02_0106_00_005(0)","蘭子","不朽なる肉体を求める遥かなる旅路……
我は、ヘラクレスの試練へと挑まん！","A far journey in search of an immortal body: ......
I challenge you to the trials of Hercules!"
"Unity_02_0106_00_006(0)","（蘭子ログ）","（筋トレしたら、体力つくかな……）","(I wonder if muscle training would help me get stronger. ......)"
"Unity_02_0106_00_007(0)","美嘉","そうだねー。まずは軽く汗を流して……
それから、ピラティスとかヨガをやるのはどう？","Yes - first a light sweatshirt and then ......
And what about doing pilates or yoga?"
"Unity_02_0106_00_008(0)","果穂","真さん！　走るのはどうですかっ？　ランニング
マシンなら、みなさん好きなペースで走れます！","True! How about running? Running
With the machine, everyone can run at any pace they like!"
"Unity_02_0106_00_009(0)","Ｐ","（みんな、楽しくオフを過ごしたようだな。
これでさらに団結力が養われたはずだ！）","(Looks like everyone had a good time off.
(This should have fostered even more unity!)"
"Unity_03_0106_00_001(0)","Ｐ","（今日は真の提案で、
体を動かすことになった……）","(Today with a true proposal,
(......) that got the body moving."
