"id","character","source","translatedstr"
"Unity_03_0111_00_004(0)","亜美","千早お姉ちゃん、よくぞ聞いてくれた！
ずばり、二人鬼ごっこだよ！","Chihaya-sis, I'm glad you asked!
It's a game of tag between two people!"
"Unity_03_0111_00_005(0)","やよい","え？　ふたりで鬼ごっこをするの？","What, are you two going to play tag?"
"Unity_03_0111_00_006(0)","亜美","ほんじゃ、さっそく亜美が鬼でゲームスタート！
はい、たーっち！　ってことで、やよいっちが鬼ー！","So, let's start the game with Ami as the demon!
So, Yayoichi is the devil!"
"Unity_03_0111_00_007(0)","亜美","んっふっふ～！
亜美は、スタコラさっさと逃げるよー！！","Mmmmmm~!
Ami is going to run away quickly, staccato!"
"Unity_03_0111_00_008(0)","やよい","もうっ、急に始めるんだから……。
こらー、亜美ー！","Oh, God, you're starting so suddenly. ......
Hey, Ami!"
"Unity_03_0111_00_009(0)","亜美","うあうあー、やよいっち速いって！　フフフ、
どうやら本気を出さねばならないようだーっ！","Uuahhhh, Yayoichi is fast!
Looks like I'm going to have to get serious!"
"Unity_03_0111_00_010(0)","やよい","亜美ー、絶対に捕まえるからねー！","Ami - I'm going to get you, I promise!"
"Unity_03_0111_00_011(0)","千早","亜美、高槻さん、ちょっと……。
……二人とも、聞こえていないみたい","Ami, Takatsuki-san, a little .......
...... Neither of you seem to hear me."
"Unity_03_0111_00_012(0)","千早","そうだ、せっかくだから
二人の様子を撮影しようかしら","Yes, since we're at it.
Maybe I should film the two of them together."
"Unity_03_0111_00_013(0)","千早","……走っているから、写真が撮り辛いわ。
けど、楽しい","I'm running ...... so it's hard to take pictures.
But it's fun!"
"Unity_03_0111_00_014(0)","千早","こういう写真を撮る機会もあまりないし、
もう少しだけ、撮ってみよう","I don't get many opportunities to take pictures like this,
Let's take a few more shots."
"Unity_03_0111_00_015(0)","Ｐ","（鬼ごっこの後は、３人で一緒に色々な遊びをして、
充実したオフを過ごしたようだ！）","(After a game of tag, the three of us played a variety of games together,
Looks like you had a great time off!)"
"Unity_02_0112_00_001(0)","Ｐ","（今日はあずささんの提案で、
占いグッズの専門店に行くことになった……）","(Today, Azusa's suggestion,
(I'm going to a store that specializes in fortune-telling goods: ......)"
"Unity_02_0112_00_002(0)","あずさ","色々な占いの本があって、迷ってしまうわ。
みんなは、何か興味のある占いってあるかしら？","There are so many different fortune-telling books out there, it's hard to keep track.
Is there any kind of fortune telling that interests you?"
"Unity_02_0112_00_003(0)","美希","んー。ミキ的には楽しいカンジの占いがいいって
思うな。例えば……宝石占いなんてどう？","Well, Miki said she wanted a fun kind of fortune-telling.
I think, for example, how about ...... gemstone readings?"
"Unity_02_0112_00_004(0)","雪歩","占星術なんてどうですか？　すごく幻想的で
大人なあずささんに似合ってると思いますぅ","How about astrology? It's so fantastic.
I think it suits the mature Azusa-san."
"Unity_02_0112_00_005(0)","響","ペット占い？　へぇ、飼っている動物の行動で
占うんだ。あずささん、これがおすすめさー！","Pet horoscope? Heh, by the behavior of your animal.
Divination, Azusa-san, this is what I recommend!"
"Unity_02_0112_00_006(0)","果穂","あずささん！　ヒーロー占いはどうですかっ！
レッドが大吉で、スッゴく強そうです！","Azusa-san! How about Hero Fortune Telling?
Red is very lucky and looks very strong!"
"Unity_02_0112_00_007(0)","甜花","あの……三浦さん……
夢占い……どう、かな……？","That ......Miura-san ......
How do you like ...... your dream reading, or ......?"
"Unity_02_0112_00_008(0)","Ｐ","（みんな、楽しくオフを過ごしたようだな。
これでさらに団結力が養われたはずだ！）","(Looks like everyone had a good time off.
(This should have fostered even more unity!)"
"Unity_03_0112_00_001(0)","Ｐ","（今日はあずささんの提案で、
占いグッズの専門店に行くことになった……）","(Today, Azusa's suggestion,
(I'm going to a store that specializes in fortune-telling goods: ......)"
"Unity_03_0112_00_002(0)","あずさ","色々な占いの本があって、迷ってしまうわ。
みんなは、何か興味のある占いってあるかしら？","There are so many different fortune-telling books out there, it's hard to keep track.
Is there any kind of fortune telling that interests you?"
"Unity_03_0112_00_003(0)","雪歩","あまり詳しくないですけど、あずささんなら、
占星術やタロット占いなんてどうですか？","I don't know much about it, but Azusa-san would,
How about astrology or tarot reading?"
"Unity_03_0112_00_004(0)","美希","ねぇねぇ、二人とも！　『開運おにぎりくじの本』
だって！　中身の具で運勢を占うなんて面白いの♪","Hey, hey, you two!
It's funny how you can tell your fortune by what's inside!"
"Unity_03_0112_00_005(0)","あずさ","食べたおにぎりの具で運勢を占うのね。今日は、
梅干しは大吉、鮭は中吉……。うふふ、面白いわ","You divine your fortune by the ingredients of the rice ball you eat,
Dried plums are great luck, salmon is medium luck. ....... ugh, that's funny."
"Unity_03_0112_00_006(0)","雪歩","でも、これっておにぎりを食べないと、
占えないってことだよね……","But this means I have to eat a rice ball,
It means you can't divine. ......"
"Unity_03_0112_00_007(0)","美希","それなら大丈夫なの！　ミキ、毎日たくさんおにぎり
食べるから☆　毎日が大吉だよ♪","Then it's okay! Miki, lots of rice balls every day!
I'll eat it☆ Every day is a big lucky day♪"
"Unity_03_0112_00_008(0)","あずさ","毎日が大吉なんて、幸せよね。
せっかくだから、買っちゃおうかしら","It's such a blessing to have great luck every day.
I might as well buy it, since I'm here."
"Unity_03_0112_00_009(0)","美希","賛成なの！　あとは小鳥に頼んで、毎日事務所に
おにぎりを用意してもらえばカンペキだって思うな","I'm all for it! Now I just need to ask a little bird to come to my office every day.
Don't think that having onigiri prepared will make it perfect."
"Unity_03_0112_00_010(0)","雪歩","あ、それなら私がお茶を入れるね。
最近新しい茶葉を買ったんだ","Oh, I'll make the tea then.
I recently bought some new tea leaves."
"Unity_03_0112_00_011(0)","あずさ","うふふ、とっても楽しみだわ♪","Mmmm, I'm really looking forward to it..."
"Unity_03_0112_00_012(0)","Ｐ","（あずささんが買った占いの本は、みんなの興味を
ひき、事務所でおにぎりブームが到来した……）","(Azusa-san bought a book on fortune telling, which is of interest to all of us.
(Hit and the onigiri boom in the office: ......)"
"Unity_02_0113_00_001(0)","Ｐ","（今日は律子の提案で、アイドルについて
ディスカッションをすることになった……）","(Today, Ritsuko suggested that we talk about idols.
(Discussion to follow: ......)"
"Unity_02_0113_00_002(0)","律子","さて、アイドルについて、みんなの考えを聞かせて
もらえる？　ずばりアイドルの魅力ってなにかしら？","Now, I'd like to hear everyone's thoughts on idols.
What is the attraction of idols?"
"Unity_02_0113_00_003(0)","真","やっぱり、可愛さが大事かな。
フリフリの衣装とか、女の子の憧れだよね！","I guess cuteness is important.
Frilly outfits and such are every girl's dream!"
"Unity_02_0113_00_004(0)","未来","私は、みんなで楽しく盛り上がれるライブが
魅力だって思います！","I am a live concert where we can all have fun and get excited together.
I think it is an attraction!"
"Unity_02_0113_00_005(0)","翼","キラキラしてるところかな？
美希先輩みたいなカンジ！　うーん、憧れちゃうな～","Is it the sparkling part?
Like Miki! Hmmm... I adore her!"
"Unity_02_0113_00_006(0)","美嘉","何かをあげられることかな？　自分たちの姿を見て、
みんなが元気になってくれたら、最高だよね★","Is it something we can give them? Look at ourselves,
It would be great if everyone could get better *."
"Unity_02_0113_00_007(0)","凛世","ファンのみなさまとの……
交流、でしょうか……","...... with our fans
Exchange, I guess. ......"
"Unity_02_0113_00_008(0)","Ｐ","（みんな、楽しくオフを過ごしたようだな。
これでさらに団結力が養われたはずだ！）","(Looks like everyone had a good time off.
(This should have fostered even more unity!)"
"Unity_03_0113_00_001(0)","Ｐ","（今日は律子の提案で、アイドルについて
ディスカッションをすることになった……）","(Today, Ritsuko suggested that we talk about idols.
(Discussion to follow: ......)"
"Unity_03_0113_00_002(0)","律子","さて、アイドルについて、みんなの考えを聞かせて
もらえる？　ずばりアイドルの魅力ってなにかしら？","Now, I'd like to hear everyone's thoughts on idols.
What is the attraction of idols?"
"Unity_03_0113_00_003(0)","未来","そうですね～……。
私は、ライブかなって思います！","Yes - .......
I think it's a live concert!"
"Unity_03_0113_00_004(0)","未来","ファンのみんなと一緒になって
盛り上がれるなんて、最高の時間ですよね！","Together with all the fans.
What a great time to get excited!"
"Unity_03_0113_00_005(0)","凛世","未来さん……
凛世も同感です……","Mirai-san: ......
Rinyo agrees with you: ......"
"Unity_03_0113_00_006(0)","凛世","みなさまと共に在ることは……
得難きものでございます……","To be with you all is ......
It's hard to get ......"
"Unity_03_0113_00_007(0)","律子","未来と凛世にとってライブを通じて
ファンと交流することが大事ってわけね","For Mirai and Rinyo, through live performances
So it's important to interact with fans."
"Unity_03_0113_00_008(0)","律子","じゃあ、ライブでファンが喜んでくれることって
なにかしら？","So, what makes fans happy at a live show?
What is it?"
"Unity_03_0113_00_009(0)","凛世","歌や……
踊り、でしょうか……","Utaya: ......
Dancing, perhaps. ......"
"Unity_03_0113_00_010(0)","未来","トロッコで、客席の近くに行ったとき、
みんなすっごく喜んでくれました！","When the trolley took me close to the audience,
Everyone was very happy!"
"Unity_03_0113_00_011(0)","律子","ふふっ、その辺り、もう少し議論してみましょうか？
次のライブの参考になりそうだわ","Hmmm, let's discuss that a little more, shall we?
That's going to help me with my next gig."
"Unity_03_0113_00_012(0)","未来","はいっ！","Yes!"
"Unity_03_0113_00_013(0)","凛世","はい……","Yes ......"
"Unity_03_0113_00_014(0)","Ｐ","（アイドルについての議論は続く……。３人とも、
目を輝かせて話をしているな！）","(Discussion about idols continues at ....... All three,
(You're talking with a twinkle in your eye!)"
"Unity_02_0201_00_001(0)","Ｐ","（今日は蘭子の提案で、
ゲームセンターに行くことになった……）","(Today, at Ranko's suggestion,
(We're going to the arcade: ......)"
"Unity_02_0201_00_002(0)","蘭子","ハーッハッハッハ！　我が同胞たちよ、
ともに神々の遊戯を始めましょう！","Ha-ha-ha! My fellow countrymen,
Together, let us begin the play of the gods!"
"Unity_02_0201_00_003(0)","（蘭子ログ）","（どんなゲームがいいかな……。
みんなと遊ぶの、すごく楽しみです♪）","(What games would you like to play? .......
I'm really looking forward to playing with everyone...)"
"Unity_02_0201_00_004(0)","春香","うーん……あ、パズルゲームならできるかな。
……思ったより難しい！　ど、どうしよう……","Hmmm ...... Oh, I guess I could play a puzzle game.
......It's harder than I thought! What should I do? ......"
"Unity_02_0201_00_005(0)","響","自分、レースゲームをやってみたいぞ！
蘭子！　自分と勝負だっ！","Myself, I'd love to play a racing game!
Ranko! You're playing with yourself!"
"Unity_02_0201_00_006(0)","歌織","プリントシール機、よく友達と撮っていたわ。
みんなも、一緒に撮らない？","Print Sticker Machine, I used to take pictures with my friends.
Why don't you guys take a picture with me?"
"Unity_02_0201_00_007(0)","凛世","以前……甜花さんと共闘した……
銃の……ゲームを……","I used to work with ...... Tenka ......
...... game of guns ......"
"Unity_02_0201_00_008(0)","甜花","甜花は、お菓子のつかみ取り……
……にへへ……大量、ゲット……♪","Tenka is a candy grabber: ......
To ...... hehe ...... mass, get ...... â"
"Unity_02_0201_00_009(0)","Ｐ","（みんな、楽しくオフを過ごしたようだな。
これでさらに団結力が養われたはずだ！）","(Looks like everyone had a good time off.
(This should have fostered even more unity!)"
"Unity_03_0201_00_001(0)","Ｐ","（今日は蘭子の提案で、
ゲームセンターに行くことになった……）","(Today, at Ranko's suggestion,
(We're going to the arcade: ......)"
"Unity_03_0201_00_002(0)","蘭子","ハーッハッハッハ！　我が同胞たちよ、
ともに神々の遊戯を始めましょう！","Ha-ha-ha! My fellow countrymen,
Together, let us begin the play of the gods!"
"Unity_03_0201_00_003(0)","（蘭子ログ）","（どんなゲームがいいかな……。
みんなと遊ぶの、すごく楽しみです♪）","(What games would you like to play? .......
I'm really looking forward to playing with everyone...)"
"Unity_03_0201_00_004(0)","春香","ふふっ、色んなゲームがあるみたいだけど、
何がいいかな？","Hmmm...sounds like a lot of different games,
What would you like?"
"Unity_03_0201_00_005(0)","蘭子","テルプシコラーの舞踏……
これこそが我らが遊戯に相応しいっ！","Terpsichorean Dance: ......
This is what our game deserves!"
"Unity_03_0201_00_006(0)","（蘭子ログ）","（ダンスゲームがありますよ。
これなんかどうですか？）","(There is a dance game.
(How about something like this?)"
"Unity_03_0201_00_007(0)","響","ダンスゲームかぁ、いいね、これにしようよ！
誰からやる？　自分はいつでもオッケーだぞ","Dance game....great...let's do this!
Who's up for it? I'm always up for it."
"Unity_03_0201_00_008(0)","春香","それじゃあ、私からやってみるね。
えっと、まずは曲を選んで……よーし、行くよー！","Well, I'll give it a go then.
Let's see, first of all, choose a song and go to ...... Okay, here we go!"
"Unity_03_0201_00_009(0)","春香","えっと、画面をしっかり見て、
同じように動いて……って、きゃあああっ！","Well, watch the screen carefully,
It moves the same way and ......, yikes!"
"Unity_03_0201_00_010(0)","","どんがらがっしゃーん！！","Dongaragansha!"
"Unity_03_0201_00_011(0)","響","は、春香、大丈夫？　もう、画面にばっかり
集中してるから転んじゃうんだぞ","Haruka, are you okay? You're all over the screen!
You're concentrating so hard, you'll fall."
"Unity_03_0201_00_012(0)","春香","うう……。ゴメンね、響ちゃん","Ugh ....... Sorry, Hibiki."
"Unity_03_0201_00_013(0)","蘭子","は、春香さん、大丈夫ですか？","Ha, Haruka-san, are you okay?"
"Unity_03_0201_00_014(0)","春香","蘭子ちゃんも、心配かけちゃってゴメンね！
えへへ、私なら大丈夫……ほら、もう平気だから！","Sorry to worry you too, Ranko!
Hehe, I'll be fine. ...... See, I'm fine now!"
"Unity_03_0201_00_015(0)","響","よーし、次は自分がやるぞ！
春香の仇はしっかりとってあげるさー","Alright, I'll do it next time!
I will avenge Haruka's death!"
"Unity_03_0201_00_016(0)","蘭子","南国の輝きを抱く乙女よ！
汝の舞でこの箱庭に新たなる風を！","O maiden who embraces the glow of the tropics!
Give a new wind to this box garden with your dance!"
"Unity_03_0201_00_017(0)","（蘭子ログ）","（響さん、がんばってくださーい♪）","（Hibiki, please keep up the good work...)"
"Unity_03_0201_00_018(0)","響","なんくるないさー！
自分の雄姿、しっかり見ててよねっ！","It's nothing to worry about!
Watch your own heroic figure, okay?"
"Unity_03_0201_00_019(0)","Ｐ","（その後もいろいろなゲームをする３人。
充実したオフを過ごしたようでなによりだ！）","(The three of us played various games after that.
Glad to see you had a good time off!)"
"Unity_02_0202_00_001(0)","Ｐ","（今日は杏の提案で、
ＶＲ体験をすることになった……）","(Today, apricot suggestion,
(......) which is a VR experience."
"Unity_02_0202_00_002(0)","杏","ここが噂のＶＲ体験コーナーかぁ。
いろんなゲームがあるみたいだけど、どうする？","So this is the rumored VR experience corner.
Seems like there are a lot of games to play."
"Unity_02_0202_00_003(0)","美希","杏、ＶＲ公園でリラックスだって♪　ミキ、ここで
おにぎり食べながら、のんびりお昼寝したいな","Anzu says she's relaxing at VR Park... Miki, here.
I'd love to take a leisurely nap while eating onigiri."
"Unity_02_0202_00_004(0)","あずさ","神秘的な空間で占い……。どういう感じなのかしら？
ねぇ、杏ちゃん。よかったら一緒にやらない？","Fortune-telling in a mystical space ....... What's it like?
Hey, Anzu, would you like to join us?"
"Unity_02_0202_00_005(0)","未来","ＶＲで冒険？　君も勇者になって魔王を倒そう……？
面白そう♪　杏さん、一緒にやりませんかっ！","Adventures in VR? You too can become a brave warrior and defeat the Demon King. ......?
Sounds interesting... Anzu, why don't you join us?"
"Unity_02_0202_00_006(0)","静香","ＶＲで空飛ぶ体験ですか。少し興味がありますね。
杏さん、やり方がわからないので出来れば一緒に……","I'm a little curious about the experience of flying in VR.
Anzu, I don't know how to do this, so if you can, please join me: ......"
"Unity_02_0202_00_007(0)","咲耶","ＶＲで体験する世界の旅、か。フフ、心が躍るね。
杏、共に異国を巡る旅人にならないかい？","A trip around the world experienced in VR, huh, that's exciting.
Anzu, would you like to be a traveler with me in a foreign country?"
"Unity_02_0202_00_008(0)","Ｐ","（みんな、楽しくオフを過ごしたようだな。
これでさらに団結力が養われたはずだ！）","(Looks like everyone had a good time off.
(This should have fostered even more unity!)"
"Unity_03_0202_00_001(0)","Ｐ","（今日は杏の提案で、
ＶＲ体験をすることになった……）","(Today, apricot suggestion,
(......) which is a VR experience."
"Unity_03_0202_00_002(0)","杏","ここが噂のＶＲ体験コーナーかぁ。
いろんなゲームがあるみたいだけど、どうする？","So this is the rumored VR experience corner.
Seems like there are a lot of games to play."
"Unity_03_0202_00_003(0)","美希","……杏、ＶＲハイキングって何？
みんなで山登りするの？","...... apricot, what is VR hiking?
Are we all going to climb mountains together?"
"Unity_03_0202_00_004(0)","杏","えっと、なになに……のどかな山道を、
のんびりまったりお散歩できるＶＲ体験、だってさ","Let's see, what's ...... a peaceful mountain road,
A relaxing and leisurely stroll in VR, they say."
"Unity_03_0202_00_005(0)","美希","山頂でおにぎり食べたら、美味しいかな？
ミキ、これやってみたいって思うな！","Would it taste good to eat onigiri at the summit?
Miki, don't think I want to try this!"
"Unity_03_0202_00_006(0)","あずさ","なんだか面白そう。
杏ちゃん、どうかしら？","It looks kind of interesting.
Anzu, what do you think?"
"Unity_03_0202_00_007(0)","杏","いいと思うよ。それにのんびりまったりだからね。
杏もゆっくりできるなら大賛成だよー","I think it's good, and it's a leisurely, laid-back experience.
I'm all for Anzu as long as they can relax too!"
"Unity_03_0202_00_008(0)","あずさ","なら、さっそくやってみましょう。
ええと、入り口は……あっちね","Then let's get on with it.
Well, the entrance is ...... over there."
"Unity_03_0202_00_009(0)","杏","いや、そっちは出口……
だ、大丈夫かな……","No, that one is the exit ......
Hey, I hope it's okay. ......"
"Unity_03_0202_00_010(0)","杏","ちょ、ちょっと美希ちゃん！
そんなところで寝たらダメだって……！","Wait a minute, Miki!
She said you shouldn't sleep in such a place. ......"
"Unity_03_0202_00_011(0)","美希","あふぅ……すやすや……なの","I'm ah...... at ease......"
"Unity_03_0202_00_012(0)","あずさ","あらあら、山頂はどっちかしら……？","Oh my goodness, which way is the summit: ......?"
"Unity_03_0202_00_013(0)","杏","あ、あずささんも、そっちじゃないって……
ＶＲで道に迷うなんて、聞いたことないよ","Oh, and Azusa, not that way. ......
I've never heard of getting lost in VR."
"Unity_03_0202_00_014(0)","杏","って、杏全然のんびりまったりできてないじゃん！
……はぁ、もう帰りたい……","I mean, you can't relax and chill out with Anzu at all!
......Ha, I want to go home now......"
"Unity_03_0202_00_015(0)","Ｐ","（ハプニングがあったが、その後もＶＲ体験を続けた
３人。充実したオフを過ごしたようでなによりだ！）","(Happened, but then continued the VR experience.
(Three, glad to hear you had a productive time off!)"
"Unity_02_0203_00_001(0)","Ｐ","（今日は美嘉の提案で、
遊園地に遊びに行くことになった……）","(Today, at Mika's suggestion,
(We're going to go play at the amusement park: ......)"
"Unity_02_0203_00_002(0)","美嘉","さてと、みんなはどのアトラクションから行く？
どうせなら、時間いっぱい楽しまないとね★","Alright, which attraction do you guys want to go to first?
We have to enjoy ourselves for the full time anyway."
"Unity_02_0203_00_003(0)","心白","美嘉さん、ホラーハウスに行きましょう。すごく
かわいいお化けが出るってＳＮＳで評判みたいです","Mika, let's go to Horror House, very much.
It seems to be popular on social networking sites for having cute ghosts!"
"Unity_02_0203_00_004(0)","律子","まずはマップを見て……と。来たからには全ての
アトラクション制覇を目指さないと！","First, look at the map at ....... Now that you're here, you can see all the
We need to try to conquer the attractions!"
"Unity_02_0203_00_005(0)","亜美","ここ、ジェットコースターがたくさんあるよ！
絶叫系に悶絶系、恐怖系だって！　超楽しそう！","There are many roller coasters here!
Screaming, fainting in agony, and even frightening!"
"Unity_02_0203_00_006(0)","未来","美嘉さん、コーヒーカップに乗りませんか？
どっちが多く回せるか、勝負しましょうっ！","Mika, would you like to get on the coffee cup?
Let's play to see who can turn in more!"
"Unity_02_0203_00_007(0)","翼","あ、メリーゴーランドだ♪
ねぇ、美嘉さん一緒に乗りましょうよ～","Oh, it's a merry-go-round... ♪
Hey, Mika, let's ride together~!"
"Unity_02_0203_00_008(0)","Ｐ","（みんな、楽しくオフを過ごしたようだな。
これでさらに団結力が養われたはずだ！）","(Looks like everyone had a good time off.
(This should have fostered even more unity!)"
"Unity_03_0203_00_001(0)","Ｐ","（今日は美嘉の提案で、
遊園地に遊びに行くことになった……）","(Today, at Mika's suggestion,
(We're going to go play at the amusement park: ......)"
"Unity_03_0203_00_002(0)","美嘉","さてと、みんなはどのアトラクションから行く？
どうせなら、時間いっぱい楽しまないとね★","Alright, which attraction do you guys want to go to first?
We have to enjoy ourselves for the full time anyway."
"Unity_03_0203_00_003(0)","翼","美嘉さん、まずはデートコースの定番、
お化け屋敷に行きましょうよ～♪","Mika, first of all, the standard date course,
Let's go to the haunted house!"
"Unity_03_0203_00_004(0)","美嘉","いいよ～。けど、デート、かぁ……","Okay~ but a date, huh? ......"
"Unity_03_0203_00_005(0)","亜美","おやおや～。みかぴょん、デートっていう言葉に
なにやら反応しているようですなぁ～","Oh, well~ Mikapin, the word ""date"" is
It seems to be reacting to something."
