"id","character","source","translatedstr"
"Idolchr_0104_B_20_01_015(0)","やよい","えー、好き嫌いはダメですよ！　でも、果穂ちゃんは
牛乳嫌いを無くそうと、努力してるみたいですよ？","Eh, don't like it! But, Kaho...
It seems like they are trying to eliminate the dislike of milk, right?"
"Idolchr_0104_B_20_01_016(0)","やよい","えへへっ♪　果穂ちゃんはしっかりしてて、
本物のヒーローみたいです！","Heh heh heh... Kaho is a firm believer,
It looks like a real hero!"
"Idolchr_0104_B_20_01_017(0)","Ｐ","そうか。やよいもお姉さんとして、
ヒーローをしっかり支えてあげてくれ","Well, Yayoi is also a big sister,
Make sure you support your heroes."
"Idolchr_0104_B_20_02_001(0)","やよい","せっせっせ～っと♪
すみっこのホコリもしっかり取りますよ～♪","Choo-choo-choo...
We'll even dust the nooks and crannies!"
"Idolchr_0104_B_20_02_002(0)","Ｐ","ありがとう、やよい。
事務所の掃除をしてもらって……","Thanks, Yayoi.
Have the office cleaned up and ......"
"Idolchr_0104_B_20_02_003(0)","Ｐ","そうだ、やよい。次に自分で
挑戦してみたい仕事とか、あるかな？","That's right, Yayoi, next time you're on your own.
Do you have a job you'd like to try or something?"
"Idolchr_0104_B_20_02_004(0)","やよい","挑戦したいこと……？　私、どんなお仕事でも、
いっしょうけんめいがんばりますよっ！","What would you like to try ......? Me, any job,
I will do my best!"
"Idolchr_0104_B_20_02_005(0)","Ｐ","いい心構えだ！　けど、本当にどんな仕事でも
いいわけじゃないよな。それなら、例えば……","Nice mindset! But really, any job.
Not a good idea, then, e.g. ......"
"Idolchr_0104_B_20_02_006(0)","選択肢","握手会","handshake event"
"Idolchr_0104_B_20_02_007(0)","選択肢","ライブ","live performance"
"Idolchr_0104_B_20_02_008(0)","選択肢","トーク番組","talk show"
"Idolchr_0104_B_20_02_009(0)","Ｐ","握手会はどうだ？","How about a handshake?"
"Idolchr_0104_B_20_02_010(0)","やよい","握手会ですかーっ！　いいと思います！
ファンのみんなとのおしゃべり、楽しみですーっ！","A handshake session?
I'm looking forward to chatting with all the fans!"
"Idolchr_0104_B_20_02_011(0)","Ｐ","そうか、じゃあできるだけ早く、
握手会ができるように動いてみるとするか","Okay, then as soon as possible,
Let's see if we can work on getting a handshake."
"Idolchr_0104_B_20_02_012(0)","Ｐ","ライブはどうだ？","How's the gig?"
"Idolchr_0104_B_20_02_013(0)","やよい","ライブを開いてくれるんですかーっ！
それなら、いーっぱいレッスンをしないとですねっ！","You're going to give us a live concert!
Then, I must give you a lot of lessons!"
"Idolchr_0104_B_20_02_014(0)","Ｐ","そうか、じゃあ近いうちにライブが出来るように
働きかけてみるか","Okay, so that we can have a live show in the near future.
Let's work on it."
"Idolchr_0104_B_20_02_015(0)","Ｐ","トーク番組はどうだ？","How about talk shows?"
"Idolchr_0104_B_20_02_016(0)","やよい","私がトーク番組？　お得なスーパーの情報とか、
節約料理についてでしたら、任せてくださいっ！","I'm a talk show? Like information on supermarket deals,
If it's about saving money on food, I'm all yours!"
"Idolchr_0104_B_20_02_017(0)","Ｐ","……そうだな。
ターゲット層は狭いが、やよいらしさは出せるか……","
The target audience is narrow, but can we create a Yayoi-like atmosphere? ......"
"Idolchr_0104_B_20_02_018(0)","Ｐ","なるほど……。ありがとう、参考になったよ","I see. ....... Thanks, that was helpful."
"Idolchr_0104_B_20_02_019(0)","やよい","どういたしまして！　やっぱり、ファンのみんなと
一緒になって楽しめる仕事が、一番好きかなーって！","You're welcome! I knew it! With all the fans.
I think I like the work best when we can enjoy it together!"
"Idolchr_0104_B_20_02_020(0)","Ｐ","了解。ファンとの交流がメインになる仕事が
できるように調整してみるよ","Roger that...a job where the main interaction is with the fans.
I'll try to coordinate so we can do it."
"Idolchr_0104_B_20_02_021(0)","やよい","うっうー！　すっごく楽しみですー！
プロデューサー、よろしくお願いしまーすっ！","I am soooooooooooooooooooooooooooooooooooooooooooooooooooooooooooo looking forward to it!
Producer, I look forward to working with you!"
"Idolchr_0104_B_20_03_001(0)","Ｐ","（やよいに事務所の買い出しを
手伝ってもらったのだが……）","(Buy the office for Yayoi.
(I had help. ......)"
"Idolchr_0104_B_20_03_002(0)","Ｐ","よし、これで全部だな。予定よりも早く済んだし、
やよいも買い物があれば付き合うぞ","Okay, that's all of them, and we're ahead of schedule,
Yayoi, if you have shopping to do, I'll go with you."
"Idolchr_0104_B_20_03_003(0)","やよい","それじゃあ、お夕飯の買い物をしてもいいですか？
商店街に寄って帰る必要もなくなるので！","May I go shopping for dinner then?
It would also eliminate the need to stop by the shopping district and go home!"
"Idolchr_0104_B_20_03_004(0)","Ｐ","ああ、もちろんいいぞ。
よかったら、俺も手伝おうか？","Yeah, sure, sure, good.
I can help you with that if you want."
"Idolchr_0104_B_20_03_005(0)","やよい","大丈夫ですっ！
私ひとりで、ササーっと買ってきちゃいます！","It's all right!
I buy them in a jiffy by myself!"
"Idolchr_0104_B_20_03_006(0)","Ｐ","（お、帰ってきたな。うん、満足げな表情だ）","(Oh, you're back. Yes, you look satisfied.)"
"Idolchr_0104_B_20_03_007(0)","やよい","プロデューサー、お待たせしました！
お買い得品がいっぱいでしたっ！","Thank you for your patience, producer!
There were lots of good deals!"
"Idolchr_0104_B_20_03_008(0)","Ｐ","おかえり、やよい。充実した買い物が
できたみたいだな。やっぱりやよいは……","Welcome back, Yayoi.
Looks like it's done...I knew it....the yayoi is ......"
"Idolchr_0104_B_20_03_009(0)","選択肢","家事上手だな","You're a good housekeeper."
"Idolchr_0104_B_20_03_010(0)","選択肢","買い物上手だな","You're a good shopper."
"Idolchr_0104_B_20_03_011(0)","選択肢","交渉上手だな","You're a good negotiator."
"Idolchr_0104_B_20_03_012(0)","Ｐ","家事上手だな","You're a good housekeeper."
"Idolchr_0104_B_20_03_013(0)","やよい","はわっ、そ、そうですかっ！？　私、
買い物してきただけですけど……えへへ","Oh, really? Me,
I just went shopping ...... ehehe"
"Idolchr_0104_B_20_03_014(0)","Ｐ","そんな照れなくても……。
それもやよいの良いところなんだから","You don't have to be so shy. ......
That's one of the good things about being a yayoi."
"Idolchr_0104_B_20_03_015(0)","Ｐ","買い物上手だな","You're a good shopper."
"Idolchr_0104_B_20_03_016(0)","やよい","えへへ♪　お得にいろいろ買えたんですよ！
お夕飯、家族も喜んでくれると思いますっ","Ehehe♪ I was able to buy a lot of things at a good price!
I'm sure your family will be very happy with your dinner!"
"Idolchr_0104_B_20_03_017(0)","Ｐ","それはよかった。でも……そんなに嬉しそうに
してるなんて、よほどお買い得だったんだな","That's good to hear, but ...... you look so happy!
I can't believe I did that. It must have been such a bargain."
"Idolchr_0104_B_20_03_018(0)","Ｐ","交渉上手だな","You're a good negotiator."
"Idolchr_0104_B_20_03_019(0)","やよい","交渉……？　オマケしてーってお願いするよりも、
チラシとか広告で調べた方がいいんですよー！","Negotiations ......? Rather than asking for a bonus,
It's better to check out the flyers and ads!"
"Idolchr_0104_B_20_03_020(0)","Ｐ","なるほど。あらかじめ、いろんなお得情報を
集めてるのか……大したものだな","I see....I can get all kinds of deals in advance.
You're collecting ...... big deal."
"Idolchr_0104_B_20_03_021(0)","Ｐ","それじゃあ……買い物も済んだところで
そろそろ帰ろうか","Well, now that you've done your ...... shopping.
I think it's time for us to go home."
"Idolchr_0104_B_20_03_022(0)","やよい","あのー、プロデューサー。実はそこの薬局で、
トイレットペーパーがおひとり様２つまでなので……","Um, producer, actually at the pharmacy there,
Toilet paper is limited to 2 per person. ......"
"Idolchr_0104_B_20_03_023(0)","Ｐ","ああ、俺も一緒に買えばいいんだな。
それじゃあ、最後に薬局に寄って帰るとするか","Yeah, I guess I'll just have to buy one with you.
Well then, I guess I'll stop by the pharmacy one last time and head home."
"Idolchr_0104_B_20_04_001(0)","Ｐ","今日の仕事は、スケジュールよりも早く終わったな。
やよいが仕事に慣れてきてなによりだ","You finished today's work ahead of schedule.
It's good to see that Yayoi is getting used to the job."
"Idolchr_0104_B_20_04_002(0)","やよい","えへへ、ありがとうございますっ！
あれもこれも、プロデューサーのおかげですー！","Ehehe, thank you very much!
I owe that and much more to the producer!"
"Idolchr_0104_B_20_04_003(0)","やよい","あの、次の予定まで、時間ありますか？
ちょっと用事があるんですけど……ダメでしょうか？","Um, do you have time before your next appointment?
I need to run a few errands. ...... No?"
"Idolchr_0104_B_20_04_004(0)","Ｐ","そんなに長くならなければ問題ないぞ。
それで、用事ってなんだ？","As long as it doesn't take that long, you won't have a problem.
So, what's the errand?"
"Idolchr_0104_B_20_04_005(0)","やよい","妹や弟たちに、お土産を買っていこうかなーって。
でも、なにを買っていけばいいのか悩んでるんです","I was thinking of buying some gifts for my sister and brothers.
But I'm not sure what to buy."
"Idolchr_0104_B_20_04_006(0)","Ｐ","ああ、なるほどな。
それなら……","Oh, I see."
"Idolchr_0104_B_20_04_007(0)","選択肢","お菓子","sweets"
"Idolchr_0104_B_20_04_008(0)","選択肢","おもちゃ","toy"
"Idolchr_0104_B_20_04_009(0)","選択肢","お惣菜","side dish"
"Idolchr_0104_B_20_04_010(0)","Ｐ","お菓子なんかいいんじゃないか？
お土産ならお菓子が定番だろう","Maybe some snacks would be nice.
Sweets would be the standard souvenir."
"Idolchr_0104_B_20_04_011(0)","やよい","お菓子、いいですね！　それなら仲良く
分けられるし、妹や弟たちも喜びますっ！","Sweets, good! Then we'll get along.
I can share it with my sister and brothers, and they will be happy too!"
"Idolchr_0104_B_20_04_012(0)","Ｐ","おもちゃはどうだ？
妹弟だけじゃなくて、やよいだって遊べるだろ","How's the toy?
Not only my younger siblings, but even Yayoi can play."
"Idolchr_0104_B_20_04_013(0)","やよい","あっ、それがいいですねっ。
長持ちしそうなオモチャにしますね！","Oh, that's a good one.
I'll make sure it's a toy that will last a long time!"
"Idolchr_0104_B_20_04_014(0)","Ｐ","お惣菜なんかどうだ？
ご飯をたくさん食べられるのが一番嬉しいだろう","How about some deli food?
You'll be most happy to eat a lot of food."
"Idolchr_0104_B_20_04_015(0)","やよい","お惣菜ですか？
はい、夕飯が一品増えると、嬉しいですよね！","Is it a delicatessen?
Yes, it would be nice to have one more dish for dinner!"
"Idolchr_0104_B_20_04_016(0)","Ｐ","でも、急にお土産なんて、どうしたんだ？","But what's up with all the souvenirs all of a sudden?"
"Idolchr_0104_B_20_04_017(0)","やよい","いつもみんなには、家事とかたくさん
手伝ってもらってるから……お礼をしたいなって！","I always have a lot of chores and stuff to do for everyone.
I just wanted to thank ...... for all the help you've been giving me!"
"Idolchr_0104_B_20_04_018(0)","Ｐ","なるほど……。やよいは妹や弟たちのことを
いつも考えてるんだな。偉いと思うぞ","I see. ....... Yayoi is my sister and brothers.
You're always thinking, and I think that's great."
"Idolchr_0104_B_20_04_019(0)","やよい","ええっ！？　妹弟だけじゃなくて私もですかっ！？
なんだか、照れちゃいます。えへへっ♪","Not only my sister and brother, but also me?
I'm kind of embarrassed."
"Idolchr_0104_B_20_05_001(0)","やよい","らんらんら～ん♪
床も机もぴかぴかに～♪","Rah-rah-rah-rah-rah-rah-rah-rah-rah-rah-rah-rah-rah-rah.
The floor and the desk are shining~♪"
"Idolchr_0104_B_20_05_002(0)","Ｐ","おっ、掃除をしてくれているのか。
いつもありがとう……でも、無理はしないようにな","Whoa, you're cleaning up.
Thanks again ......, but don't take it easy."
"Idolchr_0104_B_20_05_003(0)","やよい","いえいえー、無理なんかしてないですよ！
私、お掃除大好きですからっ！","No, no, no, I'm not forcing myself!
I love cleaning!"
"Idolchr_0104_B_20_05_004(0)","Ｐ","そうか……。
そう言ってくれるのは、ありがたいんだがな","
I appreciate you saying that."
"Idolchr_0104_B_20_05_005(0)","Ｐ","（好きでやってくれているとはいえ、やよいの
活動も忙しくなってきているし……ここはひとつ）","(Even though he likes to do it, he is a yayoi.
(Activities are getting busier and busier, and ...... here's one)"
"Idolchr_0104_B_20_05_006(0)","選択肢","掃除の日を決めよう","Set a cleaning day."
"Idolchr_0104_B_20_05_007(0)","選択肢","毎日掃除を頑張ろう","Let's try to clean up every day."
"Idolchr_0104_B_20_05_008(0)","選択肢","掃除は業者に頼もう","Let's ask the contractor to clean up."
"Idolchr_0104_B_20_05_009(0)","Ｐ","やよいにやってもらってばかりでも悪いから、
今度からは、掃除の日を決めようか","It's bad enough that I keep getting Yayoi to do it for me,
Let's set a cleaning day next time."
"Idolchr_0104_B_20_05_010(0)","やよい","はいっ、わかりました！　お掃除の日に、
テッテー的にキレイにしちゃいましょー！","Yes, okay, on the day of cleaning,
Let's clean it up tête-à-tête!"
"Idolchr_0104_B_20_05_011(0)","Ｐ","張り切ってくれるのは嬉しいけど、
やよいだけじゃなくて、みんなで頑張ろうな","I'm glad you're sticking up for me,
Not only Yayoi, let's all do our best."
"Idolchr_0104_B_20_05_012(0)","Ｐ","よし、それなら毎日掃除を頑張ろう。
中途半端にやるより、全力でやった方がいいからな","Okay, then, let's try to clean up every day.
Because it's better to go all out than halfway."
"Idolchr_0104_B_20_05_013(0)","やよい","はわっ！　ま、毎日ですかー！？　大変そうです
けど……事務所のためにがんばりますっ！","Wow! Every day? That sounds like a lot of work.
I will do my best for the ...... office though!"
"Idolchr_0104_B_20_05_014(0)","Ｐ","掃除は業者に頼もう。
その分、レッスンや仕事に集中できるだろ？","Let's ask the contractor to clean up.
That way you can focus on your lessons and your work, right?"
"Idolchr_0104_B_20_05_015(0)","やよい","ええーっ。でも私、自分たちの事務所は、
自分でちゃんとお掃除したいなーって","Ehhh...but I, their office,
I'd like to clean up properly myself."
"Idolchr_0104_B_20_05_016(0)","Ｐ","そ、そうか……。
やよいがそこまで言うなら、そうしてもらうか","Oh, yeah. .......
If Yayoi insists that much, I'll let her do so."
"Idolchr_0104_B_20_05_017(0)","Ｐ","それにしても……なんでやよいは、そこまで
事務所の掃除を手伝ってくれるんだ？","But still, ...... why is Yayoi so far off the mark?
You're going to help me clean up my office?"
"Idolchr_0104_B_20_05_018(0)","やよい","キレイな事務所にいると、やるぞーって気持ちが
こう、わーってわき上がってくるんですっ！","When you're in a clean office, you're ready to do it.
It was like a big rush!"
"Idolchr_0104_B_20_05_019(0)","Ｐ","なるほど、そういうことか。なら、上手く時間を
作ってメンバーみんなで掃除をできるようにしよう","Well, I see what you mean.
Let's make it so all members can clean it up."
"Idolchr_0104_B_20_05_020(0)","やよい","ありがとうございます！
みんなと一緒にお掃除できるの、楽しみです！","Thank you very much!
I look forward to cleaning up with everyone!"
"Idolchr_0104_B_20_06_001(0)","Ｐ","（仕事の合間の時間を利用して、昼食をとりに
やよいと一緒にファミレスへやってきた）","(I took advantage of the time between jobs to have lunch.
(I came to a family restaurant with Yayoi)"
"Idolchr_0104_B_20_06_002(0)","やよい","こんなに立派なところでご飯が食べれるなんて、
すっごくうれしいですっ！","I can't believe I get to eat in such a magnificent place,
I am very happy!"
"Idolchr_0104_B_20_06_003(0)","Ｐ","そうか。それじゃ、いつも頑張っているやよいに
ご褒美だ。好きなものを頼んでいいぞ","Okay, well, to Yayoi, who is always working hard.
Here's your reward: you can order whatever you like."
"Idolchr_0104_B_20_06_004(0)","やよい","いいんですかー！？
それなら私、プロデューサーと同じのがいいですっ！","Are you sure!
If that's the case, I want the same one as the producer!"
"Idolchr_0104_B_20_06_005(0)","Ｐ","同じのか、それは責任重大だな。
さて、何を頼もうか……","Same, that's a lot of responsibility.
Now, what shall we order? ......"
"Idolchr_0104_B_20_06_006(0)","選択肢","サービス定食","daily lunch or dinner special"
"Idolchr_0104_B_20_06_007(0)","選択肢","チョコレートパフェ","chocolate parfait"
"Idolchr_0104_B_20_06_008(0)","選択肢","サーロインステーキ","sirloin steak"
"Idolchr_0104_B_20_06_009(0)","Ｐ","じゃあ、このサービス定食にしようか。おかずも色々
ついてて、ご飯もおかわりできるし","Then let's have this service set meal with various side dishes.
You can have a second helping of rice."
"Idolchr_0104_B_20_06_010(0)","やよい","わぁっ、お得ですねっ！　それに、コロッケも
唐揚げもとっても美味しそうですっ！","Wow, what a great deal! And croquettes, too!
The fried chicken also looks very tasty!"
"Idolchr_0104_B_20_06_011(0)","Ｐ","（かなり喜んでくれたみたいだ。
俺も責任を果たせたかな）","(She seemed quite pleased.
(I hope I've lived up to my responsibility.)"
"Idolchr_0104_B_20_06_012(0)","Ｐ","じゃあ、チョコレートパフェにしようか。
いろいろフルーツものってて美味しそうだぞ","Then let's have a chocolate parfait.
It's got all kinds of fruit on it, and it looks delicious."
"Idolchr_0104_B_20_06_013(0)","やよい","うわ～、すっごくゴウカなパフェですねっ！
どこから食べようか迷っちゃいます！","Wow, that is a very gawky parfait!
It is hard to decide where to start eating!"
"Idolchr_0104_B_20_06_014(0)","Ｐ","（ふぅ、喜んでくれたみたいでよかった）","(Phew, I'm glad you're pleased.)"
"Idolchr_0104_B_20_06_015(0)","Ｐ","じゃあ、サーロインステーキにしようか。
せっかくだし高い物の方がいいだろ","Then let's have sirloin steak.
I'm just saying, why not go for the expensive one?"
"Idolchr_0104_B_20_06_016(0)","やよい","はわっ！？　お、お昼からそんなにすごいもの
食べて、バチとか当たらないですか？","Wow! Oh, it's such a great thing from noon!
Can I eat it and not get a bumblebee or something?"
"Idolchr_0104_B_20_06_017(0)","Ｐ","（高いメニュー選んで、
かえって気を遣わせてしまったようだ……）","(Choose an expensive menu,
(I'm afraid I've made you feel better about it. ......)"
"Idolchr_0104_B_20_07_001(0)","Ｐ","（ん？　音無さんが差し入れをしてくれた、
シュークリームが１つ余っているな）","(Hmm? Otonashi-san brought me some food,
(You have one extra cream puff.)"
"Idolchr_0104_B_20_07_002(0)","Ｐ","お、やよい、ちょうどいいところに。
シュークリーム、ひとつ余っているから食べていいぞ","Oh, Yayoi, just in time.
Cream puffs. I have one left over. You can have it."
"Idolchr_0104_B_20_07_003(0)","やよい","ええっ、でもプロデューサーも食べたいんじゃないん
ですか？　ここはじゃんけんで決めましょうー！","Eh, but I think the producer wants to eat it too.
Let's play rock-paper-scissors to decide!"
"Idolchr_0104_B_20_07_004(0)","Ｐ","（じゃんけんか……。やよい、あんなに力強く手を
握ってたら、絶対グーを出す気がするな……）","(Jankenka ....... Yayoi, such a strong hand!
(If you're holding it, I have a feeling you're definitely going to get some goo out of it. ......)"
"Idolchr_0104_B_20_07_005(0)","やよい","行きますよー！　じゃーんけーん！","I'm coming!"
"Idolchr_0104_B_20_07_006(0)","選択肢","あいこにする","do with favor (favour)"
"Idolchr_0104_B_20_07_007(0)","選択肢","勝ちをゆずる","yield a victory"
"Idolchr_0104_B_20_07_008(0)","選択肢","勝ちにいく","go for the win"
"Idolchr_0104_B_20_07_009(0)","Ｐ","ポン！　グー、あいこだな。
じゃあここは、仲良く半分ずつにするか","Pon! Goo, aiko.
So let's just get along and split it fifty-fifty here."
"Idolchr_0104_B_20_07_010(0)","やよい","わかりましたー！　仲良く半分ずつ食べるのが
一番美味しいですよねっ！　えへへ♪","I understand! We should eat half of the food together.
It's the most delicious!"
"Idolchr_0104_B_20_07_011(0)","Ｐ","ポン！　チョキ、俺の負けだな。
じゃあ、これはやよいがひとりで食べていいぞ","Pon! Choki, I guess I lose.
Then you can eat this one by yourself, yayoi."
"Idolchr_0104_B_20_07_012(0)","やよい","ううーっ、やっぱり私ひとりで食べるんじゃなくて
プロデューサーと半分ずつがいいですー","Ugh, I knew I shouldn't eat alone.
I'd like to have half with the producer."
"Idolchr_0104_B_20_07_013(0)","Ｐ","そうか、そこまで言うなら……
ありがたく半分もらうとするか","Well, if you insist that much: ......
I'll gratefully take half."
"Idolchr_0104_B_20_07_014(0)","Ｐ","ポン！　パー、俺の勝ちだな。じゃあ、これは勝った
俺の好きにするな。よし、やよいに食べてもらおう","Poof! Par, I win, then I win this one.
Don't do what I want...okay, let's have it yayo!"
"Idolchr_0104_B_20_07_015(0)","やよい","そんなのダメですよー！　プロデューサーが
食べないと、ズルい感じがします！","You can't do that! The producer is not allowed to do that!
If you don't eat it, it feels like cheating!"
"Idolchr_0104_B_20_07_016(0)","Ｐ","じ、じゃあ、ふたりで半分ずつ食べよう。
……はじめから、こうすれば良かったな","Well, then, let's both eat half of it.
...... should have done this from the beginning."
"Idolchr_0104_B_20_08_001(0)","Ｐ","（どうやらメンバー内で、お互いのモノマネを
するのが流行っているらしい……）","(Apparently, the members imitate each other.
(Apparently it's fashionable to do so: ......)"
"Idolchr_0104_B_20_08_002(0)","やよい","はいっ！　とっておきのを披露しちゃいますよー！
私の動きを、しーっかり見ててくださいね！","Yes! I'll show you my best one!
Please watch my every move, shhhh!"
"Idolchr_0104_B_20_08_003(0)","やよい","いっきまーすっ！","I'm off!"
"Idolchr_0104_B_20_08_004(0)","Ｐ","なるほど、これは……","Okay, this is ......"
"Idolchr_0104_B_20_08_005(0)","選択肢","果穂","Kaho"
"Idolchr_0104_B_20_08_006(0)","選択肢","亜美","Ami"
"Idolchr_0104_B_20_08_007(0)","選択肢","伊織","Iori"
"Idolchr_0104_B_20_08_008(0)","Ｐ","果穂だな。
元気な感じがすごく似ていたぞ！","Kaho.
You looked so much like him, the way he was so energetic!"
"Idolchr_0104_B_20_08_009(0)","やよい","ピンポーン、正解です、プロデューサー！
大正解のー、ハイ、ターッチ！　いぇい！","Bing bong, you are correct, producer!
The great answer - Hi, Tatch!"
"Idolchr_0104_B_20_08_010(0)","Ｐ","(よし、ちゃんと当てられたな。
すごく喜んでくれているな……！)","(Okay, you guessed it right.
You're making me very happy. ......!)"
"Idolchr_0104_B_20_08_011(0)","Ｐ","亜美かな？
元気なところが、似ている気がしたんだけど","Ami?
I felt like we had a lot in common in terms of energy."
"Idolchr_0104_B_20_08_012(0)","やよい","残念、ハズレです。
けど、すっごく惜しかったかも！","Too bad, it's a hassle.
But it might have been very close!"
"Idolchr_0104_B_20_08_013(0)","Ｐ","(しまった、間違えてしまった……！)","(Shit, I made a mistake: ......!)"
"Idolchr_0104_B_20_08_014(0)","Ｐ","うーん。
…………伊織、かな？","Hmmm.
............ Iori, maybe?"
