"id","character","source","translatedstr"
"Idolchr_0304_A_06_00_036(0)","紬","あの……。とにかく私は、
レッスンを続けさせていただきますので……","That ....... anyway I am,
We will continue our lessons at ......"
"Idolchr_0304_A_06_00_037(0)","Ｐ","（その後も、紬の自主レッスンは続き……）","(After that, Tsumugi's independent lessons continued: ......)"
"Idolchr_0304_A_06_00_038(0)","紬","はぁ、はぁ、はぁ……。
このぐらいで大丈夫でしょうか……","Ha, ha, ha. .......
Is this about right ......"
"Idolchr_0304_A_06_00_039(0)","Ｐ","紬、ちょっと頑張りすぎだ。
今日はこのくらいにしておこう","You're trying a little too hard, Tsumugi.
I'll leave it at that for today."
"Idolchr_0304_A_06_00_040(0)","紬","はい、そうさせていただきます……。
お付き合いくださり、ありがとうございました","Yes, we will do so. ......
Thank you for your time."
"Idolchr_0304_A_06_00_041(0)","Ｐ","最後の方、動きのキレはさらに良くなったと
思うけど、これじゃあ、休息の意味がないぞ","Toward the end, the sharpness of the movement was even better.
I guess, but this doesn't make any sense, then, to rest."
"Idolchr_0304_A_06_00_042(0)","紬","私の動き、よくなってましたか……？
これで元の体に……よかった……","Was my movement better ......?
This is the original body ......Good ......"
"Idolchr_0304_A_06_00_043(0)","Ｐ","元の体？
もしかして、どこか体の調子が悪いのか？","The original body?
Perhaps there is something wrong with your body?"
"Idolchr_0304_A_06_00_044(0)","紬","…………！
な、何でもありません。気にしないでください","............!
Nothing, never mind."
"Idolchr_0304_A_06_00_045(0)","Ｐ","気にしないでって、言われても……。
なにか体のことで心配があるんだろう？","Don't worry about it, I've been told. ......
You're worried about something physical, aren't you?"
"Idolchr_0304_A_06_00_046(0)","Ｐ","紬、はっきりと教えてくれないか。
なにか不安なことや悩みがあるなら話してほしいんだ","Pongee, please tell me clearly.
If you have any concerns or worries, please talk to me."
"Idolchr_0304_A_06_00_047(0)","紬","…………","…………"
"Idolchr_0304_A_06_00_048(0)","Ｐ","俺に言いにくいことだったら、
ルミナスの仲間に相談してみるとか……","If it's something you don't feel comfortable telling me,
You could talk to your Luminous friends about it: ......"
"Idolchr_0304_A_06_00_049(0)","紬","……太ったんです","...... I've gained weight."
"Idolchr_0304_A_06_00_050(0)","Ｐ","……え？","...... What?"
"Idolchr_0304_A_06_00_051(0)","紬","先日、甘味を食べすぎた分、
少し太ってしまったので体を動かしているのです！","For eating too much sweet food the other day,
I've gained some weight and I'm working out!"
"Idolchr_0304_A_06_00_052(0)","Ｐ","えっ……。
ああ、そういうことだったのか","
Oh, that's what I meant."
"Idolchr_0304_A_06_00_053(0)","紬","な、なんて軽薄な……！","What a frivolous ......!"
"Idolchr_0304_A_06_00_054(0)","紬","あなたはプロデューサーなのですから、
もっとアイドルのことを考えて発言をするべきです","You are the producer,
You should think more about your idol and make your statements."
"Idolchr_0304_A_06_00_055(0)","Ｐ","……そうだな。ごめん、ごめん","...... yeah, sorry, sorry."
"Idolchr_0304_A_06_00_056(0)","Ｐ","（うーん……。紬の些細な反応や行動に、
もっと気をつけるべきだったな……）","(Hmmm ....... to the trivial reactions and actions of the pongee,
(I should have been more careful. ......)"
"Idolchr_0304_A_07_00_001(0)","Ｐ","（事務所で紬と軽い打ち合わせをしていると……）","(I'm having a light meeting with pongee in my office ......)"
"Idolchr_0304_A_07_00_002(0)","きらり","にょわー☆　Ｐちゃんに紬ちゃん！
今日もおにゃーしゃー！","Nyowa☆ P-chan and Tsumugi!
Onyasha today!"
"Idolchr_0304_A_07_00_003(0)","紬","あっ、諸星さん、お疲れ様です","Oh, Ms. Morohoshi, thank you for your time."
"Idolchr_0304_A_07_00_004(0)","Ｐ","お疲れ、きらり","Good work, Kirari."
"Idolchr_0304_A_07_00_005(0)","きらり","おっつおっつ～☆
それじゃ、まったにぃ～♪","Oh, hey, hey, hey!
Well, then, mata ni~♪"
"Idolchr_0304_A_07_00_006(0)","紬","ぱっと現れて、いつもの挨拶をして、
さっと去っていかれましたね……","Show up quickly and say the usual greetings,
You left quickly: ......"
"Idolchr_0304_A_07_00_007(0)","Ｐ","ああ、そうだな。でも、元気いっぱいなのが、
きらりのいいところだよな","Oh, yes, but full of energy,
That's the nice thing about Kirari."
"Idolchr_0304_A_07_00_008(0)","紬","あれが、個性……
というものなのでしょうか……","That's the personality ......
Is that what it is called ......"
"Idolchr_0304_A_07_00_009(0)","Ｐ","そうだな。慣れないと少し驚くけど、
アイドルとしては大きな武器だと思う","Yes, it's a little surprising if you're not used to it,
I think it's a great weapon for an idol."
"Idolchr_0304_A_07_00_010(0)","紬","……やはり、際立った個性を見ると、
なにかを考えさせられる気持ちになります","......As I said, when I see a distinctive personality,
It makes me think about something."
"Idolchr_0304_A_07_00_011(0)","紬","最近は、適度に休息をとることで、
少しだけレッスンに余裕ができましたが……","These days, it's all about getting the right amount of rest,
I've got a little room for a few more lessons. ......"
"Idolchr_0304_A_07_00_012(0)","紬","私にも個性があれば、
もっと活動の幅を広げることができるのでは、と……","If only I had some personality,
We could expand our activities more. ......"
"Idolchr_0304_A_07_00_013(0)","Ｐ","うん？　紬は今でも十分、
個性豊かなアイドルだと思うけど","Yes? Tsumugi is still good enough,
I think you're an idol with a lot of personality."
"Idolchr_0304_A_07_00_014(0)","紬","私が個性的……？　
あなたはなにを根拠にそのようなことを……！","Do you think I'm unique ......?
On what basis do you say that ......!"
"Idolchr_0304_A_07_00_015(0)","紬","私自身、個性よりまず、歌やダンスの実力を
身に着けるべきなのは分かっています……","I, myself, am more interested in your singing and dancing ability than your personality.
I know I should wear it. ......"
"Idolchr_0304_A_07_00_016(0)","Ｐ","い、いや、そういうわけじゃないんだ。
紬の個性的なところは……","No, no, it's not like that.
The unique thing about pongee is that it is ......"
"Idolchr_0304_A_07_00_017(0)","選択肢","感受性","sensitivity"
"Idolchr_0304_A_07_00_018(0)","選択肢","金沢弁","Kanazawa dialect"
"Idolchr_0304_A_07_00_019(0)","選択肢","三味線","shamisen"
"Idolchr_0304_A_07_00_020(0)","Ｐ","豊かな感受性だと思う。庭園が好きだったり、
他のアイドルには無い個性だと思うぞ","I think he has a rich sensitivity; he likes gardens and so on,
I think it's a personality you won't find in any other idol."
"Idolchr_0304_A_07_00_021(0)","紬","私の感受性……。
なるほど、そういう考えもあるのですね","My sensitivity. .......
I see, that's one way to think about it."
"Idolchr_0304_A_07_00_022(0)","Ｐ","その紬の個性を武器にして、ルミナスの活動を
後押ししてくれることを期待しているぞ！","Luminous activities with its pongee personality as a weapon.
I'm hoping you can give us a push!"
"Idolchr_0304_A_07_00_023(0)","紬","はい。……あの、庭園好きであることを
どのようにアイドルに生かせばいいのでしょうか","Yes. ...... that you are a garden lover.
How can I make use of this in my idol?"
"Idolchr_0304_A_07_00_046(0)","紬","庭園がないところでは、
あまりお役に立てないのでは……","Where there are no gardens,
I'm afraid I can't be of much help: ......"
"Idolchr_0304_A_07_00_024(0)","Ｐ","金沢弁で話すことかな。不思議と、気持ちが
ストレートに伝わる感じがするんだ","I wonder if it is to speak in Kanazawa dialect.
I feel like it comes straight from the heart."
"Idolchr_0304_A_07_00_025(0)","紬","う、うちはそんなつもりで話しとらんげん！","I didn't mean it that way!"
"Idolchr_0304_A_07_00_026(0)","Ｐ","……うん。やっぱり個性的だ","...... Yeah, it's still unique."
"Idolchr_0304_A_07_00_027(0)","紬","うう……なんだか、プロデューサーの策略に
まんまと乗せられた気分です……","Ugh ...... what a producer's ploy!
I feel like I've been taken for a ride. ......"
"Idolchr_0304_A_07_00_047(0)","紬","それに、方言だけで個性というのも、
おかしいような気がします……","Besides, it's not just about dialects, but also about personalities,
It sounds crazy: ......"
"Idolchr_0304_A_07_00_028(0)","Ｐ","ずばり、三味線だ！","The three-stringed Japanese guitar, of course!"
"Idolchr_0304_A_07_00_029(0)","紬","……あなたは、私を三味線アイドルに
仕立てようとしているのですか？","...... you make me a shamisen idol
Are you trying to tailor it?"
"Idolchr_0304_A_07_00_030(0)","Ｐ","そ、そういう意味じゃないんだ……。
ファッション同様、目に見える個性だろ？","Well, that's not what I meant. ......
It's a visible personality, just like fashion, right?"
"Idolchr_0304_A_07_00_031(0)","紬","三味線は、演奏するものであって、
ファッションではありません……","The shamisen is something to be played,
Not in fashion. ......"
"Idolchr_0304_A_07_00_032(0)","紬","やはり、私に個性なんて……","After all, I have no personality. ......"
"Idolchr_0304_A_07_00_033(0)","きらり","そんなことないよぉ♪　紬ちゃんもきゃわいくて
個性たっぷりの、素敵なアイドルだゆ☆","That's not true... Tumugi-chan is cute too.
A wonderful idol with a lot of personality."
"Idolchr_0304_A_07_00_034(0)","紬","も、諸星さん！？","Morohoshi-san!"
"Idolchr_0304_A_07_00_035(0)","Ｐ","き、きらり……","Ki, Kirari ......"
"Idolchr_0304_A_07_00_036(0)","きらり","にょわっ！
お、おどろかせてごめんね","NyowoWow!
Oh, sorry to scare you."
"Idolchr_0304_A_07_00_037(0)","きらり","盗み聞きするつもりはなかったんだけど、紬ちゃんと
Ｐちゃんのお話、ちょこっと聞いちゃった","I didn't mean to eavesdrop, but with Tsumugi.
I heard a little bit of P-chan's story."
"Idolchr_0304_A_07_00_038(0)","きらり","紬ちゃんは、きらりんがもってないもの、
い～っぱいもってるにぃ♪","Tsumugi is what Kirarin doesn't have,
I'll have plenty."
"Idolchr_0304_A_07_00_039(0)","紬","え……？","What, ......?"
"Idolchr_0304_A_07_00_040(0)","きらり","たとえば、サラサラでツヤツヤのロングヘア―☆
紬ちゃんにバッチシお似合いで、きゃわいいなって♪","For example, long, silky, shiny hair.
It suits Tsumugi perfectly and is so cute."
"Idolchr_0304_A_07_00_041(0)","きらり","それに真面目なところも～、おしとやかなところも、
すっごく紬ちゃんって感じで、素敵だよぉ～☆","And the serious part - and the graceful part,
It's just like Tsumugi, so nice!"
"Idolchr_0304_A_07_00_042(0)","Ｐ","ああ、紬の個性もちゃんとあるんだ。
だから、もっと自信を持てばいい","Oh, and the pongee has a proper personality too.
So you should be more confident."
"Idolchr_0304_A_07_00_043(0)","紬","……ありがとうございます","Thank you ......"
"Idolchr_0304_A_07_00_044(0)","紬","今日、ふたりに言われたことで、
少しだけ、自分に自信が持てた気がします……","By what two people said to me today,
I feel a little more confident in myself. ......"
"Idolchr_0304_A_07_00_045(0)","Ｐ","（……紬も素直に受け入れてくれたようだ。
この絶妙な律儀さが紬の一番の個性なんだろうな）","(It seems that ...... Tsumugi also accepted it honestly.
(This exquisite lawfulness is probably the most unique thing about pongee.)"
"Idolchr_0304_A_08_00_001(0)","Ｐ","（打ち合わせ先から、事務所に帰るところだが……。
こんな時間なのに人でいっぱいだ）","(I'm on my way back to the office from a meeting at .......
(It's full of people, even at this hour.)"
"Idolchr_0304_A_08_00_002(0)","紬","………………","………………"
"Idolchr_0304_A_08_00_003(0)","Ｐ","どうした紬？","What's the matter, pongee?"
"Idolchr_0304_A_08_00_004(0)","紬","い、いえ……。少々、人の流れが激しすぎて、
とまどってしまって……","No, no, ....... The flow of people is a little too intense,
I'm so confused. ......"
"Idolchr_0304_A_08_00_005(0)","Ｐ","無理しなくていいぞ。
疲れてるのなら、どこかで休んでいこう","You don't have to.
If you're tired, let's go rest somewhere."
"Idolchr_0304_A_08_00_006(0)","紬","もう、大丈夫です。
少し、困惑してしまっただけですから……","It's all right now.
I'm just a little confused, that's all. ......"
"Idolchr_0304_A_08_00_007(0)","紬","ただ……こっちの人たちは
なんだか、ひしめき合っていますね……","Just ...... over here people.
It's kind of a clusterfuck: ......"
"Idolchr_0304_A_08_00_008(0)","Ｐ","交通の便もいいし、都会には人が集まるからな。
それに繁華街のど真ん中だ、人も自然と多くなるよ","Traffic is good, and people are attracted to the city.
Plus, it's right in the middle of downtown. There's naturally going to be a lot of people."
"Idolchr_0304_A_08_00_009(0)","紬","……それは、こちらの都会と呼ばれる場所にだけ、
人が多く集まってくると言いたいのですか？","...... That's only in what we call the city here,
Are you trying to say that it attracts more people?"
"Idolchr_0304_A_08_00_010(0)","紬","単純に人の行き交いが多いだけで、
賑わっているのとは意味が異なると思いますが","Simply because there are so many people coming and going,
I don't think it means the same thing as being crowded."
"Idolchr_0304_A_08_00_011(0)","Ｐ","確かに、そうだな……。
ゴメン、変な意味で言ったわけじゃないんだが","Sure, you're right. ......
Sorry, I didn't mean it in a weird way."
"Idolchr_0304_A_08_00_012(0)","紬","べ、別に私も、お説教をするつもりで
言ったのではありません！","I'm not trying to lecture you, either.
I did not say that!"
"Idolchr_0304_A_08_00_013(0)","紬","まるで東京だけが都会かのように言っていたのを、
注意しただけですから……","It was as if Tokyo was the only city in the world,
Just a heads up. ......"
"Idolchr_0304_A_08_00_014(0)","紬","…………","…………"
"Idolchr_0304_A_08_00_015(0)","Ｐ","どうした、紬？　早く駅に向かおう。
……って、もしかして疲れたのか？　それなら……","What's wrong, Tsumugi? Let's head for the station quickly.
Maybe you're tired of ......? Then go to ......"
"Idolchr_0304_A_08_00_016(0)","紬","……私がタクシーで帰ろうと、
贅沢を言うとでも思っているのですか？","...... I was going to take a cab home,
Do you think you are being extravagant?"
"Idolchr_0304_A_08_00_017(0)","Ｐ","いや、贅沢だなんて思ってないぞ……。
ちなみに改札は交差点の向こう側だ","No, I don't consider it a luxury. ......
The turnstiles, by the way, are on the other side of the intersection."
"Idolchr_0304_A_08_00_018(0)","紬","そ、それくらい分かっています！
私を迷子と勘違いしているのですか！？","Yes, I know that much!
You are mistaking me for a lost child!"
"Idolchr_0304_A_08_00_019(0)","Ｐ","（……紬は人混みが苦手なのかもしれないな。
ここはひとつ……）","(Maybe ...... pongee doesn't like crowds.
(Here's one: ......)"
"Idolchr_0304_A_08_00_020(0)","選択肢","隣を歩くように
告げる","Walk next to me.
ring (bell, alarm, warning, etc.)"
"Idolchr_0304_A_08_00_021(0)","選択肢","細かく改札までの
経路を告げる","To the ticket gate in detail
announce a route"
"Idolchr_0304_A_08_00_022(0)","選択肢","手を握るように
告げる","Like holding hands.
ring (bell, alarm, warning, etc.)"
"Idolchr_0304_A_08_00_023(0)","Ｐ","ほら、俺の隣に来るといい。そうすれば、
お互いに行きたい方向が分かりやすいだろう","Here, you can come sit next to me, and we can talk about it,
It would be easy to see where we both want to go."
"Idolchr_0304_A_08_00_024(0)","紬","と、隣にって……。そのようなことをしなくても、
目的地は改札口なのですから、平気です……","And you don't have to do that next to ......,
I'm fine, because my destination is the turnstiles: ......"
"Idolchr_0304_A_08_00_025(0)","Ｐ","改札の入口はいくつもあるからな。
俺と紬が思っている場所が違うかもしれないだろ？","There are a number of entrances to the ticket gates.
You know, me and Tsumugi might not be where you think we are."
"Idolchr_0304_A_08_00_026(0)","紬","その通りかもしれませんが……。
並んで歩いたら通行人とぶつかってしまいます","You may be right. .......
If you walk side by side, you'll bump into passersby."
"Idolchr_0304_A_08_00_027(0)","Ｐ","大丈夫、ぶつかりそうなときは俺が避けるから。
さあ、行こう。ちゃんと隣にいるんだぞ","Don't worry, I'll avoid you if you're about to bump into me.
Come on, let's go, you're right next to me."
"Idolchr_0304_A_08_00_028(0)","Ｐ","この先、３００メートル直進したら、
５番出口がある。そこから改札に向かおうか","If you go straight ahead for 300 meters,
There's Exit 5, we can head to the ticket gate from there."
"Idolchr_0304_A_08_00_029(0)","紬","分かりましたが……どのような意図で、
そのような事細かな説明をしたのですか？","I understand but ...... what is your intention,
Did you give such a detailed explanation?"
"Idolchr_0304_A_08_00_030(0)","Ｐ","交差点の向こう、
だけだったら分かりづらいかなって思ってな","Across the intersection,
I just thought it might be a little confusing if it was only"
"Idolchr_0304_A_08_00_031(0)","紬","確かに、そうかもしれませんが……３００メートルと
言われても、感覚的なもので分かりづらいです","Indeed, it may be so, but ......300 meters and
It's hard to tell because it's so sensory when you're told."
"Idolchr_0304_A_08_00_032(0)","紬","それに、距離を意識しながら歩いていると、
通行人にぶつかってしまいそうです","Besides, you have to be aware of the distance as you walk,
I'm afraid I'm going to bump into a passerby."
"Idolchr_0304_A_08_00_033(0)","Ｐ","紬の言うことも一理あるな。
気を付けて行こう。……なんなら並んで歩くか？","Tsumugi has a point.
Let's go with care. ...... If you want, we can walk side by side."
"Idolchr_0304_A_08_00_034(0)","Ｐ","ほら、紬。俺の手を握って一緒に歩こう。
そうすれば迷子にならないだろ？","Come on, Tsumugi, take my hand and walk with me.
That way you won't get lost, right?"
"Idolchr_0304_A_08_00_035(0)","紬","あなたはバカなのですか？　
そんなことしても、ふたりで迷子になるだけです","Are you an idiot?
If you do that, we'll both just get lost."
"Idolchr_0304_A_08_00_036(0)","Ｐ","お、俺が改札まで誘導するから大丈夫だぞ……？","Oh, I'll lead you to the turnstiles, you'll be fine. ......?"
"Idolchr_0304_A_08_00_037(0)","紬","手を握るのは不要です……恥ずかしいので","No need to hold my hand ...... because it's embarrassing."
"Idolchr_0304_A_08_00_038(0)","Ｐ","そ、そうだよな。
それなら、普通に並んで歩こうか","Yes, that's right.
Then let's walk side by side like normal."
"Idolchr_0304_A_08_00_039(0)","紬","…………","…………"
"Idolchr_0304_A_08_00_040(0)","Ｐ","どうしたんだ、紬？","What's the matter, Tsumugi?"
"Idolchr_0304_A_08_00_041(0)","紬","プロデューサーが先を歩いてください。
私はその後ろについていきますから","Producers should walk ahead.
I'll be right behind you."
"Idolchr_0304_A_08_00_042(0)","紬","そうすれば、離れ離れになることもありませんし、
通行人にぶつかることもありません","That way, we won't be separated,
No bumping into passersby."
"Idolchr_0304_A_08_00_043(0)","Ｐ","分かった。
はぐれないようにしっかりとついてきてくれよ","
Make sure you follow me so we don't get separated."
"Idolchr_0304_A_08_00_044(0)","紬","そ、そんな子どもではないのですから、
それくらいできます……！","I am not that kind of child,
I can do that much. ......"
"Idolchr_0304_A_09_00_001(0)","Ｐ","（紬が自主レッスンしていると聞いて来てみたが……
うん、いい表情をしている。着実に成長しているな）","(I came here when I heard that Tsumugi was giving a voluntary lesson. ......
Yeah, you've got a good look on your face; you're steadily growing.)"
"Idolchr_0304_A_09_00_002(0)","紬","あ……お疲れ様です、プロデューサー。
見ていらしたのですか……？","Ah ...... thanks for your help, producer.
Have you been watching ......?"
"Idolchr_0304_A_09_00_003(0)","Ｐ","ああ、今のレッスン、すごくいい顔だったぞ。
紬の成長が表情に出ているな","Yeah, you looked really good in that lesson just now.
You can see the growth in Tsumugi's expression."
"Idolchr_0304_A_09_00_004(0)","紬","そ、そんなん……。
私は当然のことをしているだけです","That's not how it works. ......
I'm just doing what I'm supposed to do."
"Idolchr_0304_A_09_00_005(0)","紬","私たちには１２月の最終ライブという、
大きな目標がありますから……","For us, it is the last show of December,
Because we have big goals. ......"
"Idolchr_0304_A_09_00_006(0)","紬","努力は継続するべきだと思っています。
もちろん、しっかり休息を取りながら、ですが……","I believe that the effort should continue.
Of course, with a good rest. ......"
"Idolchr_0304_A_09_00_007(0)","Ｐ","ああ、それは十分に伝わっているよ","Yeah, that's telling enough."
"Idolchr_0304_A_09_00_008(0)","Ｐ","初めて自主レッスンをしていた時の紬の表情と、
今日の表情……まるで別人みたいに楽しそうだ","With the expression on Tsumugi's face when she was giving her first independent lesson,
Today's expression ...... looks like a different person, like he's having a good time."
"Idolchr_0304_A_09_00_009(0)","紬","…………っ！","............!"
"Idolchr_0304_A_09_00_010(0)","紬","そう……かもしれませんね。
プロデューサーのご指摘通りかと思います","So ...... maybe.
I think the producer is right."
"Idolchr_0304_A_09_00_011(0)","紬","最初は、ルミナスのメンバーに選ばれたからには、
その務めを全うしなくては、と感じていました","At first, because I was chosen as a member of Luminous,
I felt I had to fulfill that duty."
"Idolchr_0304_A_09_00_012(0)","紬","自分には、個性なんてない……。だから、置いて
いかれないように、実力を身につけないといけない","I have no personality. ....... So, put it down.
We have to learn to be competent so that we don't go crazy."
"Idolchr_0304_A_09_00_013(0)","紬","そう思い、がむしゃらにレッスンをすることだけが、
必要なことだと思っていました","With that in mind, the only thing I can do is to give lessons in a grueling way,
I knew it was necessary."
"Idolchr_0304_A_09_00_014(0)","紬","ですが、プロデューサーにアドバイスをいただき、
自分を見つめ直すことができました……","But I was advised by the producer,
I was able to look at myself again: ......"
"Idolchr_0304_A_09_00_015(0)","Ｐ","俺は大したことはしていないよ。
紬が頑張った結果だ","I'm not making a big deal out of it.
It's the result of Tsumugi's hard work."
"Idolchr_0304_A_09_00_016(0)","紬","今は心に余裕もできて、みんなとレッスンや
お仕事をすることが……すごく、楽しいです","Now I have more room in my heart to work with everyone, to take lessons and
I enjoy ...... very much working with you!"
"Idolchr_0304_A_09_00_017(0)","Ｐ","ああ、いい事だと思うぞ。
紬が着実に成長している証拠だ","Yeah, I think that's a good thing.
Proof that pongee is steadily growing."
"Idolchr_0304_A_09_00_018(0)","紬","うちが成長……","Our House Grows ......"
"Idolchr_0304_A_09_00_019(0)","Ｐ","なぁ、紬。今の紬がやりたいこと、
挑戦したいことって、なにかないか？","Hey, Tsumugi, what you want to do now,
Is there anything that you would like to challenge yourself to do?"
