"id","character","source","translatedstr"
"workchr_0404_C_01_00_016(0)","甘奈","甘奈が思いつくのはこれくらいだね。
プロデューサーさん、どうかな？","That's about all Amana can come up with.
Producers, what do you think?"
"workchr_0404_C_01_00_017(0)","Ｐ","今、甘奈の考えてくれたので
十分いけそうだけど","Now that you've given it some thought Amana.
I think it's good enough."
"workchr_0404_C_01_00_018(0)","甘奈","ありがと！　でもやっぱり意見欲しいな！
決め手があるとうれしいから","Thanks, but I still want your opinion!
Because it's nice to have a deciding factor."
"workchr_0404_C_01_00_019(0)","Ｐ","うーん……それなら、
次のＣＭで甘奈が着る衣装は……","Hmmm ...... then,
The outfit that Amana will wear in the next commercial is ......"
"workchr_0404_C_01_00_020(0)","選択肢","白衣とメガネ","White Coat and Glasses"
"workchr_0404_C_01_00_021(0)","選択肢","看護師の服","Nurses' Clothing"
"workchr_0404_C_01_00_022(0)","選択肢","かわいいパジャマ","Cute pajamas"
"workchr_0404_C_01_00_023(0)","選択肢","セクシーな水着","Sexy swimwear"
"workchr_0404_C_01_00_024(0)","Ｐ","白衣がいいんじゃないか？　メガネも合わせて、
いつもとは違った甘奈の魅力が出ると思うぞ","I think a white coat would be nice. Glasses to go with it,
I think it will bring out a different kind of Amana's charm."
"workchr_0404_C_01_00_025(0)","甘奈","ギャップは大事だもんね！　えへへ、分かった！
プロデューサーさんが言うなら、そうしてみる！","Gaps are important, aren't they! Heh, heh, I get it!
If the producer says so, I'll do it!"
"workchr_0404_C_01_00_026(0)","甘奈","かっこいい女医さんをイメージして、
クールに決めちゃうね☆","Imagine a cool female doctor,
I'm going to be cool."
"workchr_0404_C_01_00_027(0)","Ｐ","(ＣＭのメガネと白衣姿の甘奈は、普段と違う印象で
かなり話題になったぞ！)","(Amana in her glasses and white coat in the commercial gives a different impression than usual.
That's quite a buzz!)"
"workchr_0404_C_01_00_028(0)","Ｐ","(ＣＭも大いに注目されて、仕事の幅も広がった！)","(The commercials also attracted a great deal of attention and work!)"
"workchr_0404_C_01_00_029(0)","Ｐ","悩むけど……看護師の服にしよう。
やっぱり王道が一番だ、うん。間違いない！","I'm torn, but I'll go with ...... nurses' clothing.
After all, the high road is the best, no doubt about it!"
"workchr_0404_C_01_00_030(0)","甘奈","色んな人に予防を意識してほしいもんね！
イメージしやすいのが一番だと思う！","I want people to be aware of prevention!
I think the best way is to make it easy to imagine!"
"workchr_0404_C_01_00_031(0)","Ｐ","ああ、わかりやすさで勝負しよう！","Yeah, let's play with clarity!"
"workchr_0404_C_01_00_032(0)","甘奈","うん！　ありがとっ！
一生懸命考えてくれたの、めっちゃうれしかった☆","Thanks!
I was so happy that she thought so hard about it."
"workchr_0404_C_01_00_033(0)","Ｐ","(予想通り、甘奈の看護師姿がかわいいと
評判になり、ＣＭも大勢の人の目に触れたぞ！)","(As expected, I thought Amana looked cute as a nurse.
You've got the word out, and your commercials have been seen by a lot of people!)"
"workchr_0404_C_01_00_034(0)","Ｐ","次のＣＭの衣装は、パジャマにしてみよう。
撮影までに甘奈に似合いそうなものを選んでおくよ","Let's try pajamas for the next commercial outfit.
I'll pick out something that will look good on Amana before the shoot."
"workchr_0404_C_01_00_035(0)","甘奈","うん！　プロデューサーさんが選んでくれた
パジャマ、着るの楽しみだな！","Yeah! The producer picked it out for me.
Pajamas, I'm looking forward to wearing them!"
"workchr_0404_C_01_00_036(0)","Ｐ","(その後、甘奈のパジャマ姿が
かわいいと評判になった)","(Then, Amana's pajamas were on.
It got a reputation for being cute.)"
"workchr_0404_C_01_00_037(0)","Ｐ","(しかしＣＭの内容には合っていなかったようで、
風邪予防についてはあまり周知されなかった……)","(But it didn't seem to fit the commercial,
Not much was known about cold prevention: ......)"
"workchr_0404_C_01_00_038(0)","Ｐ","セクシーな水着にしよう。
インパクトで勝負だ！","Let's make it a sexy swimsuit.
It's all about impact!"
"workchr_0404_C_01_00_039(0)","甘奈","え？　水着？
風邪予防と関係なくない？","What? Swimsuit?
Doesn't it have anything to do with preventing colds?"
"workchr_0404_C_01_00_040(0)","Ｐ","(ＣＭの内容に合わないとして衣装が変更になり、
撮影時間が大幅に押して、怒られてしまった……)","(The costume was changed as it did not fit the commercial,
I got pissed off because I pushed the shooting time so far: ......)"
"workchr_0404_C_01_00_041(0)","Ｐ","（今回の仕事は成功だ！）","(This job was a success!)"
"workchr_0404_C_01_00_042(0)","Ｐ","（今回の仕事は失敗だ。次こそは！）","（This job was a mistake...next time!)"
