"id","character","source","translatedstr"
"Idolchr_0204_A_10_00_030(0)","きらり","ええっ、お肌が……？
き、気を付けなくちゃ……ふにゅ……","What, your skin is ......?
Ki, I have to be careful ...... funyu......"
"Idolchr_0204_A_10_00_031(0)","きらり","Ｐちゃんは、きらりんが気付かないところまで
ちゃんと見てるんだね","P-chan, to the point where Kirari doesn't even notice.
You're looking right at it."
"Idolchr_0204_A_10_00_032(0)","Ｐ","さっきの昼寝をしていたときの、
ヨダレのあとがついてるぞ","When I was taking a nap earlier,
You've got drool on you."
"Idolchr_0204_A_10_00_033(0)","きらり","うきゅ！？　は、早く教えてよぉ～！
きらりん、恥ずかしい～！","Ukyuu!? can't wait to hear about it!
Kirarin, I'm so embarrassed!"
"Idolchr_0204_A_10_00_034(0)","きらり","あ～、きらりんのふちゅーいだけど、
Ｐちゃん、教えてくれてありがとにぃ……","Ahhh, Kirarin's futyuuuuuuuuuuuuu,
Thanks for letting me know, P. ......"
"Idolchr_0204_A_10_00_035(0)","Ｐ","俺はきらりのプロデューサーだからな。
アイドルをよく見ておくのは当然だ","I'm Kirari's producer.
It's only right to keep a close eye on your idols."
"Idolchr_0204_A_10_00_036(0)","Ｐ","だから、きらりが杏を大切に思ってるのも
よくわかるよ","That's why Kirari cares so much about Anzu.
I know exactly what you mean."
"Idolchr_0204_A_10_00_037(0)","きらり","うぇへへ☆
杏ちゃんは、きらりのお友だちだから♪","Hehehe*
Anzu is a friend of Kirari's. ♪"
"Idolchr_0204_A_10_00_038(0)","Ｐ","きらりに服を作ってもらえる杏は幸せだと思うぞ","I think Anzu is lucky to have Kirari making her clothes."
"Idolchr_0204_A_10_00_039(0)","きらり","そうだといいなぁ☆　……あっ、
Ｐちゃんのスーツ、ちょっとほつれちゃってるゆ","I hope so☆ ...... Oh,
P-chan's suit is a little frayed."
"Idolchr_0204_A_10_00_040(0)","Ｐ","えっ？　……本当だ、新調しないとな","What? ...... Really, I need a new one."
"Idolchr_0204_A_10_00_041(0)","きらり","ふみゅふみゅ……あ、きらりーん☆
いいこと、ひらめいちゃったゆー♪","Fumyu Fumyu ...... Oh, Kirari☆!
I've got an idea."
"Idolchr_0204_A_10_00_042(0)","Ｐ","（きらりは何かを閃いた様子だが……。
まあ、本人が言うように『いいこと』だと信じよう）","(Kirari seems to have had a flash of something. ......
(Well, let's just believe it's a 'good thing' as he says)"
"Idolchr_0204_A_11_00_001(0)","きらり","ふわわぁ～。あふっ……。
ご、ごめんなさいにぃ～","Fluffy - ahwah. .......
I'm sorry, I'm sorry."
"Idolchr_0204_A_11_00_002(0)","Ｐ","気にしなくてもいいけど、大きなあくびだったな","Never mind, that was a big yawn."
"Idolchr_0204_A_11_00_003(0)","Ｐ","きらりもスケジュールがびっしりで、忙しいからな。
無理をしないで、活動が大変な時は相談してくれ","Kirari's schedule is jam-packed and she's busy.
Don't take it too hard. Talk to me if you have a hard time with an activity."
"Idolchr_0204_A_11_00_004(0)","きらり","……えっ？　あっ、うん！
いつも心配してくれて、ありがと☆　Ｐちゃん♪","...... eh? Oh, yeah!
Thanks for always worrying about me, P-chan."
"Idolchr_0204_A_11_00_005(0)","Ｐ","ん？　ぎこちない返事だったけど、
活動で不安なことでもあるのか？","Hmm? It was an awkward response,
Are you worried about something in your activities?"
"Idolchr_0204_A_11_00_006(0)","きらり","うぴゃ！　そ、そうじゃなくてぇ……","That's not what I meant. ......"
"Idolchr_0204_A_11_00_007(0)","きらり","えっとね、前にＰちゃんに夜更かしは『めっ！』
って、怒られちゃったことがあったけど……","Let's see, P-chan once told me that staying up late is ""meh!
I was so pissed off once. ......"
"Idolchr_0204_A_11_00_008(0)","きらり","実は、Ｐちゃんに怒られるって分かっていたけど、
きらりん、今お洋服を作ってるの","Actually, I knew P-chan would be mad at me,
Kirarin, I'm making clothes now."
"Idolchr_0204_A_11_00_009(0)","Ｐ","……それは褒められたことじゃないな","...... That's not a compliment."
"Idolchr_0204_A_11_00_010(0)","Ｐ","だけど、杏にそこまで洋服が必要か？
いつもＴシャツしか着ていないイメージだけど","But does Anzu need that many clothes?
I've always had the image of you wearing only T-shirts."
"Idolchr_0204_A_11_00_011(0)","きらり","うぇっ！？　えっ、そ、そうだにぃ！
あ、杏ちゃん、すぐにお洋服を汚しちゃうから！","Eh, yes, that's right!
Oh, Anzu, you'll soon get your clothes dirty!"
"Idolchr_0204_A_11_00_012(0)","Ｐ","汚れただけで、新しい洋服を作るのか？","Just because it's dirty, they make new clothes?"
"Idolchr_0204_A_11_00_013(0)","きらり","うきゃっ！　えっとえ～っと……。ステージ衣装とか
すぐに破けちゃったりするから！","Uwkiah! Um, let's see... ......... stage costumes and all that.
They can tear easily!"
"Idolchr_0204_A_11_00_014(0)","Ｐ","ああ、なるほどね。杏、ステージ衣装でも、
雑に扱いそうな感じがするもんな","Oh, I see...Anzu, even in stage clothes,
It seems like he's going to treat them roughly."
"Idolchr_0204_A_11_00_015(0)","きらり","そんなことないにぃ！　杏ちゃんは、きらりんが
作った衣装、すっごく大事にしてくれるよ！","That's not true!
They will take very good care of the costumes they made!"
"Idolchr_0204_A_11_00_016(0)","Ｐ","そうだったのか。ごめんな、イメージだけで
杏のことを悪く言ったりして","Oh, right, sorry, just an image.
I would say bad things about Anzu."
"Idolchr_0204_A_11_00_017(0)","Ｐ","だとしたら、なおさら杏に新しい衣装を
作る必要もないんじゃないのか？","If so, I'd like to see a new outfit for Anzu even more so.
You don't even have to make it."
"Idolchr_0204_A_11_00_018(0)","きらり","にょわー！　ぴ、Ｐちゃん、鋭いにぃ……。
でもね、ど～しても作りたいお洋服があるの！","Nyowa! Pi-chan, p-chan, sharp nyi. ......
But you know, there are some clothes that I really want to make!"
"Idolchr_0204_A_11_00_019(0)","きらり","じつは、新しいチャレンジをしているんだけど、
なかなかうまくいかなくて……","Actually, I'm taking on a new challenge,
I'm having a hard time getting it right. ......"
"Idolchr_0204_A_11_00_020(0)","きらり","きらり～ん☆　って、いんすぴれーしょんが
わかなくて、針がチクチク進まないんだゆ……","Kirari~~"", the inspireeshon said.
I can't get the needle to move. ......"
"Idolchr_0204_A_11_00_021(0)","Ｐ","挑戦したいことは見つかったけれど、
どこから手をつけたらいいか分からない感じか……","I have found something I want to try, though,
Do you feel like you don't know where to start? ......"
"Idolchr_0204_A_11_00_022(0)","選択肢","力になるぞ","I'm gonna help you."
"Idolchr_0204_A_11_00_023(0)","選択肢","思い詰めるな","Don't get worked up."
"Idolchr_0204_A_11_00_024(0)","選択肢","諦めよう","Let's give it up."
"Idolchr_0204_A_11_00_025(0)","Ｐ","よければ力になるぞ。俺がきらりに
できることがあったら、なんだって言ってくれ","I can help you, if you like.
If there's anything I can do, anything at all, just let me know."
"Idolchr_0204_A_11_00_026(0)","きらり","ほんとにー！？　うっきゃー！
やっぱりＰちゃんは優しくて、頼りになるにぃ♪","Really!
P-chan is kind and reliable after all."
"Idolchr_0204_A_11_00_027(0)","きらり","うんうん！　Ｐちゃんが背中を押してくれるなら、
きらりん、最後まで諦めずに頑張れりゅ！","Yeah, yeah! If only P-chan would have my back,
Kirarin, don't give up and hang in there until the end!"
"Idolchr_0204_A_11_00_028(0)","Ｐ","あんまり思い詰めないようにな。そういう時は、
気を楽にしたときに解決策が見つかるもんさ","Don't get too worked up about it,
When you put your mind at ease, you'll find a solution."
"Idolchr_0204_A_11_00_029(0)","きらり","うん、わかったにぃ。Ｐちゃんに心配させない
ためにも、夜更かしは今日でおしまいにするにぃ！","I won't let P-chan worry about me.
I'm going to stay up late today for the sake of my family!"
"Idolchr_0204_A_11_00_030(0)","きらり","それに、みんなに迷惑をかけないように、
少しずつチクチク～って、ガンバルことにすゆ！","Besides, I don't want to get everyone in trouble,
I'm going to keep on trying, little by little!"
"Idolchr_0204_A_11_00_031(0)","Ｐ","そういう時は、きっぱりと諦めたほうがいいぞ。
他の活動にも影響を与えかねないからな","When that happens, you'd better give up once and for all.
It could affect other activities."
"Idolchr_0204_A_11_00_032(0)","きらり","うう……Ｐちゃんがそう言っても、
諦めることは、どぉ～してもできないよぉ","Uu......P even if you say so,
Giving up is not an option."
"Idolchr_0204_A_11_00_033(0)","きらり","夜更かしはおしまいにするから、今チクチクしている
お洋服だけは……絶対に完成させたいの！","I'm staying up late, so I'm tingling now.
I just want to make sure that the clothes are ...... absolutely finished!"
"Idolchr_0204_A_11_00_034(0)","Ｐ","そうか。きらりの意思は伝わったぞ……。
そういうことなら、俺も手伝おう","Well, Kirari's intentions were conveyed to me. ......
In that case, I'll help you."
"Idolchr_0204_A_11_00_035(0)","きらり","えっとね～。新しいお洋服のイメージが、
きらりんの頭の中にもやもや～ってあるんだけどぉ","Let's see...what do you think of the new clothes?
I've got a maze~ in Kirarin's head..."
"Idolchr_0204_A_11_00_036(0)","きらり","それが、きらり～ん☆　ってなって、びしぃ！　っと
ハピハピになれる、なにかが見つからないにぃ～","And then, ""kirari~n*"", and then, ""bish!
I can't find anything that makes me happy~!"
"Idolchr_0204_A_11_00_037(0)","Ｐ","……つまりは、きらりの想像力が高まるような
洋服のサンプルがあれば……ってことか","...... that is, to enhance Kirari's imagination.
If you have a sample of clothing, you mean ......"
"Idolchr_0204_A_11_00_038(0)","きらり","にょっわ～！　さっすが、Ｐちゃん！　そうだよね、
いろんなお洋服を見て勉強するのがイチバンだにぃ！","Nyowa~! That's great, P-chan! I know, right?
The best way to learn is to look at a variety of clothes!"
"Idolchr_0204_A_11_00_039(0)","Ｐ","きらりがどうしても作ってみたい洋服か……。
それは俺も、ぜひ見てみたいもんだな","Is it the clothes Kirari really wants to make or .......
I'd love to see that, too."
"Idolchr_0204_A_11_00_040(0)","きらり","ぴやぁ！　ホントぉ～！？
Ｐちゃんのためにも、きらりん頑張っちゃうにぃ！","Really?
I'll do my best for P-chan, Kirarin!"
"Idolchr_0204_A_11_00_041(0)","きらり","きゃわゆくてハピハピなお洋服が作れるように、
お洋服のサンプルをおにゃーしゃー！　Ｐちゃん♪","To make cute and happy clothes,
Onyasha for the clothing samples! P-chan ♪"
"Idolchr_0204_A_11_01_001(0)","Ｐ","きらり、約束の衣装を持ってきたぞ。
これがあれば、新しい洋服の参考になるだろう","Kirari, I've got the outfit I promised you.
This would be a great reference for new clothes."
"Idolchr_0204_A_11_01_002(0)","きらり","にょわわー！　ステキなお洋服だにぃ～！
Ｐちゃん、ありがとぉー☆","Nyowawaa! Lovely clothes~!
Thanks, P-chan!"
"Idolchr_0204_A_11_01_003(0)","きらり","にゅふふっ♪　新しいお洋服を見ていると、
キュピーン☆　って、イメージが湧いてくりゅ～！","Nyuhuhu♪ Looking at your new clothes,
I can't help but get an image of ""Cupid!"
"Idolchr_0204_A_11_01_004(0)","Ｐ","役に立てたのならなによりだ。きらりなら、
きっと素敵な洋服を作れると思うぞ","I'm glad I could be of help, Kirari,
I'm sure you'll make some great clothes."
"Idolchr_0204_A_11_01_005(0)","きらり","うん♪　ハピハピなＰちゃんのスーツを、
作ってあげるからね♪","Yeah...Â HAPPY P-suit,
I'll make it for you. ♪"
"Idolchr_0204_A_11_01_006(0)","Ｐ","俺のスーツ？　杏の洋服じゃなくて？","My suit? Not apricot clothes?"
"Idolchr_0204_A_11_01_007(0)","きらり","にょわっ！！","Nyoww!"
"Idolchr_0204_A_11_01_008(0)","きらり","え～っと。ぴ、Ｐちゃんのスーツじゃなくて……！
ピーコート……！　じゃなくて～、え～っと……","Let's see...P, not P-chan's suit.........
Peacoat ......! Not - let's see - ......"
"Idolchr_0204_A_11_01_009(0)","きらり","あ～、にょわにょわ～。口がすべっちゃったぁ……。
Ｐちゃんには、秘密にしておきたかったのにぃ～","Oh, nyowa nyowa - I slipped up. ......
I wanted to keep it a secret from you, P-chan."
"Idolchr_0204_A_11_01_010(0)","Ｐ","そうだったのか。俺のスーツを……。
ありがとうな、きらり","I didn't know that...you can check out my suit at .......
Thanks, Kirari."
"Idolchr_0204_A_11_01_011(0)","きらり","ん～ん、どういたしまして☆","Mmmm, you're welcome*."
"Idolchr_0204_A_11_01_012(0)","きらり","うぇへへ♪　Ｐちゃんには、
いつも助けてもらってるからにぃ♪","Ehehehe♪ For P-chan,
You're always helping me out."
"Idolchr_0204_A_11_01_013(0)","きらり","きらりにしかできないことで、
いつかお礼がしたいなって思ってたんだぁ☆","It's something only Kirari can do,
I've been wanting to thank you someday."
"Idolchr_0204_A_11_01_014(0)","きらり","すっごくきゃわゆくって、
ハピハピなスーツを作っちゃうからにぃ！","They were so cute,
I'll make you a happy-go-lucky suit!"
"Idolchr_0204_A_11_01_015(0)","Ｐ","……それはそうと、色んな生地を用意している
みたいだけど、どんなスーツを作る気なんだ？","...... That's right, we have a lot of different fabrics.
It sounds like, what kind of suit are you going to make?"
"Idolchr_0204_A_11_01_016(0)","きらり","にゅふふ♪
それはできてからのお楽しみ～♪","â™ª
I'll let you know when it's ready...."
"Idolchr_0204_A_11_01_017(0)","きらり","よーし☆　Ｐちゃんが用意してくれた衣装を
参考にして、スーツのデザインを考えるにぃ♪","Okay☆ P-chan prepared the costume for me.
I'll use it as a reference and think about the design of my suit."
"Idolchr_0204_A_11_01_018(0)","Ｐ","（きらりお手製のスーツか……。
どんな仕上がりになるのか、楽しみだな）","(Kirari's handmade suit or .......
Can't wait to see how it turns out.)"
"Idolchr_0204_A_12_00_001(0)","","どたたたたっ！","Slap!"
"Idolchr_0204_A_12_00_002(0)","Ｐ","（廊下を勢いよく走ってくる音が聞こえてくるが……
誰だろう……？）","(Although you can hear them running briskly down the hallway: ......
(Who is this ......?)"
"Idolchr_0204_A_12_00_003(0)","きらり","Ｐちゃん、Ｐちゃん！
ようやく完成したにぃ！　はい、これっ！","P-chan, P-chan!
I finally finished it! Here it is!"
"Idolchr_0204_A_12_00_004(0)","Ｐ","これは、プレゼントボックス……？
おっ、前に言っていた手作りスーツだな","Is this a gift box ......?
Whoa, that's the handmade suit you mentioned before."
"Idolchr_0204_A_12_00_005(0)","きらり","うん♪　きらりからのお礼とー、これからも
よろしくおにゃーしゃー！　の気持ちだゆ♪","Thank you from Kirari and keep up the good work.
I'm just saying hello to you!"
"Idolchr_0204_A_12_00_006(0)","Ｐ","ああ、ありがとう。
さっそく、開けさせてもらうよ","
I'll get right on it."
"Idolchr_0204_A_12_00_007(0)","","ガサゴソ……ガサゴソ……","Gazagoso......Gazagoso......"
"Idolchr_0204_A_12_00_008(0)","Ｐ","こ、これは……！","This is ......!"
"Idolchr_0204_A_12_00_009(0)","きらり","うぇへへー♪　Ｐちゃん専用、世界でひとつの
カラフルハピハピスーツだゆ☆","Hee hee hee ♪ P-chan's exclusive, one and only in the world
Colorful Happi-Happi Suit☆"
"Idolchr_0204_A_12_00_010(0)","きらり","Ｐちゃんが用意してくれた衣装を参考にして、
縫い縫いしたんだにぃ♪　気に入ってくれたかなぁ？","Referring to the costumes prepared by P-chan,
I sewed it on... I hope you like it."
"Idolchr_0204_A_12_00_011(0)","Ｐ","そうだな、少し派手な気もするけど……","Yes, I know, it seems a bit fancy, but ......"
"Idolchr_0204_A_12_00_012(0)","選択肢","最高にハピハピな
スーツだな！","Happiest, happiest.
Suit!"
"Idolchr_0204_A_12_00_013(0)","選択肢","俺に似合うかな？","Do you think it would look good on me?"
"Idolchr_0204_A_12_00_014(0)","Ｐ","最高にハピハピなスーツだな！
着ているだけで、ハピハピが舞い込んできそうだ！","That's the happiest suit I've ever seen!
Just by wearing it, it seems to bring in the hapi-happi!"
"Idolchr_0204_A_12_00_015(0)","きらり","うぇへへ～、ありがとにぃ♪　Ｐちゃんが毎日
ハピハピになるように、きらりんも縫い縫いしたゆ！","Hee hee~, thank you... ♪ P-chan is here every day
Kirariman sewed and stitched yu to make it hapi-happi!"
"Idolchr_0204_A_12_00_016(0)","きらり","それに、Ｐちゃんがハピハピになったら、
きらりんもみんなもハピハピになれるにぃ♪","Besides, when P-chan becomes happy-go-lucky,
Kirari and everyone else can be happy-happy too!"
"Idolchr_0204_A_12_00_017(0)","Ｐ","素敵なスーツだけど、俺に似合うかな？","Nice suit, but will it look good on me?"
"Idolchr_0204_A_12_00_018(0)","きらり","もっちろん！　Ｐちゃんが着ている姿を想像して、
きらりんが縫い縫いしたんだゆ！","Of course! Imagine P-chan wearing it,
Kirarin sewed the stitches!"
"Idolchr_0204_A_12_00_019(0)","きらり","Ｐちゃんのために作った、Ｐちゃんだけの
スーツだからばっちしお似合いだよぉ♪","Made for P-chan and only for P-chan.
You look great in your suit."
"Idolchr_0204_A_12_00_020(0)","きらり","それに、サイズもぴったんこに作ったから、
Ｐちゃんにびしぃ！　っと決まるはずだゆ！","Besides, I made it exactly the right size,
P-chan should be able to decide with a snap!"
"Idolchr_0204_A_12_00_021(0)","Ｐ","確かに。いつも着ているスーツと同じ大きさだ。
サイズなんて測ってなかったのに、よく分かったな","Indeed, it is the same size as the suit I always wear.
I didn't measure you for size, but how could you tell?"
"Idolchr_0204_A_12_00_022(0)","きらり","にゅふふ、いつもＰちゃんのことを見てたから、
それくらいは簡単にわかっちゃうんだにぃー♪","Nyuhuhu, I was always watching P-chan,
It's easy to figure that out."
"Idolchr_0204_A_12_00_023(0)","きらり","あっ……ぴゃあ！　い、いつも見てたっていうのは、
そーゆー意味じゃにゃくてぇ～","Oh, ......pyaa! No, I mean that I was always watching you,
That's not what I meant~!"
"Idolchr_0204_A_12_00_024(0)","Ｐ","ありがとう、きらり。すごくうれしいよ。
世界に１着しかない、俺だけのスーツだからな！","Thank you, Kirari, that makes me very happy.
It's my own suit, the only one in the world!"
"Idolchr_0204_A_12_00_025(0)","きらり","よかったぁ♪　あのね、きらり……。
Ｐちゃんやみんなに認められて嬉しかったの","Good... You know, Kirari .......
I was happy to be recognized by P-chan and everyone else."
"Idolchr_0204_A_12_00_026(0)","きらり","きらりにしかできないこと、
きらりらしく活動していくこと……","Something only Kirari can do,
To work in a Kirari-like manner: ......"
"Idolchr_0204_A_12_00_027(0)","きらり","すっごく大事なことを、
Ｐちゃんに教えてもらったんだぁ","Something very important,
P-chan taught me that!"
"Idolchr_0204_A_12_00_028(0)","きらり","だから、きらりにしかできないことを、まずは
一番大切なＰちゃんに、やってあげたいなって♪","So, let's start with what only Kirari can do.
I wanted to do this for P-chan, the most important person in my life."
"Idolchr_0204_A_12_00_029(0)","Ｐ","そうか。このスーツには、
きらりの気持ちがいっぱい詰まってるんだな","Oh yeah, for this suit,
You're full of Kirari's feelings."
"Idolchr_0204_A_12_00_030(0)","きらり","うん♪　Ｐちゃんへいろんな気持ちを込めて、
縫い縫いしたゆ☆","Yes...Â I put all kinds of feelings for P-chan into it,
Stitched ☆"
"Idolchr_0204_A_12_00_031(0)","きらり","こうして、きらりにしかできないことに挑戦して、
きらりが一番やりたいことに、近づきたいなって☆","In this way, you challenge yourself to do what only Kirari can do,
I wanted to get closer to what Kirari wanted to do most."
"Idolchr_0204_A_12_00_032(0)","Ｐ","ああ、目標を持つことは良いことだな。
俺もきらりのやりたいことを応援するぞ","Yeah, it's good to have goals.
I'll support what Kirari wants to do, too."
"Idolchr_0204_A_12_00_033(0)","きらり","うぇへへ☆　ありがとＰちゃん♪","Hehehe* Thanks, P-chan!"
"Idolchr_0204_A_12_00_034(0)","Ｐ","ところで、一番やりたいことって何なんだ？","By the way, what do you most want to do?"
"Idolchr_0204_A_12_00_035(0)","きらり","そ、それは……！
うっきゃーっ☆　おとめのひみつだゆ！","So, that's ......!
Ukkkyo☆ Otome no Himitsu Datayu!"
"Idolchr_0204_Z_01_00_001(0)","Ｐ","（あれから、俺ときらりは互いに活動の幅を広げ、
多忙な日々を送っていた……）","(Since then, Kirari and I have expanded our activities with each other,
(......) which kept him very busy."
"Idolchr_0204_Z_01_00_002(0)","きらり","あっ、Ｐちゃん、おっつおっつ！
今、撮影が終わったところなんだぁ～♪","Oh, P-chan, whoa whoa whoa!
I just finished filming..........................."
"Idolchr_0204_Z_01_00_003(0)","Ｐ","お疲れ様、きらり。
俺も今、打ち合わせが終わったところだ","Good job, Kirari.
I just got out of a meeting myself."
"Idolchr_0204_Z_01_00_004(0)","きらり","ほんとぉ？
それじゃあ、途中まで一緒に帰ろう♪","Really?
Well then, come home with me on the way... ♪"
"Idolchr_0204_Z_01_00_005(0)","Ｐ","ああ、そうしようか","Yeah, let's do that."
"Idolchr_0204_Z_01_00_006(0)","きらり","ほんとは寄り道して帰りたいけどぉ、
今日は遅いから、また今度にしようにぃ♪","I really want to stop by and go home,
It's late today, so we'll do it another time."
"Idolchr_0204_Z_01_00_007(0)","Ｐ","そうだな。お互い明日も早いだろうからな","Yes, we both have early mornings tomorrow."
"Idolchr_0204_Z_01_00_008(0)","きらり","うん、そうするにぃ♪
にゅふふっ……♪","Yeah, I'll do that.
Nyuhuhu......♪"
"Idolchr_0204_Z_01_00_009(0)","Ｐ","……どうしたんだ。急に笑ったりして","...... what's wrong with you, suddenly you're laughing and stuff."
"Idolchr_0204_Z_01_00_010(0)","きらり","ん～ん。Ｐちゃんが、きらりんお手製の
スーツを着てくれていることがうれしくって♪","Hmmm...P-chan is making Kirari-chan's homemade
I'm so glad you're wearing a suit... ♪"
"Idolchr_0204_Z_01_00_011(0)","Ｐ","ああ、今日は大事な打ち合わせだったからな。
ここぞって時には、このスーツを着てるんだ","Yeah, I had an important meeting today.
I'm wearing this suit when I'm here."
"Idolchr_0204_Z_01_00_012(0)","きらり","うぷぷ♪
すっかりＰちゃんのトレードマークだにぃ♪","pouting
It's totally P-chan's trademark..."
"Idolchr_0204_Z_01_00_013(0)","Ｐ","ああ、『派手なスーツの有能プロデューサー』って
親しまれて、仕事も増えてきたしな","Oh, you know, 'competent producer in a fancy suit'.
They're getting more and more familiar with me, and I'm getting more and more work."
"Idolchr_0204_Z_01_00_014(0)","きらり","お仕事が増えたのは、スーツじゃなくて
Ｐちゃんがゆーしゅーだからだゆ！","More work, not more suits.
Because P-chan is yu-shu!"
"Idolchr_0204_Z_01_00_015(0)","Ｐ","でも、このスーツを着るようになってから、
ハピハピが舞い込んでくるような気がしてな","But then I started wearing this suit,
I have a feeling the Happi Happi's are about to start pouring in."
"Idolchr_0204_Z_01_00_016(0)","きらり","それはきっと、Ｐちゃんがハピハピをつかもうと、
一生懸命、お仕事を頑張ってるからだよぉ♪","That must be P-chan trying to grab Happi-Happi,
Because you're working so hard."
