"id","character","source","translatedstr"
"Idolchr_0306_A_05_00_039(0)","Ｐ","うーん、迷いどころだが……","Hmmm, I'm not sure if I'm lost. ......"
"Idolchr_0306_A_05_00_040(0)","選択肢","ガーリー系","fashion style characterized by brown hair and deep-tanned skin, expensive brand-name clothes and accessories"
"Idolchr_0306_A_05_00_041(0)","選択肢","ボーイッシュ系","boyish"
"Idolchr_0306_A_05_00_042(0)","選択肢","セクシー系","sexy"
"Idolchr_0306_A_05_00_043(0)","Ｐ","甘奈も言っていたが、
琴葉はガーリー系がいいんじゃないか？","As Amana said,
Kotoha should be girly, don't you think?"
"Idolchr_0306_A_05_00_044(0)","甘奈","だよね！
甘奈が行ったお店、ガーリー系の服もあったよ！","That's right!
The store Amana went to, they had girly clothes!"
"Idolchr_0306_A_05_00_045(0)","琴葉","ガーリー系って、ピンクとかフリルのついた
女の子らしいファッションだよね？","Girly type means pink and frilly.
It's a girly fashion, right?"
"Idolchr_0306_A_05_00_046(0)","琴葉","とってもかわいくて、憧れるなぁ♪","It's so cute and I adore it."
"Idolchr_0306_A_05_00_047(0)","Ｐ","ここは思い切って、
ボーイッシュ系にしてみるのはどうだ？","I'm going out on a limb here,
How about we go for a boyish look?"
"Idolchr_0306_A_05_00_048(0)","琴葉","えっ、ボーイッシュ系ですか？
あまり意識したことがなかったかも……","What, are you a boyish type?
I may not have been very aware of it. ......"
"Idolchr_0306_A_05_00_049(0)","琴葉","チャレンジしてみるのもいいのかな？
でも……うーん……","Is it a good idea to take up the challenge?
But ...... hmmm ......"
"Idolchr_0306_A_05_00_050(0)","翼","とことん、いろんな服を試してみるのも
いいかもですね♪","I'm sure you'll be able to try on a variety of clothes.
That might be nice... ♪"
"Idolchr_0306_A_05_00_051(0)","Ｐ","ここはやっぱり、セクシー系で！","I knew this was the place to go for the sexy type!"
"Idolchr_0306_A_05_00_052(0)","琴葉","せ、セクシー系ですか？
それはさすがにちょっと……","Is it a sexy type?
That's a bit of a stretch indeed: ......"
"Idolchr_0306_A_05_00_053(0)","Ｐ","そ、そうか……。
セクシー系も行けると思ったんだが……","Oh, yeah. .......
I thought we could go sexy too: ......"
"Idolchr_0306_A_05_00_054(0)","Ｐ","とにかく、みんなが楽しめる
買い物になってくれればと思うよ","Anyway, it's fun for everyone.
I just wish they'd shop around."
"Idolchr_0306_A_05_00_055(0)","琴葉","プロデューサー、ありがとうございます","Thank you, producer!"
"Idolchr_0306_A_05_00_056(0)","琴葉","でも、絶対に楽しいショッピングになるので、
その心配は、ご無用です♪","But it will definitely be a fun shopping experience,
Don't worry about that."
"Idolchr_0306_A_06_00_001(0)","Ｐ","（打ち合わせが終わり、琴葉と真美、
蘭子と果穂と買い出しにやって来た）","(After the meeting, Kotoha and Mami,
(I came here to go shopping with Ranko and Kaho.)"
"Idolchr_0306_A_06_00_002(0)","果穂","お買い物、どこから行きますか……っ！","Where do you shop and where do you go from here: ......?"
"Idolchr_0306_A_06_00_003(0)","蘭子","ククク……。
堕ちた翼にひと刻の安らぎを！","Kukuk. .......
A moment's peace for fallen wings!"
"Idolchr_0306_A_06_00_004(0)","蘭子ログ","（ショッピングを楽しんじゃいましょー♪）","（Let's enjoy shopping!)"
"Idolchr_0306_A_06_00_005(0)","琴葉","ふふっ、蘭子ちゃんもみんなでお出かけするの
楽しみにしてたんだ","Phew, Ranko, we are all going out together.
I was looking forward to it."
"Idolchr_0306_A_06_00_006(0)","琴葉","レッスンで顔を合わせることは多いけど、
こうしてお出かけする機会ってあまりないもんね","We often see each other at lessons, though,
We don't get many opportunities to go out like this."
"Idolchr_0306_A_06_00_007(0)","真美","んっふっふ～。兄ちゃんってば太っ腹だね！
今日はなーんでも欲しいもの買ってくれるんでしょ？","You're so generous, brother!
You'll buy me whatever I want today, right?"
"Idolchr_0306_A_06_00_008(0)","Ｐ","そんなわけないだろう。事務所に必要な物の
買い出しだから、無駄な物は買わないからな","No way...of what I need for my office.
I'm a shopper. I don't buy useless stuff."
"Idolchr_0306_A_06_00_009(0)","Ｐ","それと、真美。
ひとりで勝手に行動しないようにな","And Mami.
Don't go off on your own."
"Idolchr_0306_A_06_00_010(0)","真美","もう、兄ちゃんってば、こういう時だけ
ヒイキにされると、真美困っちゃうよ～","Oh, brother, only at times like this.
Mami will be in trouble if you make me a hero!"
"Idolchr_0306_A_06_00_011(0)","琴葉","真美ちゃん……。
『贔屓』の使い方、間違ってるよ","Mami. .......
You're using 'favoritism' all wrong."
"Idolchr_0306_A_06_00_012(0)","Ｐ","琴葉、くれぐれも真美を頼む……ん？
携帯が鳴っているな。仕事の連絡か……","Kotoha, please take care of Mami for me. ...... hmm?
Your cell phone is ringing...is it a work call? ......"
"Idolchr_0306_A_06_00_013(0)","琴葉","私たちはここで待っています","We are waiting for you here."
"Idolchr_0306_A_06_00_014(0)","Ｐ","ああ、ありがとう","Oh, thank you."
"Idolchr_0306_A_06_00_015(0)","","ピッ","ping"
"Idolchr_0306_A_06_00_016(0)","Ｐ","はい、もしもし？
……ええ、お久しぶりです","Yes, hello?
...... yeah, it's been a while!"
"Idolchr_0306_A_06_00_017(0)","真美","……兄ちゃん行っちゃったね。
んっふっふ～、今がチャーンス！","I see you've gone to ...... brother.
Hmmm...now is a good time!"
"Idolchr_0306_A_06_00_018(0)","真美","兄ちゃんがいぬ間にお菓子のモーレツ爆買いだー！
欲しいものを片っ端から買っていこー！","While my brother is away, I'm going to buy moret bomb of sweets!
I'll buy everything I want from one end to the other!"
"Idolchr_0306_A_06_00_019(0)","琴葉","だ、ダメだよ、真美ちゃん。
勝手に行動したら……","No, no, Mami.
If you act on your own ......"
"Idolchr_0306_A_06_00_020(0)","真美","ふっ……今の真美を止めるのは、
たとえヤキニクマンでも無理だかんね！","Phew ...... what's stopping Mami now,
Even a yakiniku man can't do it!"
"Idolchr_0306_A_06_00_021(0)","果穂","でも……せっかくみなさんと一緒に来たので
全員でお買い物がしたいです……！","But ...... since I'm here with all of you.
We all want to shop at ......!"
"Idolchr_0306_A_06_00_022(0)","琴葉","真美ちゃん、果穂ちゃんの言う通りだよ。
プロデューサーもすぐに戻ってくるだろうし……","Mami, Kaho is right.
Producers will be back soon. ......"
"Idolchr_0306_A_06_00_023(0)","真美","えーっ！？　でもでも、
今なら欲しいものがなーんでも手に入るんだよ？","Eh! But,
You can get whatever you want now, right?"
"Idolchr_0306_A_06_00_024(0)","蘭子","な、なんというロキの狡猾さよ！","Hey, what a cunning of Loki!"
"Idolchr_0306_A_06_00_025(0)","蘭子ログ","（そ、そんなのダメですよ～！）","(Oh, no, you can't do that~!)"
"Idolchr_0306_A_06_00_026(0)","琴葉","真美ちゃん。
そうやってそそのかしちゃダメだよ","Mami.
Don't intrigue me like that."
"Idolchr_0306_A_06_00_027(0)","琴葉","お財布はプロデューサーが持っているんだから、
爆買いなんてできないし","The producer has the wallet,
I can't afford to buy a bomb."
"Idolchr_0306_A_06_00_028(0)","琴葉","プロデューサーからも、勝手に動いたら
ダメって言われてるよね？","If you move on your own, even from a producer.
They said no, right?"
"Idolchr_0306_A_06_00_029(0)","真美","え～？　ちょっとくらいいいじゃんかー。
琴葉お姉ちゃんはマジメすぎるんだよ～","Eh~? It's okay for a little bit, isn't it?
Kotoha-sis is too serious~!"
"Idolchr_0306_A_06_00_030(0)","真美","こういう時に、日々のふらふられーしょんを
ババっと発散しなくっちゃ！","At times like this, the daily fluffiness of the
I have to vent!"
"Idolchr_0306_A_06_00_031(0)","琴葉","ふらふられーしょん……。
フラストレーションのこと？","FluffyReason. .......
Frustration?"
"Idolchr_0306_A_06_00_032(0)","琴葉","もしかして真美ちゃん、疲れてるのかな……？","Maybe Mami is tired ......?"
"Idolchr_0306_A_06_00_033(0)","Ｐ","ふぅ……みんな、待たせてゴメン！","Whew ...... sorry for the wait guys!"
"Idolchr_0306_A_06_00_034(0)","真美","ねぇねぇ、兄ちゃん！
兄ちゃんも日頃のうっふ～んがたまってるっしょ？　","Hey, hey, brother!
I'm sure you have a lot of daily frustrations, don't you, brother?"
"Idolchr_0306_A_06_00_035(0)","真美","パーッとお菓子を爆買いして、
みんなでぱーちーしようよ～","Buy a bomb of candy,
Let's all go party!"
"Idolchr_0306_A_06_00_036(0)","Ｐ","うっふんって……。
鬱憤って言いたいのか？","Ummm... .......
You want to call it exasperation?"
"Idolchr_0306_A_06_00_037(0)","Ｐ","疲れてはいるけど、今は買い出しが先だ。
ほら、行くぞ","I'm tired, but right now I have to buy something first.
Here we go."
"Idolchr_0306_A_06_00_038(0)","琴葉","……あ、あの、プロデューサー。
先にどこかで休憩して行きませんか？","...... Oh, um, producer.
Why don't you go ahead and take a break somewhere?"
"Idolchr_0306_A_06_00_039(0)","琴葉","プロデューサーもお疲れみたいですし、
私も打ち合わせで疲れているので！","And the producer seems to be tired,
I'm tired from the meeting too!"
"Idolchr_0306_A_06_00_040(0)","Ｐ","休憩か……","Break or ......"
"Idolchr_0306_A_06_00_041(0)","選択肢","それもそうだな","That's true, too."
"Idolchr_0306_A_06_00_042(0)","選択肢","先に買い物だ","I'm going shopping first."
"Idolchr_0306_A_06_00_043(0)","Ｐ","それもそうだな、疲れを溜めるのもよくないし……。
琴葉、アドバイスありがとう","That's true, and it's not good to be tired. ......
Kotoha, thanks for the advice."
"Idolchr_0306_A_06_00_044(0)","琴葉","い、いえ。
真美ちゃんを見ていたら気づいただけで……","No, no.
I just noticed it when I was looking at Mami: ......"
"Idolchr_0306_A_06_00_057(0)","Ｐ","ああ、真美がお菓子を買おうとしていたのは
そういう理由だったのか……","Oh, Mami was trying to buy candy.
That was the reason. ......"
"Idolchr_0306_A_06_00_045(0)","琴葉","それにプロデューサーも、働き詰めですよね？","And producers work hard, don't they?"
"Idolchr_0306_A_06_00_046(0)","琴葉","プロデューサーになにかあったら、
大変ですから……","If something happens to the producer,
It's hard work. ......"
"Idolchr_0306_A_06_00_047(0)","Ｐ","いや、先に買い物を済ませよう","No, let's finish our shopping first."
"Idolchr_0306_A_06_00_048(0)","琴葉","でも、疲れを溜め込むのは良くないですし、
１度休んだ方がいいと思います","But it's not good to be tired,
I think you should take a break once."
"Idolchr_0306_A_06_00_049(0)","Ｐ","うーん……まあ、そうだな。
じゃあ、ちょっと休憩していくか","Hmmm ...... Well, yes.
Well, let's take a break."
"Idolchr_0306_A_06_00_050(0)","Ｐ","よし、フードコートに寄っていこう","Okay, let's stop by the food court."
"Idolchr_0306_A_06_00_051(0)","果穂","わーい！
ありがとうございます、プロデューサーさんっ！","Wow!
Thank you, producer!"
"Idolchr_0306_A_06_00_052(0)","蘭子","同胞たちよ！　魔力を分かち合おう！","Brethren, let us share our magic!"
"Idolchr_0306_A_06_00_053(0)","蘭子ログ","（みんなでシェアして食べましょう～♪）","(Let's share the food together~♪)"
"Idolchr_0306_A_06_00_054(0)","真美","琴葉お姉ちゃん、ナイス！
兄ちゃんの財布を空にするまで食べるぞ～！","Kotoha sis, nice!
I'm going to eat until I empty my brother's wallet!"
"Idolchr_0306_A_06_00_055(0)","Ｐ","ほどほどにしてくれ。
買い出しもあるんだからな","Moderation.
There's some shopping to be done."
"Idolchr_0306_A_06_00_056(0)","琴葉","ふふっ、それじゃあみんなで、
あっちのテーブルに行きましょう","Phew, then, everyone,
Let's go to that table over there."
"Idolchr_0306_A_07_00_001(0)","美希・杏","むにゃむにゃ……すぅ……","Mnya mnya ...... soo ......"
"Idolchr_0306_A_07_00_002(0)","美希・杏","んー……すぅ……すぅ……","Mmm ...... soooooooooooooooooooooooooooooooooooooooooooooooooooooooooooooooooooooooooooo ......"
"Idolchr_0306_A_07_00_003(0)","琴葉","あの……美希ちゃーん、杏ちゃーん。
そろそろ用意しないと、レッスンに遅れちゃうよ？","That ...... Miki, Anzu.
If you don't get ready soon, you'll be late for your lesson."
"Idolchr_0306_A_07_00_004(0)","美希・杏","すぅ……すぅ……","Soo ...... Soo ......"
"Idolchr_0306_A_07_00_005(0)","美希・杏","すぅ……すぅ……","Soo ...... Soo ......"
"Idolchr_0306_A_07_00_006(0)","琴葉","うーん……起きる気配がしない……。
でも、このまま放っておくわけにもいかないし……","Hmmm ...... no sign of ...... waking up.
But I can't just leave it at that. ......"
"Idolchr_0306_A_07_00_007(0)","琴葉","美希ちゃーん、杏ちゃーん？","Miki, Anzu?"
"Idolchr_0306_A_07_00_008(0)","美希","あふぅ……ミキ、もう食べられないの……。
琴葉が食べていいよ……","Ahu...... Miki, I can't eat anymore.......
Kotoha can eat it: ......"
"Idolchr_0306_A_07_00_009(0)","杏","むにゃ……夢の中で、レッスンしてるから……","Munyi...... in your dreams, because I'm giving you a lesson......"
"Idolchr_0306_A_07_00_010(0)","琴葉","……ちっとも起きそうにない。
無理にでも起こした方がいいのかな……","...... doesn't look like it's going to happen anytime soon.
Should I force myself to wake him up? ......"
"Idolchr_0306_A_07_00_011(0)","琴葉","でも、ふたりともいつも忙しそうだし……。
休ませてあげた方がいいのかも……","But they both seem to be busy all the time. ......
Maybe we should give it a rest: ......"
"Idolchr_0306_A_07_00_012(0)","琴葉","適度な息抜きは大事って聞くけど、
どこまでが息抜きになるんだろう？　うーん……","I hear it's important to take a proper break,
How much of this is a breather? Hmmm ......"
"Idolchr_0306_A_07_00_013(0)","","ガチャッ","(with a) slamming noise (door, telephone receiver)"
"Idolchr_0306_A_07_00_014(0)","Ｐ","あれ？　琴葉……？　今日はみんなと一緒に
レッスンをする日じゃなかったか？","Huh? Kotoha ......? I'll be with you guys today.
Wasn't it the day to give lessons?"
"Idolchr_0306_A_07_00_015(0)","琴葉","あ、プロデューサー。そうなんですけど、
美希ちゃんと杏ちゃんがなかなか起きてくれなくて","Oh, producer, yes,
Miki and Anzu had a hard time getting up."
"Idolchr_0306_A_07_00_016(0)","Ｐ","姿が見えないと思ってたら、
こんなところで寝ていたのか……","If you thought you couldn't see him,
You've been sleeping here: ......"
"Idolchr_0306_A_07_00_017(0)","琴葉","レッスン時間も迫ってますし、
どうやって美希ちゃんたちを起こせばいいですか？","It's almost time for the lesson,
How do I wake up Miki and the others?"
"Idolchr_0306_A_07_00_018(0)","Ｐ","こういう時は、ちょっと強引な方法が
よさそうだな。それなら……","In these situations, a slightly more aggressive approach is
Sounds good, then ......"
"Idolchr_0306_A_07_00_019(0)","選択肢","アラーム音を鳴らす","Sounds an alarm"
"Idolchr_0306_A_07_00_020(0)","選択肢","体を激しくゆする","shake violently"
"Idolchr_0306_A_07_00_021(0)","選択肢","食べ物で釣る","attract fish with food"
"Idolchr_0306_A_07_00_022(0)","選択肢","歌って起こす","wake someone by singing to them"
"Idolchr_0306_A_07_00_023(0)","Ｐ","美希たちは、ただでは起きないだろう。
アラーム音を鳴らして、無理やりにでも起こすぞ！","Miki and the others would not just wake up.
I'm going to sound the alarm and force you to wake up!"
"Idolchr_0306_A_07_00_024(0)","","ピピピピピ！","Bipipipi!"
"Idolchr_0306_A_07_00_025(0)","美希","わあ！？
び、びっくりしたの……","Wow!
I was surprised. ......"
"Idolchr_0306_A_07_00_026(0)","杏","ふわぁ～……。目は覚めたけど……、
普通に声をかけて起こしてくれてもよくない？","Wow. ....... I woke up but ......,
Couldn't you just call out to them and wake them up like normal?"
"Idolchr_0306_A_07_00_027(0)","Ｐ","琴葉が起こそうとしたのに、どうしても
起きなかったそうじゃないか。まったく……","Kotoha tried to wake me up, but I just couldn't help myself.
I heard you didn't wake up at all: ......"
"Idolchr_0306_A_07_00_028(0)","琴葉","私がやっても全然ダメだったのに、
こんなにすぐに起こせるなんて……","I did it and it didn't work at all,
I can't believe it happened so quickly: ......"
"Idolchr_0306_A_07_00_029(0)","琴葉","さすがプロデューサーです♪","That's what I'm talking about...a producer..."
"Idolchr_0306_A_07_00_030(0)","Ｐ","おーい、美希！　杏！
レッスンに遅刻するぞー！　起きて支度するんだ！","Hey, Miki! Anzu!
You're going to be late for your lesson! Get up and get ready!"
"Idolchr_0306_A_07_00_031(0)","美希","プロデューサーが代わりに支度して……。
ミキ、お昼寝中だから……","Producers can get ready on your behalf at .......
Miki, I'm taking a nap: ......"
"Idolchr_0306_A_07_00_032(0)","Ｐ","ダメだ！　ほら、杏も！
いい加減に起きろー！","No! No! Look, Anzu, too!
Wake up for goodness sake!"
"Idolchr_0306_A_07_00_033(0)","杏","ふわぁ……。なに、プロデューサー……。
もっと優しく起こしてよ……","Wow. ....... What, producer .......
Wake me up more gently: ......"
"Idolchr_0306_A_07_00_034(0)","琴葉","ちょっと強引ですけど……。
なんとかふたりとも、起きてくれたみたいですね！","It's a bit forced, but you can find it at .......
It seems that both of them managed to wake up!"
"Idolchr_0306_A_07_00_035(0)","Ｐ","ほら、美希、杏。
特大おにぎりと新作の飴だぞ～？","Look, Miki, Anzu.
It's an oversized rice ball and a new candy bar~?"
"Idolchr_0306_A_07_00_036(0)","美希","えっ、特大おにぎり！？","What? Oversized rice balls!"
"Idolchr_0306_A_07_00_037(0)","杏","新しい飴！？","New candy!"
"Idolchr_0306_A_07_00_038(0)","琴葉","す、すごい……！
ふたりがあっという間に起きて……","Wow, that's great. ......!
The two happened so quickly ......"
"Idolchr_0306_A_07_00_039(0)","美希","……って、どこにもないの","I can't find ...... anywhere."
"Idolchr_0306_A_07_00_040(0)","杏","プロデューサー。杏たちを騙したね","Producer, you cheated us."
"Idolchr_0306_A_07_00_041(0)","Ｐ","う……い、いや。騙してないぞ。
レッスンが終わったら、ちゃんとあげるよ","U...... no. I'm not deceiving you.
I'll make sure I give it to you when the lesson is over."
"Idolchr_0306_A_07_00_042(0)","Ｐ","ただじゃ起きないだろうから、
歌でも歌って起こすか。ら～らら～♪","Because it won't happen for free,
I'll wake you up with a song."
"Idolchr_0306_A_07_00_043(0)","美希","むにゃ……すぅ、すぅ……","Munyi ...... Soooo, soooo ......"
"Idolchr_0306_A_07_00_044(0)","杏","むにゃ……すぅ、すぅ……","Munyi ...... Soooo, soooo ......"
"Idolchr_0306_A_07_00_045(0)","琴葉","プ、プロデューサー！
ダメです、完全に寝入ってしまいました！","P, producer!
No good, I fell asleep completely!"
"Idolchr_0306_A_07_00_046(0)","Ｐ","うっ……子守唄になってしまったか。
こうなったら……美希！　杏！　起きてくれ～！","Ugh ...... has become a lullaby?
If this happens, ...... Miki! Anzu, wake up~!"
"Idolchr_0306_A_07_00_047(0)","美希","あふぅ……。
あ、プロデューサーなの……","Ahu. .......
Oh, I'm a producer. ......"
"Idolchr_0306_A_07_00_048(0)","杏","ふわぁ～。ゆっくり寝させてよ……","Whew... let me get some sleep. ......"
"Idolchr_0306_A_07_00_049(0)","Ｐ","ほら、ふたりとも。起きた起きた！","Look, they're both awake!"
"Idolchr_0306_A_07_00_050(0)","Ｐ","そうこうしている間に、時間が……。
みんなでレッスンに行くぞ！","In the meantime, the time has come to .......
We're all going to take lessons!"
"Idolchr_0306_A_07_00_051(0)","美希","……レッスン？
ミキ、もうちょっと寝たいから、また今度じゃダメ？","...... lessons?
Miki, I need to get some more sleep, can't we do this another time?"
"Idolchr_0306_A_07_00_052(0)","杏","杏ももうひと眠りしたい……ふわぁ……。
ということで、おやすみなさい……","Anzu want to have another sleep ...... wow .......
So, good night ......"
"Idolchr_0306_A_07_00_053(0)","Ｐ","昼寝はレッスンが終わったら、
いくらでもしていいから。ほら、行くぞ！","Naps are taken after lessons,
Come on, let's go!"
"Idolchr_0306_A_07_00_054(0)","琴葉","よろしくお願いします！","Best regards!"
"Idolchr_0306_A_07_00_055(0)","美希","お願いしますなの～","Please, please, please..."
"Idolchr_0306_A_07_00_056(0)","杏","よろしくお願いしまーす","I look forward to working with you!"
"Idolchr_0306_A_07_00_057(0)","琴葉","美希ちゃんたち、すごく眠そう。
ちゃんとレッスンできるのかな？","Miki and her friends look so sleepy.
Will I be able to give lessons properly?"
"Idolchr_0306_A_07_00_058(0)","Ｐ","美希、杏。しゃんとするんだ","Miki, Anzu, get your act together."
"Idolchr_0306_A_07_00_060(0)","杏","はーい","Yes, sir."
"Idolchr_0306_A_07_00_059(0)","美希・杏","はーい","Yes, sir."
"Idolchr_0306_A_07_00_061(0)","トレーナー","それじゃあ、さっそく始めるわよ。
ワン、ツー、スリー、フォー……！","Well then, let's get started.
One, Two, Three, Four. ......"
"Idolchr_0306_A_07_00_062(0)","美希","ファイブ、シックス、セブン……。
ターンをして、キメポーズなの！","Five, Six, Seven. .......
I do a turn and strike a pose!"
"Idolchr_0306_A_07_00_063(0)","杏","ファイブ、シックス、セブン……。
ターンをして、キメ！","Five, Six, Seven. .......
Turn and kime!"
"Idolchr_0306_A_07_00_064(0)","琴葉","すごい……。新しい振り付けを、
もう完璧に踊りこなしてる……","Awesome ....... new choreography,
I'm already dancing perfectly ......"
"Idolchr_0306_A_07_00_065(0)","トレーナー","田中さん、どうしたの？","Mr. Tanaka, what's wrong?"
"Idolchr_0306_A_07_00_066(0)","琴葉","あっ、はい！　すみません！
もう１回、お願いします！","Oh, yes! Sorry!
One more time, please!"
"Idolchr_0306_A_07_00_067(0)","トレーナー","いい感じに仕上がってきているわよ。
それじゃあ、今日のレッスンはここまで！","It's coming along nicely.
Well, that's it for today's lesson!"
"Idolchr_0306_A_07_00_068(0)","美希","はーい、お疲れさまでしたなの♪","Yes, thank you very much for your hard work."
"Idolchr_0306_A_07_00_069(0)","杏","お疲れさまでーす","thank you for your hard work"
"Idolchr_0306_A_07_00_070(0)","琴葉","……ありがとうございました。
お疲れさまです","Thank you for .......
thank you for your hard work"
"Idolchr_0306_A_07_00_071(0)","Ｐ","琴葉……？
元気がないけど、どうした？","Kotoha ......?
I don't feel well. What's wrong?"
"Idolchr_0306_A_07_00_072(0)","琴葉","い、いえ、そんなことありません……","No, no, not at all. ......"
"Idolchr_0306_A_07_00_073(0)","琴葉","ただ……美希ちゃんたち、
ちゃんとレッスンできるかなって心配してたのに……","Just ...... Miki and her friends,
I was worried that I wouldn't be able to do the lesson properly. ......"
"Idolchr_0306_A_07_00_074(0)","琴葉","ふたりとも、私よりもずっとすごくて。
自分の実力を客観的に考えていました","They were both much more amazing than I was.
I was objective about my abilities."
"Idolchr_0306_A_07_00_075(0)","Ｐ","なるほどな。
それで、どうだった？","I see.
So, how did it go?"
"Idolchr_0306_A_07_00_076(0)","琴葉","……素直に言って、劣等感を抱きました","...... honestly made me feel inferior!"
"Idolchr_0306_A_07_00_077(0)","Ｐ","普段の美希たちを見ていたら、
そう思ってしまうのも仕方がないだろう","I would have seen Miki and the others in their normal lives,
You'd be forgiven for thinking so."
"Idolchr_0306_A_07_00_078(0)","Ｐ","だけど十人十色という言葉があるように、
様々なアイドルがいる","But as the saying goes, there are ten different people,
Various idols."
