"id","character","source","translatedstr"
"Idolchr_0101_A_07_00_007(0)","春香","それに、ずっと昔のことみたいに言ってますけど、
そんなに昔じゃないですからね","And you say that like it was a long time ago,
It wasn't that long ago."
"Idolchr_0101_A_07_00_008(0)","春香","あの頃、私は緊張してばっかりで余裕もなくて……","Back then, I was so nervous all the time, I didn't have time to spare. ......"
"Idolchr_0101_A_07_00_009(0)","春香","あ、でも、プロデューサーさんが
見守っててくれたのは覚えてます","Ah, but the producer.
I remember you watching over me."
"Idolchr_0101_A_07_00_010(0)","Ｐ","ありがとな。
でも、実は俺だって緊張していたんだぞ","Thanks.
But you know what? Actually, I was nervous too."
"Idolchr_0101_A_07_00_011(0)","春香","ええっ、本当ですか？","Eh, really?"
"Idolchr_0101_A_07_00_039(0)","Ｐ","ああ。みんなが無事仕事をやり終えるまで、
いつだって緊張しっぱなしだよ","Yeah, until everyone else finishes the job,
I'm always nervous."
"Idolchr_0101_A_07_00_012(0)","春香","……初めて知りました。
あの、どうして今まで教えてくれなかったんですか？","I learned about it for the first time at .......
Um, why didn't you tell me before?"
"Idolchr_0101_A_07_00_013(0)","Ｐ","ん？　ああ、別に秘密にしていたわけじゃないけど、
自分からは言い出しにくくてな。それに……","Hmm? Oh, it's not that I've been keeping it a secret,
It's hard for me to bring myself to say it, plus I'm on ......"
"Idolchr_0101_A_07_00_014(0)","選択肢","プロデューサー
だから","producer
therefore"
"Idolchr_0101_A_07_00_015(0)","選択肢","バレると
恥ずかしいから","When they find out...
Because I'm embarrassed."
"Idolchr_0101_A_07_00_016(0)","選択肢","社長に
怒られるから","To the Manager.
Because I'll be pissed."
"Idolchr_0101_A_07_00_017(0)","Ｐ","俺がプロデューサーだから、かな。
俺まで緊張してるところ、見せられないだろ？","Because I'm the producer, I guess.
I can't show you how nervous I am either, can I?"
"Idolchr_0101_A_07_00_018(0)","春香","プロデューサーさんだから……。
なるほど……私たちのため、だったんですね","Because he's a producer, he can be found at .......
I see... ...... was for us, wasn't it?"
"Idolchr_0101_A_07_00_019(0)","Ｐ","春香に緊張してたのがバレてなかったってことは、
うまく隠せてたってことなのかな","The fact that Haruka didn't know I was nervous,
I guess that means it was well hidden."
"Idolchr_0101_A_07_00_020(0)","春香","ふふ、そうですね。あんまり上手に
隠してたから、すっかり騙されちゃいました","Hmmm, yes, not too well.
I was totally fooled because I hid it from you."
"Idolchr_0101_A_07_00_021(0)","春香","でも……私、プロデューサーさんに会えて、一緒に
お仕事できて、本当に幸せだなって思いましたよ","But ...... me, I met the producer and together
I felt really happy to be able to work with you."
"Idolchr_0101_A_07_00_040(0)","Ｐ","ありがとう、春香……","Thanks, Haruka: ......"
"Idolchr_0101_A_07_00_022(0)","Ｐ","恥ずかしいだろ、緊張してるのがバレたら","It would be embarrassing, if they knew you were nervous."
"Idolchr_0101_A_07_00_023(0)","春香","ふふっ。プロデューサーさんって、
意外とかわいいところがあるんですね","Hmmm...producers, huh?
You have a surprisingly cute side."
"Idolchr_0101_A_07_00_024(0)","春香","でも私だって恥ずかしかったのに、
自分だけうまく隠せてズルいです！","But even I was embarrassed,
It's cheating to hide yourself so well!"
"Idolchr_0101_A_07_00_025(0)","Ｐ","そわそわしてたら社長に
しゃんとするようにと怒られそうで……","I was fidgeting, and then I got the president.
I'm going to be pissed off at you for being so obnoxious. ......"
"Idolchr_0101_A_07_00_026(0)","春香","そういう理由だったんですね","So that was the reason."
"Idolchr_0101_A_07_00_027(0)","春香","でも、緊張してそわそわしてるプロデューサーさん、
想像できないので、ちょっと見てみたい気もします","But you are a nervous and fidgety producer,
I can't imagine it, so I'd kind of like to see it."
"Idolchr_0101_A_07_00_028(0)","Ｐ","でも、今でも緊張はしているよ。
それはこれからも変わらないと思う……","But I'm still nervous.
I don't think that will change in the future: ......"
"Idolchr_0101_A_07_00_029(0)","Ｐ","でもプロデューサーがそんなんじゃ、
アイドルたちが不安になるからな","But if the producer is like that,
It makes the idols anxious."
"Idolchr_0101_A_07_00_030(0)","春香","確かに、プロデューサーさんがそわそわしてたら、
もっと緊張しちゃってたかもしれませんね","Sure, if the producer is fidgety,
I might have been more nervous."
"Idolchr_0101_A_07_00_031(0)","春香","今だってそう……。新しいことに挑戦する時、
プロデューサーさんが見守ってくれるから……","Even now, so ......, it's time to try something new,
The producer will be watching over you. ......"
"Idolchr_0101_A_07_00_032(0)","春香","落ち着いて見ていてくれるから、
私たち、安心してパフォーマンスできます","Because they are calm and watchful,
We can perform with confidence."
"Idolchr_0101_A_07_00_033(0)","Ｐ","春香がそう言ってくれるなら、
俺も、落ち着いて振る舞った甲斐があるよ","If only Haruka would say so,
It's worth it for me, too, to act so calm."
"Idolchr_0101_A_07_00_034(0)","春香","ふふ。私もプロデューサーさんを
見習わなくちゃいけないですよね！","Hmmm...I'll take the producer too.
We have to learn from them!"
"Idolchr_0101_A_07_00_035(0)","春香","先輩として、ルミナスのみんなのことをもっと
見てあげたいし、私も堂々としてなくっちゃ","As a senior, I'm more interested in everyone at Luminous.
I want to see them and I have to be magnificent."
"Idolchr_0101_A_07_00_036(0)","Ｐ","（開始の合図が響いて、ステージの幕が上がる。
ステージを見る春香は慈しむような表情だ）","(The stage curtain rises as the signal to begin rings out.
(Haruka looks at the stage with a benevolent expression)"
"Idolchr_0101_A_07_00_037(0)","春香","みんな、ステージを楽しんでね……","Enjoy the stage, everyone. ......"
"Idolchr_0101_A_07_00_038(0)","Ｐ","(いつの間にか、
すっかり先輩らしくなってたんだな……）","(When,
(You were totally becoming a senior. ......)"
"Idolchr_0101_A_08_00_001(0)","Ｐ","（レッスンの準備状況を見に来たけれど……）","(I came to see how the lesson was being prepared, but ......)"
"Idolchr_0101_A_08_00_002(0)","春香","お疲れさまです、プロデューサーさん……","Thanks for your help, producer: ......"
"Idolchr_0101_A_08_00_003(0)","Ｐ","お疲れ様、春香。随分早いな？
レッスン開始までまだ時間があるぞ","Good work, Haruka, you're up early, aren't you?
There's still time before the lesson starts."
"Idolchr_0101_A_08_00_004(0)","春香","はい……。
実はちょっと悩んでることがあって……","Yes. .......
I'm actually having a bit of trouble with this: ......"
"Idolchr_0101_A_08_00_005(0)","春香","プロデューサーさんに相談したいなって思って、
みんなより、一足先に来たんです","I wanted to talk to the producer about it,
I got here one step ahead of everyone else."
"Idolchr_0101_A_08_00_006(0)","Ｐ","そうだったのか。
それで、悩みって何なんだ？","I didn't know that.
So, what's the trouble?"
"Idolchr_0101_A_08_00_007(0)","春香","ん～、なんだかこう……。
レッスンがしっくりこないというか……","Hmm, it's kind of like this: .......
It's not like the lesson doesn't feel right. ......"
"Idolchr_0101_A_08_00_008(0)","春香","決してみんなが手を抜いてるとかじゃないんです！
もちろん私も、全力でやってます！","It's not that everyone is out of touch or anything!
Of course, I, too, am doing everything I can!"
"Idolchr_0101_A_08_00_009(0)","春香","次のステージに向けて、形にはなってきてるし、
気にしすぎなのかもしれませんけど……","We are getting into shape for the next stage,
Maybe I care too much, but ......"
"Idolchr_0101_A_08_00_010(0)","春香","……ステージの日が近付いてるのに、
まだ手応えを掴めてない気がするんです","Even though the ...... stage date is coming up,
I don't feel like I've gotten a good response yet."
"Idolchr_0101_A_08_00_011(0)","Ｐ","なるほどなぁ……","I see what you mean. ......"
"Idolchr_0101_A_08_00_012(0)","Ｐ","いろんな事務所のアイドルが集まってるから、
かみ合わないこともあるだろうな","It's a collection of idols from various offices,
I'm sure there will be times when they won't engage."
"Idolchr_0101_A_08_00_013(0)","春香","そうかもしれません。それぞれの個性で動くから、
バラバラになってしまう気がします……","Maybe so, because each works with its own personality,
I feel like it's falling apart. ......"
"Idolchr_0101_A_08_00_014(0)","春香","プロデューサーさん、今のルミナスのために、
私にできることって……何でしょうか？","Producers, now for Luminous,
What can I do to help ......?"
"Idolchr_0101_A_08_00_015(0)","Ｐ","春香ができることか……","Is it something Haruka can do? ......"
"Idolchr_0101_A_08_00_016(0)","選択肢","今のままでいい","I'm fine the way I am."
"Idolchr_0101_A_08_00_017(0)","選択肢","何もない","Nothing."
"Idolchr_0101_A_08_00_018(0)","Ｐ","春香は今のままでいい。
今まで通りみんなを支えてやってくれ","Haruka is fine as it is.
Keep supporting everyone as you always have."
"Idolchr_0101_A_08_00_019(0)","春香","今のまま……。
確かに、私……焦りすぎている気もしていて……","As it is now, .......
Indeed, I ...... feel like I'm being too hasty and ......"
"Idolchr_0101_A_08_00_020(0)","春香","だから、プロデューサーさんが、今まで通りで
いいって言ってくれて、私、安心しました！","So, the producer is still the same.
I was relieved when he said it was okay!"
"Idolchr_0101_A_08_00_021(0)","Ｐ","でもみんなを見ている春香だからこそ、
バラバラだって気づけたんだと思うぞ","But it's because Haruka is watching everyone,
I think they're realizing it's all falling apart."
"Idolchr_0101_A_08_00_022(0)","春香","ありがとうございます。私……みんなを見ていると、
ルミナスは、もっともっと輝けるって思うんです！","Thank you, I ...... looking at you everyone,
I think Luminous can shine even brighter!"
"Idolchr_0101_A_08_00_023(0)","春香","そのために私ができることがあるなら、
どんなことでも頑張りたいって……","If there is anything I can do for that,
She wants to do her best in whatever he does. ......"
"Idolchr_0101_A_08_00_024(0)","春香","だから、教えてください、プロデューサーさん！
どうしたらもっと良くなりますか？","So tell me, producer!
How can I make it better?"
"Idolchr_0101_A_08_00_025(0)","Ｐ","春香の気持ちはすごく伝わってきたよ。
俺が言いたいことは……","I could really feel Haruka's feelings.
What I'm trying to say is: ......"
"Idolchr_0101_A_08_00_026(0)","Ｐ","いや、何もないよ","No, nothing."
"Idolchr_0101_A_08_00_027(0)","春香","うっ……そんな……
私じゃまだ力不足ってことですか？","Ugh ...... such ......
Are you saying that I am not strong enough?"
"Idolchr_0101_A_08_00_028(0)","春香","プロデューサーさんに頼ってもらえてるって
思ってたのに……やっぱり頼りないんですね","I'm glad to know that my producer is relying on me.
I was thinking ...... you're still unreliable."
"Idolchr_0101_A_08_00_029(0)","Ｐ","ああ、いや、そういう意味じゃないんだ！
言葉足らずだったな、ごめん。俺が言いたいのは……","Oh, no, that's not what I meant!
I didn't word it right, sorry, I meant ......"
"Idolchr_0101_A_08_00_030(0)","Ｐ","無理に全員をひとつに合わせようとしなくて
いいんじゃないか、って事だよ","You don't have to try to force everyone to fit into one place.
I mean, that's fine."
"Idolchr_0101_A_08_00_031(0)","春香","合わせようとしないってことは、
バラバラのままでいいってことですか……？","That they don't try to match,
Are you saying you want it to stay in pieces ......?"
"Idolchr_0101_A_08_00_032(0)","Ｐ","いや。ただ、一度、動きたいように動いてみるって
いうのも、ひとつのやり方だと思うんだ","No, just that once I get going, I'm going to try to move the way I want to move.
I think that's one way to do it."
"Idolchr_0101_A_08_00_033(0)","Ｐ","まずはみんなの個性を活かしつつ、徐々に
全体のバランスを見ていくのはどうだろう？","First, we will gradually work to make the most of everyone's individuality.
How about looking at the overall balance?"
"Idolchr_0101_A_08_00_034(0)","春香","なるほど……わかりました！
今日はその考え方で進めてみます！","I see. ...... I understand!
I will try to proceed with that idea today!"
"Idolchr_0101_A_08_00_035(0)","春香","プロデューサーさんがいなかったら、
思いつきませんでした。ありがとうございます！","If it weren't for the producer,
I hadn't thought of that, thank you!"
"Idolchr_0101_A_08_00_036(0)","Ｐ","（ちょうどレッスンをしている頃だから、
見に来たけれど……）","(It's just around the time I'm giving lessons,
(I came to see but ......)"
"Idolchr_0101_A_08_00_037(0)","春香","みんなの『個性』もルミナスの魅力だと思うの。
だから、それを大事にしていくのはどうかな？","I think everyone's ""individuality"" is also the charm of Luminous.
So how about we take care of that?"
"Idolchr_0101_A_08_00_038(0)","春香","それぞれの得意なことやリズムに合ったところで
見せ場を作れば、個性がもっと魅力になるよ！","Where each of us is good at what we do and where we fit into the rhythm.
If you make a show of it, your personality will become more attractive!"
"Idolchr_0101_A_08_00_039(0)","春香","合わせようとしてぎこちなくなるより、
今日は自分らしく思いっきり踊ってみよう！","Rather than trying to match and becoming awkward,
Let's dance as much as we can today, just as we are!"
"Idolchr_0101_A_08_00_040(0)","Ｐ","（春香の的確な指導で
メンバーの動きが格段に良くなった）","(with Haruka's precise guidance)
(Members are moving much better.)"
"Idolchr_0101_A_08_00_041(0)","Ｐ","（みんなが春香の話を真剣に聞いている。
春香らしいリーダーシップを発揮しているな）","(Everyone is listening to Haruka's story seriously.
(You're showing the kind of leadership that is typical of Haruka.)"
"Idolchr_0101_A_09_00_001(0)","Ｐ","（少し時間があるな……寄り道していくか。
ん？　向こうから歩いてくるのは……）","(You have a little time. ...... Let's take a side trip.
(Hmm? The one walking from over there is ......)"
"Idolchr_0101_A_09_00_002(0)","春香","あっ、プロデューサーさん！
偶然ですね、これからお仕事ですか？","Ah, Producer-san!
Coincidence, are you going to work now?"
"Idolchr_0101_A_09_00_003(0)","　P","いや、時間があるから、そこのベンチで
少し休んでいこうかと思ってな","No, I've got time. I'll be on the bench there.
I thought I'd take some time off."
"Idolchr_0101_A_09_00_004(0)","春香","私も一緒にいいですか？
少しだけ時間が空いてるんです♪","May I join you?
I have a few minutes to spare... ♪"
"Idolchr_0101_A_09_00_005(0)","Ｐ","（頷くと、春香は嬉しそうに笑ってベンチに座る。
こんな時間も久しぶりだな）","(When I nodded, Haruka smiled happily and sat down on the bench.
(It's been a long time since I've had this kind of time.)"
"Idolchr_0101_A_09_00_006(0)","春香","今日はお天気が良くて、気持ちいいですね～。
風は少し強いですけど、公園日和です","The weather is nice and pleasant today!
The wind is a little strong, but it's a beautiful day in the park!"
"Idolchr_0101_A_09_00_007(0)","春香","こうしてると、なんだか
のんびーりした気持ちになりますね♪","I feel like I'm doing this.
It makes me feel relaxed..."
"Idolchr_0101_A_09_00_008(0)","Ｐ","そうだな、昼寝でもしたい気分になるよ","Yeah, I feel like taking a nap."
"Idolchr_0101_A_09_00_009(0)","春香","あはは、プロデューサーさん、
杏ちゃんみたいなこと言ってますよ","Haha, Producer-san,
She's talking like Anzu."
"Idolchr_0101_A_09_00_010(0)","Ｐ","（そういえば、春香からルミナスメンバーの
名前が出ることも多くなったな）","(Speaking of which, Haruka has asked me to send her a luminous member's
(I'm seeing more and more names mentioned.)"
"Idolchr_0101_A_09_00_011(0)","Ｐ","そうだな。
ところで春香、ルミナスの調子はどうだ？","Yes.
By the way, Haruka, how's Luminous doing?"
"Idolchr_0101_A_09_00_012(0)","春香","ルミナスの調子ですか？
あくまでも私から見た印象になりますけど……","How is Luminous doing?
It's just an impression from my point of view. ......"
"Idolchr_0101_A_09_00_013(0)","Ｐ","構わないよ、
春香から見たルミナスの話が聞きたいんだ","I don't mind,
I want to hear about Luminous from Haruka's point of view."
"Idolchr_0101_A_09_00_014(0)","春香","分かりました。私は悪くない、って思ってます。
ダンスの動きは前よりずっと良くなりました！","I understand, I think it's not my fault.
My dance moves are much better than before!"
"Idolchr_0101_A_09_00_015(0)","春香","ただ、プロデューサーさんが言ったように、
いろんな個性の子がたくさん集まってるから……","But as the producer said,
We have a lot of kids with different personalities. ......"
"Idolchr_0101_A_09_00_016(0)","春香","どうしても他の子に、無意識に
遠慮してしまう子もいるみたいなんです","Inevitably, the other children, unintentionally.
It's like some kids are reserved."
"Idolchr_0101_A_09_00_017(0)","春香","自分の見せ場なのに、前に出られなくて
控えめになっちゃったりだとか……","It was my moment to show off, but I couldn't get ahead.
I hear it's getting understated. ......"
"Idolchr_0101_A_09_00_018(0)","春香","控えめな子だって、考えがあるはずなのに、
うーん、言えずに飲み込んじゃうのかな……？","Even a modest child should have an idea,
Hmmm... I guess I'll just swallow it without saying it: ......?"
"Idolchr_0101_A_09_00_019(0)","春香","そういう垣根とか、遠慮がなくなると、
もっともっと良くなるのかなーって……","When such barriers and reservations are eliminated,
I was wondering if it could be better. ......"
"Idolchr_0101_A_09_00_020(0)","Ｐ","驚いた……
本当によく、みんなのことを見てるんだな","Amazing ......
You really do look out for everyone, don't you?"
"Idolchr_0101_A_09_00_021(0)","春香","えっ、そ、そうですか？","Oh, really?"
"Idolchr_0101_A_09_00_022(0)","Ｐ","ああ。春香の成長ぶりに、また驚かされたよ。
いつの間にそんなに成長してたんだ……？","Yeah, Haruka's growth has surprised me again.
When did you grow so much ......?"
"Idolchr_0101_A_09_00_023(0)","春香","え、えへへ……そんなに、褒められると……。
照れちゃいますけど、嬉しいです♪","Eh, ehehe ...... so much, when you get praised .......
I'm embarrassed, but I'm happy."
"Idolchr_0101_A_09_00_024(0)","春香","え、えっと、プロデューサーさんから見て、私が
特に成長したところって、どこだと思いますか？","Well, let's see, from the producer's point of view, I'm the one...
Where do you think you have grown in particular?"
"Idolchr_0101_A_09_00_025(0)","Ｐ","そうだな、春香が特に成長したところは……","Yes, Haruka has grown in particular: ......"
"Idolchr_0101_A_09_00_026(0)","タッチ","頭をタッチ","Touch the head"
"Idolchr_0101_A_09_00_027(0)","タッチ","腕を撫でる","place one's arms under those of the opponent and caress them"
"Idolchr_0101_A_09_00_028(0)","タッチ","時間経過・何もしない","Time Lapse / Nothing"
"Idolchr_0101_A_09_00_029(0)","タッチ","その他（タッチ）","Other (touch)"
"Idolchr_0101_A_09_00_030(0)","春香","頭、ですか？　具体的にどういうところがって、
聞いてもいいですか？","The head, you mean? What exactly do you mean?
Can I ask you something?"
"Idolchr_0101_A_09_00_031(0)","Ｐ","ああ。観察力と、それを分析する力だな。
みんなや周りをよく見て、よく考えている","Ah, the power of observation and the ability to analyze it.
I look and think carefully about everyone and everything around me."
"Idolchr_0101_A_09_00_032(0)","Ｐ","アイドルとしてどうあるべきか、向き合って
考えている姿勢に、特に成長を感じるよ","How you should be as an idol, face to face.
I feel you've grown, especially in the way you're thinking about it."
"Idolchr_0101_A_09_00_033(0)","春香","えへへー、ありがとうございます！
私だってやる時はやるんです！　えっへん！","Ehehe, thank you very much!
Even I do it when I have to!"
"Idolchr_0101_A_09_00_034(0)","春香","なーんて！　えへへ……。
ほ、褒めてもらえて……嬉しいです！","Nah! Ehehe .......
Ho, I'm ...... glad to hear your praise!"
"Idolchr_0101_A_09_00_035(0)","春香","腕？
腕が成長したってことでしょうか……？","Arms?
Does that mean your arm has grown ......?"
"Idolchr_0101_A_09_00_036(0)","Ｐ","アイドルとしての手腕っていうのかな。
春香があまりにもしっかりしてて、驚きだよ","I guess you could call it idol skills.
Haruka is so solid, it's amazing."
"Idolchr_0101_A_09_00_037(0)","春香","プロデューサーさんってば、もしかして私のこと、
もっとぼんやりしてるって、思ってたんですか？","I mean, maybe the producer is me,
Did you think it was more of a blur?"
"Idolchr_0101_A_09_00_038(0)","Ｐ","いや！　成長したのはわかってたんだが、こんなに
しっかり周りを見られるようになってたんだな","No! I knew you'd grown up, but not this much.
You had to make sure you were looking around."
"Idolchr_0101_A_09_00_039(0)","春香","……そう改めて言われると……。
えへへ、ありがとうございます♪","...... so again, .......
Hehehe, thank you... ♪"
"Idolchr_0101_A_09_00_040(0)","春香","あのー……、プロデューサーさん、
そんなに難しい質問をしちゃいましたか……？","Um, ......, producer,
Did I ask you such a difficult question ......?"
"Idolchr_0101_A_09_00_041(0)","Ｐ","いや、春香の成長がどこ、と聞かれると難しいな。
心も、中身もずいぶん成長したな、と思って","No, it's hard to ask where Haruka's growth is.
I thought, ""You've grown up a lot inside and out."
"Idolchr_0101_A_09_00_042(0)","Ｐ","ルミナスの問題、俺も気になってはいたんだ。
春香ほどしっかり分析できていたわけじゃないけど","The luminous issue, I've been wondering about that too.
I wasn't able to analyze it as thoroughly as Haruka."
"Idolchr_0101_A_09_00_043(0)","春香","え、そんな……私もまだまだですけど……。
えへへ","Oh, no ...... I'm not ready for that ......, but I'm not ready for that .......
tee-hee"
"Idolchr_0101_A_09_00_044(0)","春香","きゃっ！　ぷ、プロデューサーさん？　もしかして、
ここが成長したって……言いたいんですか？","Psst! Psst! Producer? Could it be?
Are you trying to say ...... that this place has grown?"
"Idolchr_0101_A_09_00_045(0)","Ｐ","わ、悪い、そうじゃなくて、風が強くて、
ボタンが外れそうに見えたんだ","Wow, sorry, I didn't mean that. It was so windy,
It looked like it was about to unbutton."
"Idolchr_0101_A_09_00_046(0)","春香","そ、そうだったんですか。
でも、ちょっとびっくりしました","Oh, I see.
But I was a little surprised."
"Idolchr_0101_A_09_00_047(0)","Ｐ","驚かせてごめん。春香は周りをよく見ているな。
全体的にレベルアップしていると思うぞ","Sorry to startle you...Haruka is very observant of her surroundings.
I think you're Leveling up overall."
"Idolchr_0101_A_09_00_048(0)","Ｐ","この流れで言っても、あんまり説得力が
ないかもしれないが……","I'm not too persuasive when I say it in this vein.
Maybe not. ......"
"Idolchr_0101_A_09_00_049(0)","春香","えっと、褒められるのは嬉しいです。
ありがとうございます","Um, I'm happy to receive compliments.
Thank you."
