"id","character","source","translatedstr"
"Idolchr_0201_A_05_00_037(0)","Ｐ","蘭子がアイドルをやっている理由が分かれば、
蘭子の言葉が、より分かるようになると思って","If only we knew why Ranko is an idol,
I thought it would help me better understand what Ranko said."
"Idolchr_0201_A_05_00_038(0)","蘭子","なるほど……フフフ、さすがは我が友！
汝の意志、しかと受けとったわ。……ふぅ","I see. ...... Huhuhu, that's my friend!
Thy will be done. ......"
"Idolchr_0201_A_05_00_039(0)","蘭子ログ","（そうだったんですね！　少し、私が
勘違いしていたみたいです……。は、恥ずかしい～）","(I see that you did!) A little bit, I
I guess I was wrong. ....... ha, shame~)"
"Idolchr_0201_A_05_00_040(0)","Ｐ","蘭子だけじゃなくて、みんなに聞いているんだ","I'm asking everyone, not just Ranko."
"Idolchr_0201_A_05_00_041(0)","蘭子","なるほど……。集いし乙女達の導き手として、
その意思を見定めよう、と","I see. ....... As a guiding hand for the maidens gathered together,
Let's find out what they are willing to do."
"Idolchr_0201_A_05_00_042(0)","蘭子ログ","（あっ、ルミナスのみんなに、
意気込みを聞いていたってことですね！）","(Oh, to everyone at Luminous,
(You mean you heard the enthusiasm!)"
"Idolchr_0201_A_05_00_043(0)","Ｐ","いや、仕事で必要なんだ。
雑誌で掲載されるプロフィール用にね","No, I need it for work.
For a profile in a magazine."
"Idolchr_0201_A_05_00_044(0)","蘭子","なるほど……その顔から理由を読み取れず、
何事かと思ってしまったわ","I see. ...... I can't read the reason from that face,
I was wondering what was going on."
"Idolchr_0201_A_05_00_045(0)","蘭子ログ","（そ、そういうことだったんですね。
真剣な顔をしていたから、驚いちゃいました）","(Yes, that's what you meant.
(I was surprised at how serious he looked.)"
"Idolchr_0201_A_05_00_046(0)","蘭子","うむ、我が堕天の理……。我が宿命を
受け入れる喜び、ということだろうか","Mm, my fallen reason ....... my destiny.
The joy of acceptance, I suppose."
"Idolchr_0201_A_05_00_047(0)","蘭子ログ","（え～っと。アイドルをやっていて、
楽しいって思う時だったら……）","(Let's see...I'm an idol,
(......) if that's when you think it's fun."
"Idolchr_0201_A_05_00_048(0)","蘭子","フフフ、それは新たな聖衣を纏いし喜び！
闇の鼓動が高鳴る、祝祭の歓喜！","Hmph, it is the joy of being clothed in a new holy robe!
The heartbeat of darkness is beating high, the joy of festivities!"
"Idolchr_0201_A_05_00_049(0)","蘭子ログ","（新しい衣装を着るときや、ライブをするとき……。
楽しい瞬間はいっぱいありますよ～♪）","(When you wear a new outfit or perform live at .......
There are lots of fun moments~♪)"
"Idolchr_0201_A_05_00_050(0)","Ｐ","……聖衣に祝祭の歓喜か。なるほどね","...... festive rejoicing over holy robes... I see."
"Idolchr_0201_A_05_00_051(0)","蘭子","うむ、ゆえにこの光輝なる集いに選ばれたこと……。
我が魂は歓喜に震えているわ！","Mm, hence being chosen for this luminous gathering. ......
My soul is trembling with joy!"
"Idolchr_0201_A_05_00_052(0)","蘭子ログ","（なので、ルミナスに選ばれたことで、
楽しいことがいっぱい増えて嬉しいです♪）","(So, by being selected for Luminous,
I'm glad you're having so much fun...)"
"Idolchr_0201_A_05_00_053(0)","Ｐ","蘭子なりにルミナスの活動を、
楽しんでくれているのならなによりだ","Luminous activity in the luminary's own way,
I'm glad you're enjoying it."
"Idolchr_0201_A_05_00_054(0)","蘭子","……我が友よ。
なぜゆえそのような邪心が蔓延るのか？","...... my friend.
Why, therefore, does such an evil mind prevail?"
"Idolchr_0201_A_05_00_055(0)","蘭子ログ","（……プロデューサー。
どうしてそんなことを思うんですか？）","(...... producer.
(What makes you think that?)"
"Idolchr_0201_A_05_00_056(0)","Ｐ","邪心……？　いや、蘭子を疑ってなんかいない。
ただ、蘭子のことが分からない時があって……","Evil mind ......? No, I'm not doubting Ranko.
But there were times when I didn't understand the orchid. ......"
"Idolchr_0201_A_05_00_057(0)","Ｐ","前にレッスンの見学に行った時も、
俺に気を使わせてしまったみたいだし","I went to observe a lesson before,
I'm afraid I've put you on the spot."
"Idolchr_0201_A_05_00_058(0)","蘭子","あ、あの時は……！","Oh, I was at ...... at the time!"
"Idolchr_0201_A_05_00_059(0)","蘭子","オホン。レーテーの川……。
我が友よ。あの時の出来事は忘れるといい","Ohon. the river of Rhaetian. .......
My friend, you can forget what happened."
"Idolchr_0201_A_05_00_060(0)","蘭子ログ","（あ、あの時のことは忘れてください～！）","(Oh, forget about that time~!)"
"Idolchr_0201_A_05_00_061(0)","Ｐ","そうか。蘭子がそう言ってくれるならいいけど。
蘭子が楽しく活動できているのなら……","Okay, I hope Ranko says so.
If you are enjoying your orchid activities, please visit ......"
"Idolchr_0201_A_05_00_062(0)","蘭子","フッ……≪瞳≫を持つ者よ。
案ずることはないわ。我は我が覇道を突き進むまで！","Hu ...... ""O you who have eyes"".
Don't worry, I will continue on my path!"
"Idolchr_0201_A_05_00_063(0)","蘭子ログ","（心配しないで大丈夫ですよー。
私は楽しく活動しているので！）","(Don't worry about it!
(Because I'm a fun activity!)"
"Idolchr_0201_A_05_00_064(0)","Ｐ","そうか……。俺の勘違いみたいだったな","Well, ....... Looks like I was wrong."
"Idolchr_0201_A_05_00_065(0)","Ｐ","もっと蘭子の伝えたいことが、
分かればいいんだけど……","More of what Ranko wants to tell you,
I wish I knew. ......"
"Idolchr_0201_A_05_00_066(0)","蘭子","我が友よ……","My Friends ......"
"Idolchr_0201_A_05_00_067(0)","蘭子ログ","（プロデューサー……）","(Produced by ......)"
"Idolchr_0201_A_05_00_068(0)","Ｐ","……どうしたんだ、蘭子？","...... What's up, Ranko?"
"Idolchr_0201_A_05_00_069(0)","蘭子","……いえ、何でもないわ。≪瞳≫を持つ者よ……。
これからも我の片翼として、共に羽ばたこうぞ","...... No, it's nothing, it's the one with the ≪eye≫. ......
Let's continue to flap our wings together as one wing of my own!"
"Idolchr_0201_A_05_00_070(0)","蘭子ログ","（ううん。何でもないです、プロデューサー。
これからも、一緒に頑張りましょう……ね？）","(No, it's nothing, producer.
Let's keep working together ...... right?)"
"Idolchr_0201_A_06_00_001(0)","蘭子","この西洋の城廓の佇まい！
我の≪瞳≫を誘う輝きを放っているわ！","The appearance of this Western-style brothel!
It has a radiance that invites my ""eyes"" to look at it!"
"Idolchr_0201_A_06_00_002(0)","蘭子ログ","（見てください、このヨーロッパのお城！
一度でいいから、こんなお城に住んでみたいな♪）","(Look at this European castle!
(Just once, I'd love to live in a castle like this...)"
"Idolchr_0201_A_06_00_003(0)","貴音","そうですね。日本の古城にはない、
西洋独特の繊細さが美しさを際立たせているかと","Yes, it is, and it is not found in the old castles of Japan,
I wonder if the delicacy unique to the West accentuates the beauty."
"Idolchr_0201_A_06_00_004(0)","心白","フランスのお城……ですか？
わぁ～、お城の中の装飾も素敵ですね！","Are you a French castle ......?
Wow, I love the decorations inside the castle!"
"Idolchr_0201_A_06_00_005(0)","蘭子","うむ、聖なる白色で統一された、素晴らしき曲線美！
我が魂を高ぶらせるわ！","Mmm, a wonderful curvaceous beauty, unified by the holy white color!
It lifts my spirits!"
"Idolchr_0201_A_06_00_006(0)","蘭子ログ","（ロココ調ですね！
いつ見ても、息を飲む美しさです～♪）","(It is rococo style!
It's always breathtakingly beautiful~♪)"
"Idolchr_0201_A_06_00_007(0)","Ｐ","ん、３人でなにを見てるんだ？","Hmm, what are you three looking at?"
"Idolchr_0201_A_06_00_008(0)","蘭子","闇に飲まれよ！
我が友も、共に異国の古跡に想いを馳せようぞ！","Let darkness consume you!
My friends, let's think together of the ancient sites of foreign lands!"
"Idolchr_0201_A_06_00_009(0)","蘭子ログ","（お疲れ様です♪
プロデューサーも一緒に、海外の本を見ませんか？）","（Thank you for your hard work...
(Would producers like to join us and look at books from other countries?)"
"Idolchr_0201_A_06_00_010(0)","Ｐ","この本も蘭子が持ってきた魔術書……なのか？","Is this book also the magic book ...... that Ranko brought?"
"Idolchr_0201_A_06_00_011(0)","蘭子","フフフ、これは魔術書にあらず！
我が知識の文殿から授かりしもの！","Hmph, this is not a magic book!
Given to me by my Lord Wen of Knowledge!"
"Idolchr_0201_A_06_00_012(0)","蘭子ログ","（これは魔術書じゃないんです。
私が図書館から借りてきた美術本ですよ♪）","(This is not a magic book."
"Idolchr_0201_A_06_00_013(0)","Ｐ","……ん？　この本の文章って英語じゃないよな……。
いったい、どこの国の本を読んでいるんだ？","...... hmm? The text of this book is not in English. ......
Where in the world are you reading?"
"Idolchr_0201_A_06_00_014(0)","蘭子","フフフ、さすが≪瞳≫を持つ者！
これは大海の彼方、西欧の歴史を語る創造の書！","As expected of a person with ""eyes""!
This is a book of creation that tells the history of the West, beyond the oceans!"
"Idolchr_0201_A_06_00_015(0)","蘭子ログ","（はい、この本はフランスの本で、
あの本はイタリアの本ですよ！）","(Yes, this book is a French book,
(That book is an Italian book!)"
"Idolchr_0201_A_06_00_016(0)","Ｐ","そうだよな。英語なら何となく分かるけど……。
よく、こんな難しい本を読めるな","Yes, I know, I can kind of understand it in English. ......
How can you read such a difficult book?"
"Idolchr_0201_A_06_00_017(0)","心白","私たちも書いてある言葉は読めませんが、
写真や挿絵を見て楽しんでいます","We can't read the written word either,
I enjoy looking at the pictures and illustrations."
"Idolchr_0201_A_06_00_018(0)","蘭子","き、禁忌の流布は大罪であるぞっ！？","The spreading of taboo is a mortal sin!"
"Idolchr_0201_A_06_00_019(0)","蘭子ログ","（こ、心白さん……！
それは内緒って言ったじゃないですか～）","(Ko, Mr. Shinbaku, ......!
(I told you not to tell me that~)"
"Idolchr_0201_A_06_00_020(0)","心白","あっ、そうでした。
す、すみません、つい口を滑らせてしまって","Oh, that's right.
I'm sorry, I just slipped up."
"Idolchr_0201_A_06_00_021(0)","蘭子","し、しかし！
芸術を嗜むのに制約は要らぬ！","Sh, however!
No restrictions are needed to enjoy the arts!"
"Idolchr_0201_A_06_00_022(0)","蘭子ログ","（でも、言葉が分からなくても、
芸術品は見るだけで楽しめますから！）","(But even if you don't understand the language,
(Because a work of art can be enjoyed just by looking at it!)"
"Idolchr_0201_A_06_00_023(0)","蘭子","この栄光に満ちた古き絵画を見よ！
我らの魂に語りかけてくるようだわ！","Behold this glorious old painting!
It seems to speak to our souls!"
"Idolchr_0201_A_06_00_024(0)","蘭子ログ","（ほ、ほら！　見てください！
何百年も前の絵画なんですよ！）","(Ho, ho! Look at this!
(These paintings are hundreds of years old!)"
"Idolchr_0201_A_06_00_025(0)","貴音","確か、るねっさんす期との呼称だったかと。
私も見覚えのある絵画がいくつかありました","I believe it was called the RuneSansu period.
There were a few paintings I recognized too!"
"Idolchr_0201_A_06_00_026(0)","Ｐ","そういえば、貴音が海外の芸術品を
眺めている姿って、なんだか新鮮だな","Speaking of which, I've been working on a piece of art from overseas by Takayuki.
It's kind of refreshing to see you looking at it."
"Idolchr_0201_A_06_00_027(0)","貴音","はい、私も勉強のため、
お二人と一緒に拝見しようと思いまして","Yes, I am also a student,
I thought I'd take a look at it with you two."
"Idolchr_0201_A_06_00_028(0)","蘭子","うむ、美に宿る魔力は、
我らを原罪から解き放つ……","Mm, the magic that resides in beauty,
Free us from original sin: ......"
"Idolchr_0201_A_06_00_029(0)","蘭子ログ","（芸術に触れると新鮮な気持ちになりますよね～♪）","(It's refreshing to be exposed to art!)"
"Idolchr_0201_A_06_00_030(0)","蘭子","ときに我が友よ。芸術品に触れ、その魂……。
その≪瞳≫の浄化を怠っていないか？","Sometimes my friends, touch the work of art, its soul .......
Have you neglected to purify those ""eyes""?"
"Idolchr_0201_A_06_00_031(0)","蘭子ログ","（プロデューサーは、美術鑑賞は好きですか？）","(Do producers like to view art?)"
"Idolchr_0201_A_06_00_032(0)","Ｐ","瞳の浄化――美術館に行くか、ってことか？
うーん、そうだな……","Purification of the eyes--do you mean go to a museum?
Hmmm, yes. ......"
"Idolchr_0201_A_06_00_033(0)","選択肢","結構、行くほうかな","I guess I'm pretty good at going."
"Idolchr_0201_A_06_00_034(0)","選択肢","たまに行くかな","Maybe I'll go there once in a while."
"Idolchr_0201_A_06_00_035(0)","選択肢","あんまり行かないな","I don't go there much."
"Idolchr_0201_A_06_00_036(0)","選択肢","行ったことがないな","Never been there."
"Idolchr_0201_A_06_00_037(0)","Ｐ","ああ、結構行く方かな。
気になる展覧会には行くようにしているぞ","Yeah, I guess I'm a pretty go-getter.
I'll try to go to the exhibitions you're interested in!"
"Idolchr_0201_A_06_00_038(0)","蘭子","クックック……！
背負いし十字架に不可欠な魔力は常に補っている、と","Cook Cook. ......!
The magic that is essential to the cross that we carry is always supplemented, he said."
"Idolchr_0201_A_06_00_039(0)","蘭子ログ","（なるほど～、美術館に行ってプロデュースに
役立つ情報を集めているんですね！）","(I see - go to the museum and produce.
You're gathering useful information!)"
"Idolchr_0201_A_06_00_040(0)","蘭子","さすがは≪瞳≫を持つ者……。貪欲なる美への追及！
その魂は乙女達を更なる高みへ導くだろう！","As expected of a person with ""eyes"" ....... Greedy pursuit of beauty!
Their spirit will lead the maidens to greater heights!"
"Idolchr_0201_A_06_00_041(0)","蘭子ログ","（さすが、プロデューサー！　ルミナスのために
色々と頑張ってくれてるんですね～♪）","(That's what I'm talking about, producer! For Luminous!
You're doing a lot of work on a lot of things...)"
"Idolchr_0201_A_06_00_042(0)","Ｐ","まあ、たまに行く程度……。
気が向いたときに行くくらいだな","Well, I only go there occasionally. ......
I only go there when I feel like it."
"Idolchr_0201_A_06_00_043(0)","蘭子","うむ、それでも魔力の補充は怠っていない、と。
本能的に堕天の運命を受け入れているようね……","Mm, and yet, he said, he has not neglected to replenish her magical power.
You seem to instinctively accept your fallen destiny: ......"
"Idolchr_0201_A_06_00_044(0)","蘭子ログ","（気が向いたら行くってことは、
きっと芸術に興味があるってことですよ～♪）","(That I'll go there when I feel like it,
I'm sure that means you're interested in art~♪)"
"Idolchr_0201_A_06_00_045(0)","蘭子","ミューズに囚われし定め……。
我らは美の魔力から逃れられぬ運命！","Trapped by the Muse. .......
We are doomed not to escape the magic of beauty!"
"Idolchr_0201_A_06_00_046(0)","蘭子ログ","（アイドル活動をしていると、
芸術品に触れたくなっちゃう時があるんです♪）","(She said he is an idolater,
Sometimes I feel like touching a work of art♪)"
"Idolchr_0201_A_06_00_047(0)","Ｐ","う～ん、あんまり行かないな。
それに展覧会に行く時間もないし","Hmmm, I don't go there much.
And I don't have time to go to exhibitions."
"Idolchr_0201_A_06_00_048(0)","蘭子","美の魔力に飢えながらも、
その翼を休ませる刻がない、と……","While starving for the magic of beauty,
There is no time to rest its wings, and ......"
"Idolchr_0201_A_06_00_049(0)","蘭子ログ","（芸術鑑賞に興味はあるけど、
行く時間がないんですか……）","(I'm interested in art appreciation, though,
(Don't have time to go? ......)"
"Idolchr_0201_A_06_00_050(0)","蘭子","我が友よ！　乙女をヴァルハラへ導くために、
魂の浄化を怠ってはいけないわ！","My friends, to lead the maiden to Valhalla,
Don't neglect to purify your soul!"
"Idolchr_0201_A_06_00_051(0)","蘭子ログ","（ルミナスの活動で大変だと思いますが、
たまには美術鑑賞を楽しむのも悪くないですよ～）","(I know it's a lot of work with the Luminous activities,
(It's not a bad idea to enjoy art appreciation once in a while~)"
"Idolchr_0201_A_06_00_052(0)","Ｐ","もしかしたら、行ったことがないかもしれないな……","Maybe you've never been there. ......"
"Idolchr_0201_A_06_00_053(0)","蘭子","なっ……！　それは真か、我が友よ……","Is it true, my friend? ......"
"Idolchr_0201_A_06_00_054(0)","蘭子ログ","（ほ、本当ですか、プロデューサー）","(Ho, really? Producer)"
"Idolchr_0201_A_06_00_055(0)","蘭子","美の魔力に触れるのも悪くないか、と。
必ずやその≪瞳≫に、新たな光を与えるだろう","I wondered if it wouldn't be a bad idea to get in touch with the magic of beauty.
I will surely give a new light to those ""eyes."
"Idolchr_0201_A_06_00_056(0)","蘭子ログ","（あの、私が言うのもなんですけど、一度くらい
美術館に行くのも悪くないと思いますよ～）","(Um, I'm not sure if I should say this, but at least once...)
(I don't think going to a museum is a bad idea~)"
"Idolchr_0201_A_06_00_057(0)","Ｐ","新しい光か……。
そうだな、たまには美術に触れてみるか","New Light or .......
Yeah, I guess I should touch some art once in a while."
"Idolchr_0201_A_06_00_058(0)","蘭子","フフフ、我が友も美の魔力に飢えていたとは……！
≪瞳≫を持つ者よ。共に魂の浄化を！","Huh, I didn't know my friend was also hungry for the magic of beauty. ......
≪O you who have eyes, let us purify our souls together!"
"Idolchr_0201_A_06_00_059(0)","蘭子ログ","（芸術鑑賞に興味があるみたいでよかったです！
今度一緒に美術館に行きましょー♪）","(I'm glad he is interested in art appreciation!
Let's go to the museum together next time.)"
"Idolchr_0201_A_06_00_060(0)","貴音","プロデューサーと二人で芸術鑑賞に誘うなんて、
ふふっ……。蘭子も大胆なところがあるのですね","I can't believe you and your producer invited me to see art,
Hmmm... ......... Ranko has a bold streak too."
"Idolchr_0201_A_06_00_061(0)","蘭子","ええっ！？　そ、そういう意味ではなくて……！
ぷ、プロデューサー。い、今のは……！ ","What? That's not what I meant. ......
P, producer. yes, that was ......!"
"Idolchr_0201_A_06_00_062(0)","Ｐ","あ、ああ。分かっているよ","Uh, yeah, I know."
"Idolchr_0201_A_06_00_063(0)","蘭子","クッ……我が友よ！　容易く審判を下しているが、
我が言霊を理解したというのか！？","Kk ...... my friend, though you are easily judged,
You say you understand my words!"
"Idolchr_0201_A_06_00_064(0)","蘭子ログ","（ぷ、プロデューサー！　返事が軽すぎますよ～。
本当に私の言葉が伝わったんですか？）","(P, producer! Your reply is too light!
(Did you really get my word?)"
"Idolchr_0201_A_06_00_065(0)","Ｐ","そうだな、蘭子と貴音の会話を聞いていると、
なんとなく言いたいことは伝わったぞ","Yes, I've heard the conversation between Ranko and Takane,
I kind of got your point."
"Idolchr_0201_A_06_00_066(0)","蘭子","ほう、さすがは≪瞳≫を持つ者。
共鳴者を介して闇の言葉を解釈した、と……","As expected of a person with ""eyes"".
Interpreted dark words through a resonator, and ......"
"Idolchr_0201_A_06_00_067(0)","蘭子ログ","（そういうことだったんですね。貴音さん、
私の言葉が伝わっているみたいで嬉しいです～♪）","(So that's what it was all about, Takane,
I'm glad my words are getting through to you~!)"
"Idolchr_0201_A_06_00_068(0)","貴音","それで、プロデューサー。蘭子からの誘いを
受けるのですか？　返事を差しあげてください","So, producer...Ranko asked me to join you.
Do you accept? Please give him an answer."
"Idolchr_0201_A_06_00_069(0)","蘭子","つ、月の執行者……！
我を羞恥の淵へと再び追い込むのか……！","One, the executor of the moon, ......!
Will you drive me back into the abyss of shame again? ......"
"Idolchr_0201_A_06_00_070(0)","蘭子ログ","（た、貴音さん！
話を蒸し返さないでください～）","(Ta, Takane!
(Please don't rehash the story~)"
"Idolchr_0201_A_06_00_071(0)","心白","あ、あの……。
よかったら、みなさんで美術館に行きませんか？","Oh, that .......
If you would like, why don't you all go to the museum?"
"Idolchr_0201_A_06_00_072(0)","心白","ルミナスの全員では難しいと思うので、
都合がつく人だけで……というのは、いかがでしょう","I think it would be difficult for all of us at Luminas to do this,
How about ...... only for those who are convenient!"
"Idolchr_0201_A_06_00_073(0)","蘭子","うむ、それが良い！
さすが、真白き魂の杯を与えられし者！","Mm, that's good!
As is to be expected from one who has been given the cup of the true white soul!"
"Idolchr_0201_A_06_00_074(0)","蘭子ログ","（はい、みんなで行きましょう～！
さすが心白さん、ナイスパスです～♪）","(Yes, let's all go together!
Nice pass, Mr. Shinbaku, as expected~~)"
"Idolchr_0201_A_06_00_075(0)","心白","ま、真白き魂の……。杯を与えられし者……？","Well, the true white soul ......, the one who was given the Grail ......?"
"Idolchr_0201_A_06_00_076(0)","Ｐ","そうだな。みんなのスケジュールを考えて、
時間が作れそうなら、美術鑑賞にでも行くか","Yes, considering everyone's schedule,
If I can make time, I'll go see some art."
"Idolchr_0201_A_06_00_077(0)","蘭子","ククク……。美との邂逅の予感！
魂が喜びに打ち震えているわ！","Kukuku ....... I have a feeling of encounter with beauty!
My soul is trembling with joy!"
"Idolchr_0201_A_06_00_078(0)","蘭子ログ","（わーい、楽しみにしています！
今のうちに美術について勉強しておこうっと♪）","(Wow, I'm looking forward to it!
I'll learn more about art while I'm at it...)"
"Idolchr_0201_A_07_00_001(0)","Ｐ","（蘭子と事務所に向かう途中……）","(On the way to the office with Ranko: ......)"
"Idolchr_0201_A_07_00_002(0)","蘭子","…………ふぅ","............ Phew!"
"Idolchr_0201_A_07_00_003(0)","Ｐ","（……どうしたんだろう、蘭子。
明らかに元気がない様子だけど……）","(...... What's going on, Ranko?
(She clearly doesn't look well. ......)"
"Idolchr_0201_A_07_00_004(0)","蘭子","ときに、≪瞳≫を持つ者よ……","Sometimes, O you who have ""eyes"": ......"
"Idolchr_0201_A_07_00_005(0)","蘭子ログ","（あの、プロデューサー……）","(Um, producer ......)"
"Idolchr_0201_A_07_00_006(0)","Ｐ","ど、どうした？","What's wrong?"
"Idolchr_0201_A_07_00_007(0)","蘭子","光輝なる集いの中で、
我が魔力は発揮されているだろうか……？","In a luminous gathering,
Is my magic working? ......?"
"Idolchr_0201_A_07_00_008(0)","蘭子ログ","（私……。ルミナスの中で、
しっかりやれているのかな、って……）","(I ....... In Luminous,
I wondered if I was doing it right. ......)"
"Idolchr_0201_A_07_00_009(0)","Ｐ","蘭子の魔力……？　ああ、そういうことか","Ranko's magic ......? Oh, that's what I meant."
"Idolchr_0201_A_07_00_010(0)","Ｐ","もちろんだ。
蘭子の魅力はルミナスの中で光り輝いているぞ","Of course.
Ranko's charm shines through in Luminous!"
"Idolchr_0201_A_07_00_011(0)","蘭子","そ、そうであったか……。
ならば良いのだが……","Oh, that's right. .......
I hope so. ......"
"Idolchr_0201_A_07_00_012(0)","蘭子ログ","（あ、ありがとうございます……。
そう言ってもらえると嬉しいんですけど……）","(Oh, thank you, .......
(I'm glad you said that. ......)"
