"id","character","source","translatedstr"
"Idolchr_0306_A_10_00_019(0)","琴葉","すぐに見抜かれちゃうなんて……。
さすがプロデューサーです","I can't believe they would see right through it. ......
That's what I'd expect from a producer."
"Idolchr_0306_A_10_00_020(0)","Ｐ","すぐに見抜いた、か……","You saw right through it, or ......"
"Idolchr_0306_A_10_00_021(0)","選択肢","これくらい当然だ","This much is obvious."
"Idolchr_0306_A_10_00_022(0)","選択肢","琴葉の顔を見ればわかる","I can tell by the look on Kotoba's face."
"Idolchr_0306_A_10_00_023(0)","選択肢","あてずっぽうだ","at random"
"Idolchr_0306_A_10_00_024(0)","Ｐ","これくらい、プロデューサーとして当然だよ。
今、琴葉の一番近くにいるのは、俺だからな","This is about as much as I deserve as a producer.
I'm the one closest to Kotoha right now."
"Idolchr_0306_A_10_00_025(0)","琴葉","ふふっ、プロデューサーは、いつでも
そばにいてくれます","Phew, producers are always
They'll be right by your side."
"Idolchr_0306_A_10_00_026(0)","琴葉","……プロデューサーが見てくれているから、
私はどんな時でも頑張れるんです","Because ...... producers are watching us,
I can do my best in any situation."
"Idolchr_0306_A_10_00_027(0)","Ｐ","琴葉の顔を見ればわかる。
質問した時、浮かない表情だったからな","You can tell by the look on Kotoha's face.
When I asked you the question, you didn't look happy."
"Idolchr_0306_A_10_00_028(0)","琴葉","私、そんなに顔に出てるんだ……。
なんだか恥ずかしいです","I'm so in your face. ......
It's kind of embarrassing."
"Idolchr_0306_A_10_00_029(0)","琴葉","でも、ありがとうございます。
プロデューサーに、隠し事はできませんね","But thank you.
I can't hide anything from my producer."
"Idolchr_0306_A_10_00_030(0)","Ｐ","実は……半分くらい、あてずっぽうだったんだ。
すまない……","Actually, I was guessing half the time at .......
Sorry ......"
"Idolchr_0306_A_10_00_031(0)","琴葉","そ、そうだったんですか。
でも……半分は見抜いていたってことですよね？","Oh, I see.
But ...... you mean you saw through half of it, right?"
"Idolchr_0306_A_10_00_032(0)","Ｐ","まあ、うん……。
当たってよかったよ","Well, yeah .......
I'm glad I won."
"Idolchr_0306_A_10_00_033(0)","Ｐ","それで琴葉。例えば挑戦してみたいこともないのか？
少し考えてみたことがある、くらいでもいいんだけど","So, Kotoba, for example, is there nothing you'd like to try?
I've thought about it a bit, or at least I've thought about it."
"Idolchr_0306_A_10_00_034(0)","琴葉","………。挑戦してみたいことはありますが、
今の私にどれほどの力があるのか、分からないんです",".......... I'm up for the challenge, though,
I just don't know how much power I have right now."
"Idolchr_0306_A_10_00_035(0)","Ｐ","……琴葉は考えすぎかもしれないな","I think ...... Kotoba might be overthinking this."
"Idolchr_0306_A_10_00_036(0)","琴葉","考えすぎ……ですか？","Are you overthinking ......?"
"Idolchr_0306_A_10_00_037(0)","琴葉","でも、考えなしに挑戦して失敗したら、
いろんな人に迷惑をかけてしまうから","But if you try without thinking and fail,
I'm going to get in trouble with a lot of people."
"Idolchr_0306_A_10_00_038(0)","Ｐ","迷惑、かけていいじゃないか。
そのために俺がいるんだから","It's okay to be bothered.
That's why I'm here."
"Idolchr_0306_A_10_00_039(0)","琴葉","え……？","What, ......?"
"Idolchr_0306_A_10_00_040(0)","Ｐ","琴葉はもっと『わがまま』になってもいいと思う","I think Kotoba could be more 'selfish'."
"Idolchr_0306_A_10_00_041(0)","琴葉","わ、わがままだなんて……。
そんなこと、私には、無理……","Wow, I can't believe I'm being selfish. ......
I can't do that. ......"
"Idolchr_0306_A_10_00_046(0)","Ｐ","大事なのは琴葉の素直な気持ちだ。
だからありのまま、わがままになってもいいんだ","What matters is Kotoha's honest feelings.
So it's okay to be who you are and be selfish."
"Idolchr_0306_A_10_00_042(0)","琴葉","……。でも……わがままになってでも、
やりたいことを見つけることも、大事ですよね……","....... but ...... even if it's selfish,
Finding what you want to do is also important. ......"
"Idolchr_0306_A_10_00_043(0)","Ｐ","難しく考える必要はない。
俺は琴葉の素直な気持ちを聞きたいんだ","There is no need to think too hard.
I want to hear Kotoha's honest feelings."
"Idolchr_0306_A_10_00_044(0)","琴葉","……分かりました、もう少し考えてみます。
自分が本当にやりたいことを","...... Okay, I'll give it some more thought.
What I really want to do."
"Idolchr_0306_A_10_00_045(0)","Ｐ","ああ。琴葉の挑戦を楽しみにしているぞ！","Yeah, I'm looking forward to Kotoha's challenge!"
"Idolchr_0306_A_11_00_001(0)","Ｐ","（さてと、時間があるうちに事務仕事を片付けるか。
……ん？　外から威勢のいい足音が近づいてくるな）","(Well, let's get the paperwork done while we still have time.
(......? I hear the sound of brisk footsteps approaching from outside.)"
"Idolchr_0306_A_11_00_002(0)","","ガチャッ","(with a) slamming noise (door, telephone receiver)"
"Idolchr_0306_A_11_00_003(0)","琴葉","はあ、はあ……ぷ、プロデューサー！
私……けほっ、ごほっ……","Ha, ha ...... p, producer!
I ...... keho, goho ......"
"Idolchr_0306_A_11_00_004(0)","Ｐ","ど、どうした琴葉！？
そんなに慌てて……","What's wrong Kotoha!
In such a hurry ......"
"Idolchr_0306_A_11_00_005(0)","琴葉","だ、大丈夫です……
はあ……ふう……","It's okay, it's okay. ......
haha ...... wind ......"
"Idolchr_0306_A_11_00_006(0)","Ｐ","全然、大丈夫なようには見えないぞ？
ほら、深呼吸をして息を整えるんだ","You don't look okay at all, do you?
Here, take a deep breath and catch your breath."
"Idolchr_0306_A_11_00_007(0)","琴葉","は、はい。スー……ハー……。
ふぅ……なんとか落ち着きました","Ha, yes. sue ...... har .......
Phew ...... managed to calm down!"
"Idolchr_0306_A_11_00_008(0)","Ｐ","ああ、よかった。
それで、どうしたんだ？","Oh, thank God.
So, what's up?"
"Idolchr_0306_A_11_00_009(0)","琴葉","プロデューサー……。
私、やりたいことが見つかりました！","Produced by .......
I found what I want to do!"
"Idolchr_0306_A_11_00_055(0)","Ｐ","本当か？　それで、どんな内容なんだ","Really? So, what's the story?"
"Idolchr_0306_A_11_00_010(0)","琴葉","はい！　ルミナスのみんなの力を借りて、
挑戦したいこと……","Yes! With the help of everyone at Luminous,
Challenges: ......"
"Idolchr_0306_A_11_00_011(0)","琴葉","私、みんなと一緒に
メドレーライブをやってみたいです！","Me, with everyone else.
I would like to do a medley live performance!"
"Idolchr_0306_A_11_00_012(0)","Ｐ","メドレーライブか……うん、いいと思うぞ！","Medley Live or ...... Yeah, I think that's a good idea!"
"Idolchr_0306_A_11_00_013(0)","Ｐ","でも、どうしてメドレーライブをやりたいって
思ったんだ？","But why did you want to do a medley live performance?
You thought?"
"Idolchr_0306_A_11_00_016(0)","琴葉","はい。私は今まで、ルミナスのサポートとして、
みんなと交流してきました","Yes, I have been a luminous support,
I've interacted with everyone."
"Idolchr_0306_A_11_00_017(0)","琴葉","その中で、個性豊かなルミナスのみんなを見てきて、
やっぱりルミナスはすごいって思ったんです……","In the process, I've seen everyone at Luminous with their unique personalities,
I knew Luminous was great. ......"
"Idolchr_0306_A_11_00_018(0)","琴葉","ひとりひとりの個性が輝くルミナス……。
私も……その中に、ルミナスのひとりとして歌いたい","The individuality of each person shines through at Luminous .......
I also want to sing as one of the luminous ...... in it!"
"Idolchr_0306_A_11_00_019(0)","琴葉","メドレーがいいって思ったのは、
みんなと一緒に歌えるから","I thought the medley was a good idea,
I can sing with everyone."
"Idolchr_0306_A_11_00_020(0)","琴葉","その方がルミナスの魅力が、より多く
伝えられると思ったんです","This way, the appeal of Luminous is more
I thought I could tell them."
"Idolchr_0306_A_11_00_056(0)","Ｐ","なるほど……","I see: ......"
"Idolchr_0306_A_11_00_021(0)","琴葉","サポートとしてルミナスの魅力を伝える……","Luminous as a support: ......"
"Idolchr_0306_A_11_00_057(0)","琴葉","私のやるべきことが、
私のやりたいことに変わっていったんです","What I have to do,
It turned into something I wanted to do."
"Idolchr_0306_A_11_00_022(0)","Ｐ","やるべきことが、やりたいことに……か。
面白い発想だな","Is what you need to do what you want to do ......?
Interesting idea."
"Idolchr_0306_A_11_00_014(0)","琴葉","私、プロデューサーが言っていたように、
わがままになってみようと決めたんです","I, as the producer said,
I decided to be selfish."
"Idolchr_0306_A_11_00_015(0)","琴葉","みんなに迷惑が掛かるとしても、
私がやりたいことに、正直に向き合うことにしました","Even if it inconveniences everyone,
I decided to be honest about what I wanted to do."
"Idolchr_0306_A_11_00_023(0)","琴葉","この私なりの答えが、
正しいのか間違っているのか……","This my own answer,
Right or wrong: ......"
"Idolchr_0306_A_11_00_024(0)","琴葉","ルミナスのみんなの力を借りて、
確かめてみたい","With the help of everyone at Luminous,
I'd like to be sure."
"Idolchr_0306_A_11_00_025(0)","琴葉","そして、みんなと力を合わせた結果を、
ファンのみんなに見てもらいたいんです","And the result of joining forces with everyone,
I want all my fans to see it."
"Idolchr_0306_A_11_00_026(0)","Ｐ","琴葉の気持ちは分かった。
やってみよう！","I know how Kotoha feels.
Let's do it!"
"Idolchr_0306_A_11_00_027(0)","琴葉","……は、はいっ！","......, yes!"
"Idolchr_0306_A_11_00_028(0)","琴葉","あ、でも……みんなはどんどんレベルアップ
してますよね……","Oh, but ...... everyone is getting more and more Level up!
I know you do. ......"
"Idolchr_0306_A_11_00_029(0)","琴葉","私だと、やっぱり実力不足でしょうか……","If it's me, I guess I'm not good enough. ......"
"Idolchr_0306_A_11_00_030(0)","Ｐ","（実力に大きな差があるとは思えないが、自信が
持てないのか。ここでかけるべき言葉は……）","(I don't think there is a big difference in ability, but confidence
(You can't have it; the word to use here is ......)"
"Idolchr_0306_A_11_00_031(0)","選択肢","そんなことはない","That's not true."
"Idolchr_0306_A_11_00_032(0)","選択肢","もう少し
考えてもいいぞ？","a bit more
You can think about it, okay?"
"Idolchr_0306_A_11_00_033(0)","選択肢","それならやめるか？","Would you stop then?"
"Idolchr_0306_A_11_00_034(0)","Ｐ","そんなことはない。
琴葉だってどんどん実力をつけている","That's not true.
Even Kotoha is getting better and better at what she does."
"Idolchr_0306_A_11_00_035(0)","Ｐ","それになにより、琴葉が挑戦したいという気持ちが、
一番大切なんだよ","And most importantly, Kotoha is willing to take on the challenge,
It's the most important thing."
"Idolchr_0306_A_11_00_036(0)","琴葉","……そうですよね。
すみません、弱気になってしまって","...... Yes, that's right.
I'm sorry, I'm just feeling vulnerable."
"Idolchr_0306_A_11_00_037(0)","琴葉","プロデューサー、ありがとうございます。
私、全力で挑みたいと思います","Thank you, producer.
I, for one, will give it my all."
"Idolchr_0306_A_11_00_038(0)","Ｐ","もう少し考えてもいいぞ？
ちゃんと納得して挑戦するのが大事だからな","You can think about it some more, okay?
It's important to be properly convinced and challenged."
"Idolchr_0306_A_11_00_039(0)","琴葉","ちゃんと、納得して……。
私は……","Properly and convincingly .......
I am ......"
"Idolchr_0306_A_11_00_040(0)","琴葉","……プロデューサー。
やっぱり、挑戦させてください","...... producer.
After all, let me try!"
"Idolchr_0306_A_11_00_041(0)","琴葉","怖じ気づいていたら、
いつまでも前に進めませんから！","If you are scared,
We can't keep moving forward forever!"
"Idolchr_0306_A_11_00_042(0)","Ｐ","それならやめるか？
琴葉が乗り気じゃないなら意味がないからな","Would you stop then?
Because if Kotoha isn't on board, there's no point."
"Idolchr_0306_A_11_00_043(0)","琴葉","や、やめません！
それに、私が言い出したことですから","No, I will not stop!
Besides, I'm the one who brought it up."
"Idolchr_0306_A_11_00_044(0)","琴葉","うう……。で、でも、やるなら
しっかりと覚悟を決めないと","Ugh. ....... So, but if you're going to do it.
We need to make sure we're ready."
"Idolchr_0306_A_11_00_058(0)","Ｐ","琴葉の気持ちはよく分かった。
それじゃ、さっそく準備をはじめようか","I know exactly how Kotoha feels.
Well, then, let's get started on the preparations."
"Idolchr_0306_A_11_00_045(0)","琴葉","はい！　それで、みんなとライブをするにあたって、
色々考えてきたんですが……","Yes! So, on performing live with everyone,
I've been thinking a lot about ......"
"Idolchr_0306_A_11_00_046(0)","琴葉","同じステージに立つ以上、
もっとお互いを知った方がいいと思うんです","As long as we are on the same stage,
I think we should get to know each other better."
"Idolchr_0306_A_11_00_047(0)","琴葉","それに、改めてみんなの趣味や特技を
確認したくて……","Plus, once again, everyone's hobbies and skills.
I just wanted to check: ......"
"Idolchr_0306_A_11_00_048(0)","琴葉","ひとりひとりとの個別面談とかどうでしょうか？","What about individual interviews with each person?"
"Idolchr_0306_A_11_00_049(0)","Ｐ","ちょっ、ちょっと待った！　そこまで徹底的に
下準備をしなくてもいいんじゃないか？","Wait a minute, wait a minute, wait a minute!
You don't have to do any prep work."
"Idolchr_0306_A_11_00_050(0)","琴葉","そうですか？　相手のことを知るためには、
話し合うことが大事だと思いますが……","Is that right? To get to know the other person,
I think it's important to talk about it: ......"
"Idolchr_0306_A_11_00_051(0)","Ｐ","琴葉らしくていいと思うけど、
もっと肩の力を抜いてもいいかもな","I think it's just like Kotoha,
Maybe you could relax your shoulders a little more."
"Idolchr_0306_A_11_00_052(0)","琴葉","……。
分かりました。もう少し柔軟に考えてみます",".......
Understood, I'll try to be a little more flexible."
"Idolchr_0306_A_11_00_053(0)","Ｐ","ああ。琴葉とみんななら、
ライブを成功させてくれるって信じているからな","Yeah, if it's Kotoha and everyone else,
I have faith that you'll make the gig a success."
"Idolchr_0306_A_11_00_054(0)","琴葉","はいっ！
期待に応えられるよう、頑張ります！","Yes, sir!
We will do our best to meet your expectations!"
"Idolchr_0306_A_11_01_001(0)","Ｐ","（いつまで経っても、拍手と歓声が鳴り止まない。
メドレーライブは、大成功だ……！）","(No matter how long it took, the applause and cheers never stopped.
Medley Live is a huge success ......!)"
"Idolchr_0306_A_11_01_002(0)","琴葉","プロデューサー！","Producer!"
"Idolchr_0306_A_11_01_003(0)","Ｐ","琴葉、お疲れ様！
みんなと息がバッチリ合っていたな","Kotoha, thanks for your help!
You were breathing perfectly with everyone."
"Idolchr_0306_A_11_01_004(0)","Ｐ","なにより、ステージのみんなもファンも
楽しそうだった。いいライブだったぞ！","Above all, everyone on stage and the fans.
Looked like fun...good show!"
"Idolchr_0306_A_11_01_005(0)","琴葉","はい……はいっ！　ありがとうございます！
私、すっごく楽しかったです","Yes ...... Yes! Thank you!
I had a lot of fun!"
"Idolchr_0306_A_11_01_006(0)","琴葉","胸もまだドキドキしていて……。
こんなに高揚するのは、初めて……","My heart is still pounding too. ......
I've never been so uplifted in my life. ......"
"Idolchr_0306_A_11_01_007(0)","琴葉","最初はみんなについていけるのか、
心配だったけど……","At first, I wondered if I could keep up with everyone,
I was worried about that. ......"
"Idolchr_0306_A_11_01_008(0)","琴葉","お客さんの顔を見たら、
不安もすべて吹っ飛んじゃいました……♪","If you see the customer's face,
All my fears were blown away. ......♪"
"Idolchr_0306_A_11_01_009(0)","Ｐ","（みんなとメドレーライブを成功させた、
琴葉の笑顔……）","(I had a successful medley live performance with everyone,
(Kotoha's smile: ......)"
"Idolchr_0306_A_11_01_010(0)","Ｐ","（この笑顔を見れば、
琴葉はやりたいことを成し遂げれたようだな……）","(If you see this smile,
Looks like Kotoba was able to accomplish what she wanted to do (......)"
"Idolchr_0306_A_11_01_011(0)","琴葉","私、ルミナスのみんなと自分を比べて、
落ち込んだり焦ったりしていました","Me, comparing myself to everyone in Luminous,
I was depressed and impatient."
"Idolchr_0306_A_11_01_012(0)","琴葉","みんなは個性的で、私よりもずっと、
キラキラ輝いているように見えたから……","Everyone is unique, much more so than I am,
Because it looked so sparkly and shiny: ......"
"Idolchr_0306_A_11_01_013(0)","琴葉","でも、その不安はもうありません","But those fears are no more."
"Idolchr_0306_A_11_01_014(0)","琴葉","私のやりたいこと……やらなければならないことを、
私の考えで成し遂げることができましたから","What I want to do ...... what I have to do,
Because it was my idea to accomplish it."
"Idolchr_0306_A_11_01_015(0)","琴葉","メドレーライブを成功させることができたのも、
仲間やファンのみんな……","We were also able to make the medley live show a success,
All my friends and fans: ......"
"Idolchr_0306_A_11_01_016(0)","琴葉","それにプロデューサーのおかげです。
本当に、ありがとうございます！","And thanks to the producer.
Really, thank you very much!"
"Idolchr_0306_A_11_01_017(0)","Ｐ","俺は道を示しただけだ。ここまで歩んで
来られたのは、紛れもなく琴葉の力だよ","I'm just showing you the way.
It's undeniably the power of Kotoha that brought us here."
"Idolchr_0306_A_11_01_018(0)","琴葉","……ふふっ、謙虚なのはプロデューサーも
一緒じゃないですか","...... phew, humble is the producer too!
I think we're the same."
"Idolchr_0306_A_11_01_019(0)","琴葉","私、もっともっと上を目指したい。
プロデューサー、これからもよろしくお願いします！","I, I want to go higher and higher.
Producers, please keep up the good work!"
"Idolchr_0306_A_12_00_001(0)","Ｐ","（レッスンが終わり、
琴葉と一緒に屋上にやって来た）","(End of lesson,
(I came to the rooftop with Kotoha)"
"Idolchr_0306_A_12_00_002(0)","Ｐ","先日のライブ、業界で評判だぞ。
この前の打ち合わせでも、話題に上がっていた","Your recent gig, it's well received in the industry.
It was brought up at our last meeting."
"Idolchr_0306_A_12_00_003(0)","Ｐ","もちろん、仕事の話もきているぞ。
これも琴葉の努力と向上心の賜物だな！","Of course, you've been offered a job.
This is another result of Kotoha's hard work and ambition!"
"Idolchr_0306_A_12_00_004(0)","琴葉","ふふっ、ありがとうございます♪
プロデューサーはいつも私をほめてくれますよね","Phew, thank you... ♪ Thank you, thank you, thank you ♪
Producers are always complimenting me."
"Idolchr_0306_A_12_00_005(0)","琴葉","でもライブは、私ひとりの力で
成功したわけじゃありません","But the live show is my own effort.
It wasn't a success."
"Idolchr_0306_A_12_00_006(0)","琴葉","ルミナスのみんな、スタッフのみなさん……","Everyone at Luminous and staff ......"
"Idolchr_0306_A_12_00_007(0)","琴葉","それに、プロデューサーの協力があったからこそ、
素晴らしいライブができたんです","Besides, it was because of the cooperation of the producer,
We had a great show."
"Idolchr_0306_A_12_00_008(0)","Ｐ","あんなにすごいライブを成功させたって、
胸を張ってもいいのに。琴葉らしいな","She said they pulled off such an amazing live performance,
It's so typical of Kotoha."
"Idolchr_0306_A_12_00_009(0)","Ｐ","そういえば、ライブ前にルミナスのみんな
ひとりひとりと話したんだろう？","Oh, by the way, everyone in Luminous before the concert.
You talked to each and every one of them, didn't you?"
"Idolchr_0306_A_12_00_010(0)","琴葉","みんな、私の思いを汲んで、
ステージに立ってくれました","Everyone, take my thoughts,
They took the stage."
"Idolchr_0306_A_12_00_011(0)","琴葉","私、ルミナスのお手伝いができて、
本当に良かったって思っています","I, Luminous, was able to help,
I'm really glad I did."
"Idolchr_0306_A_12_00_012(0)","琴葉","みんなと過ごす中で、自分の意見を言う大切さや、
時には息抜きをすることの大切さ……","The importance of expressing one's own opinions while spending time with everyone and
The importance of taking a break from time to time: ......"
"Idolchr_0306_A_12_00_013(0)","琴葉","そして、心から望んで努力をすれば、
いくらでも成長できること","And if you sincerely desire it and make the effort,
The ability to grow as much as possible."
"Idolchr_0306_A_12_00_014(0)","琴葉","私たちアイドルには、無限の可能性があるんだって、
気づくことができました","We idols have unlimited potential, he said,
I've come to realize that"
"Idolchr_0306_A_12_00_015(0)","Ｐ","そうか……。琴葉がルミナスの力になり、
ルミナスが琴葉の力になったんだな","So ....... Kotoha became a force for Luminous,
Luminous must have helped Kotoha."
"Idolchr_0306_A_12_00_016(0)","Ｐ","琴葉に手伝いをお願いして、
本当によかったよ","Ask Kotoha to help,
I'm really happy for you."
"Idolchr_0306_A_12_00_017(0)","琴葉","それで、あの……","So, that ......"
"Idolchr_0306_A_12_00_048(0)","琴葉","ん？　どうしたんだ？","Hmm? What's going on?"
"Idolchr_0306_A_12_00_018(0)","琴葉","私、もっといろんなことに挑戦したいです！","I, for one, want to try more things!"
"Idolchr_0306_A_12_00_019(0)","琴葉","ルミナスのみんなとプロデューサーとなら、自分の
やりたいことが、もっと実現できると思うんです！","With everyone in Luminous and the producer, I can make my
I think we can achieve more of what we want to do!"
"Idolchr_0306_A_12_00_020(0)","Ｐ","ああ、今の琴葉ならきっとできるよ","Yeah, I'm sure Kotoha can do it now."
"Idolchr_0306_A_12_00_021(0)","Ｐ","……なあ、覚えているか？
ルミナスの手伝いが始まった頃のことを","...... Hey, remember me?
I remember when I started helping Luminous."
"Idolchr_0306_A_12_00_022(0)","Ｐ","『今はやりたいことよりも、
やらなければいけないことをやりたい』","'More than what I want to do now,
I want to do what I have to do."""
"Idolchr_0306_A_12_00_023(0)","Ｐ","あの時、琴葉はそう言っていたけど、今は自分から
やりたいことを見つけられるようになったんだな","Kotoha said so at the time, but now she's saying it herself.
You got to be able to find what you want to do."
"Idolchr_0306_A_12_00_024(0)","琴葉","そ、そんなこともありましたね。
うう、恥ずかしい……","Yes, that has happened.
Ugh, embarrassing: ......"
"Idolchr_0306_A_12_00_025(0)","琴葉","プロデューサーはいつも、私に大切なことを
気づかせてくれます","Producers have always been very important to me.
It makes you realize."
"Idolchr_0306_A_12_00_026(0)","琴葉","そんなプロデューサーと一緒だから、
私は成長することができる……","I'm with a producer like that,
I can grow ......"
"Idolchr_0306_A_12_00_027(0)","琴葉","だから、ありがとうございます！
……ふふっ、なんだか私、お礼を言ってばかり","So, thank you very much!
...... Hmmm, I kind of keep thanking you!"
"Idolchr_0306_A_12_00_028(0)","琴葉","でも、それだけプロデューサーに
感謝してるってことなんですよ？","But that's all the more reason to get a producer.
It means you're grateful, right?"
