"id","character","source","translatedstr"
"Idolchr_0306_A_03_00_028(0)","琴葉","でも私は、みんなを追いかけるので精一杯で……。
私にはなにができるのかなって……","But I'm too busy catching up with everyone else. ......
I was wondering what I can do. ......"
"Idolchr_0306_A_03_00_029(0)","美嘉","うーん、そんなことないんじゃないの？
考えすぎだと思うけど……咲耶ちゃんはどう思う？","Hmmm, I don't think so.
I think you're overthinking this. ...... What do you think, Sakuya?"
"Idolchr_0306_A_03_00_030(0)","咲耶","美嘉の言う通りだ。琴葉の不安も分かるけれど、
それは誰しも感じるものさ","Mika is right, although I can understand Kotoha's apprehension,
It's something we all feel."
"Idolchr_0306_A_03_00_031(0)","琴葉","私の不安……","My concerns: ......"
"Idolchr_0306_A_03_00_032(0)","咲耶","それを拭い去るには経験や時間が必要だが、
自分の良いところを認めるのも効果的だと思うよ","It takes experience and time to wipe that out, though,
I think it helps to acknowledge your good qualities."
"Idolchr_0306_A_03_00_033(0)","琴葉","みんな、自分の考えをしっかり持っていて
すごいな……","Everyone has her or her own ideas.
That's great: ......"
"Idolchr_0306_A_03_00_034(0)","琴葉","私には、なにができるんだろう……","What can I do? ......"
"Idolchr_0306_A_03_00_035(0)","琴葉","プロデューサー、
私に必要なことって何でしょうか？","Producer,
What is it that I need to do?"
"Idolchr_0306_A_03_00_036(0)","Ｐ","うーん、琴葉もしっかりしていると思うが……。
琴葉に必要なことは……","Hmmm, I think Kotoba is solid too. ......
What you need to do for Kotoha: ......"
"Idolchr_0306_A_03_00_037(0)","選択肢","経験","experience"
"Idolchr_0306_A_03_00_038(0)","選択肢","努力","effort"
"Idolchr_0306_A_03_00_039(0)","Ｐ","経験だろうな。咲耶も言っていたけれど、
経験は不安を打ち消してくれると思う","It must be experience, as Sakuya said,
I think experience cancels out anxiety."
"Idolchr_0306_A_03_00_040(0)","琴葉","それはたくさんレッスンをしたり、
多くのステージに立つ……ということですか？","It does a lot of lessons,
Do you mean ......, where you stand on many stages?"
"Idolchr_0306_A_03_00_041(0)","Ｐ","ああ、今の琴葉も多くの経験をしてきたと思う。
でも、経験が多いほど自らの糧になる……","Yeah, I think Kotoha has been through a lot now.
But the more experience we have, the more we feed ourselves. ......"
"Idolchr_0306_A_03_00_042(0)","Ｐ","って、
自分に言い聞かせているところもあるんだけどな","She said,
I've been telling myself that in some ways."
"Idolchr_0306_A_03_00_043(0)","琴葉","そんな……プロデューサーは私たちに、
大切なことをたくさん教えてくれます","Such ...... producers to us,
It teaches us many important things."
"Idolchr_0306_A_03_00_044(0)","琴葉","必要なことは経験……。
しっかり胸に刻んで、活動に臨みます！","All you need is experience .......
I will keep this in mind as I go about my activities!"
"Idolchr_0306_A_03_00_045(0)","Ｐ","努力だろうな。
努力を重ねることで自分に自信が持てると思うぞ","It would be an effort.
I think you'll find you'll be more confident in yourself if you put in the effort."
"Idolchr_0306_A_03_00_046(0)","琴葉","努力……それは、レッスンやお仕事を
頑張ればいいということですか？","Effort ...... that is, lessons and work.
Does that mean I should work hard?"
"Idolchr_0306_A_03_00_047(0)","Ｐ","そうだな。アイドルは努力した分だけ、
結果が出る世界だと思っている","Yes, idols are only as good as the effort they put in,
I believe it's a world of consequences."
"Idolchr_0306_A_03_00_048(0)","琴葉","結果を出すことができれば、
私の不安もなくなる……ってことですね","If we can get results,
I guess that means no more anxiety for me. ......"
"Idolchr_0306_A_03_00_049(0)","琴葉","ありがとうございます、プロデューサー。
なんだか少し気が楽になりました","Thank you, producer.
It kind of made me feel a little better."
"Idolchr_0306_A_03_00_050(0)","咲耶","ところで、琴葉。次のライブについて
意見があったら、聞かせてくれないかい？","By the way, Kotoha, about the next gig.
If you have an opinion, I'd like to hear it."
"Idolchr_0306_A_03_00_051(0)","琴葉","えっ、私の意見を？","What, my opinion?"
"Idolchr_0306_A_03_00_052(0)","美嘉","気になったことがあれば、なんでも教えて！
今、ステージ上のメンバー配置について話してたんだ","Let me know if there's anything you're interested in!
We were just talking about the placement of members on stage."
"Idolchr_0306_A_03_00_053(0)","琴葉","うーん……さっきのお話を聞いていたから、
なんとなくイメージは浮かぶけど……","Hmmm ...... because I heard what you said earlier,
I can kind of picture it, but ......"
"Idolchr_0306_A_03_00_054(0)","琴葉","心白ちゃんがセンターなら、美嘉ちゃんと
咲耶ちゃんをサイドにするんじゃなくて……","If Xinhaku is the center, Mika and
Don't make Sakuya a side. ......"
"Idolchr_0306_A_03_00_055(0)","琴葉","アシンメトリーでポジションを取ると、
このステージで３人が映えると思うな","When positioned asymmetrically,
Don't think the three of us will look good on this stage."
"Idolchr_0306_A_03_00_056(0)","咲耶","アシンメトリー……左右非対称ということか。
なるほど、３人で立つステージでそれは面白そうだ","You mean asymmetry ...... asymmetry?
Okay, that sounds interesting on a stage where the three of us stand together."
"Idolchr_0306_A_03_00_057(0)","美嘉","だったら、みんなが一緒に登場する必要もないし、
別々に登場する演出も作れそうだね！","Then there's no need for everyone to appear together,
I guess I could create a production where they appear separately!"
"Idolchr_0306_A_03_00_058(0)","心白","あの……いいアイディアだと思います。
さっそく次のレッスンで試してみませんか？","That ...... is a good idea.
Why don't you try it at your next lesson right away?"
"Idolchr_0306_A_03_00_059(0)","琴葉","ふふっ、私のアイディアが
役に立ったなら、嬉しいな！","Phew, my idea.
Glad you found it helpful!"
"Idolchr_0306_A_03_00_060(0)","美嘉","ふふっ、お礼を言うのはアタシたちの方だから。
琴葉ちゃんってホント真面目★","Phew, it's us who should be thanking you.
Kotoha is really serious."
"Idolchr_0306_A_03_00_061(0)","Ｐ","さすがだな。
琴葉ならではの視点で、いいアドバイスだったぞ","That's as good as it gets.
That was good advice, from Kotoba's unique perspective!"
"Idolchr_0306_A_03_00_062(0)","琴葉","本当ですか？
少しでもルミナスに貢献できてよかったです","Really?
I'm glad I could contribute to Luminous in any way I could."
"Idolchr_0306_A_03_00_063(0)","琴葉","自分ができること……。
もう少し考えてみようと思います","What you can do. ......
I'll give it some more thought."
"Idolchr_0306_A_03_00_064(0)","Ｐ","ああ、そうだな。
一緒に考えていこう","Oh, yes.
We'll figure it out together."
"Idolchr_0306_A_04_00_001(0)","Ｐ","（ルミナスメンバーのライブが終わり、
事務所に戻る前に琴葉と公園に寄ることにした）","(Luminous member's live concert is over,
(I decided to stop by the park with Kotoha before heading back to the office)"
"Idolchr_0306_A_04_00_002(0)","琴葉","ライブ大盛況でしたね！　なんだか、
思い出すだけで、また胸が熱くなってきます","The live concert was a great success!
Just remembering it makes my heart flutter again!"
"Idolchr_0306_A_04_00_003(0)","琴葉","ファンのみなさんも笑顔で、
心から楽しんでいるのが伝わってきて……","Fans are all smiles,
I could tell he was truly enjoying himself. ......"
"Idolchr_0306_A_04_00_004(0)","琴葉","心白ちゃんたち、本当にすごかったです！
とてもいい勉強になりました","The heart white girls were really amazing!
It was a very good learning experience."
"Idolchr_0306_A_04_00_005(0)","Ｐ","琴葉のアイディアを参考に、
演出や構成を作っていったんだ","Based on Kotoha's idea,
We created the direction and the structure."
"Idolchr_0306_A_04_00_006(0)","Ｐ","みんな、琴葉に感謝していたぞ？","They all thanked Kotoha, you know?"
"Idolchr_0306_A_04_00_007(0)","Ｐ","次のライブが決まったら、
また意見を聞かせてほしいそうだ","When the next gig is scheduled,
She'd like to hear your opinion again."
"Idolchr_0306_A_04_00_008(0)","琴葉","私でよかったら、喜んで協力します！","If it's okay with me, I'm happy to help!"
"Idolchr_0306_A_04_00_009(0)","Ｐ","ああ、伝えておくよ。琴葉は真面目だからこそ、
的確なアドバイスをしてくれるからな","Yeah, I'll tell them...Kotoha is serious,
They'll give you the right advice."
"Idolchr_0306_A_04_00_010(0)","琴葉","あの……プロデューサー","That ...... producer"
"Idolchr_0306_A_04_00_011(0)","琴葉","プロデューサーから見ても、
私って真面目すぎますか？","From the producer's point of view,
Am I too serious?"
"Idolchr_0306_A_04_00_012(0)","Ｐ","そうだな……。
確かに、少し真面目すぎるところがあるかな","Yes, .......
Sure, maybe a little too serious at times."
"Idolchr_0306_A_04_00_013(0)","琴葉","やっぱり……そうですよね","I knew you would ...... right?"
"Idolchr_0306_A_04_00_014(0)","琴葉","自分でも柔軟に対応できればって
思ってるんですけど、融通が利かなくて……","I just wish I could be flexible.
I'm thinking, but I'm not very flexible. ......"
"Idolchr_0306_A_04_00_015(0)","琴葉","私、ルミナスに迷惑をかけていないでしょうか？","Am I causing trouble for Luminous?"
"Idolchr_0306_A_04_00_016(0)","Ｐ","迷惑なんてかけていないぞ。琴葉の真面目さが、
ルミナスみんなの力になっているんだ","I'm not bothering you, Kotoha's seriousness,
Luminous, we're helping everyone."
"Idolchr_0306_A_04_00_017(0)","琴葉","それならいいんですけど……。でも、真面目以外にも
もっと個性を磨いた方がいいのかなって……","Then that's fine. ....... but besides seriousness.
I was wondering if I should work on my personality more. ......"
"Idolchr_0306_A_04_00_018(0)","Ｐ","うーん……。新しい個性を磨くことよりも、
琴葉が持っている個性を磨いた方がいいと思うぞ","Hmmm ....... than to hone a new personality,
I think you'd be better off honing the personality that Kotoba has."
"Idolchr_0306_A_04_00_019(0)","琴葉","私の個性……真面目なところをですか？","Is my personality ...... serious?"
"Idolchr_0306_A_04_00_020(0)","Ｐ","ああ、ただ真面目なだけじゃなくて……","Yeah, not just serious ......"
"Idolchr_0306_A_04_00_021(0)","選択肢","肩の力を抜く","not take oneself too seriously"
"Idolchr_0306_A_04_00_022(0)","選択肢","元気よく","cheerfully"
"Idolchr_0306_A_04_00_023(0)","選択肢","おもしろおかしく","amusingly"
"Idolchr_0306_A_04_00_024(0)","選択肢","もっと厳しく","Stricter."
"Idolchr_0306_A_04_00_025(0)","Ｐ","肩の力を抜いた真面目さ……なんていうのはどうだ？","How about some seriousness off the shoulder ......?"
"Idolchr_0306_A_04_00_026(0)","琴葉","うーん、なんだか、
矛盾しているような気がしますけど……","Hmmm, something,
It seems like a contradiction in terms. ......"
"Idolchr_0306_A_04_00_027(0)","Ｐ","琴葉自身、少し真面目過ぎると感じているのなら、
それもひとつの手段だと思ったんだ","If Kotoha herself feels a little too serious,
I figured that was one way to go."
"Idolchr_0306_A_04_00_028(0)","琴葉","……それは、ルミナスのみんなと、
もっと自然に接してみる……ということですか？","...... it is with everyone in Luminous,
Do you mean that I should try to treat it more naturally ......?"
"Idolchr_0306_A_04_00_029(0)","Ｐ","琴葉の場合は、肩ひじ張らずに少し力を抜いたら、
自分のことが見えてくると思うぞ","In Kotoha's case, if you relax a little bit, don't shrug your shoulders,
I think you're gonna see yourself in a whole new light."
"Idolchr_0306_A_04_00_030(0)","琴葉","私のことが見えてくる……。
はい、とても勉強になりました！","You can see mine at .......
Yes, I learned a lot!"
"Idolchr_0306_A_04_00_031(0)","Ｐ","もっと元気よく、ハキハキとした真面目さ……。
なんていうのはどうだ？","More energy, crispness and seriousness. ......
What do you say?"
"Idolchr_0306_A_04_00_032(0)","琴葉","元気よく？……今の私は、
あまり元気よさそうに見えませんか？","How are you doing? ...... I am now,
Doesn't it look too healthy?"
"Idolchr_0306_A_04_00_033(0)","Ｐ","そんなことないぞ。
今の琴葉も、十分元気でハキハキしている","That's not true.
Kotoha is also healthy and crisp enough right now."
"Idolchr_0306_A_04_00_034(0)","Ｐ","ただ、ルミナスに遠慮しているように感じたから、
素の琴葉を出してみたらどうかなって思ったんだ","I just felt like they were being reserved for Luminous,
I thought I'd bring out the bare bones kotoha."
"Idolchr_0306_A_04_00_035(0)","琴葉","素の私をですか……分かりました。
これから心がけてみようと思います！","Is it the plain me? ...... I understand.
I will try to keep this in mind from now on!"
"Idolchr_0306_A_04_00_036(0)","Ｐ","おもしろおかしい真面目さ……。
なんていうのはどうだ？","Funny Funny Seriousness. .......
What do you say?"
"Idolchr_0306_A_04_00_037(0)","琴葉","面白くて真面目……。
反対の意味でしかないと思うのですが……","Funny and serious. .......
I think it's just the opposite: ......"
"Idolchr_0306_A_04_00_038(0)","Ｐ","真面目さを際立たせるための、面白さってことだ。
ボケと真面目を使い分けてメリハリをつけていこう！","I mean fun, to highlight the seriousness.
Let's use blur and seriousness to keep it crisp and clear!"
"Idolchr_0306_A_04_00_039(0)","琴葉","ぼ、ボケですか？　なんだか話がズレてますが……。
頑張って挑戦してみようと思います！","Blah, blah, blah? I'm kind of off topic. ......
I will try my best to give it a go!"
"Idolchr_0306_A_04_00_040(0)","Ｐ","琴葉には、もっとルミナスに厳しい目を持って、
真面目になるのもいいと思うぞ","Be more strict with luminous for kotoha,
I think it's good you're being serious."
"Idolchr_0306_A_04_00_041(0)","琴葉","ルミナスのみんなに厳しく……。私が急に
そんな態度を取ったら、おかしく思われませんか？","I'm strictly for everyone in Luminous. ....... I'm suddenly
Wouldn't you think I was crazy if I took that attitude?"
"Idolchr_0306_A_04_00_042(0)","Ｐ","確かに……それはそうかもしれないな。
すまない、今のアドバイスは忘れてくれ……","Sure ...... that may be true.
Sorry, forget the advice I just gave you: ......"
"Idolchr_0306_A_04_00_043(0)","琴葉","い、いえ、とんでもないです。プロデューサーが、
私のことを考えてくれて、嬉しかったです……","No, no, not at all,
I was glad you thought of me: ......"
"Idolchr_0306_A_04_00_044(0)","Ｐ","そもそも、琴葉を真面目すぎると言ったのは、
悪い意味でじゃないんだ","In the first place, I said Kotoha was too serious,
And I don't mean that in a bad way."
"Idolchr_0306_A_04_00_045(0)","Ｐ","ルミナスには個性的なアイドルが多いだろう？","Luminous has many unique idols, doesn't it?"
"Idolchr_0306_A_04_00_046(0)","琴葉","はい。魅力的な子たちばかりです","Yes, they are all attractive children!"
"Idolchr_0306_A_04_00_047(0)","Ｐ","琴葉も十分魅力的だと思う。
だからこそ、ルミナスのみんなにも必要なんだ","I think Kotoba is attractive enough.
That's why we need everyone in Luminous."
"Idolchr_0306_A_04_00_048(0)","Ｐ","それに琴葉の真面目なところは、
みんなにとって模範になることも多い","And the seriousness of Kotoha,
Often a role model for all."
"Idolchr_0306_A_04_00_049(0)","Ｐ","だから、悩むことなんてなにひとつないんだ","So there is nothing to worry about."
"Idolchr_0306_A_04_00_050(0)","琴葉","分かりました……。
はいっ、ありがとうございます！","Understood. ......
Yes, thank you!"
"Idolchr_0306_A_04_00_051(0)","琴葉","今後は私にできることで、
ルミナスに協力をしていきたいと思います","In the future, I will do what I can,
We would like to cooperate with Luminous!"
"Idolchr_0306_A_04_00_052(0)","琴葉","私、頑張ります！　的確なアドバイスが
できるように、もっと勉強しなくちゃ……","I'll do my best, and your advice is right on the money.
I need to learn more so I can do it. ......"
"Idolchr_0306_A_04_00_053(0)","琴葉","その中でプロデューサーに前に言われたこと……","One of them was told to me before by a producer: ......"
"Idolchr_0306_A_04_00_054(0)","琴葉","私のやりたいことを見つけられればと思います！","I hope to find what I want to do!"
"Idolchr_0306_A_04_00_055(0)","Ｐ","ああ、それはいい考えだ","Yeah, that's a good idea."
"Idolchr_0306_A_04_00_056(0)","Ｐ","（ルミナスの活動を通して、
琴葉のいいところを伸ばしてあげよう）","(Through the activities of Luminous,
(Let's extend Kotoba's good points)"
"Idolchr_0306_A_05_00_001(0)","Ｐ","（仕事の息抜きに屋上に行くと、
琴葉ときらり、翼と甘奈がいた）","(When I go to the rooftop for a break from work,
(Kotoha and Kirari, Tsubasa and Amana were there)"
"Idolchr_0306_A_05_00_002(0)","Ｐ","おっ、みんなここにいたのか。
……ん？　なにを見ているんだ？","Whoa, everyone was here.
...... hmm? What are you looking at?"
"Idolchr_0306_A_05_00_003(0)","琴葉","あ、中高生に人気のファッション誌です。
甘奈ちゃんが持ってきてくれたんですよ","Oh, it is a fashion magazine popular among middle and high school students.
Amana brought it to me."
"Idolchr_0306_A_05_00_004(0)","翼","そういえば……甘奈さん、
この前、話したブランドのお店って行きました～？","By the way, ...... Amana,
Did you go to the brand store we talked about the other day?"
"Idolchr_0306_A_05_00_005(0)","甘奈","うん☆
めっちゃかわいーお洋服がたくさんあったよ～","☆☆
There were so many cute clothes!"
"Idolchr_0306_A_05_00_057(0)","","へぇ、ブランドのお店か","Wow, a brand new store."
"Idolchr_0306_A_05_00_006(0)","甘奈","日本初上陸の
ファストファッションのお店だよっ！","First time in Japan
It's a fast fashion store!"
"Idolchr_0306_A_05_00_007(0)","きらり","きらりも知ってゆ～！
きゃわいい雑貨も、た～っくさんあるお店だよね♪","Kirari also knows about it!
There are a lot of cute goods in this store."
"Idolchr_0306_A_05_00_008(0)","琴葉","あ、そこって、友達が話していたところかも。
服から雑貨までそろっているお店だって","Oh, maybe that's where my friend was talking about.
I heard that the store has everything from clothes to sundries."
"Idolchr_0306_A_05_00_009(0)","甘奈","うん！　めっちゃ充実してたよ！
かわいー小物入れとかあって、欲しくなっちゃった！","Yes! It was very fulfilling!
There were some cute little containers that I wanted to buy!"
"Idolchr_0306_A_05_00_010(0)","甘奈","甜花ちゃんと一緒に行ったんだけど、
おそろいのアクセ買ったんだ。見てみて！","I went there with Beetika,
I bought matching accessories, check it out!"
"Idolchr_0306_A_05_00_011(0)","翼","わあ、カワイイ～！
甘奈さんにとっても似合ってますね♪","Wow, kawaii~!
It looks great on you, Amana..."
"Idolchr_0306_A_05_00_012(0)","きらり","うんうん！　とってもお似合いだにぃ♪
きらりもショッピングに行きたいな～☆","Yes, yes, yes! They look so good together.
I wish Kirari could go shopping too!"
"Idolchr_0306_A_05_00_013(0)","琴葉","とっても似合ってるよ。
それに、姉妹でお揃いって……素敵だなぁ","It looks great on you.
And I love ...... that you and your sisters are matching!"
"Idolchr_0306_A_05_00_014(0)","Ｐ","（みんな楽しそうに話しているな……）","(You all sound like you're having a great time. ......)"
"Idolchr_0306_A_05_00_015(0)","翼","琴葉さんも、ファッションは好きですよね～？","Kotoha, you like fashion too, don't you~?"
"Idolchr_0306_A_05_00_016(0)","琴葉","うん！
みんなほど詳しいかは分からないけど……","Yeah!
I don't know if I know as much as everyone else, but ......"
"Idolchr_0306_A_05_00_017(0)","甘奈","え、好きって気持ちが一緒なら
甘奈、めっちゃ盛り上がっちゃうよ","Eh, if we like each other...
Amana, it's going to be so much fun!"
"Idolchr_0306_A_05_00_018(0)","甘奈","それに、おしゃれはフィーリングが大切だもん☆","Besides, fashion is all about feeling."
"Idolchr_0306_A_05_00_019(0)","琴葉","……ありがとう、甘奈ちゃん！","Thanks ......, Amana!"
"Idolchr_0306_A_05_00_020(0)","琴葉","今度ショッピングする時は、
フィーリングで選んでみようかな","Next time you go shopping,
I'll pick one based on feeling."
"Idolchr_0306_A_05_00_021(0)","琴葉","私、友達のアドバイスに
悩みすぎちゃうことがあるから","Me, on a friend's advice.
Because sometimes I worry too much."
"Idolchr_0306_A_05_00_022(0)","Ｐ","そういう悩みすぎるところも、
琴葉の魅力のひとつだと思うぞ？","That's the part that worries me too much,
I think that's part of the charm of Kotoha, don't you?"
"Idolchr_0306_A_05_00_023(0)","翼","もう、プロデューサーさん！
それじゃ、フォローになってないですよ～！","Oh, God, producer!
That's not a follow-up!"
"Idolchr_0306_A_05_00_024(0)","翼","琴葉さん、オシャレが好きなら
一緒に新しいお店に行きませんか～？","Kotoha, if you like to dress up.
Why don't you come to the new store with us~?"
"Idolchr_0306_A_05_00_025(0)","甘奈","いいね！
きらりちゃんも一緒に行こ！","Nice!
Kirari, go with me!"
"Idolchr_0306_A_05_00_026(0)","きらり","もっちろん♪
みんなでレッツショッピング～☆","of course
Let's go shopping together!"
"Idolchr_0306_A_05_00_027(0)","琴葉","うん！　みんなでお出かけするの、
楽しみだな♪","Yes! We are all going out together,
Â I'm looking forward to it."
"Idolchr_0306_A_05_00_028(0)","琴葉","今までとは違う、
新しいファッションに出会えそう！","It's different now,
You will find new fashions!"
"Idolchr_0306_A_05_00_029(0)","きらり","うんうん♪　み～んなで
新しいファッションに挑戦しちゃお～☆","♪ Mm-hm ♪ All of you ♪
Let's try new fashion!"
"Idolchr_0306_A_05_00_030(0)","Ｐ","そうだな。翼たちと買い物に行けば、
いい刺激になりそうだ","Yes, go shopping with the wings,
Sounds like a good stimulus."
"Idolchr_0306_A_05_00_031(0)","甘奈","うーん……かわいーから、
どんな服でも似合いそうだけど……","Hmmm, because ...... is so cute,
It looks good in any outfit. ......"
"Idolchr_0306_A_05_00_032(0)","甘奈","ガーリー系や大人キレイ系の
琴葉ちゃんとか、見てみたいかも！","Girly and beautiful for adults
Maybe I'd like to see Kotoha-chan or something!"
"Idolchr_0306_A_05_00_033(0)","きらり","うんうん、琴葉ちゃんなら
どんなお洋服も着こなせちゃいそう！","Yeah, yeah, yeah. Kotoha-chan can do it.
You will be able to wear any kind of clothes!"
"Idolchr_0306_A_05_00_034(0)","きらり","にゅふふ♪　きらりんおすすめの、
ふわっふわキラキラコーデもやってみてほすぃなぁ☆","Nyufufu♪ Kirarin recommended,
I wish they'd try the fluffy glittery coordinates."
"Idolchr_0306_A_05_00_035(0)","翼","わあ！　ふわっふわのお洋服を着た琴葉さん、
見たいかも～♪","Wow! Kotoha-san in fluffy clothes,
I might want to see it..."
"Idolchr_0306_A_05_00_036(0)","琴葉","ふ、ふわふわ……？
衣装以外であまり着たことがないかも","Fluffy, fluffy ......?
Maybe I haven't worn it much outside of costumes."
"Idolchr_0306_A_05_00_037(0)","翼","琴葉さん！　ファッションは時に冒険をすることも
大事なんですよ！","Kotoha! Fashion can sometimes be an adventure.
It's important!"
"Idolchr_0306_A_05_00_038(0)","翼","プロデューサーさんは、
どんなイメージの服がいいと思いますか～？","Producers,
What kind of image do you think you should wear~?"
