"id","character","source","translatedstr"
"Idolchr_0104_B_20_08_015(0)","やよい","違いますよー！
うぅ……自信あったのに、ダメでした","No, sir!
Ugh ...... I was so confident, but it didn't work!"
"Idolchr_0104_B_20_08_016(0)","Ｐ","(しまった、思い切り間違えてしまった……）","(Shit, I made a drastic mistake: ......)"
"Idolchr_0104_C_30_01_001(0)","Ｐ","（やよいの仕事終わり、
気分転換を兼ねて出かけることにした……）","(Yayoi's work is done,
I decided to go out for a change (......)"
"Idolchr_0104_C_30_01_002(0)","Ｐ","（もうこんな時間か……。
やよいも楽しんでくれたようだな）","(Is it that time already? .......
(I see you enjoyed it too, Yayoi.)"
"Idolchr_0104_C_30_01_003(0)","やよい","うっうー！　今日はありがとうございましたっ。
すーっごく楽しかったです！","Woohoo! Thank you very much for today.
It was sooooo much fun!"
"Idolchr_0104_C_30_01_004(0)","やよい","プロデューサー。また気分転換しましょうねーっ！
約束のー、ハイ、ターッチ！　いぇい！","Producer...let's have another change of pace!
Promise - Hi, Tatch!"
"runintochr_0104_A_01_00_001(0)","Ｐ","あそこにいるのは……。
おはよう、やよい！","You can see them over there at .......
Good morning, Yayoi!"
"runintochr_0104_A_01_00_002(0)","やよい","あっ、プロデューサー！
おはようございますっ！","
Good morning!"
"runintochr_0104_A_01_00_003(0)","Ｐ","今日も元気だな！
ルミナスの活動は順調か？","You're looking good today!
How is Luminous doing?"
"runintochr_0104_A_01_00_004(0)","やよい","はいっ！　順調ですよー！
毎日、すっごく楽しいです！","Yes! It's going well!
Every day is so much fun!"
"runintochr_0104_A_01_00_005(0)","Ｐ","そうか、やよいなら心配いらなかったな","Oh, well, you needn't have worried about Yayoi."
"runintochr_0104_A_01_00_006(0)","やよい","今日もみんなと一緒だって思うと、
なんだか、ワクワクしてきちゃいます！","When I think that I am with everyone today,
It's kind of exciting!"
"runintochr_0104_A_01_00_007(0)","Ｐ","やよいの元気で、みんなを引っ張ってくれ。
それじゃ、一緒に事務所に行こうか","Pull us all along with your energy, Yayoi.
Well, then, let's go to the office together."
"runintochr_0104_B_02_00_001(0)","やよい","プロデューサー！
おはようございまーす！","
Good morning!"
"runintochr_0104_B_02_00_002(0)","Ｐ","おっ、やよい、おはよう。
今日も朝から元気だな","Whoa, Yayoi, good morning.
You're looking good this morning."
"runintochr_0104_B_02_00_003(0)","やよい","はいっ！
今日も朝ご飯を、しっかり食べてきましたからっ！","
I've had a good breakfast today, too!"
"runintochr_0104_B_02_00_004(0)","Ｐ","なるほど。
やよいの元気の源は朝ご飯というわけか……","
So the source of Yayoi's energy is breakfast. ......"
"runintochr_0104_B_02_00_005(0)","やよい","それにしても、朝からこんなところで
プロデューサーに会うなんてすごい偶然ですねっ！","But still, I've been here all morning.
What an amazing coincidence to meet the producer!"
"runintochr_0104_B_02_00_006(0)","Ｐ","確かに、通勤路で会うのは珍しいな","Sure, it's rare to see them on the way to work."
"runintochr_0104_B_02_00_007(0)","やよい","今日はなんだかいいことが起きそうかもっ！？
いいことが起きたら、すぐに教えますね！","Maybe something good will happen today!
I'll let you know as soon as something good happens!"
"runintochr_0104_B_02_00_008(0)","Ｐ","ああ、楽しみにしてるぞ","Yeah, I'm looking forward to it."
"runintochr_0104_C_03_00_001(0)","やよい","お疲れ様です、プロデューサー！
遅くまでお仕事ですかー？","Thanks for your help, producer!
Are you working late?"
"runintochr_0104_C_03_00_002(0)","Ｐ","ああ。ちょうど今、一段落ついたところだ。
それで、どうしたんだ？","Yeah, I'm just now getting over the hump."
"runintochr_0104_C_03_00_003(0)","やよい","あのっ！　毎日、私たちのためにお仕事してくれて、
ありがとうございますっ！","Ano! For working for us every day,
Thank you very much!"
"runintochr_0104_C_03_00_004(0)","Ｐ","こちらこそ、ありがとう。
やよいの言葉で、疲れなんて吹っ飛んでいったよ","Thank you, too.
The words of Yayoi blew away all my tiredness."
"runintochr_0104_C_03_00_005(0)","やよい","えへへっ♪　そう言われちゃうと、
なんだか体がポッポしてきちゃいましたー！","Hehehe♪ When you put it like that,
I was feeling kind of pouty!"
"runintochr_0104_C_03_00_006(0)","やよい","プロデューサー！
これからもよろしくお願いしまーっす！","
Thank you for your continued support!"
"runintochr_0104_C_03_00_007(0)","Ｐ","ああ、みんなで一緒に頑張っていこうな","Yeah, we're all in this together."
"runintochr_0104_D_01_00_001(0)","やよい","あ、プロデューサー！　おはようございますっ！
朝の挨拶の、ハイ、ターッチ！　いぇい♪","Oh, producer! Good morning!
Morning greeting, Hi, Tatch! Yay!"
"runintochr_0104_D_01_01_001(0)","やよい","あ、プロデューサー、おはようございます！
しっかり、朝ごはんは食べてきましたか～？","Oh, good morning, producer!
Have you had a good breakfast~?"
"runintochr_0104_E_02_00_001(0)","やよい","お疲れ様です、プロデューサー。
今日は頑張ったので、ぐっすり眠れそうです～","Thanks for your help, producer.
I worked hard today and will sleep well~!"
"runintochr_0104_E_02_01_001(0)","やよい","プロデューサー、お疲れ様でした！
あ！　急いで帰らないと、特売に間に合いませんー！","Thank you for your hard work, producer!
Oh! If I don't hurry home, I won't make it in time for the special sale!"
"spworkchr_0104_A_01_00_001(0)","Ｐ","やよい、いよいよ今日は
『芸能人農業チャレンジＴＶ』の収録日だ！","Yayoi, finally today!
It's the day of recording for ""Celebrity Farming Challenge TV!"
"spworkchr_0104_A_01_00_002(0)","やよい","はわっ！？　農業チャレンジＴＶですか！
私にピッタリのお仕事かも……","Wow! Is it Agricultural Challenge TV?
This may be the perfect job for me: ......"
"spworkchr_0104_A_01_00_003(0)","Ｐ","収録は２回に分かれていて、
まずは、大自然の中でもやし栽培するシーンを録る","The recording was divided into two parts,
First, record a scene of growing sprouts in the wilderness."
"spworkchr_0104_A_01_00_004(0)","Ｐ","無事栽培が出来たら、
今度はスタジオで料理もして欲しい……とのことだ","If you can grow it safely,
Now they want you to cook in the studio, too. ......"
"spworkchr_0104_A_01_00_005(0)","やよい","もやしを育てて、お料理するんですね？
それなら私、得意です！　頑張りますっ！","So you grow sprouts and cook them?
I'm good at that! I'll do my best!"
"spworkchr_0104_A_01_00_006(0)","やよい","あ、でも。もやしはキットで育てたことあるけど、
ＴＶの企画だと、もっとたくさん作らないとですね？","Oh, but...I've grown bean sprouts with a kit,
With a TV project, you have to make more, don't you?"
"spworkchr_0104_A_01_00_007(0)","Ｐ","そうだな……たくさんのもやしを、どう育てるか。
自然の中、ってところが重要だよな","Yes, ...... how to grow a lot of sprouts.
The ""in nature"" part is important."
"spworkchr_0104_A_01_00_008(0)","やよい","うーん？　プロデューサーだったら、
どんな場所でもやしを育てますか？","Hmmm? If I were a producer,
What kind of place do you grow sprouts?"
"spworkchr_0104_A_01_00_009(0)","Ｐ","そうだな……","Right ......"
"spworkchr_0104_A_01_00_010(0)","選択肢","洞窟で育てる","Growing up in a cave"
"spworkchr_0104_A_01_00_011(0)","選択肢","小川で育てる","Growing in a creek"
"spworkchr_0104_A_01_00_012(0)","Ｐ","ここには、ちょっとした洞窟があるそうだ。
自然の暗所ならこの企画に最適なんじゃないか？","They have a little cave here.
A natural dark place would be perfect for this project."
"spworkchr_0104_A_01_00_013(0)","やよい","なるほどー！　洞窟なら大自然って感じがするし、
美味しいもやしができそうですね♪","I see! If it's a cave, it feels like the great outdoors,
I'm sure you'll have delicious bean sprouts... ♪"
"spworkchr_0104_A_01_00_014(0)","やよい","プロデューサー、もしかして、もやしの育て方とか
調べておいてくれたんですか？","Producer, maybe you can tell me how to grow sprouts or something.
Did you check it out?"
"spworkchr_0104_A_01_00_015(0)","Ｐ","ああ。やよいの方が詳しいだろうけど、
俺もちゃんと知っておきたくて","Yeah, I'm sure Yayoi knows more about it than I do,
I just wanted to make sure I knew what I was talking about."
"spworkchr_0104_A_01_00_016(0)","やよい","プロデューサーのそういうところ、尊敬ですっ！
私、絶対に美味しいもやしを育ててみせますね！","I respect that about producers!
I will definitely grow delicious bean sprouts!"
"spworkchr_0104_A_01_00_017(0)","やよい","うっうー！　ワクワクしてきましたよー！
早速洞窟を探しに行きましょー！","Woohoo! I'm getting excited!
Let's go find a cave right away!"
"spworkchr_0104_A_01_00_018(0)","Ｐ","（その後やよいが見つけた洞窟で、もやしは
順調に育った。良い結果になって良かった！）","(Later, in the cave that Yayoi found, the bean sprouts
(Grew up fine, glad it turned out well!)"
"spworkchr_0104_A_01_00_019(0)","Ｐ","小川で育てるのはどうだ？　少し調べたんだけど、
もやしって水耕栽培なんだよな、確か","How about growing them in a creek? I did a little research,
Sprouts are hydroponic, I believe."
"spworkchr_0104_A_01_00_020(0)","やよい","す……すごいです、プロデューサー！
私、そんなこと思いつきませんでした！","I'm very impressed with ......, Producer!
I, I never thought of that!"
"spworkchr_0104_A_01_00_021(0)","やよい","もやしは暗いところで育てなきゃいけないから、
外じゃ難しいって思ってて……","Because bean sprouts have to be grown in the dark,
I thought it was hard to do outside. ......"
"spworkchr_0104_A_01_00_022(0)","Ｐ","えっ……、そうなのか？","What, ......, is that right?"
"spworkchr_0104_A_01_00_023(0)","やよい","はいっ！　でも、思い切って新しい挑戦を
した方がいいってことですよねっ？","Yes! But I'm going to take the plunge and try something new.
I mean, I should do that, right?"
"spworkchr_0104_A_01_00_024(0)","Ｐ","あっ、いや、ちょっと待って……！","Oh, no, wait a minute. ......!"
"spworkchr_0104_A_01_00_025(0)","やよい","私、頑張りますっ！　大自然もやし、
きっと新しい味になりますよっ！","I'll do my best! Great nature sprouts,
It will be a new taste for sure!"
"spworkchr_0104_A_01_00_026(0)","Ｐ","（しかし、小川で育てたもやしは
あまり育たなかった……）","(But the bean sprouts grown in the creek are
(It didn't grow much. ......)"
"spworkchr_0104_A_01_00_027(0)","Ｐ","（間違ったアドバイスをしてしまったかもしれない。
もやしのことをもっと調べておくべきだった……）","(I may have given the wrong advice.
(I should have done more research on sprouts: ......)"
"spworkchr_0104_A_01_00_028(0)","Ｐ","（今回の仕事は成功だ！）","(This job was a success!)"
"spworkchr_0104_A_01_00_029(0)","Ｐ","（今回の仕事は失敗だ。次こそは！）","（This job was a mistake...next time!)"
"spworkchr_0104_A_02_00_001(0)","Ｐ","（無事にもやし栽培に成功したやよい、
次は料理の収録だ）","(Yayoi succeeded in growing bean sprouts,
(Next up, we'll record the food.)"
"spworkchr_0104_A_02_00_002(0)","やよい","プロデューサー、見てください！
洞窟の中で、こんな立派なもやしに成長しました～！","Producers, look at this!
It grew into such a fine bean sprout in the cave!"
"spworkchr_0104_A_02_00_003(0)","Ｐ","うおっ！？　本当に大きいぞ！　スーパーで
見かけるようなもやしの、倍の大きさはある！","Whoa! It's really big! At the supermarket.
It is twice the size of a typical bean sprout!"
"spworkchr_0104_A_02_00_004(0)","やよい","大きいだけじゃないですよ～！
さっき私、試しに食べてみたんですけど……","It's not just big!
I just tried it out myself: ......"
"spworkchr_0104_A_02_00_005(0)","やよい","もやし１本１本が、すっごくしっかりしてるんです！
シャキシャキで、とってもおいしい！","Each bean sprout is very firm!
Crunchy and very tasty!"
"spworkchr_0104_A_02_00_006(0)","Ｐ","よし……食材はまったく問題なさそうだな！","Okay, ...... ingredients look perfectly fine!"
"spworkchr_0104_A_02_00_007(0)","やよい","はい！　毎日お水換えて、お掃除して、頑張って
育てましたからっ！　自慢のもやしたちです！","Yes! Change your water every day, clean up, and good luck!
We are proud of our sprouts!"
"spworkchr_0104_A_02_00_008(0)","Ｐ","あとは、どうやって調理をするか……だな。
ゲストは大御所の女優から若手のお笑い芸人……","Now we just need to figure out how to cook it .......
Guests range from big name actresses to young comedians ......"
"spworkchr_0104_A_02_00_009(0)","やよい","つまり、ろーにゃくなんにょに、
よろこんでもらえる味ってことですよね？","In other words, ro-nyaku nanyoni,
It's a taste that makes people happy, right?"
"spworkchr_0104_A_02_00_010(0)","Ｐ","ああ、そうだな……。だけど、食材がもやしだけで、
みんなが納得できる料理ができるのかな……","Yeah, I know. ....... but the only ingredients are sprouts,
I wonder if we can all agree on the food: ......"
"spworkchr_0104_A_02_00_011(0)","やよい","そうですね～。
プロデューサー、どうしますか～？","Yes, that's right!
Producers, what do you want to do~?"
"spworkchr_0104_A_02_00_012(0)","Ｐ","そうだな。やよいが栽培した、
立派なもやしに負けないような味付けとなると……","Yes, it was cultivated by Yayoi,
When it comes to seasoning that can compete with the magnificent bean sprouts, ......"
"spworkchr_0104_A_02_00_013(0)","選択肢","ガツンと
やよい特製のタレ","with a thump
Yayoi's special sauce"
"spworkchr_0104_A_02_00_014(0)","選択肢","シンプルに
塩コショウ","Simple.
salt and pepper"
"spworkchr_0104_A_02_00_015(0)","Ｐ","やよいが家で使っている
タレで炒めてみるのはどうだ？","Yayoi uses it at home.
How about frying them with some sauce?"
"spworkchr_0104_A_02_00_016(0)","やよい","それって、もやし祭りのですか？","Is that from the Bean Sprouts Festival?"
"spworkchr_0104_A_02_00_017(0)","Ｐ","ああ！　もやしのスペシャリストのやよいが、
考えたタレなら万人受けは間違いなしだ","Ah! The bean sprout specialist, Yayoi,
With the sauce we've come up with, I'm sure it'll be a hit with everyone."
"spworkchr_0104_A_02_00_018(0)","やよい","はいっ！　わかりました～！
パパッ、と調味料を混ぜてタレを作っちゃいますね！","Yes, I understand!
I'll make the sauce by mixing the seasonings!"
"spworkchr_0104_A_02_00_019(0)","Ｐ","（食欲をそそられる、良い匂いがしてきた……！
これなら最高のもやし料理ができそうだ！）","(It's appetizing and smells good. ......!
(This would make the best bean sprout dish ever!)"
"spworkchr_0104_A_02_00_020(0)","Ｐ","（……ゲストの実食結果は大好評だった。
大御所がタレを商品にしたいと言うくらいだ！）","(...... Guests' actual food results were very positive.
(So much so that the big man wants to turn the sauce into a product!)"
"spworkchr_0104_A_02_00_021(0)","Ｐ","シンプルに塩コショウにして、
もやし本来の味をゲストに伝えるんだ！","Simply salt and pepper,
You have to convey the true taste of the bean sprouts to your guests!"
"spworkchr_0104_A_02_00_022(0)","やよい","わかりましたっ！
なんだか、本物の料理人さんになった気分です～！","I understand!
I feel like a real cook!"
"spworkchr_0104_A_02_00_023(0)","Ｐ","もやしのスペシャリストのやよいなら、
この力強いもやしを料理できるはずだ","Yayoi, the bean sprout specialist, would be a good choice,
You should be able to cook these mighty sprouts."
"spworkchr_0104_A_02_00_024(0)","やよい","まかせてくださいっ！　塩コショウだけで、
おいしいもやし料理を作っちゃいます！","Just salt and pepper,
We make a delicious bean sprout dish!"
"spworkchr_0104_A_02_00_025(0)","Ｐ","（塩コショウだけで試作品を作っているが、
食欲をそそられる何かが足りない気がする……）","(Although I'm making a prototype with just salt and pepper,
(I think I'm missing something appetizing ......)"
"spworkchr_0104_A_02_00_026(0)","Ｐ","（予想通り、ゲスト実食の結果はあまり好評では
なかった。もっと違うアドバイスができれば……）","(As expected, the results of the actual guest meals were not very favorable.
I wish I could advise you differently (......)."
"spworkchr_0104_A_02_00_027(0)","Ｐ","（今回の仕事は成功だ！）","(This job was a success!)"
"spworkchr_0104_A_02_00_028(0)","Ｐ","（今回の仕事は失敗だ。次こそは！）","（This job was a mistake...next time!)"
