"id","character","source","translatedstr"
"Idolchr_0201_A_07_00_013(0)","Ｐ","……なにか悩みがあるなら、相談に乗るぞ？
俺で分かる範囲でなら……","......If you have any problems, I'm here to help you?
As far as I can tell, it's ......"
"Idolchr_0201_A_07_00_014(0)","蘭子","そんな……な、悩みなんて……","I don't ...... have any such ...... worries."
"Idolchr_0201_A_07_00_015(0)","蘭子","くっ……我が友を昏き闇に落とすなど、
堕天使の契約への叛逆……","Damn ...... my friend into the coma,
Rebellion against the Fallen Angel Covenant: ......"
"Idolchr_0201_A_07_00_016(0)","蘭子ログ","（すみません……。プロデューサーに
心配をかけちゃったみたいですね……）","(Sorry, ....... To the producer.
(I guess I worried you. ......)"
"Idolchr_0201_A_07_00_017(0)","蘭子","我が友よ。
先日の我が祝祭を覚えているだろうか？","My friends.
Do you remember our recent festivities?"
"Idolchr_0201_A_07_00_018(0)","蘭子ログ","（このあいだ、
私のライブがあったのを覚えていますか？）","(During this time,
(Remember when I had my gigs?)"
"Idolchr_0201_A_07_00_019(0)","Ｐ","たしか祝祭ってライブのことだよな。
ああ、会場には行けなかったけど覚えているぞ","I think the festival is supposed to be a live concert.
Yeah, I couldn't make it to the venue, but I remember you."
"Idolchr_0201_A_07_00_020(0)","蘭子","……その祝祭で我は、
十分に魔力を発揮することができなかった","......I am at that feast,
I couldn't work my magic well enough."
"Idolchr_0201_A_07_00_021(0)","蘭子ログ","（……そのライブで、私は自分の力を
全て出し切ることができなかったんです……）","(...... that live performance, I was able to make my
I couldn't get it all out (......)."
"Idolchr_0201_A_07_00_022(0)","蘭子","否、我が魔力を解放しなかった……。
と、言った方が正しいかもしれないわ","No, I did not release my magic. ......
And maybe I'm right in saying that."
"Idolchr_0201_A_07_00_023(0)","蘭子ログ","（ううん、私は自分の力を発揮しなかった、
って言ったほうがいいのかもしれません……）","(No, I didn't exert myself,
(Maybe I should say ......)"
"Idolchr_0201_A_07_00_024(0)","蘭子","収束点での饗宴を慮るゆえ、
目の前の祝祭を疎かにするなど……","Because we consider the feast at the convergence point,
Neglecting the festivities before us, etc. ......"
"Idolchr_0201_A_07_00_025(0)","蘭子ログ","（スターリットシーズンのことが気になって、
いつものライブを疎かにしていたんです……）","(I was wondering about the Starlit season,
We've been neglecting our usual gigs (......)."
"Idolchr_0201_A_07_00_026(0)","蘭子","新たな宿命に囚われ、
堕天使の原罪を忘れるとは……。なんと愚かな","Caught in a new fate,
How foolish of ...... to forget the original sin of the fallen angels."
"Idolchr_0201_A_07_00_027(0)","蘭子ログ","（プロジェクトルミナスのことばっかり考えて、
ライブで失敗なんて……。私っておバカです……）","(Thinking only about Project Luminous,
(I can't believe I screwed up at a gig. ....... I'm such an idiot. ......)"
"Idolchr_0201_A_07_00_028(0)","Ｐ","そうか……。
ライブで本来の力を出せなかったのか","I see. .......
You didn't get your true potential in a live performance."
"Idolchr_0201_A_07_00_029(0)","Ｐ","それを後悔しているんだったら……","If you regret it, you can do so at ......"
"Idolchr_0201_A_07_00_030(0)","選択肢","後悔すればいい","You'll regret it."
"Idolchr_0201_A_07_00_031(0)","選択肢","忘れればいい","Forget about it."
"Idolchr_0201_A_07_00_032(0)","Ｐ","それなら、もっと後悔すればいい","Then you'll regret it all the more."
"Idolchr_0201_A_07_00_033(0)","蘭子","後悔……ですか？","Regret ......?"
"Idolchr_0201_A_07_00_034(0)","Ｐ","そうすれば、なにがいけなかったのか、
なにが悪かったのかが浮かび上がってくる","If so, what went wrong?
What went wrong comes to light."
"Idolchr_0201_A_07_00_035(0)","Ｐ","開き直る……って、意味に聞こえるけれど、
そういう強い気持ちも必要だと思うぞ","It sounds like it means ...... to reopen it, though,
I think you need to be strong like that."
"Idolchr_0201_A_07_00_036(0)","蘭子","フフ……さすが、乙女達の導き手。
傷ついた翼を癒す言葉を知っている……","HUFF ...... indeed, the guiding hand of maidens.
I know the words to heal wounded wings: ......"
"Idolchr_0201_A_07_00_037(0)","蘭子ログ","（ありがとうございます、プロデューサー。
なんだか安心してきました……）","(Thank you, producer.
(I feel somewhat relieved ......)"
"Idolchr_0201_A_07_00_038(0)","蘭子","自らの贖罪を、自らで断罪する……。
テミスのごとき審判を自らの手で下す意志！","Declare your own redemption on your own. ......
The will to bring down judgment like Themis with her own hands!"
"Idolchr_0201_A_07_00_039(0)","蘭子ログ","（自分の失敗から逃げないことが、
大切ってことですね）","(To not run away from one's mistakes,
(You mean it's important.)"
"Idolchr_0201_A_07_00_040(0)","Ｐ","いっそのこと忘れればいい","Forget about it once and for all."
"Idolchr_0201_A_07_00_041(0)","蘭子","忘れる……それでいいんですか？","Forget ...... is that okay?"
"Idolchr_0201_A_07_00_042(0)","Ｐ","ああ、過去の失敗を気にしていたら、
先に進めなくなってしまうからな","Oh, if only I cared about my past mistakes,
I'm not going to be able to move on."
"Idolchr_0201_A_07_00_043(0)","Ｐ","開き直る……って、意味に聞こえるけれど、
気持ちを切り替えることも大事だ","It sounds like it means ...... to reopen it, though,
It's important to change your mind."
"Idolchr_0201_A_07_00_044(0)","蘭子","うむ、乙女達の先導者たるに、ふさわしい予言！","A prophecy befitting a leader of maidens!"
"Idolchr_0201_A_07_00_045(0)","蘭子ログ","（はい、プロデューサーの言う通りですね！）","(Yes, the producer is right!)"
"Idolchr_0201_A_07_00_046(0)","蘭子","過去に捕らわれるのではなく、
スクルドの意志に身を委ねよ……と！","Not to be trapped in the past,
Surrender to Skuld's will with ......!"
"Idolchr_0201_A_07_00_047(0)","蘭子ログ","（失敗を引きずらないで、
未来について考えたほうがいいってことですよね）","(Don't let your failures drag you down,
(Which means you'd better think about the future.)"
"Idolchr_0201_A_07_00_048(0)","蘭子","しかし、≪瞳≫を持つ者よ。
時には懺悔することも堕天使の宿命……","But, O you who have ""eyes"".
Sometimes repentance is the fate of fallen angels: ......"
"Idolchr_0201_A_07_00_049(0)","蘭子ログ","（でも、反省しないといけないことって、
あると思うんです……）","(But what I have to reflect on,
(I think there is ......)"
"Idolchr_0201_A_07_00_050(0)","Ｐ","懺悔……か。それも、大切だと思うけど、
それよりも大切なことは、その次のじゃないのか？","Penance ....... I think that's important, too,
Isn't that more important than the next?"
"Idolchr_0201_A_07_00_051(0)","蘭子","その次……？","Next to that ......?"
"Idolchr_0201_A_07_00_052(0)","Ｐ","ああ。何度失敗したって、必ず次はある。
もう一度、頑張ればいいだけの話だよ","Yeah, no matter how many times you fail, there is always a next time.
You just have to try again."
"Idolchr_0201_A_07_00_053(0)","蘭子","……ふむ。その言霊は偽りなき真理！
さすが、我が認めた≪瞳≫を持つ者だわ","...... Hmmm...that saying is the untrue truth!
You are indeed the one with the ""eyes"" that I recognized."
"Idolchr_0201_A_07_00_054(0)","蘭子ログ","（はい♪　プロデューサーの言う通りですね！）","（Â Yes, the producer is right!)"
"Idolchr_0201_A_07_00_055(0)","Ｐ","ま、そんな考えすぎは良くないってことだな。
そうだ、時間もあるし喫茶店でも寄っていくか？","Well, I guess that's why it's not a good idea to overthink things like that.
Oh yeah, we've got some time, maybe we can stop by a coffee shop?"
"Idolchr_0201_A_07_00_056(0)","蘭子","フフフ……。我が精神を蝕む厄災からの解放！
ヴァルキュリアの蜜を持てい！","Hmph.............free from the evil plagues that have corroded my spirit!
Have some Valkyrian nectar!"
"Idolchr_0201_A_07_00_057(0)","蘭子ログ","（ホントですか♪
わーい、オシャレなカフェに行きたいでーす♪）","（Really?
Yay, I want to go to a fashionable cafe!)"
"Idolchr_0201_A_07_00_058(0)","Ｐ","じゃあ、近くの喫茶店でいいか？
蘭子が好きなお店、近くにあったよな","Well, can we go to a nearby coffee shop?
I remember a restaurant nearby that Ranko liked to go to."
"Idolchr_0201_A_07_00_059(0)","蘭子","うむ。
我が友は、刻に我のエーテルを満たしてくれる……","Mm.
My friends fill my ether at every moment ......"
"Idolchr_0201_A_07_00_060(0)","蘭子ログ","（はい、ありがとうございます。
すっごく嬉しい……です）","(Yes, thank you.
(I'm so happy ......)"
"Idolchr_0201_A_07_00_061(0)","蘭子","あ、あの……","Oh, um, ......"
"Idolchr_0201_A_07_00_062(0)","Ｐ","ん、どうした蘭子。
どこか、行きたいお店でもあるのか？","Hmm, what's the matter, Ranko?
Is there some place, some restaurant you want to go?"
"Idolchr_0201_A_07_00_063(0)","蘭子","い、いや。そうじゃないわ！","No, no!"
"Idolchr_0201_A_07_00_064(0)","蘭子ログ","（い、いえ。そうじゃなくて……！）","(Yes, no, that's not what I meant. ......!)"
"Idolchr_0201_A_07_00_065(0)","蘭子","あ、あの……。プロデューサー……。
ありがとう、ございます……！","Oh, that ....... Producer .......
Thank you, thank you. ......"
"Idolchr_0201_A_07_00_066(0)","Ｐ","……えっ？","...... eh?"
"Idolchr_0201_A_07_00_067(0)","蘭子","い、いえ……。
い、今のは……！　あうぅ……","Yes, no, .......
Yes, that was ......! Ahhh ......"
"Idolchr_0201_A_07_00_068(0)","蘭子","コホン……。我が友よ！
今の我が言霊は忘れるがよい……！","Cohon ....... My friends!
Forget my words now: ......!"
"Idolchr_0201_A_07_00_069(0)","蘭子ログ","（何でもありません。気にしないでください！）","(It's nothing, don't worry about it!)"
"Idolchr_0201_A_07_00_070(0)","Ｐ","忘れた方がいいのなら、そうするけど……","If I should forget about it, I will. ......"
"Idolchr_0201_A_07_00_071(0)","Ｐ","でも、いつもの蘭子の言葉も魅力的だけど、
素直な言葉を聞けるのも、なんだか嬉しいな","But the usual words of Ranko are fascinating, too,
It's kind of nice to hear honest words."
"Idolchr_0201_A_07_00_072(0)","蘭子","う、嬉しい……！？
そ、そんなこと言われても……。あうぅ～","Ugh, I'm so glad ......!
Well, that's what they say at ....... Augh~!"
"Idolchr_0201_A_08_00_001(0)","Ｐ","（おっ、あの姿は蘭子だな……そうだ！
前に悩んでいたから、少し元気が出るように……）","(Whoa, that's Ranko looking like that. ...... Yeah!
(......) to cheer you up a bit because you were struggling before."
"Idolchr_0201_A_08_00_002(0)","Ｐ","おーい、蘭子","Hey, Ranko."
"Idolchr_0201_A_08_00_003(0)","蘭子","あっ……。
ぷ、プロデューサー……","Oh, .......
P, Producer ......"
"Idolchr_0201_A_08_00_004(0)","Ｐ","えっと……。『闇に飲まれよ、蘭子！』
で、あっていたよな……？","Let's see, ....... ""Drink to the Darkness, Ranko!""
And you were right, weren't you ......?"
"Idolchr_0201_A_08_00_005(0)","蘭子","お、お疲れ様です……！","Oh, thanks for your help. ......"
"Idolchr_0201_A_08_00_006(0)","Ｐ","……えっ？","...... eh?"
"Idolchr_0201_A_08_00_007(0)","蘭子","……えっ？","...... eh?"
"Idolchr_0201_A_08_00_008(0)","蘭子","わ、我が友よ！
や、闇の言葉を操るとは何事……！","Wow, my friend!
Ya, what's with the manipulation of the language of darkness. ......"
"Idolchr_0201_A_08_00_009(0)","蘭子ログ","（ぷ、プロデューサー……！
急にどうしたんですか～！）","(P, producer ......!
(What's up with you all of a sudden~!)"
"Idolchr_0201_A_08_00_010(0)","Ｐ","いや、蘭子の言葉であいさつするのも、
悪くないかなって思ったんだけど","No, nor greet in the language of the orchid,
I thought it wasn't so bad."
"Idolchr_0201_A_08_00_011(0)","Ｐ","というか、蘭子の方こそ……","Or rather, it's the orchid that's ......"
"Idolchr_0201_A_08_00_012(0)","蘭子","い、今のはほんの気まぐれ……。
堕天使の小休止！　意味などないわ……！","Yes, that was just a whim. ......
Pause for Fallen Angels! There's no such thing as meaning. ......"
"Idolchr_0201_A_08_00_013(0)","蘭子ログ","（い、今のは何となく言ってみただけです！
気にしないでください～！）","(Yes, that was just something I said!
(Never mind~!)"
"Idolchr_0201_A_08_00_014(0)","蘭子","我が友こそ、知らぬ間に、
闇の言葉を習得していたとは……！","My friends are the ones who do not know,
I didn't realize I had mastered the language of darkness. ......"
"Idolchr_0201_A_08_00_015(0)","蘭子ログ","（プロデューサーこそ、
いつの間に私の言葉を覚えてくれたんですか～）","(The producer is the one,
When did you learn my language~)"
"Idolchr_0201_A_08_00_016(0)","Ｐ","うーん、蘭子のよく使う言葉を
真似てみただけで、習得ってほどではないかな","Hmmm... the words that Ranko often uses.
I guess I'm just trying to imitate, but not so much learn."
"Idolchr_0201_A_08_00_017(0)","蘭子","さすが≪瞳≫の持ち主よ！
意のままに闇の言葉を操れる、と……","You are indeed the owner of the ""Eye""!
You can control the language of darkness at will, and ......"
"Idolchr_0201_A_08_00_018(0)","蘭子ログ","（自然と闇の言葉を使えるなんて、
さすがプロデューサーです♪）","(I can't believe I can use the language of darkness naturally,
â™"" (That's what I'm talking about... a producer.)"
"Idolchr_0201_A_08_00_019(0)","Ｐ","多分こういう意味だろう、ってくらいだから、
褒めてもらえるようなことでもないと思うぞ","It's so much like, ""Maybe this is what it means,
I don't think that's something you're going to get a lot of credit for."
"Idolchr_0201_A_08_00_020(0)","蘭子","謙遜することはない……！
理性の鳥籠に幽閉されし、≪瞳≫が覚醒する兆候だわ","Don't be modest. ......
It's a sign that the ""eye"" imprisoned in the birdcage of reason is awakening."
"Idolchr_0201_A_08_00_021(0)","蘭子ログ","（プロデューサーにも、私の言葉が
分かるようになってきたってことですよ～！）","(My word to the producer as well.
(It means I'm starting to understand~!)"
"Idolchr_0201_A_08_00_022(0)","Ｐ","……やっぱり、蘭子の言葉は少し難しいな。
俺の読解力が無いだけだと思うけど","...... I still find Ranko's language a bit difficult.
I guess I just don't read well enough."
"Idolchr_0201_A_08_00_023(0)","Ｐ","難しい魔術書を読んでいるだけあって、
蘭子はいろんな言葉を知っているな","I'm just reading a difficult book on witchcraft,
Ranko knows a lot of words."
"Idolchr_0201_A_08_00_024(0)","蘭子","ククク……我が友よ。どうやらひとつ、
大いなる過ちを犯しているようね","Kukuk...... my friend, apparently one,
Looks like you're making a big mistake."
"Idolchr_0201_A_08_00_025(0)","蘭子ログ","（え～っと……プロデューサー。
ひとつ大きな勘違いをしてるみたいですね）","(Let's see... ...... Producer.
(I think you're making one big mistake.)"
"Idolchr_0201_A_08_00_026(0)","蘭子","確かに、魔術書は我が言霊を強くしてくれる。
しかし、闇の言葉は徒に発するものではないわ","Indeed, the book of magic strengthens my words.
But words of darkness aren't meant to be uttered in vain."
"Idolchr_0201_A_08_00_027(0)","蘭子ログ","（魔術書から素敵な言葉を引用していますが、
適当に言っているわけじゃないんですよ～）","(Although I am quoting a nice quote from a book on witchcraft,
(I'm not saying this in a random way~)"
"Idolchr_0201_A_08_00_028(0)","蘭子","フッフッフ……！　≪瞳≫を持つ者であれば、
何処から闇の言葉が創造されるか分かる……はず","If you are a person with ""eyes"",
You can see where the dark language is created from: ...... should"
"Idolchr_0201_A_08_00_029(0)","蘭子ログ","（プロデューサーなら、闇の言葉がどこから
生まれてくるかわかりますよね♪）","(If you are a producer, where did the dark words come from?
♪ You know you're going to be born ♪)"
"Idolchr_0201_A_08_00_030(0)","蘭子","我が友よ！
闇の言葉が生成されるのは何処か！？","My friends!
Where are the dark words generated!"
"Idolchr_0201_A_08_00_031(0)","蘭子ログ","（ふふ♪　どこから闇の言葉が生まれてくるか、
当ててみてください～♪）","(Hmmm...where do the dark words come from?
Let me guess~♪)"
"Idolchr_0201_A_08_00_032(0)","Ｐ","えっ、蘭子の言葉の出所――ってことか？
そうだな。だとすると……","What, you mean the source of Ranko's words--?
Yes, if that's the case: ......"
"Idolchr_0201_A_08_00_033(0)","タッチ","胸に触る","feel one's way (with one's heart)"
"Idolchr_0201_A_08_00_034(0)","タッチ","頭に触る","touch (a person) on the head"
"Idolchr_0201_A_08_00_035(0)","タッチ","顔に触る","touch someone's face"
"Idolchr_0201_A_08_00_036(0)","タッチ","時間切れ","time-out"
"Idolchr_0201_A_08_00_037(0)","蘭子","うむ。さすが≪瞳≫を持つ者。我が闇の言葉が
どこから出ずるのか、気づいているようね","As expected of the one who has the Eyes, my words of darkness.
I see you've noticed where I'm coming from."
"Idolchr_0201_A_08_00_038(0)","蘭子ログ","（さすが、プロデューサー！　正解です♪）","（You're right, producer!)"
"Idolchr_0201_A_08_00_039(0)","蘭子","そう！　闇の言葉は我が魂……。
すなわち！　心の深淵から発せられるもの！","Yes! The language of darkness is my soul .......
That which emanates from the depths of the heart!"
"Idolchr_0201_A_08_00_040(0)","蘭子ログ","（私の言葉は、
心の奥底から湧いて出てくるんです！）","(My words,
(It comes from deep within!)"
"Idolchr_0201_A_08_00_041(0)","蘭子","故に我が友が、闇の言葉に戸惑うのも無理はないわ","So it's no wonder my friend is confused by the words of darkness."
"Idolchr_0201_A_08_00_042(0)","蘭子ログ","（なので、プロデューサーが私の言葉が
分からないのは、仕方ないと思います）","(So, if the producer says that my words are
(I don't know, I guess I don't blame you.)"
"Idolchr_0201_A_08_00_043(0)","蘭子","ククク、そう焦らずとも、我と共に
覇道を行けばやがて共鳴の刻は来るだろう！","Kukuku, don't be in such a hurry.
If we take the high road, the time of resonance will eventually come!"
"Idolchr_0201_A_08_00_044(0)","蘭子ログ","（あの……。これからも私と一緒に活動していけば、
いつか分かってもらえると思います！）","(That ....... If you continue to work with me,
I'm sure someday you'll understand!)"
"Idolchr_0201_A_08_00_045(0)","蘭子","我が叡智の回廊によって、
闇の言葉が生まれている、と","By the corridors of My wisdom,
A dark language is being created, and"
"Idolchr_0201_A_08_00_046(0)","蘭子ログ","（えっと……私の頭の中で、
生まれてるって言いたいんですね）","(Let's see, ...... in my head,
(You want to say ""born."")"
"Idolchr_0201_A_08_00_047(0)","蘭子","ククク……。誤謬とまでは言わぬが、
≪瞳≫の覚醒とまではいかないようね","Kukuk ....... I wouldn't go so far as to call it a fallacy,
≪It doesn't seem to be an awakening of the ""eye."
"Idolchr_0201_A_08_00_048(0)","蘭子ログ","（う～ん、惜しいです！）","(Hmmm, that's a close one!)"
"Idolchr_0201_A_08_00_049(0)","蘭子","魔術書は知徳を授けてくれるが、
あくまでそれは知徳にすぎぬ！","The book of magic, though, bestows knowledge and virtue,
It is only knowledge and virtue!"
"Idolchr_0201_A_08_00_050(0)","蘭子ログ","（魔術書からいろんなことを勉強していますけど、
それは魔術書から得たもの……）","(I study a lot of things from magic books, though,
(That's what I got from a magic book: ......)"
"Idolchr_0201_A_08_00_051(0)","蘭子","我が言霊は魂によって創造される、我が化身！","My words are created by the soul, My incarnation!"
"Idolchr_0201_A_08_00_052(0)","蘭子ログ","（私の言葉は心から生まれるんです！）","(My words come from the heart!)"
"Idolchr_0201_A_08_00_053(0)","蘭子","んぐっ……！
わ、我が口から言霊が創造される……と？","Ngugu ......!
Wow, with ...... that words are created from my mouth?"
"Idolchr_0201_A_08_00_054(0)","蘭子ログ","（ん～、今口を触りましたね～？）","(Hmmm, you just touched your mouth, didn't you?)"
"Idolchr_0201_A_08_00_055(0)","Ｐ","いや、言葉だから、
普通に口から出てるのかなって……","No, it's a word,
I was just wondering if it comes out of your mouth normally. ......"
"Idolchr_0201_A_08_00_056(0)","蘭子","我が闇の言葉は口先だけの言霊ではない！
魂から創造される、我が化身！","The words of our darkness are not just words of mouth!
My incarnation, created from the soul!"
"Idolchr_0201_A_08_00_057(0)","蘭子ログ","（私の闇の言葉は、
心の底から生まれてくるんですよ～）","(My dark words are,
(It's born from the bottom of your heart~)"
"Idolchr_0201_A_08_00_058(0)","蘭子","どうした、我が友よ。
なにを子羊のように迷っている","What is it, my friend?
What are you lost as a lamb?"
"Idolchr_0201_A_08_00_059(0)","蘭子ログ","（どうしたんですか、プロデューサー？）","(What's wrong, producer?)"
"Idolchr_0201_A_08_00_060(0)","Ｐ","いや、さっぱり分からなくて……","No, I have no idea. ......"
"Idolchr_0201_A_08_00_061(0)","蘭子","≪瞳≫を持つ者ならば分かると思ったが……。
どうやら、我の見当違いだったようね……","≪I thought anyone with ""eyes"" would understand. ......
Looks like I was wrong. ......"
"Idolchr_0201_A_08_00_062(0)","蘭子ログ","（残念です……。プロデューサーなら
分かってくれると思ったんですけど～）","(Too bad ....... If you are a producer.
I thought you would understand.)"
"Idolchr_0201_A_08_00_063(0)","蘭子","ククク……。ならば教えるとしよう。
我が言霊は魂より創造されし、我が化身！","Kukuku ....... Then I will tell you.
My words are created from my soul, my incarnation!"
"Idolchr_0201_A_08_00_064(0)","蘭子ログ","（正解は私の心から生まれてくる！　でした～）","(The correct answer was ""Born from my heart!"")"
"Idolchr_0201_A_08_00_065(0)","Ｐ","……なるほどね。蘭子が難しい言葉を、
スラスラ話せる理由がなんとなく分かったよ","...... I see...Ranko is a difficult word,
I kind of understand why you can talk so sloooooowly."
"Idolchr_0201_A_08_00_066(0)","Ｐ","でも、蘭子の言葉は面白いけど、普通の言葉で
挨拶するのも新鮮な感じがして良かったな","But the language of the orchid is interesting, but in ordinary language.
It was nice to say hello to you, and it was nice to feel fresh."
"Idolchr_0201_A_08_00_067(0)","蘭子","うぅ……！　さ、さっきのは……！","Ugh ......! Well, that was just ......!"
"Idolchr_0201_A_08_00_068(0)","蘭子","闇のベールを纏わぬ言霊も、
また一興だと言っていたが故……","And words that do not wear a veil of darkness,
She said it's another one of those things that's fun, but it's not the same thing, hence ......"
"Idolchr_0201_A_08_00_069(0)","蘭子ログ","（この前、プロデューサーが私の素直な言葉を聞けて
嬉しいって言ってくれたから……）","(Last time a producer could hear my honest words.
(......) because he said he was so happy."
"Idolchr_0201_A_08_00_070(0)","蘭子","い、否！　≪瞳≫を持つ者への共鳴を、
自ら閉ざそうとするとは……。何たる愚行！","No, no! Resonance for those who have ""eyes"",
What a folly to try to close it yourself. ......!"
"Idolchr_0201_A_08_00_071(0)","蘭子ログ","（で、でも……。プロデューサーが、
せっかく私の言葉を理解し始めてくれたのに……）","(So, but ....... the producer,
(After all the trouble I went through to begin to understand my language: ......)"
