"id","character","source","translatedstr"
"Idolchr_0304_A_03_00_045(0)","紬","しばらく、事務所に置いておくだけですけど。
それでよろしければ……","I'm just going to leave it in my office for a while.
If that's all right with you, ......"
"Idolchr_0304_A_03_00_046(0)","Ｐ","ああ。紬が三味線を持ってきてくれるのを、
楽しみにしているよ","Oh, to have Tsumugi bring me a shamisen,"
"Idolchr_0304_A_04_00_001(0)","Ｐ","（紬がレッスンスタジオに通いつめて、
自主レッスンをしていると聞いて来てみたが……）","(Tsumugi went to the lesson studio,"
"Idolchr_0304_A_04_00_002(0)","紬","ふぅ……。やっぱり、うまくできん……。
もう一度、最初から……","Phew. ....... I still can't get it right. .......
Again, from the beginning: ......"
"Idolchr_0304_A_04_00_003(0)","Ｐ","（……ずいぶんと深刻そうだな）","(...... sounds pretty serious)"
"Idolchr_0304_A_04_00_004(0)","Ｐ","紬、頑張ってるな！","You're doing a great job, Tsumugi!"
"Idolchr_0304_A_04_00_005(0)","紬","きゃっ！？　……ぷ、プロデューサー！
ど、どこから入ってきたのですか！","Kya! ...... pu, producer!
Where did you come in?"
"Idolchr_0304_A_04_00_006(0)","Ｐ","い、入口だけど……
ど、どうかしたのか？","Yes, it's an entrance, but ......
What's wrong?"
"Idolchr_0304_A_04_00_007(0)","紬","……急に声をかけられて驚いただけです。
それに、今はレッスンに集中していましたから","...... I was just surprised to be approached so suddenly.
Besides, I was concentrating on my lessons now."
"Idolchr_0304_A_04_00_008(0)","Ｐ","す、すまなかった……。
しかし、あまり根を詰めすぎるのもよくないぞ","Sorry, sorry. ......
But don't put too much root into it."
"Idolchr_0304_A_04_00_009(0)","紬","……いいえ、私はまだまだです。
歌もダンスも、たくさんのことを覚えないと……","...... No, I am not there yet.
I need to learn a lot of singing and dancing. ......"
"Idolchr_0304_A_04_00_010(0)","Ｐ","……なあ、紬。
寝る子は育つって知ってるか？","...... Hey, pongee.
You know what they say, a child who sleeps grows up?"
"Idolchr_0304_A_04_00_011(0)","紬","え？　はい。
もちろん知っていますが……","What? Yes.
I know of course, but ......"
"Idolchr_0304_A_04_00_012(0)","Ｐ","い、いや……純粋に意味を聞いただけだ。
……寝ている間に子どもは大きくなるってことだ","No, no, ...... I was purely asking what it meant.
It's just that kids grow up while ...... they sleep."
"Idolchr_0304_A_04_00_013(0)","Ｐ","同じように、アイドルも休息を取ることで
成長すると思わないか？","In the same way, idols can also take a break from
Don't you think it will grow?"
"Idolchr_0304_A_04_00_014(0)","紬","あの……？","That ......?"
"Idolchr_0304_A_04_00_015(0)","Ｐ","紬はずいぶんとレッスンに精を出しているよな","Tsumugi has been working very hard on her lessons, hasn't he?"
"Idolchr_0304_A_04_00_016(0)","Ｐ","だからこそ、
成長のためには休むことも大切だと思うんだ","That's why,
I think it's important to rest for growth."
"Idolchr_0304_A_04_00_017(0)","紬","……分かりました","...... Got it."
"Idolchr_0304_A_04_00_018(0)","紬","……ですが、アイドルの休みというのは、
具体的になにをすればよいのでしょうか？","It is ......, but it is called Idol's Holiday,
What exactly do I need to do?"
"Idolchr_0304_A_04_00_019(0)","Ｐ","（紬には単純に休めと言っても伝わらないよな……。
そうだな、アイドルの休日といえば……）","(You can't simply tell Tsumugi to take a break. ......
Yes, speaking of idle holidays (......)"
"Idolchr_0304_A_04_00_020(0)","選択肢","森林浴","being immersed in a forest"
"Idolchr_0304_A_04_00_021(0)","選択肢","スイーツめぐり","sweets tour"
"Idolchr_0304_A_04_00_022(0)","選択肢","部屋で休む","Rest in your room"
"Idolchr_0304_A_04_00_023(0)","Ｐ","森林浴なんていいんじゃないか。たまに
大きな自然に触れることで、気分転換にもなるだろう","Forest bathing is a good idea...sometimes.
A touch of the great outdoors would be a nice change of pace!"
"Idolchr_0304_A_04_00_024(0)","紬","そうですね……。庭園を散策するのは好きですから。
松を見て巡るのも、森林浴のようなものかと……","Yes, ......, because I love to stroll through the gardens.
I thought going around looking at the pine trees would be like taking a walk in the forest. ......"
"Idolchr_0304_A_04_00_025(0)","Ｐ","ああ、そうだな。
庭園の散策なんて、最高の気晴らしになると思うぞ","
I think a stroll through the gardens would be the perfect distraction!"
"Idolchr_0304_A_04_00_026(0)","紬","はい、事務所からでも行ける、お気に入りの
庭園があるので伺ってみることにします","Yes, I can go from my office, my favorite.
I have a garden to visit."
"Idolchr_0304_A_04_00_027(0)","Ｐ","スイーツのお店を巡ってＳＮＳに投稿したら、
アイドルらしい休日っぽくないか？","If you visit a sweets store and post on social networking sites,
Isn't that a bit like an idol-esque holiday?"
"Idolchr_0304_A_04_00_028(0)","紬","そうですね……甘味処を巡るのは好きですから、
そういった休日の過ごし方なら、私にもできそうです","Yes, ...... because I like to visit sweet shops,
I think I can do that kind of holiday!"
"Idolchr_0304_A_04_00_029(0)","Ｐ","甘味処か、紬らしくていいな。ルミナスにも、
スイーツに詳しい子が多いし、一緒に行ったらどうだ","Sweet shop, or maybe it's just like pongee....and luminous,
Many of the girls know a lot about sweets. Why don't you go with them?"
"Idolchr_0304_A_04_00_030(0)","紬","はい、それも良いかと思います。
おすすめのお店の情報交換とかもしていますし……","Yes, I think that would be good too.
We also exchange information on recommended restaurants and ......"
"Idolchr_0304_A_04_00_031(0)","Ｐ","部屋でゆっくりするのはどうだ？","Why don't you relax in your room?"
"Idolchr_0304_A_04_00_032(0)","紬","……部屋でゆっくりとは、
より多くの睡眠を取れということでしょうか？","What is ...... relaxing in your room?
Does this mean we should get more sleep?"
"Idolchr_0304_A_04_00_033(0)","Ｐ","寝る以外にも部屋での楽しみ方はあると思うぞ。
宅配のピザを食べるとか、掃除をするとか","I'm sure there are other ways to have fun in your room besides sleeping.
Eating pizza for delivery, or cleaning the house."
"Idolchr_0304_A_04_00_034(0)","紬","……それはプロデューサーの、
休日の過ごし方なのではありませんか？","...... it's the producer's,
Isn't that how you spend your holidays?"
"Idolchr_0304_A_04_00_035(0)","Ｐ","た、確かに、そうかも……。でも、たまには
そういう休日を過ごすのも悪くないと思うぞ！","Ta, sure, maybe so. ....... But sometimes...
I don't think it's a bad idea to have a holiday like that!"
"Idolchr_0304_A_04_00_036(0)","紬","……ただ、今はルミナスの活動を優先する
つもりなので、いつになるかわかりません","...... but for now, the priority is the activities of Luminous
I don't know when that will be."
"Idolchr_0304_A_04_00_037(0)","紬","ですが、今はルミナスの活動を優先するつもりです。
休日だからといって、時間を無駄にはできません","However, I intend to prioritize Luminous activities for now.
Just because it's a holiday doesn't mean you can waste your time!"
"Idolchr_0304_A_04_00_038(0)","Ｐ","……なあ、紬。
もう少し、気楽に考えたらどうかな？","...... Hey, pongee.
Why don't you take it a little easier on yourself?"
"Idolchr_0304_A_04_00_039(0)","紬","気楽に考える……。今の私の話を聞いていましたか？
そんな悠長なことをしている場合ではありません","Take it easy ....... Did you hear what I just said?
This is not the time for such leisurely activities."
"Idolchr_0304_A_04_00_040(0)","Ｐ","そうか……それじゃ、一緒に休むか。
俺と一緒なら、それも仕事のうちに入るだろ","Well, ...... then, let's rest together.
If you're with me, that's part of the job."
"Idolchr_0304_A_04_00_041(0)","紬","ふたりで休むのが……仕事ですか？","Is it a ...... job for the two of you to take a break?"
"Idolchr_0304_A_04_00_042(0)","Ｐ","成長のための休息だ。
仕事ってことでもいいんじゃないか？","It's a rest for growth.
It could mean work, right?"
"Idolchr_0304_A_04_00_043(0)","紬","あなたという方は……。
どこまでも気楽な性質で、うらやましいことです","The person named you can be reached at .......
I am envious of your endlessly easy-going nature."
"Idolchr_0304_A_05_00_001(0)","Ｐ","（紬に正しい休息の取り方を教えるため、
カフェに誘ってみたが……）","(To teach Tsumugi how to rest properly,
(I invited him to a cafe. ......)"
"Idolchr_0304_A_05_00_002(0)","紬","……プロデューサー。
なぜ、ここに来たのですか……","...... producer.
Why did you come here: ......"
"Idolchr_0304_A_05_00_003(0)","Ｐ","なぜと言われても……。
カフェに来ることに、なにか問題あるかな？","If you're asking why, please visit .......
Is there something wrong with coming to a cafe?"
"Idolchr_0304_A_05_00_004(0)","紬","カフェに問題があるとは思いません。
ただ……","I don't think there is a problem with the cafe.
Just ......"
"Idolchr_0304_A_05_00_005(0)","Ｐ","この前、アイドルは休むのも大事って話したよな。
とりあえず、近場で体験してもらおうと思って","I told you the other day that it's important for idols to rest.
In the meantime, I thought I'd give you an experience in the neighborhood."
"Idolchr_0304_A_05_00_006(0)","紬","……それで、私にカフェで休めというのですか","...... and you want me to rest in a cafe?"
"Idolchr_0304_A_05_00_007(0)","Ｐ","まあ……そういうのも悪くないと思うんだけど、
ダメかな？","Well, ...... I don't think that kind of thing is a bad idea,
No?"
"Idolchr_0304_A_05_00_008(0)","紬","みなさんがレッスンしている時間に、
私だけ休んでいる場合ではないと思うのですが……","At the time when everyone is having lessons,
I don't think I'm the only one taking a break. ......"
"Idolchr_0304_A_05_00_009(0)","Ｐ","紬はそういうけど、
俺はそうは思わないな","That's what Tsumugi says,
I don't think so."
"Idolchr_0304_A_05_00_010(0)","紬","……なぜですか？","...... Why?"
"Idolchr_0304_A_05_00_011(0)","Ｐ","見ていてわかるんだよ。
俺は紬のプロデューサーだから","I know it when I see it.
I'm a producer of pongee."
"Idolchr_0304_A_05_00_012(0)","紬","……う、うちを見てる……？","......U, are you looking at our ......?"
"Idolchr_0304_A_05_00_013(0)","Ｐ","ああ、アイドルが気づいていないことに、
目を配るのもプロデューサーの仕事なんだ","Oh, that the idol is unaware,
It's the producer's job to keep an eye on things."
"Idolchr_0304_A_05_00_014(0)","紬","私が気づいていないこと……。
……それで、私になにをしろというのですか？","What I haven't noticed: .......
...... So what do you want me to do?"
"Idolchr_0304_A_05_00_015(0)","Ｐ","折角カフェに来たんだ、
なにか食べてゆっくりしよう","I came to the café at the right time,
Let's get something to eat and relax."
"Idolchr_0304_A_05_00_016(0)","Ｐ","これがメニューだけど、
スイーツが充実しているみたいだ。お勧めなのは……","This is the menu, though,
They seem to have a good selection of sweets, I recommend ......"
"Idolchr_0304_A_05_00_017(0)","選択肢","抹茶ぜんざい","green tea zenzai"
"Idolchr_0304_A_05_00_018(0)","選択肢","アイスモナカ","iced monaca"
"Idolchr_0304_A_05_00_019(0)","選択肢","チョコレートパフェ","chocolate parfait"
"Idolchr_0304_A_05_00_020(0)","選択肢","ダブルハンバーガー","double hamburger"
"Idolchr_0304_A_05_00_021(0)","Ｐ","抹茶ぜんざいなんてどうだ？","How about some green tea zenzai?"
"Idolchr_0304_A_05_00_022(0)","紬","抹茶ぜんざい……すごくおいしそうですね。
濃厚な抹茶に浮かぶ、ほどよい甘さの白玉……","Matcha Zenzai ...... looks so delicious.
A moderately sweet shiratama floating in rich matcha green tea. ......"
"Idolchr_0304_A_05_00_023(0)","紬","粒あんのトッピングと、添えられたサクランボ……。
和の素材が集まった、和スイーツの定番ですね","Topped with grains of sweet bean paste and served with cherries. ......
It's a classic Japanese sweet with a collection of Japanese ingredients."
"Idolchr_0304_A_05_00_024(0)","Ｐ","おお、さすが紬……。
甘味の話になると活き活きとするな","Oh, as expected, .......
You're so lively when you talk about sweetness."
"Idolchr_0304_A_05_00_025(0)","紬","わ、私はただ、プロデューサーに勧められたものの、
感想を述べただけです……！","Wow, I just, although the producer recommended it,
I was just expressing my opinion. ......"
"Idolchr_0304_A_05_00_026(0)","紬","……せっかくですから、抹茶ぜんざいにします。
プロデューサーのお勧めを無下にもできませんから","...... Since we are here, I will make green tea zenzai.
I can't turn down a producer's recommendation."
"Idolchr_0304_A_05_00_027(0)","Ｐ","アイスモナカなんてどうだ？　あんこも入っていて、
アイスとのハーモニーが美味しそうだぞ","How about an ice cream monaka, with some anko (sweet bean paste) in it?
You're going to love the harmony with the ice cream."
"Idolchr_0304_A_05_00_028(0)","紬","和と洋のハーモニーですか……。
はい、とても気になります","Is it a harmony of Japanese and Western styles? ......
Yes, I'm very curious."
"Idolchr_0304_A_05_00_029(0)","Ｐ","それはよかった。
紬なら気に入ってくれるんじゃないかと思ったんだ","That was good.
I thought Tsumugi would like it."
"Idolchr_0304_A_05_00_030(0)","紬","……甘味は好きですから。ですが、
他にもおいしそうな甘味がありそうです……","...... because I like sweetness,
There may be other delicious sweet treats: ......"
"Idolchr_0304_A_05_00_031(0)","Ｐ","ああ、好きなものを頼むといい。
はい、メニュー","Oh, you can order whatever you like.
Yes, menu"
"Idolchr_0304_A_05_00_032(0)","紬","……ありがとうございます。
では、こちらを……","
Now, here's the ......"
"Idolchr_0304_A_05_00_033(0)","Ｐ","スイーツといえば、
王道のチョコレートパフェなんかどうだ？","Speaking of sweets,
How about a chocolate parfait?"
"Idolchr_0304_A_05_00_034(0)","紬","おいしそうなチョコレートパフェですね。
ただ、他に気になるメニューが……","That looks like a delicious chocolate parfait.
However, there is another menu item that I'm interested in: ......"
"Idolchr_0304_A_05_00_035(0)","Ｐ","そうなのか？","Is that so?"
"Idolchr_0304_A_05_00_036(0)","紬","はい……。
今は和のスイーツにしようかと……","
Now I'm thinking of making Japanese sweets: ......"
"Idolchr_0304_A_05_00_037(0)","Ｐ","そうだったのか……。それなら好きなものを
頼むといい。はい、メニュー","I didn't know that. ....... Then I like it.
Yes, the menu."
"Idolchr_0304_A_05_00_038(0)","紬","……ありがとうございます。
では、こちらを……","
Now, here's the ......"
"Idolchr_0304_A_05_00_039(0)","Ｐ","スイーツじゃなくて、ハンバーガーにするか？
それもダブルの大盛りのやつ","Would you like to have a hamburger instead of a sweet?
And a double large one at that."
"Idolchr_0304_A_05_00_040(0)","紬","大盛りのハンバーガー……あなたはバカなのですか！
スイーツがお勧めと言ったはずでは？","Large hamburger ...... are you an idiot?
Didn't I say that sweets were recommended?"
"Idolchr_0304_A_05_00_041(0)","Ｐ","ん？　もしかして、今のはダジャレ……？","Hmm? Perhaps that was a pun ......?"
"Idolchr_0304_A_05_00_042(0)","紬","……バカ……バーガー……！
だ、駄洒落なんかではありませんっ！　","...... stupid ...... burger ......!
No, it's not a pun!"
"Idolchr_0304_A_05_00_043(0)","紬","はぁ……。さっき、メニューに
甘味が見えたので、私はそれを……","Huh. ....... I just went to the menu.
I could see the sweetness in it, so I ......"
"Idolchr_0304_A_05_00_044(0)","Ｐ","ああ、好きなものを頼むといい。
はい、メニュー","Oh, you can order whatever you like.
Yes, menu"
"Idolchr_0304_A_05_00_045(0)","紬","……ありがとうございます。
では、こちらを……","
Now, here's the ......"
"Idolchr_0304_A_05_00_046(0)","紬","ふぅ……ごちそうさまでした","Phew ...... thanks for the food!"
"Idolchr_0304_A_05_00_051(0)","Ｐ","抹茶ぜんざい、おいしかったか？","Did you enjoy the matcha zenzai?"
"Idolchr_0304_A_05_00_052(0)","紬","はい。……すごく美味しかったです","Yes. ...... It was so delicious!"
"Idolchr_0304_A_05_00_047(0)","Ｐ","やっぱり、紬は
リラックスしているときのほうが、かわいいな","After all, pongee is
You're cuter when you're relaxed."
"Idolchr_0304_A_05_00_048(0)","紬","か、かわいい……！？　あ、あなたは、
急に私をからかって、なにが楽しいのですか？","Ka, cute ......! Oh, you,
What's the fun in suddenly making fun of me?"
"Idolchr_0304_A_05_00_053(0)","Ｐ","からかってるわけじゃないぞ。休憩することで、
心身を落ち着けることが大切だって話だ","I'm not kidding about taking a break,
I'm talking about calming your mind and body."
"Idolchr_0304_A_05_00_049(0)","紬","……いただいたものは、とてもおいしかったです。
ですが、それとこれとは話は別です！","The one we received from ...... was very good.
But that is not the same thing!"
"Idolchr_0304_A_05_00_050(0)","Ｐ","（ちょっと、天邪鬼な言い方だけど……。
さっきの笑顔が全てを物語っているな……）","(Hey, heaven forbid, .......
Your smile earlier says it all (......)."
"Idolchr_0304_A_06_00_001(0)","Ｐ","（紬がダンスレッスンスタジオで、
自主レッスンをしていると聞いてやって来た……）","(Tsumugi is a dance lesson studio,
(I came here when I heard you were giving a self-guided lesson: ......)"
"Idolchr_0304_A_06_00_002(0)","Ｐ","（最近は、前ほど無茶なレッスンはしなくなったと
聞いているけど……）","(Recently, he said, he doesn't give as many reckless lessons as he used to.
(I'm listening but ......)"
"Idolchr_0304_A_06_00_003(0)","紬","いち、に、さん、し……
いち、に、さん、し……ここで、ターン……！","One, Two, Three, Four ......
One, two, three, four ...... here, turn ......!"
"Idolchr_0304_A_06_00_004(0)","Ｐ","（……うん。
以前よりも、動きが良くなっている）","(...... yeah.
(It's moving better than it used to.)"
"Idolchr_0304_A_06_00_005(0)","Ｐ","自主レッスン、お疲れ様。
ずいぶん熱心にやってるみたいだな","Thanks for the voluntary lesson.
You seem pretty dedicated to it."
"Idolchr_0304_A_06_00_006(0)","紬","あ……お疲れ様です……。
今日もまた、見学にいらしたのですか？","Oh ...... thanks for your help .......
Did you visit again today?"
"Idolchr_0304_A_06_00_007(0)","Ｐ","ああ、まあな。少し紬のことが
気になったから来てみたんだけど……","Yeah, well, I've been thinking about Tsumugi a little bit.
I came here because I was curious: ......"
"Idolchr_0304_A_06_00_008(0)","紬","気になること……ですか？
なにか用件があるのでしたら言ってください","Are you interested in ......?
Please let me know if there is something I can do for you."
"Idolchr_0304_A_06_00_009(0)","Ｐ","自主レッスンに励むのはいいけど、
あまり無理はしないようにな","I don't mind working hard on my independent lessons,
Don't take it too hard."
"Idolchr_0304_A_06_00_010(0)","紬","……心配していただき、ありがとうございます。
ですが、無理はしていません","Thank you for your concern about .......
But I'm not pushing it."
"Idolchr_0304_A_06_00_011(0)","Ｐ","分かっているのならいいんだけど……。
でも、息抜きも大事だってこと忘れないようにな","I hope you know what you're doing. ......
But don't forget that it's important to let off steam."
"Idolchr_0304_A_06_00_012(0)","紬","はい。休息の大切さは、
プロデューサーから教えていただきましたから……","Yes, the importance of rest,
Because the producer told me about it: ......"
"Idolchr_0304_A_06_00_013(0)","紬","あれ以来、日々のレッスンでも、
動きが軽くなってきたように思えます……","Since then, even in daily lessons,
The movement seems to be getting lighter: ......"
"Idolchr_0304_A_06_00_014(0)","Ｐ","ああ。さっきのレッスンを見ていて、
俺も同じように感じたよ","Yeah, I was watching the lesson earlier,
I felt the same way."
"Idolchr_0304_A_06_00_015(0)","紬","だからこそ、今は体を動かしておかないと
いけないのです……","That's why we need to get moving now.
You shouldn't: ......"
"Idolchr_0304_A_06_00_016(0)","Ｐ","うん？
どうしていけないんだ？","Hm?
Why not?"
"Idolchr_0304_A_06_00_017(0)","紬","え、えっと……。
そ、それはうちの……","Let's see, let's see. .......
Well, that's our ......"
"Idolchr_0304_A_06_00_018(0)","紬","と、とにかく私がレッスンに励むのは、
あなたにとっても、好都合なのではありませんか？","And anyway, I'm working hard on my lessons,
Wouldn't it be expedient for you as well?"
"Idolchr_0304_A_06_00_019(0)","Ｐ","俺にとっても好都合？
ますます、理由が分からなくなってきたが……","Is it good for me?
More and more, I'm not sure why, but ......"
"Idolchr_0304_A_06_00_020(0)","紬","う、うちのことは大丈夫なので、
放っておいてくれませんか？","U, we are fine with our house,
Will you leave me alone?"
"Idolchr_0304_A_06_00_021(0)","Ｐ","（放っておいてと言われてもな……。
俺が出来ることといえば……）","(Even if they tell you to leave them alone. ......
The best I can do is ......)"
"Idolchr_0304_A_06_00_022(0)","選択肢","見守る","watch over"
"Idolchr_0304_A_06_00_023(0)","選択肢","指導をする","Guidance."
"Idolchr_0304_A_06_00_024(0)","選択肢","一緒に
レッスンをする","together (with)
Lesson."
"Idolchr_0304_A_06_00_025(0)","Ｐ","いや、ちゃんと見守るよ。
紬を放っておくなんてできないからな","No, I'll look after it properly.
I can't just leave the pongee alone."
"Idolchr_0304_A_06_00_026(0)","紬","は、はい。分かりました。ですけど……。
ずっと見られているのは、何だか恥ずかしいです","Yes, I understand, but please visit .......
It's kind of embarrassing to be watched all the time."
"Idolchr_0304_A_06_00_027(0)","Ｐ","恥ずかしい？
いつもやっていることだと思うけど？","Embarrassed?
I guess that's what we always do, right?"
"Idolchr_0304_A_06_00_028(0)","紬","な、何でもありません……！
とにかく私は、レッスンを続けさせてもらいます！","Nah, it's nothing. ......
Anyway I will let the lesson continue!"
"Idolchr_0304_A_06_00_029(0)","Ｐ","そこまでレッスンに熱心なら、
俺が指導をしようか？","If you are that dedicated to your lessons,
You want me to give you some guidance?"
"Idolchr_0304_A_06_00_030(0)","紬","そ、それは結構です！　先ほどトレーナーさんから、
特別メニューを教えていただきましたので","Well, that's fine! From the trainer just now,
We were given a special menu to learn about."
"Idolchr_0304_A_06_00_031(0)","Ｐ","特別メニュー？
どんなメニューを組んでもらったんだ？","Special menu?
What kind of menu did you have them put together?"
"Idolchr_0304_A_06_00_032(0)","紬","ええっと、それは……と、とにかく！
私はレッスンに集中させてもらいます！","Um, it's ...... and anyway!
Let me concentrate on my lesson!"
"Idolchr_0304_A_06_00_033(0)","Ｐ","俺も一緒にレッスンをするぞ！","I'm going to give you a lesson with me!"
"Idolchr_0304_A_06_00_034(0)","紬","……無理をしないようにと、私に言いましたよね。
無理をしているのは、プロデューサーの方では？","You told me not to take it easy on .......
Isn't it the producer who is overreaching?"
"Idolchr_0304_A_06_00_035(0)","Ｐ","確かに。みんなが受けているようなレッスンを、
俺が出来るのか不安だな……","Sure...lessons like everyone else is getting,
I'm not sure I can do it. ......"
