"id","character","source","translatedstr"
"Idolchr_0107_B_20_05_015(0)","Ｐ","しかし、いいライバルができてよかったな。
それにもしかするとふたりも、練習しているかもな","But it's nice to have a good competitor.
And maybe they're both practicing, too."
"Idolchr_0107_B_20_05_016(0)","真美","うん、真美もゲーム仲間が増えてうれしいよーん♪
あれもこれもそれも兄ちゃんのおかげだね！","Yes, Mami is glad to have more friends in the game.
That, that, and that, all thanks to you, brother!"
"Idolchr_0107_B_20_05_017(0)","Ｐ","そんなこと言って……
またコンビニ限定の新しいお菓子でもでたのか？","Say that. ......
Is it another new candy only available at convenience stores?"
"Idolchr_0107_B_20_05_018(0)","真美","んっふっふ～、バレてしまいましたか！
限定チョコ、後で一緒に買いに行こうね、兄ちゃん♪","Hmmm...I guess they found out!
Limited edition chocolate, let's go buy some together later, brother♪"
"Idolchr_0107_B_20_06_001(0)","Ｐ","真美、そろそろ休憩時間はおしまいだぞ。
もう充分、ゲームやっただろ？","Mami, it's time for your break to end.
Haven't you played enough games already?"
"Idolchr_0107_B_20_06_002(0)","真美","見て、兄ちゃん！　クレーンゲームがあるよ！
帰る前に真美のために、なんか取っておくれ～ん♪","Look, brother! There's a crane game!
Please get something for Mami before you leave."
"Idolchr_0107_B_20_06_003(0)","Ｐ","仕方がないな。これをやったら帰るからな。
ええと、なににするかな……","I don't have a choice; I'll leave after I do this.
Let's see, what should it be: ......"
"Idolchr_0107_B_20_06_004(0)","選択肢","お菓子","sweets"
"Idolchr_0107_B_20_06_005(0)","選択肢","クッション","cushion"
"Idolchr_0107_B_20_06_006(0)","選択肢","カップ麺","cup noodle"
"Idolchr_0107_B_20_06_007(0)","Ｐ","真美！　お菓子の詰め合わせを狙うぞ","Mami! We're going for the assortment of sweets!"
"Idolchr_0107_B_20_06_008(0)","真美","兄ちゃん、ナイスターゲット！　事務所のモミアゲに
なるね！　あ、でも最初は真美にお菓子選ばせてね♪","Brother, nice target! To the momiage in the office.
Oh, but first let Mami choose the sweets."
"Idolchr_0107_B_20_06_009(0)","Ｐ","（よし！　すごく喜んでくれているな……！）","(Okay! You're making me very happy. ......!)"
"Idolchr_0107_B_20_06_010(0)","Ｐ","あの可愛いクッションはどうだ？","How about that pretty cushion?"
"Idolchr_0107_B_20_06_011(0)","真美","いいね～！　事務所のソファーに合いそうだし、
お昼寝用の枕にもなりそう～","I like it! It looks like it would go well with the sofa in my office,
It would also make a great nap pillow~!"
"Idolchr_0107_B_20_06_012(0)","Ｐ","（ふう、どうやら喜んでくれたみたいだ）","(Phew, apparently she's pleased.)"
"Idolchr_0107_B_20_06_013(0)","Ｐ","カップ麺はどうだ？","How about a cup of noodles?"
"Idolchr_0107_B_20_06_014(0)","真美","兄ちゃん、それ真美のためじゃなくて、
自分のために取ろうとしてるっしょ！　ぶーぶー！","Brother, that's not for Mami,
You're trying to get it for yourself!"
"Idolchr_0107_B_20_06_015(0)","Ｐ","（うーん、あまり喜んでくれなかったみたいだ……）","(Hmmm, I don't think she was too happy about it. ......)"
"Idolchr_0107_B_20_07_001(0)","Ｐ","（ルミナスの中でどうやらモノマネが
流行っているらしい……）","(The moniker apparently in the luminous
(I hear it's going viral: ......)"
"Idolchr_0107_B_20_07_002(0)","真美","兄ちゃん！　真美の新しい決めポーズ見てちょ！
誰のマネか兄ちゃんに見破れますかなぁ？","Look at Mami's new pose!
I wonder if my brother will be able to spot whose impersonation it is?"
"Idolchr_0107_B_20_07_003(0)","Ｐ","ルミナスメンバーのモノマネか？
どれ、見せてくれ","Is this an impersonation of a luminous member?
Which one, let me see."
"Idolchr_0107_B_20_07_004(0)","真美","いっくよ～ん！","I'll be right back!"
"Idolchr_0107_B_20_07_005(0)","Ｐ","なるほど。そのポーズは……","I see...that pose is ......"
"Idolchr_0107_B_20_07_006(0)","選択肢","咲耶","Sakuya"
"Idolchr_0107_B_20_07_007(0)","選択肢","きらり","Kirari"
"Idolchr_0107_B_20_07_008(0)","選択肢","静香","Shizuka"
"Idolchr_0107_B_20_07_009(0)","Ｐ","咲耶の真似だろう？
どうだ？","You're copying Sakuya, aren't you?
What do you think?"
"Idolchr_0107_B_20_07_010(0)","真美","アタリだぴょーん♪　かっくいい王子ポーズどう？
真美の新たなミリキ、引き出せちゃったかなー♪","How about a nice Prince Charming pose?
I wonder if I've brought out the new Miriki in Mami..."
"Idolchr_0107_B_20_07_011(0)","Ｐ","（なるほど格好いいか……。
普段とは違った真美の魅力が出てるな）","(Is it cool enough for you? .......
(You're showing a different Mami's charm than usual.)"
"Idolchr_0107_B_20_07_012(0)","Ｐ","もしかしてきらりの真似か？","Could it be an imitation of Kirari?"
"Idolchr_0107_B_20_07_013(0)","真美","兄ちゃんは見る目がないなぁ。
きらりんは、もっと『うっきゃー☆』っしょ？","My brother is so blind to see.
Kirarin is more ""Ukkyo☆"", right?"
"Idolchr_0107_B_20_07_014(0)","Ｐ","（間違えたみたいだ……誰の真似だったんだろう）","(I think I made a mistake ...... who was I imitating)"
"Idolchr_0107_B_20_07_015(0)","Ｐ","もしかして静香の真似か？","Perhaps you are imitating Shizuka?"
"Idolchr_0107_B_20_07_016(0)","真美","あれ？　これが伝わらないなんて、
兄ちゃんって案外見る目、ないのかな？","Huh? I can't believe I didn't get this,
I wonder if my brother is more discerning than I thought."
"Idolchr_0107_B_20_07_017(0)","Ｐ","（間違えた上に、俺の力量を疑われてしまった……）","(I made a mistake and they questioned my competence ......)"
"Idolchr_0107_B_20_08_001(0)","Ｐ","（ルミナスのメンバーの中で、モノマネが流行って
いるらしく、真美がモノマネを披露しにきた）","(The moniker became popular among the members of Luminous.
(Mami came to perform a mimicry)."
"Idolchr_0107_B_20_08_002(0)","真美","じゃ、兄ちゃん、いっくよー！
真美のモノマネ聞いて～誰か当ててちょんまげ！","Okay, brother, I'm going!
Listen to Mami's moniker - guess who's a chonmage!"
"Idolchr_0107_B_20_08_003(0)","真美","『ハーッハッハッハッ！　我が友よ！　我に供物を！
魔力滴る、天界の甘露を捧げよ！』","'Ha-ha-ha! My friends, give me an offering!
Dripping with magic, offer up the nectar of the heavens!"
"Idolchr_0107_B_20_08_004(0)","真美","（兄ちゃん！　お菓子食べたい！
元気が出そうな甘いやつちょーだい！）","（I want to eat sweets!
(Give me something sweet to cheer me up!)"
"Idolchr_0107_B_20_08_005(0)","Ｐ","う～ん、そのモノマネは……","Hmmm, that moniker is ......"
"Idolchr_0107_B_20_08_006(0)","選択肢","蘭子","Ranko"
"Idolchr_0107_B_20_08_007(0)","選択肢","凛世","Rinze"
"Idolchr_0107_B_20_08_008(0)","選択肢","歌織さん","voice with a poetic haiku flavor (flavour)"
"Idolchr_0107_B_20_08_009(0)","Ｐ","蘭子のモノマネか？
しかし、よくそんな難しい言葉を……","Is this an impersonation of Ranko?
But how often do you use such difficult words ......"
"Idolchr_0107_B_20_08_010(0)","真美","んっふっふ～♪　ゾンブンにおどろきたまえ～♪
真美は新たな世界への扉を開けたのだー！","Be amazed at the zombun~♪
Mami has opened the door to a new world!"
"Idolchr_0107_B_20_08_011(0)","Ｐ","（正解だったか、当てられてよかった。
しかし真美のモノマネ、なかなか上手だったな）","(I'm glad you guessed right.
(But Mami's mimicry was quite good.)"
"Idolchr_0107_B_20_08_012(0)","Ｐ","もしかして凛世の真似か？","Could it be an imitation of Rinze?"
"Idolchr_0107_B_20_08_013(0)","真美","兄ちゃん、ちゃんと聞いてた？　りんぴょんは
もっとこう、オシトヤカでカレンって感じっしょ？","Did you hear me right, brother? Rinpyo is...
It's more like ""ositoyaka"" and ""karen,"" right?"
"Idolchr_0107_B_20_08_014(0)","Ｐ","（間違えたみたいだ……。
誰のモノマネだったんだろう）","(I think I made a mistake. .......
(I wonder whose impersonation that was.)"
"Idolchr_0107_B_20_08_015(0)","Ｐ","もしかして歌織さんの真似か？","Perhaps you are imitating Kaori-san?"
"Idolchr_0107_B_20_08_016(0)","真美","う～ん……真美のレッスン不足？
それとも兄ちゃんの耳がドンカンなだけ？","Hmmm... ...... Mami's lack of lessons?
Or is it just that my brother's ears are donkey ears?"
"Idolchr_0107_B_20_08_017(0)","Ｐ","（違ったみたいだ……。
しかし誰のモノマネだったんだろう？）","(I guess not. .......
(But whose impersonation was it?)"
"Idolchr_0107_C_30_01_001(0)","Ｐ","（真美の仕事終わり、
気分転換を兼ねて出かけることにした……）","(Mami's end of work,
I decided to go out for a change (......)"
"Idolchr_0107_C_30_01_002(0)","Ｐ","（もうこんな時間か……。
真美も楽しんでくれたようだな）","(Is it that time already? .......
(Mami seems to have enjoyed it as well.)"
"Idolchr_0107_C_30_01_003(0)","真美","兄ちゃん！　真美、すっごく楽しかったよ～♪
また一緒に遊ぼうね","Mami, it was so much fun!
Let's play together again."
"Idolchr_0107_C_30_01_004(0)","真美","んっふっふ～。　兄ちゃんさっすがー！
真美的兄ちゃんポイントがぐんぐん上がったよ～♪","Mmmmmmmm~, brother, that's great!
Mami-esque big brother points went up a lot~!"
