"id","character","source","translatedstr"
"Idolchr_0101_A_03_00_042(0)","小鳥","でも、プロデューサーさんがいない間も、
みんな協力し合って、頑張ってたんですよ","But also while the producer is away,
We all worked together and did our best."
"Idolchr_0101_A_03_00_043(0)","小鳥","もちろん、春香ちゃんも……。
トップアイドルとしての自覚も強くなったみたいです","Of course, Haruka can also be found at .......
She is now more aware of her role as a top idol."
"Idolchr_0101_A_03_00_044(0)","小鳥","それに、春香ちゃんが事務所で転ぶの、
久しぶりに見ました。懐かしいくらいですよ","Besides, Haruka falls down in the office,
I haven't seen it in a long time; I miss it so much!"
"Idolchr_0101_A_03_00_045(0)","Ｐ","そうでしたか……","Was that so: ......"
"Idolchr_0101_A_03_00_046(0)","Ｐ","（思わず気が緩んでしまうほど、
俺が帰ってきて安心したってことか……）","(I can't help but feel relaxed,
(You mean you're relieved I'm back. ......)"
"Idolchr_0101_A_03_00_047(0)","Ｐ","（春香の信頼に応えられるくらい、
俺もしっかりしないとな……！）","(Enough to live up to Haruka's trust,
I've got to get my shit together too. ......!)"
"Idolchr_0101_A_04_00_001(0)","Ｐ","（俺がいる環境にも慣れたのか、
春香は本来のペースを取り戻したようだ）","(Have you gotten used to the environment I'm in?
(Haruka seems to have picked up her natural pace)"
"Idolchr_0101_A_04_00_002(0)","Ｐ","（本当に音無さんの言った通りだった。
相変わらず７６５プロの信頼と絆は、揺らがないな）","(It really was just as Otonashi said.
(As always, the trust and bond between the 765 Pros is unwavering.)"
"Idolchr_0101_A_04_00_003(0)","Ｐ","春香、ちょっといいか？
大事な話があるんだ","Haruka, can I have a word?
I have something important to tell you."
"Idolchr_0101_A_04_00_004(0)","春香","あ、はい！
今、行きます！","Ah, yes!
I'm coming!"
"Idolchr_0101_A_04_00_005(0)","Ｐ","…………","…………"
"Idolchr_0101_A_04_00_006(0)","春香","プロデューサーさん？
どうしたんですか、そんなにじっと……","Producer?
What's wrong, so still ......"
"Idolchr_0101_A_04_00_007(0)","春香","その……私を見つめて……。
……も、もしかして私に何か付いてますか！？","Its ...... look at me .......
Is ...... also maybe something on me!"
"Idolchr_0101_A_04_00_008(0)","Ｐ","ああ、いや、そうじゃないんだ。
改めてだけど、やっぱり春香が変わったなと思って","Oh, no.
Again, I knew Haruka had changed."
"Idolchr_0101_A_04_00_009(0)","春香","私が、変わった……？　あの、プロデューサーさん、
私、どんな風に変わったんでしょう？","I've changed, ......? Um, Producer-san,
How have I changed?"
"Idolchr_0101_A_04_00_010(0)","Ｐ","そうだな……。
どんな風に変わったかっていうと……","Yes, .......
How things have changed: ......"
"Idolchr_0101_A_04_00_011(0)","選択肢","頼もしくなった","becoming more dependable"
"Idolchr_0101_A_04_00_012(0)","選択肢","かわいくなった","Cute."
"Idolchr_0101_A_04_00_013(0)","選択肢","ドジが減った","Fewer screw-ups."
"Idolchr_0101_A_04_00_014(0)","Ｐ","頼もしくなったよ。
一回り大きくなったみたいだ","I've become more dependable.
It's like he's grown a size."
"Idolchr_0101_A_04_00_015(0)","春香","本当ですか？　じゃあ、プロデューサーさん！
これからは私のこと、頼ってくださいね！","Really? Well, then, Producer-san!
You can count on me from now on!"
"Idolchr_0101_A_04_00_016(0)","Ｐ","当たり前だ。
春香のおかげで、いいユニットになっているしな","No wonder.
And thanks to Haruka, we're a good unit."
"Idolchr_0101_A_04_00_017(0)","春香","えへへ、嬉しいです。
私、もっともっと頑張りますね♪","Ehehe, I'm glad.
I'll try harder and harder... ♪"
"Idolchr_0101_A_04_00_018(0)","春香","プロデューサーさんと一緒に、もっと上を
目指したくて、今まで努力してきたんですから","Up the ante with the producer.
I've been trying to get there, and I've been working hard all this time."
"Idolchr_0101_A_04_00_019(0)","Ｐ","ますますかわいくなったんじゃないか？","Isn't he getting cuter and cuter?"
"Idolchr_0101_A_04_00_020(0)","春香","か、かわいくなった！？　そんなことは……でも、
プロデューサーさんが、そう言ってくれるなら……","Ka, it's getting cute! You can find out more about that at ......,
If the producer says so, ......"
"Idolchr_0101_A_04_00_021(0)","春香","って、そうじゃなくて！
私、中身もしっかり成長したんですよー！","And that's not what I mean!
I've grown up well on the inside, too!"
"Idolchr_0101_A_04_00_045(0)","春香","だから、もっと頼ってください","So rely on us more."
"Idolchr_0101_A_04_00_046(0)","Ｐ","ああ、分かったよ","Yeah, all right."
"Idolchr_0101_A_04_00_022(0)","Ｐ","ちょっとしたドジが、減ったと思うぞ。
……まあ、まだちょこちょこ転びはするけどな","I think you're a little less screwed up than you used to be.
...... Well, I still fall over a little bit."
"Idolchr_0101_A_04_00_023(0)","春香","うう、それが成長でいいんでしょうか……？
転ぶのも……気をつけては、いるんですけど……","Ugh, is that good for growth ......?
I try to be ...... careful about falling down, but ......"
"Idolchr_0101_A_04_00_047(0)","春香","もっと、プロデューサーさんに
頼ってもらいたかったのに……","More, for the producer.
I was hoping you could count on me. ......"
"Idolchr_0101_A_04_00_024(0)","Ｐ","ま、まあ……前よりは転んでないような……
そうでもないような……？","Well, well, I guess I haven't fallen as far ...... as I did before. ......
Not so much like ......?"
"Idolchr_0101_A_04_00_025(0)","Ｐ","それじゃあ、成長した春香に、
折り入って頼みたいことがあるんだが……","Well then, to the grown-up Haruka,
I need to ask you for a favor: ......"
"Idolchr_0101_A_04_00_026(0)","Ｐ","ルミナスはそろそろ……次のステップに進むべきだ。
そこで春香に、メンバーのサポートを頼みたい","It's time for Luminous to take the next step .......
So I would like to ask Haruka to support our members."
"Idolchr_0101_A_04_00_027(0)","春香","わ、私が、ですか……？
確かにみんなより、経験はありますけど……","Wow, me, is that ......?
I certainly have more experience than everyone else, but ......"
"Idolchr_0101_A_04_00_028(0)","春香","みんなすごく個性的で、元気いっぱいで……
私がサポート役なんて……できるでしょうか？","Everyone is so unique and full of energy. ......
How can I be a supportive ......?"
"Idolchr_0101_A_04_00_029(0)","Ｐ","確かにルミナスは個性の強いメンバーが多いな","You're right, Luminous has many members with strong personalities."
"Idolchr_0101_A_04_00_030(0)","春香","ですよね……私が一番普通なんじゃないかと
思うくらいで……サポート役、うぅ……","I know, right? ...... I'm probably the most normal person you'll ever meet.
I think so much ...... support role, ugh ......"
"Idolchr_0101_A_04_00_031(0)","春香","プロデューサーさんの頼みですし、
引き受けたいんですけど……","And it's what the producer asked me to do,
I'd like to take it on. ......"
"Idolchr_0101_A_04_00_032(0)","春香","でも期待に応えられなかったら……。
みんなにも、迷惑かけてしまいますし","But if we don't meet your expectations, please contact us at .......
And it's not good for everyone."
"Idolchr_0101_A_04_00_033(0)","Ｐ","春香なら大丈夫だ。安易に引き受けずに、
そうやって真剣に考えてくれてるじゃないか","Haruka will be fine; don't take the easy way out,
You're taking me seriously like that."
"Idolchr_0101_A_04_00_034(0)","Ｐ","メンバーひとりひとりをよく見ているし、
今も上手にまとめていると思うぞ","I look at each member very carefully,
I think you're still putting it all together very well."
"Idolchr_0101_A_04_00_035(0)","春香","わかりました。プロデューサーさんが、
そこまで言ってくれるなら……","I understand, Producer-san,
If you can say that much: ......"
"Idolchr_0101_A_04_00_036(0)","春香","天海春香、全力でサポート役をこなしてみせます！","Haruka Amami, I will do my best to play a supportive role!"
"Idolchr_0101_A_04_00_037(0)","Ｐ","ありがとう、春香！
助かるよ","Thanks, Haruka!
That'd be great."
"Idolchr_0101_A_04_00_038(0)","春香","で、でもっ、もし困ったことがあったら……
その時は相談に乗ってくださいね！","And, but, if you have any trouble, please contact us at ......
Please consult with me then!"
"Idolchr_0101_A_04_00_039(0)","　P","ああ、もちろんだ！","Yes, of course!"
"Idolchr_0101_A_04_00_040(0)","春香","ふふっ、頼ってくださいって言ったのに、
結局プロデューサーさんに頼っちゃってますね","Huh, I told you to rely on me,
After all, you're relying on your producer, aren't you?"
"Idolchr_0101_A_04_00_041(0)","Ｐ","頼ってくれなきゃ困る。
俺は春香のプロデューサーなんだからな","You have to rely on me.
I'm Haruka's producer."
"Idolchr_0101_A_04_00_042(0)","Ｐ","サポート役だからってひとりで抱えず、
いつでも相談してくれよ","Don't take it upon yourself to play a supportive role,
You can always talk to me about it."
"Idolchr_0101_A_04_00_043(0)","春香","はい！　あ、プロデューサーさんも、
ひとりで抱えちゃダメですよ？","Yes! Oh, and the producer,
Don't keep it to yourself, okay?"
"Idolchr_0101_A_04_00_044(0)","春香","ふたりで協力して、
ルミナスを支えていきましょうね！","Working together, the two of us,
Let's support Luminous!"
"Idolchr_0101_A_05_00_001(0)","Ｐ","（忙しい最中だが、ルミナスについて話したくて、
春香に喫茶店に来てもらった）","(I'm in the middle of a busy day, but wanted to talk to you about Luminous,
(Haruka had me come to the coffee shop)"
"Idolchr_0101_A_05_00_002(0)","春香","プロデューサーさん……。
だいぶお疲れみたいですね","Producer: .......
You look very tired."
"Idolchr_0101_A_05_00_003(0)","春香","大丈夫ですか？　最近忙しそうですけど……。
困った時は相談し合うって約束、忘れてませんか？","Are you okay? You seem to be busy lately. ......
Have you forgotten your promise to consult with each other in times of trouble?"
"Idolchr_0101_A_05_00_004(0)","Ｐ","ああ、忘れてないよ。春香と話したかったんだ、
時間を作ってくれてありがとうな","Oh, I didn't forget, I wanted to talk to Haruka,
Thanks for making time for me, man."
"Idolchr_0101_A_05_00_005(0)","春香","いえ、覚えていてくれたなら嬉しいです！
それで、話って……？","No, I am glad you remember me!
So, what's the story, ......?"
"Idolchr_0101_A_05_00_006(0)","Ｐ","話っていうのは、
ちょっと春香に聞いてみたいことがあってな","A story is,
I just wanted to ask Haruka something."
"Idolchr_0101_A_05_00_007(0)","春香","はい！　何でも聞いてください！
聞きたいことって何ですか？","Yes! Please ask anything!
What is it that you want to ask?"
"Idolchr_0101_A_05_00_008(0)","Ｐ","春香から見たルミナスはどうだ？
春香の意見が聞いてみたいんだ","How's Luminous from Haruka's point of view?
I just want to hear what Haruka has to say."
"Idolchr_0101_A_05_00_009(0)","春香","私から見たルミナスですか？
そうですね……とっても刺激的だって思います","Is it luminous from my point of view?
Yes, I think ...... is very exciting!"
"Idolchr_0101_A_05_00_010(0)","春香","キラキラした、いろんな子が集まっていて……
驚かされることも多いんですよ","It's a sparkling, diverse group of kids. ......
I'm often surprised."
"Idolchr_0101_A_05_00_011(0)","春香","でもみんな、本当に個性的なので……。
あの……私、埋もれてしまってないでしょうか？","But they are all really unique and can be found at .......
That ...... am I not buried?"
"Idolchr_0101_A_05_00_012(0)","Ｐ","春香がルミナスで埋もれているかどうかか……。
そうだな……","Whether Haruka is buried in luminous or .......
Yes. ......"
"Idolchr_0101_A_05_00_013(0)","選択肢","埋もれてないよ","It's not buried."
"Idolchr_0101_A_05_00_014(0)","選択肢","突き抜けている！","It is through and through!"
"Idolchr_0101_A_05_00_015(0)","選択肢","みんなと一緒だ","I'm with you everyone."
"Idolchr_0101_A_05_00_016(0)","Ｐ","埋もれてなんかない。
春香は春香らしく、輝いているよ","It's not buried.
Haruka is shining, just like Haruka."
"Idolchr_0101_A_05_00_017(0)","春香","私は私らしく輝いて……はい！
みんなそれぞれ違う輝きがありますもんね","I am shining as I am. ...... Yes!
Everyone has their own unique brilliance, don't they?"
"Idolchr_0101_A_05_00_018(0)","春香","その中で私もちゃんと、私らしく輝けているなら
すごく幸せです！　ありがとうございます！","If I am able to shine in my own way in the midst of it.
I am very happy!"
"Idolchr_0101_A_05_00_019(0)","Ｐ","春香は、一段と突き抜けているぞ！
自信をもて！","Haruka is going through the motions!
Be confident!"
"Idolchr_0101_A_05_00_020(0)","春香","あはは、大げさですよ、プロデューサーさん。
でも、励まそうとしてくれてありがとうございます","Haha, you're exaggerating, producer.
But thank you for trying to encourage me."
"Idolchr_0101_A_05_00_021(0)","Ｐ","みんなと一緒だ。
埋もれてはないし、みんな等しくキラキラしている","I'm with everyone.
They're not buried, and they all sparkle equally."
"Idolchr_0101_A_05_00_022(0)","春香","みんなと一緒……ですか？　安心したような……
少しだけ寂しいような気もします、不思議ですね","Are you with everyone ......? I feel relieved ......
I feel a little sad about it, it's strange."
"Idolchr_0101_A_05_00_023(0)","春香","でも私、どうしてもみんなと比べちゃって……。
やっぱり私、一番普通なんじゃないかなって……","But I can't help comparing myself to everyone else. ......
I still think I'm the most normal ......"
"Idolchr_0101_A_05_00_024(0)","Ｐ","いやいや、だからほら、春香はなんていうか……
安心するし落ち着くからな","No, no, no, so, you see, what can I say about Haruka: ......
It's reassuring and calming."
"Idolchr_0101_A_05_00_025(0)","春香","プロデューサーさん、
フォローの方向がなんだかずれてますよ","Producer,
Your follow-up is somewhat misdirected."
"Idolchr_0101_A_05_00_026(0)","Ｐ","う、言葉選びって難しいな……。
あっ、春香、注文してたパフェが来たぞ！","Ugh, word choice is so hard. ......
Oh, Haruka, the parfait you ordered is here!"
"Idolchr_0101_A_05_00_027(0)","春香","わあっ、美味しそう！　いただきまーす♪","Wow, it looks delicious!"
"Idolchr_0101_A_05_00_028(0)","春香","あっ、美味しい♪　クッキーもついてますね。
よかったら、プロデューサーさんもおひとつどうぞ！","
If you like, you can have one, too, producer!"
"Idolchr_0101_A_05_00_029(0)","Ｐ","え、いや……そ、そうだな。いただくよ。
……うん、うまいな","Oh, no, ......, yes, I'll have some.
...... Yeah, that's good."
"Idolchr_0101_A_05_00_030(0)","春香","ねっ、美味しいですよね～！
はぁ～、幸せな気分です♪","Hey, it's delicious!
Hah, I feel so happy..."
"Idolchr_0101_A_05_00_031(0)","Ｐ","（スイーツで上機嫌になる春香もかわいらしい。
無個性なんかじゃないのに、うまく伝えられないな）","(Haruka is also adorable when she is in a good mood with sweets.
(I'm not characterless, but I can't seem to get it across.)"
"Idolchr_0101_A_05_00_032(0)","Ｐ","（春香の魅力をもっと引き出せるように、
しっかりレッスンをしてもらおう……！）","(To bring out more of Haruka's charm,
Let's get a good lesson in ......!)"
"Idolchr_0101_A_06_00_001(0)","Ｐ","（事務所で作業していると、春香が訪ねてきた）","(While I was working in my office, Haruka came to visit me)"
"Idolchr_0101_A_06_00_002(0)","春香","プロデューサーさん、お疲れ様です！
少し休憩して、クッキー食べませんか？","Thanks for your help, producer!
Why don't we take a break and have some cookies?"
"Idolchr_0101_A_06_00_003(0)","春香","手作りなんです。
ルミナスのみんなにも配ったんですよ♪","They are handmade.
I gave them out to everyone at Luminous... ♪"
"Idolchr_0101_A_06_00_004(0)","心白","さっき私や甘奈さんももらったんです。
春香さんのクッキーすごく美味しいですよ♪","I and Amana got them a while ago.
Haruka's cookies are so delicious!"
"Idolchr_0101_A_06_00_005(0)","春香","えへへっ♪　そう言ってもらえると嬉しいな。
プロデューサーさんも、はい、どうぞ♪","Eheheh♪ I'm glad to hear you say so.
Producers, yes, please... ♪"
"Idolchr_0101_A_06_00_006(0)","Ｐ","ありがとう。いただきます。
モグモグ……んっ？　この味は……","Thank you very much.
Mogmog...... hmmm? This flavor is ......"
"Idolchr_0101_A_06_00_007(0)","春香","えっ、ど、どうしました？","What? What's wrong?"
"Idolchr_0101_A_06_00_008(0)","Ｐ","いや、このクッキー……","No, these cookies ......"
"Idolchr_0101_A_06_00_009(0)","選択肢","美味しいぞ！","Delicious!"
"Idolchr_0101_A_06_00_010(0)","選択肢","知ってる味だ！","It's a taste I know!"
"Idolchr_0101_A_06_00_011(0)","選択肢","なんだっけ？","What was that?"
"Idolchr_0101_A_06_00_012(0)","Ｐ","美味しいぞ！
春香の手作りだからかな","Delicious!
Maybe because it's Haruka's handmade."
"Idolchr_0101_A_06_00_013(0)","春香","そんな……照れちゃいます。でも、
プロデューサーさんに喜んでもらえて良かったぁ♪","I'm embarrassed by such ....... But,
I'm glad the producer is happy."
"Idolchr_0101_A_06_00_014(0)","Ｐ","それにこの味、なんかどこかで……","And this taste, something somewhere ......"
"Idolchr_0101_A_06_00_015(0)","春香","あっ、気付いちゃいました？
実はこれ……","Oh, did you notice that?
Actually, this one: ......"
"Idolchr_0101_A_06_00_016(0)","Ｐ","知ってる味がするぞ！　春香のクッキーだけど、
以前とちょっと違ってて……この味、どこかで……？","I know what they taste like! They're Haruka's cookies, though,
It's a little different than before and ...... this taste, where ......?"
"Idolchr_0101_A_06_00_017(0)","心白","プロデューサーさん、春香さんのクッキーを
よく食べてたんですか？","Producer, Haruka's cookies.
Did you eat a lot?"
"Idolchr_0101_A_06_00_018(0)","春香","海外に行く前にね。あと多分、プロデューサーさんが
感じた『ちょっと違う』っていうのは……","Before I go overseas, and maybe also before the producer...
The 'slightly different' that I felt was ......"
"Idolchr_0101_A_06_00_019(0)","Ｐ","いや……なんだっけ……？
なんか……どこかで食べたことのあるような……","No. What is ......? ......?
Something ...... I've had somewhere ......"
"Idolchr_0101_A_06_00_020(0)","春香","あ、もしかして気づきました？
実はこの味はですね……","Oh, maybe you noticed?
Actually, it tastes like this: ......"
"Idolchr_0101_A_06_00_021(0)","Ｐ","あ、分かった！
この前の喫茶店で食べたクッキーの味じゃないか？","Oh, I get it!
Isn't that the taste of the cookies I had at the coffee shop the other day?"
"Idolchr_0101_A_06_00_022(0)","春香","正解です！　プロデューサーさんと一緒に食べた
クッキーの味を再現してみました！","Correct! I ate with the producer.
I tried to recreate the taste of cookies!"
"Idolchr_0101_A_06_00_023(0)","春香","どうですか？
ちゃんと再現できてます？","What do you think?
Are you able to reproduce it properly?"
"Idolchr_0101_A_06_00_024(0)","Ｐ","ああ、すごく美味しい……それに、
喫茶店で食べたやつより正統派な感じがするな","Oh, so delicious ...... and,
That sounds more orthodox than the one I had at the coffee shop."
"Idolchr_0101_A_06_00_025(0)","春香","え、ええー！？
それは言い過ぎですよ～！","Eh, eh!
That is an exaggeration!"
"Idolchr_0101_A_06_00_026(0)","春香","さすがにお店の味にはかないませんけど……。
近づけるように、頑張りました","As you can imagine, it doesn't taste as good as the restaurant's, but you can find it at .......
I did my best to get close."
"Idolchr_0101_A_06_00_027(0)","Ｐ","そうか。素朴だけどしっかりしてて、
食べた人が笑顔になれる、真っ直ぐな美味しさだよ","Okay...rustic but firm,
It's straight-up deliciousness that will make anyone who eats it smile."
"Idolchr_0101_A_06_00_028(0)","春香","えへへー……そう、なのかな……。
嬉しいです……！","Ehehe ...... yes, I guess so .......
I'm glad you're here: ......!"
"Idolchr_0101_A_06_00_029(0)","心白","そうですね、このクッキーって、
まるで春香さんみたいです！","Yes, these cookies are,
It is just like Haruka!"
"Idolchr_0101_A_06_00_030(0)","春香","ええっ、私！？","Eh, me!"
"Idolchr_0101_A_06_00_031(0)","心白","はい！　すごく春香さんらしいというか、
春香さんそのものみたいだなって","Yes! It is very Haruka-like,
It's like Haruka herself."
"Idolchr_0101_A_06_00_032(0)","甘奈","うんっ！　優しいけど、しっかりしてる。
そんなところが春香ちゃんみたい☆","Yes! She is gentle but firm.
That's just like Haruka☆."
"Idolchr_0101_A_06_00_033(0)","心白","ほら、甘奈さんも賛同してますよ♪","See, Amana agrees with me..."
"Idolchr_0101_A_06_00_034(0)","春香","ええ～……！？
そ、そんなことないよー！","Yeah~......!
That's not true!"
"Idolchr_0101_A_06_00_035(0)","Ｐ","春香は成長したけど、変わらないところもあるな。
そこも春香のいいところか","Haruka has grown, but some things haven't changed.
That's another good thing about Haruka."
"Idolchr_0101_A_06_00_036(0)","春香","ぷ、プロデューサーさんまで……。
みんなして、私のこと褒めすぎですよー","Ps, even the producer can be found at .......
You all give me too many compliments!"
"Idolchr_0101_A_06_00_037(0)","心白","本当のことを言ってるだけなのに……","I'm just telling the truth: ......"
"Idolchr_0101_A_06_00_038(0)","Ｐ","だよなぁ。
春香、本当のことを言ってるだけなんだぞ","I guess.
Haruka, I'm just telling you the truth."
"Idolchr_0101_A_06_00_039(0)","春香","え、えーと、えーと……あ、ありがとうございます。
そんな風に言ってもらえて嬉しい、です","Uh, well, uh, uh, ...... Oh, thank you very much.
I'm glad to hear you say that, sir."
"Idolchr_0101_A_06_00_040(0)","春香","で、でもやっぱり私はそれほどじゃないですよ～！","And, but I'm still not that good!"
"Idolchr_0101_A_06_00_041(0)","Ｐ","（どんなに有名になっても春香の謙遜癖は
変わらないな）","(No matter how famous she becomes, Haruka's habit of modesty
(You haven't changed.)"
"Idolchr_0101_A_07_00_001(0)","Ｐ","（関係者が招待してくれたので、
春香と新人アイドルのライブに来た）","(The people involved invited me,
(I'm here for Haruka and her new idol's live show)"
"Idolchr_0101_A_07_00_002(0)","Ｐ","（春香はなんだか落ち着きない様子だ。
ずいぶんキョロキョロしているな）","(Haruka seems somewhat restless.
(You've been scurrying around a lot.)"
"Idolchr_0101_A_07_00_003(0)","春香","これからステージに立つ彼女たちのことを考えたら、
なんだか私まで、緊張してきちゃいました","I think about the girls who are going to be on stage,
I was getting nervous, too."
"Idolchr_0101_A_07_00_004(0)","春香","この会場の雰囲気も、
デビューしたばっかりの頃を思い出しますね……","And the atmosphere of this venue,
I remember when I was just starting out: ......"
"Idolchr_0101_A_07_00_005(0)","Ｐ","そうだなぁ。今をときめくトップアイドル、
天海春香にも新人の頃があったんだよな","Yes, the top idol of the moment,
Haruka Amami had her rookie days, too."
"Idolchr_0101_A_07_00_006(0)","春香","そ、そんな、私、まだまだ
トップアイドルじゃないですよ！","Oh, no, I'm not ready yet.
I'm not a top idol!"
