"id","character","source","translatedstr"
"Idolchr_0405_A_04_00_022(0)","凛世","…………","…………"
"Idolchr_0405_A_04_00_023(0)","凛世","凛世には……
わかりません……","For Rinze: ......
I don't know. ......"
"Idolchr_0405_A_04_00_024(0)","凛世","みなさまの中で……
輝くためには……","In all of you: ......
To Shine: ......"
"Idolchr_0405_A_04_00_025(0)","Ｐ","なるほど、何を重点的に磨いていくべきか、
迷ってるんだな","Okay, what should we focus on polishing?
You're lost."
"Idolchr_0405_A_04_00_026(0)","Ｐ","そうだなぁ……
凛世の場合は……","
For Rinze, see ......"
"Idolchr_0405_A_04_00_027(0)","選択肢","全部","all"
"Idolchr_0405_A_04_00_028(0)","選択肢","ダンス","dance"
"Idolchr_0405_A_04_00_029(0)","選択肢","トーク","talk show"
"Idolchr_0405_A_04_00_030(0)","Ｐ","やっぱり全部バランス良く、かな。
難しいと思うが、凛世ならできると思う","I guess it all has to be balanced.
I know it's hard, but I think Rinze can do it."
"Idolchr_0405_A_04_00_031(0)","凛世","はい……
その言葉に報いられるよう……","
I hope to be rewarded for my words: ......"
"Idolchr_0405_A_04_00_032(0)","Ｐ","ああ、誰かが努力をしている姿は、
みんなの刺激になるからな","Oh, the sight of someone making an effort,
It's an inspiration to all of us."
"Idolchr_0405_A_04_00_033(0)","Ｐ","凛世が努力をしている姿も、
きっとルミナスの原動力になってくれる","Rinze is also making an effort,
I'm sure they will be the driving force behind Luminous."
"Idolchr_0405_A_04_00_034(0)","凛世","凛世が……
ルミナスの原動力……","Rinze is at ......
Luminous Dynamics: ......"
"Idolchr_0405_A_04_00_035(0)","Ｐ","ダンスかな。ユニットで統一感を取りながら、
個人が持っている個性を活かさなくちゃならない","Dance, I guess, while keeping unity as a unit,
We have to take advantage of the individuality that each of us possesses."
"Idolchr_0405_A_04_00_036(0)","凛世","はい……
とても勉強に……","
Very informative ......"
"Idolchr_0405_A_04_00_037(0)","Ｐ","ダンスにもっと自信が付いたら、
他のことにも目を向けていこう","When I have more confidence in my dancing,
Let's look at something else."
"Idolchr_0405_A_04_00_038(0)","凛世","はい……ご意見……
ありがとうございます……","Yes......Opinions......
Thank you ......"
"Idolchr_0405_A_04_00_039(0)","Ｐ","トークはどうかな？　話術で笑いを取りにいく、
バラエティ路線というのは……","How about talk? I'm going for laughs with my storytelling,
The variety line is ......"
"Idolchr_0405_A_04_00_040(0)","凛世","笑い……？","LOL ......?"
"Idolchr_0405_A_04_00_041(0)","Ｐ","いや、ごめん。アドバイスを間違えた。
やっぱり、凛世は自然体でいこう","No, sorry, wrong advice.
After all, Rinze, let's keep it natural."
"Idolchr_0405_A_04_00_042(0)","凛世","はい……","Yes ......"
"Idolchr_0405_A_04_00_043(0)","Ｐ","とにかく今は、みんなとのレッスンや仕事の中で
学べることが一番大きいと思うぞ","Anyway, now I'm in lessons and work with everyone.
I think the biggest thing you're going to learn is that you're going to learn."
"Idolchr_0405_A_04_00_044(0)","凛世","ふふ……はい……
この刺激を糧に……","Hmmm ...... yes ......
Feed on this stimulus: ......"
"Idolchr_0405_A_04_00_045(0)","Ｐ","ああ、ルミナスでの経験が成長に繋がれば、
たくさんのファンが喜んでくれるだろうな","Oh, if only my experience at Luminous would help me grow,
I'm sure a lot of fans will be happy to hear that."
"Idolchr_0405_A_04_00_046(0)","凛世","ファンのみなさまが……
喜んでくださる……","We hope that fans will visit ......
She'll be glad to hear it: ......"
"Idolchr_0405_A_04_00_047(0)","凛世","それならば……
本望です……","If that's the case, please visit ......
I really hope so. ......"
"Idolchr_0405_A_04_00_048(0)","Ｐ","（凛世はファン思いのいいアイドルだ。凛世が、
ルミナスの中でもっと輝けるように応援していこう）","（Rinze is a good idol who cares about her fans,
(Let's cheer them on so they can shine more brightly in Luminous)"
"Idolchr_0405_A_05_00_001(0)","Ｐ","（凛世、真美、翼、杏の４人と一緒に、
買い出しに来たまでは良かったのだが……）","(with Rinze, Mami, Tsubasa, and Anzu,
(It was fine until I came to buy something. ......)"
"Idolchr_0405_A_05_00_002(0)","真美","あっ！　真美、あそこの文房具屋さんに行きたいな。
カワイイすてーしょんなり～グッズ、見たいんだ！","Oh! Mami, I want to go to that stationery shop over there.
I want to see kawaii stesshonari~goods!"
"Idolchr_0405_A_05_00_003(0)","翼","文房具屋さん……？　あっ、それよりも、
その隣の雑貨屋さんに行きたいかも☆","Stationery shop ......? Oh, more than that,
Maybe I'll go to that grocery store next door ☆."
"Idolchr_0405_A_05_00_004(0)","杏","おーい、ふたりとも。今日はお菓子の買い出しだよ。
ストック、もっと充実させたいでしょ？","Hey you two, I'm shopping for snacks today.
Stock, you want to make it more substantial, don't you?"
"Idolchr_0405_A_05_00_005(0)","Ｐ","お菓子を買いに来たんじゃないし、
文房具屋さんも雑貨屋さんも行かないぞ","And I'm not here to buy candy,
I'm not going to the stationery store or the grocery store."
"Idolchr_0405_A_05_00_006(0)","真美","そんな～！　最近、活動が忙しくて、２日ぶりに
買い物に来たっていうのに～！　兄ちゃんのケチ！","Oh no~! I've been so busy with activities lately, it's been two days.
We came here to shop~! My brother's stingy!"
"Idolchr_0405_A_05_00_007(0)","Ｐ","２日ぶりって、そこそこの頻度で
買い物を楽しんでいるじゃないか……","It's been two days, that's how often it's been there.
You enjoy shopping. ......"
"Idolchr_0405_A_05_00_008(0)","翼","え～、ほんとに頼まれた物だけを買って、
事務所に帰るだけなんですか～？","Eh, really, buy only what you are asked to buy,
Are you just going back to the office~?"
"Idolchr_0405_A_05_00_009(0)","杏","杏、そこのベンチで休んでるから、
てきとーに買い物が終わったら迎えに来て～","Anzu, I'm resting on the bench there,
Just pick me up when you're done with your shopping."
"Idolchr_0405_A_05_00_010(0)","Ｐ","……３人とも買い出しに
付き合ってくれるって言ったじゃないか","......3 both of us to buy.
You said you'd go out with me."
"Idolchr_0405_A_05_00_011(0)","凛世","ふふ……","Hmmm... ......"
"Idolchr_0405_A_05_00_012(0)","真美","りんぴょんはどう思う？　やっぱ学生のたまりば、
文房具屋さんでたむろしたいよね？","What do you think of Rinpyo? It's a student hangout after all,
Want to hang out at a stationery store?"
"Idolchr_0405_A_05_00_013(0)","凛世","はい……
筆記用具も必要かと……","
I thought you might also need a writing utensil: ......"
"Idolchr_0405_A_05_00_014(0)","翼","凛世さん、雑貨屋さんにも行きましょうよ～。
見ているだけでも、楽しいものがいっぱいですよ！","Rinze, let's go to the grocery store too!
There are so many fun things to see and do!"
"Idolchr_0405_A_05_00_015(0)","凛世","はい……
それも……","
It's also available at ......"
"Idolchr_0405_A_05_00_016(0)","杏","だったら、事務所の置き菓子も切れてたはずだよ～。
これは非常事態だよね、凛世ちゃん？","If that were the case, the office's leftover candy would have run out too!
This is an emergency situation, right, Rinze?"
"Idolchr_0405_A_05_00_017(0)","凛世","たしか……
残り少なく……","I think it's ......
Fewer left: ......"
"Idolchr_0405_A_05_00_018(0)","Ｐ","こら、３人とも……。凛世を味方につけて、
自分の意見を通そうとしているな","Hey, all three of you can go to ...... and get Rinze on your side,
You're trying to get your point across."
"Idolchr_0405_A_05_00_019(0)","Ｐ","しょうがないな……。好きな店に行って来ていいぞ。
ただし、３０分以内には必ず戻ってくること！","I can't help it. ....... You can go to any restaurant you like.
However, they must return within 30 minutes!"
"Idolchr_0405_A_05_00_020(0)","真美","さっすが、兄ちゃん！　話が分かるね！
兄ちゃんが使いそうな、高級万年筆も探してくるね！","You're right, brother! You know what you're talking about!
I'll also look for a high-end fountain pen that my brother might use!"
"Idolchr_0405_A_05_00_021(0)","翼","それじゃあ、わたしも行ってきま～す♪
あっ、良かったら凛世さんも来てくださいね～","Well then, I'm off too!
Oh, please come, Rinze-san, if you like!"
"Idolchr_0405_A_05_00_022(0)","杏","３０分以内で今の季節にぴったりの、お菓子の
ラインナップを揃える……杏の腕の見せどころだね","In less than 30 minutes, you'll have the perfect treat for the current season.
It's a testament to ...... Anzu's skill in putting together a lineup."
"Idolchr_0405_A_05_00_023(0)","凛世","お気をつけて……
行ってらっしゃいませ……","Take care ......
Have a nice trip: ......"
"Idolchr_0405_A_05_00_024(0)","Ｐ","凛世、すまなかったな。
みんなのわがままに、巻き込んでしまって","Rinze, I'm sorry.
I got caught up in everyone's selfishness."
"Idolchr_0405_A_05_00_025(0)","凛世","いいえ……
そのようなことは……","No. ......
You can do so at ......"
"Idolchr_0405_A_05_00_026(0)","Ｐ","あれ、凛世は買い物に行かないのか？
好きな店を見てきていいんだぞ？","Hey, isn't Rinze going shopping?
You can go see any store you want, okay?"
"Idolchr_0405_A_05_00_027(0)","凛世","凛世は……
これといって……","Rinze can be found at ......
This is not to say that ......"
"Idolchr_0405_A_05_00_028(0)","Ｐ","そうか。じゃあ俺は……","Okay, well I'll go to ......"
"Idolchr_0405_A_05_00_029(0)","選択肢","買い物に行く","go shopping"
"Idolchr_0405_A_05_00_030(0)","選択肢","ここで待ってる","I'll wait here."
"Idolchr_0405_A_05_00_031(0)","選択肢","ベンチで寝る","sleep on a bench"
"Idolchr_0405_A_05_00_032(0)","Ｐ","今のうちに買い物を済ませておくか。
えーっと……買うものは何だったかな","Let's get some shopping done while we're at it.
Let's see... ...... what to buy"
"Idolchr_0405_A_05_00_033(0)","凛世","コピー用紙、だったかと……","Copy paper, I think it was ......"
"Idolchr_0405_A_05_00_034(0)","Ｐ","ああ、そうだった。
凛世がちゃんと覚えててくれて助かるよ","Yes, it was.
I'm glad Rinze remembers me right."
"Idolchr_0405_A_05_00_035(0)","凛世","ふふ……
お力になれたなら……、光栄です……","Hmmm... ......
I would be honored if I could help you ......, ......"
"Idolchr_0405_A_05_00_036(0)","Ｐ","そうだ。
凛世も買い出しに付き合ってくれないか？","Yes, it is.
Rinze, would you like to accompany me on my shopping trip?"
"Idolchr_0405_A_05_00_037(0)","凛世","はい……
ご一緒いたします……","
We will be with you: ......"
"Idolchr_0405_A_05_00_038(0)","Ｐ","３人が戻ってくるまで、ここで待っていようかな。
凛世はどうする？　ここにいてもつまらないだろ？","I think I'll wait here until the three of them come back.
What about Rinze? It's boring to stay here, isn't it?"
"Idolchr_0405_A_05_00_039(0)","凛世","いえ……
そのようなことは……","No. ......
You can do so at ......"
"Idolchr_0405_A_05_00_040(0)","Ｐ","でも、凛世を一緒に待たせるのは悪いな。
せっかくだから、残りの買い出しに行くとするか","But I feel bad making Rinze wait with me.
Since we're here, let's go buy the rest."
"Idolchr_0405_A_05_00_041(0)","凛世","それでは……
凛世も、ご一緒いたします……","Let's see: ......
Rinse will be with you: ......"
"Idolchr_0405_A_05_00_042(0)","Ｐ","うーん……ベンチで寝ていようかな","Hmmm ...... I think I'll sleep on the bench"
"Idolchr_0405_A_05_00_043(0)","凛世","このような場所では……
お身体を……","In these locations: ......
Please let us know how you're doing at ......"
"Idolchr_0405_A_05_00_044(0)","Ｐ","たしかに……。
それに他のお客さんの迷惑にもなるよな","Indeed, .......
Besides, it would be a nuisance to other customers."
"Idolchr_0405_A_05_00_045(0)","Ｐ","それじゃ、３人が戻ってくる前に、
残りの買い物を済ませるとするか","Well then, before the three of you come back,
Let's get the rest of the shopping done."
"Idolchr_0405_A_05_00_046(0)","凛世","それでは……
凛世も、ご一緒いたします……","Let's see: ......
Rinse will be with you: ......"
"Idolchr_0405_A_05_00_047(0)","Ｐ","よし、俺たちも頼まれたものを買いに行こうか！","Okay, let's go buy what we've been asked to buy too!"
"Idolchr_0405_A_05_00_048(0)","凛世","はい……
プロデューサーさま……","Yes ......
Dear Producer: ......"
"Idolchr_0405_A_05_00_049(0)","Ｐ","俺たちも買い物が早く済んだら、
どこか寄り道していこうか？","If we finish our shopping early too,
Shall we stop off somewhere?"
"Idolchr_0405_A_05_00_050(0)","凛世","ふふ……
それもよいかと……","Hmmm... ......
I thought that might be a good idea: ......"
"Idolchr_0405_A_06_00_001(0)","Ｐ","（仕事帰り、凛世とカフェに寄ることにした……）","(After work, Rinze and I decided to stop by a cafe ......)"
"Idolchr_0405_A_06_00_002(0)","凛世","…………","…………"
"Idolchr_0405_A_06_00_003(0)","Ｐ","どうしたんだ、凛世。
何かメニューで気になるものでもあったか？","What's wrong, Rinze?
Something on the menu that caught your attention?"
"Idolchr_0405_A_06_00_004(0)","凛世","こちらの……
抹茶ドーナツ……","You can find it here: ......
Matcha doughnuts: ......"
"Idolchr_0405_A_06_00_005(0)","Ｐ","美味そうだな。
凛世は抹茶ドーナツが好きなのか？","Looks delicious.
Does Rinze like matcha doughnuts?"
"Idolchr_0405_A_06_00_006(0)","凛世","格別という訳では……
ございませんが……","Not that it's exceptional: ......
There is no ......"
"Idolchr_0405_A_06_00_007(0)","凛世","洋菓子と……抹茶……
いずれも……引き立つゆえ……","Western sweets and ...... matcha ......
Both ...... stand out therefore ......"
"Idolchr_0405_A_06_00_008(0)","Ｐ","なるほど、凛世らしい発想だな。
じゃあ、凛世は抹茶ドーナツにするか？","Well, that's a very Rinse idea.
So, Rinze, would you like a green tea doughnut?"
"Idolchr_0405_A_06_00_009(0)","凛世","はい……、プロデューサーさまは……
何になさいますでしょうか……？","Yes, ...... and the producer is ......
What can I get you for ......?"
"Idolchr_0405_A_06_00_010(0)","Ｐ","そうだな……。
俺は何にしようかな……？","
What shall I do ......?"
"Idolchr_0405_A_06_00_011(0)","選択肢","黒蜜ソフト","molasses soft"
"Idolchr_0405_A_06_00_012(0)","選択肢","プレーンドーナツ","plain doughnut"
"Idolchr_0405_A_06_00_013(0)","選択肢","コーヒー","coffee"
"Idolchr_0405_A_06_00_014(0)","選択肢","味噌汁","miso soup"
"Idolchr_0405_A_06_00_015(0)","Ｐ","黒蜜ソフトにしてみようかな。
これも、和と洋のミックスだ","I think I'll try the molasses soft.
This, too, is a mix of Japanese and Western styles."
"Idolchr_0405_A_06_00_016(0)","凛世","ふふ……
そのようですね……","Hmmm... ......
Looks like it: ......"
"Idolchr_0405_A_06_00_017(0)","Ｐ","凛世も他にも気になったメニューがあるなら、
遠慮しないで頼んでいいからな","Rinze too, if there are other menu items you are interested in,
Don't hesitate to ask."
"Idolchr_0405_A_06_00_018(0)","凛世","いいえ……
凛世は、もう十分でございます……","No. ......
Rinze has had enough ......"
"Idolchr_0405_A_06_00_019(0)","Ｐ","プレーンドーナツにしよう。
王道には王道の良さがある","Let's go with plain donuts.
The high road has its own advantages"
"Idolchr_0405_A_06_00_020(0)","凛世","不変の良さ……
でしょうか……","The constant good: ......
Is it: ......"
"Idolchr_0405_A_06_00_021(0)","Ｐ","そうそう。抹茶も美味しそうだけど、
俺は王道の味にしようかなって","And yes, matcha does sound good too,
I thought I'd take the high road."
"Idolchr_0405_A_06_00_022(0)","凛世","はい……
楽しみで、ございます……","
I'm looking forward to it. ......"
"Idolchr_0405_A_06_00_023(0)","Ｐ","コーヒーだけにしとくよ","I'll just make coffee."
"Idolchr_0405_A_06_00_024(0)","凛世","それでは……
凛世も……","Let's see: ......
Rinze also ......"
"Idolchr_0405_A_06_00_025(0)","Ｐ","いやいや、凛世は好きなものを食べていいんだぞ。
たまたま、俺はコーヒーを注文したかっただけだ","No, no, no, Rinze, you can eat whatever you want.
It just so happens I wanted to order a coffee."
"Idolchr_0405_A_06_00_026(0)","凛世","はい……","Yes ......"
"Idolchr_0405_A_06_00_027(0)","Ｐ","急に味噌汁が飲みたくなったな……","Suddenly you want some miso soup. ......"
"Idolchr_0405_A_06_00_028(0)","凛世","では……
別のお店に……","
Another store: ......"
"Idolchr_0405_A_06_00_029(0)","Ｐ","いや、大丈夫だ。思いつきで言っただけだから……。
そうだな、俺はいつも通りのコーヒーにするか","No, it's okay, I just thought of it. ......
Right, I'll have coffee as usual."
"Idolchr_0405_A_06_00_030(0)","Ｐ","それじゃあ、注文しようか……。
すみませーん","Let's order then. ......
excuse me"
"Idolchr_0405_A_06_00_031(0)","店員","はい。ご注文をどうぞ","Yes, please place your order."
"Idolchr_0405_A_06_00_032(0)","Ｐ","えーっと、抹茶ドーナツと、
それから…………","Let's see, matcha doughnuts and,
Then go to ............"
"Idolchr_0405_A_06_00_033(0)","店員","お待たせいたしました。
こちら、お先に抹茶ドーナツです","
Here is a matcha doughnut after you!"
"Idolchr_0405_A_06_00_034(0)","凛世","ふふ……
美味しそうで、ございます……","Hmmm... ......
It looks delicious. ......"
"Idolchr_0405_A_06_00_035(0)","Ｐ","あ、先に食べてくれ。
俺の注文を待たなくていいからな","Oh, eat first.
You don't have to wait for my order."
"Idolchr_0405_A_06_00_036(0)","凛世","では、お言葉に甘えて……
いただきます……","Well, I'll take your word for it: ......
Bon appétit: ......"
"Idolchr_0405_A_06_00_037(0)","凛世","はむ……","Hamu ......"
"Idolchr_0405_A_06_00_038(0)","凛世","ふふ……
とても美味しいです……","Hmmm... ......
Very tasty. ......"
"Idolchr_0405_A_06_00_039(0)","Ｐ","そうか。それはよかった","Well, that's good to know."
"Idolchr_0405_A_06_00_040(0)","凛世","プロデューサーさまも……
ぜひ……","Producers can also visit ......
Please visit ......"
"Idolchr_0405_A_06_00_041(0)","Ｐ","いいのか？　じゃあひと口……","Are you sure? Then take a sip: ......"
"Idolchr_0405_A_06_00_042(0)","Ｐ","うん、美味いよ！
抹茶って、いろんなお菓子に合うんだな","Yeah, it's delicious!
Matcha goes well with all kinds of sweets."
"Idolchr_0405_A_06_00_043(0)","凛世","お気に召されたのでしたら……
なにより……","If you like it, please visit ......
Above all, ......"
"Idolchr_0405_A_06_00_044(0)","Ｐ","それに、美味しいものを
分かち合うっていうのも楽しいしな","Plus, you're going to get some good food.
It's fun to share."
"Idolchr_0405_A_06_00_045(0)","凛世","ふふ……
はい……","Hmmm... ......"
"Idolchr_0405_A_07_00_001(0)","Ｐ","（しまった……。後回しにしていた仕事が、
こんなにも溜まっていたとは……）","(Oh shoot............the work I've been putting off,
(I didn't realize it had accumulated so much ......)"
"Idolchr_0405_A_07_00_002(0)","凛世","お疲れ様です……","Thanks for your help: ......"
"Idolchr_0405_A_07_00_003(0)","Ｐ","おっ、凛世。お疲れ様。
レッスンの前の準備か？","Hey, Rinse, thanks for your hard work.
Preparation before the lesson?"
"Idolchr_0405_A_07_00_004(0)","凛世","はい……
時間が少々ございましたので……","
We have a little time, so please visit ......"
"Idolchr_0405_A_07_00_005(0)","Ｐ","そうか。
最近レッスンの調子はどうだ？","Okay.
How's the lesson going lately?"
"Idolchr_0405_A_07_00_006(0)","凛世","はい……
順調に進んで……","
Stay tuned and visit ......"
"Idolchr_0405_A_07_00_007(0)","凛世","それに……
ルミナスのみなさまとも……","It can be found at ......
Also with everyone at Luminous: ......"
"Idolchr_0405_A_07_00_008(0)","Ｐ","なるほど、それはいいことだな。
仕事ぶりを見ても、息が合ってきてるのはわかるよ","Well, that's good to know.
I can tell from the way you're working that you're starting to catch your breath."
"Idolchr_0405_A_07_00_009(0)","凛世","それは……
プロデューサーさまのご指導の賜物……","
Thanks to the producer's guidance: ......"
"Idolchr_0405_A_07_00_010(0)","Ｐ","そんなことないぞ。
凛世やみんなが努力をしているからだ","
Because Rinse and everyone else is making an effort."
"Idolchr_0405_A_07_00_011(0)","凛世","はい……
そのお言葉を……励みに……","
We encourage you to take those words to ...... ......"
"Idolchr_0405_A_07_00_012(0)","凛世","あの……
プロデューサーさま……","That ......
Dear Producer: ......"
"Idolchr_0405_A_07_00_013(0)","凛世","差し出がましいようですが……
ご多忙のところだったのでは……","I'm sorry to be so blunt, but ......
I'm sure you've been busy: ......"
"Idolchr_0405_A_07_00_014(0)","Ｐ","いや、そんなことはないぞ。みんなが
レッスンの時に、片付けようとしていた仕事だ","No, it's not true, people.
That's the job I was trying to clean up at the lesson."
"Idolchr_0405_A_07_00_015(0)","凛世","…………","…………"
"Idolchr_0405_A_07_00_016(0)","Ｐ","もしかして、何か聞きたいことがあったのか？
時間はあるから、相談に乗るぞ","Perhaps you had something you wanted to ask?
I've got time. I'll talk to you about it."
"Idolchr_0405_A_07_00_017(0)","凛世","……はい……","...... yes......"
"Idolchr_0405_A_07_00_018(0)","凛世","お聞きしたいことが……
ひとつ……","I have a question for you: ......
One: ......"
"Idolchr_0405_A_07_00_019(0)","Ｐ","俺に答えられることなら何でも聞いてくれ","Ask me anything I can answer."
"Idolchr_0405_A_07_00_020(0)","凛世","プロデューサーさまには……
海外の……ご経験が……","Producers are encouraged to contact us at ......
If you have ...... experience abroad, please contact us at ......"
"Idolchr_0405_A_07_00_021(0)","Ｐ","ああ。少しだけど海外でエンターテイメントや、
プロデュースについて勉強してきたんだ","Yeah, a little bit of overseas entertainment,
I've been studying about producing."
"Idolchr_0405_A_07_00_022(0)","凛世","それは……
ご自身でご決断を……？","
Please make your own decision at ......?"
"Idolchr_0405_A_07_00_023(0)","Ｐ","もちろん。みんなをもっと輝かせるには、
俺自身が広い世界を知っておくべきだからな","Of course...to make everyone shine brighter,
I should know the wider world myself."
"Idolchr_0405_A_07_00_024(0)","凛世","そのような……
決意が……","Such as ......
The determination is ......"
"Idolchr_0405_A_07_00_025(0)","凛世","臆することなく……
広い世界を……","Unabashedly ......
The wider world: ......"
"Idolchr_0405_A_07_00_026(0)","Ｐ","はは……まあ、多少不安はあったけど、
成長してやろうって気持ちの方が強かったから","Haha ...... well, I was somewhat worried,
I was more interested in growing up."
"Idolchr_0405_A_07_00_027(0)","Ｐ","海外ではいろんなことがあったよ。
一番印象的だったのは……そうだな","I've had a lot of things happen to me overseas.
I guess the most impressive one was ......"
"Idolchr_0405_A_07_00_028(0)","選択肢","価値観","values"
"Idolchr_0405_A_07_00_029(0)","選択肢","食べ物","food"
"Idolchr_0405_A_07_00_030(0)","Ｐ","価値観の違いってやつかな。
海外の多様性には感心させられたよ","I guess it's called a difference in values.
I've been impressed with the diversity of foreign countries."
"Idolchr_0405_A_07_00_031(0)","凛世","それは……
とても貴重な経験ですね……","
It's a very valuable experience. ......"
"Idolchr_0405_A_07_00_032(0)","Ｐ","物事を良し悪し、新しい古いで区切らず、自分が
何に挑戦したいのか……。それを教えてもらったよ","Don't divide things into good and bad, new and old.
What do you want to try ....... I've been told that."
