"id","character","source","translatedstr"
"Idolchr_0404_A_11_00_029(0)","甘奈","確かにファンのみんながライブを楽しんで
くれてるってよく分かったよ！","Surely all the fans enjoyed the show.
I'm well aware that you're giving it to me!"
"Idolchr_0404_A_11_00_030(0)","Ｐ","ふたりが楽しそうなのが伝わってきたからな。
楽しむことも、大切だよ","I could tell the two of them were having fun.
It's important to have fun, too."
"Idolchr_0404_A_11_00_031(0)","甘奈","うん、まずはステージの上の甘奈たちが
楽しんでるのって大事だよね","Yeah, first of all, Amana and the others on stage.
It's important that you're having fun."
"Idolchr_0404_A_11_00_032(0)","甘奈","そうしないと、ファンのみんなに
楽しさは届けられないもん！","If you don't, you'll be a fan.
You can't deliver fun!"
"Idolchr_0404_A_11_00_033(0)","甘奈","甘奈ね、やっとわかった気がするんだ。
前にプロデューサーさんが伝えてくれたこと……","Amana, I think I finally understand.
What the producer told me before: ......"
"Idolchr_0404_A_11_00_034(0)","甘奈","『ファンが甘奈のことを見てくれてる』……","'Fans are looking out for Amana.' ......"
"Idolchr_0404_A_11_00_035(0)","甘奈","甘奈には甘奈の、甜花ちゃんには甜花ちゃんの
小さくてもそれぞれの輝きがあって……","Amana's for Amana and Beetika's for Beetika.
They may be small, but they each have their own sparkle. ......"
"Idolchr_0404_A_11_00_036(0)","甘奈","ふたり一緒にいると、
また違う輝きができるってことなんだね……","The two together,
I guess that means we can shine differently again. ......"
"Idolchr_0404_A_11_00_037(0)","甘奈","だから甘奈たちにしかできないやりかたで、
ファンのみんなに喜んでもらえたらいいな……！","So, we did it in a way that only Amana and her colleagues could do,
I hope all the fans are happy. ......"
"Idolchr_0404_A_11_00_038(0)","Ｐ","甘奈たちが一生懸命考えたやり方なら、
みんな喜んでくれるだろうな","If it's the way Amana and her team have worked so hard to come up with,
I'm sure they'd all love it."
"Idolchr_0404_A_11_00_039(0)","甘奈","えへへ……。って、甘奈、自分で自分のこと
輝いてるなんて言っちゃった……！","Ehehe ......... and Amana, you're on your own.
I said it was brilliant. ......"
"Idolchr_0404_A_11_00_040(0)","Ｐ","いや、甘奈も甜花も輝いていたよ。
これからはルミナスでもふたりの……","No, both Amana and Tetuka shined.
From now on, we will both be ...... in Luminous."
"Idolchr_0404_A_11_00_041(0)","","きゅ～……","Kyu~......"
"Idolchr_0404_A_11_00_042(0)","甜花","あ、あう……
……お腹、空いちゃった……","Ah, ah ......
......I'm hungry......"
"Idolchr_0404_A_11_00_043(0)","甜花","……ごめんね、なーちゃん……","I'm sorry, Nah ...... ......"
"Idolchr_0404_A_11_00_044(0)","甘奈","ごめんね、甜花ちゃん。
おしゃべりに夢中になって、気づかなかったよ","Sorry, beetroot.
I was so busy chatting that I didn't even notice."
"Idolchr_0404_A_11_00_045(0)","甘奈","甜花ちゃんと一緒に食べたいの、
たっくさんあるんだ☆","I want to eat with Tenka,
There are a lot of them."
"Idolchr_0404_A_11_00_046(0)","甘奈","あのね、ここのパフェは食べなくちゃダメだよ！
ライバルだから☆","You know, you have to eat the parfait here!
They're rivals."
"Idolchr_0404_A_11_00_047(0)","甜花","ら、ライバル……！？
……それなら……負けない……！","La, a competitor ......!
...... then ...... you can't lose ......!"
"Idolchr_0404_A_11_00_048(0)","甘奈","うん、一緒に戦お～☆","Yes, let's fight together~☆☆☆."
"Idolchr_0404_A_11_00_049(0)","甜花","お、お～……！","Oh, oh~ ......!"
"Idolchr_0404_A_11_00_050(0)","Ｐ","（うん、ふたりともいい笑顔だ。
キラキラ、眩しくて……）","(Yes, they both have nice smiles.
(Sparkle, dazzle, dazzle: ......)"
"Idolchr_0404_A_11_00_051(0)","Ｐ","（ふたりがもっと輝く姿を見るために
俺も頑張ろう）","(To see the two of you shine even brighter)
(I'll do my best.)"
"Idolchr_0404_A_12_00_001(0)","Ｐ","（甘奈と一緒に仕事に向かっている……）","(I'm heading to work with Amana at ......)"
"Idolchr_0404_A_12_00_002(0)","甘奈","プロデューサーさん☆","Producers☆"
"Idolchr_0404_A_12_00_003(0)","Ｐ","甘奈、どうしたんだ？　こんなに近づいてきて……
いま向かってる仕事について相談でもあるのか？","Amana, what's wrong with you? You came so close to me. ......
You want to talk to me about the job you're on your way to?"
"Idolchr_0404_A_12_00_004(0)","甘奈","んーん、ちがうよー。
えっとねー……","Mmmm, no.
Let's see... ......"
"Idolchr_0404_A_12_00_005(0)","甘奈","プロデューサーさん、いつもありがとね☆","Thanks for everything, producer!"
"Idolchr_0404_A_12_00_006(0)","甘奈","甘奈ね、ホントに感謝してるんだ。
ちゃんと伝わってるといいんだけど……","Amana, I really appreciate it.
I hope I'm getting it right: ......"
"Idolchr_0404_A_12_00_007(0)","Ｐ","ど、どうしたんだ突然","What's wrong with you?"
"Idolchr_0404_A_12_00_008(0)","甘奈","ちゃんとお礼を言えてなかったから、
しっかり伝えたかったの……ありがとって……","I didn't thank him properly,
I wanted to make sure to tell you ...... thanks ......"
"Idolchr_0404_A_12_00_009(0)","甘奈","甜花ちゃんのことで悩んで……自分でもよく
わかんなくなって……甘奈、自信失くしてた","I'm having a hard time with Tenka ...... myself.
I lost my confidence in ...... Amana because I didn't know what to do."
"Idolchr_0404_A_12_00_010(0)","甘奈","でもプロデューサーさんのおかげで
また頑張れたの……","But thanks to the producer.
I was able to work hard again: ......"
"Idolchr_0404_A_12_00_011(0)","Ｐ","甘奈……","Amana ......"
"Idolchr_0404_A_12_00_012(0)","甘奈","それにね、甜花ちゃんとふたりでライブをして
わかった気がするんだ……","Besides, you and Tetuka are going to do a live concert together.
I think I understand. ......"
"Idolchr_0404_A_12_00_013(0)","甘奈","アイドルに大切なこと……
えへへ……気付くの遅すぎるよね……","Important for idols: ......
Hehehe ...... you're too late to notice that. ......"
"Idolchr_0404_A_12_00_014(0)","Ｐ","そんなことはない！　だって……","That's not true, because ......"
"Idolchr_0404_A_12_00_015(0)","","それが甘奈本来の
才能だよ","That is Amana's original
Talent."
"Idolchr_0404_A_12_00_016(0)","","甘奈は最初から
アイドルだった","Amana was the first.
She was an idol."
"Idolchr_0404_A_12_00_017(0)","","気付いて良かった","Good to know."
"Idolchr_0404_A_12_00_018(0)","Ｐ","甘奈は最初から気づいていたよ。
それが本来の甘奈の才能だったんじゃないかな","Amana noticed it from the beginning.
I think that was Amana's original talent."
"Idolchr_0404_A_12_00_019(0)","甘奈","才能？　甘奈、最初はよく分かってなかったよ。
今も分かってないかもしれないけど……","Talent? Amana, I didn't quite get it at first.
Maybe you still don't get it. ......"
"Idolchr_0404_A_12_00_020(0)","甘奈","でも、前よりは分かった気がするんだ。そうやって
少しずつでも、成長していけたらいいなって","But I feel like I understand it better than I did before, that's how.
I hope to grow little by little."
"Idolchr_0404_A_12_00_021(0)","Ｐ","甘奈は最初からちゃんとアイドルだったよ","Amana was an idol right from the start."
"Idolchr_0404_A_12_00_022(0)","甘奈","最初からアイドル……？","Idol ...... from the beginning?"
"Idolchr_0404_A_12_00_023(0)","Ｐ","甘奈は自分で気付いていないだけで、
ちゃんと輝いていたんだ。俺が保証するよ","Amana just doesn't realize it herself,
It was shining, I assure you."
"Idolchr_0404_A_12_00_024(0)","甘奈","そっか。甘奈、今なら少しだけ、アイドルがわかる
気がするから……輝けてる……かな、えへへ……","I see...Amana, now I can understand your idol a little better.
I feel like I'm ...... shining ......, hehehe ......"
"Idolchr_0404_A_12_00_025(0)","Ｐ","遅いなんてことはない。
今気付いて良かったじゃないか","It is never too late.
You're lucky you just realized that now."
"Idolchr_0404_A_12_00_026(0)","甘奈","そうだよね、気付かずにいたら甘奈、
もっと甜花ちゃんの足を引っ張ってた！","Yes, Amana if you are unaware of it,
I was dragging my feet on more beetroot!"
"Idolchr_0404_A_12_00_027(0)","甘奈","今気付いても、
遅すぎるってことは……ない……よね？","Even if you realize it now,
If it's too late, it's ...... not ......, right?"
"Idolchr_0404_A_12_00_028(0)","Ｐ","甘奈は覚えていないかもしれないけど、甘奈は
動きが魅力的だって伝えたことがあっただろ？","Amana may not remember, but Amana is.
Didn't I once tell you that the movement was fascinating?"
"Idolchr_0404_A_12_00_029(0)","Ｐ","あれは『他の人を惹き付ける力』の原石だったんだ。
人前に立つ者として、無自覚の決意があった","That was the rough stone of 'the power to attract others.
As a public figure, I had an unacknowledged determination."
"Idolchr_0404_A_12_00_030(0)","Ｐ","甘奈は初めからアイドルに大切なことを知っていた。
俺はそれを引き出す手伝いをしただけだ","From the beginning, Amana knew what was important for idols.
I just helped bring it out."
"Idolchr_0404_A_12_00_031(0)","Ｐ","甘奈はアイドルとして輝いてるぞ","Amana is a shining idol."
"Idolchr_0404_A_12_00_032(0)","甘奈","ありがと……","Thanks ......"
"Idolchr_0404_A_12_00_033(0)","甘奈","プロデューサーさんにそう言ってもらえるのが、
一番うれしいな……","I can't wait to hear the producer say that,
I'm most happy for you. ......"
"Idolchr_0404_A_12_00_034(0)","甘奈","……甘奈、もっとちゃんと理解したい。
アイドルのこと、もっと……もっと！","...... Amana, I would like to understand it better.
More about idols, more ...... more!"
"Idolchr_0404_A_12_00_035(0)","甘奈","けど、プロデューサーさんと一緒なら
きっと大丈夫だから……","But if you're with the producer
It's going to be okay. ......"
"Idolchr_0404_A_12_00_036(0)","甘奈","だから……！　プロデューサーさん、
これからも甘奈のこと支えてほしいな！","So ......! Producer,
I hope you will continue to support Amana!"
"Idolchr_0404_A_12_00_037(0)","甘奈","甜花ちゃんも一緒に！　ね☆","Beetika, you're with me!"
"Idolchr_0404_A_12_00_038(0)","Ｐ","ああ、一緒に進んでいこうな！","Yeah, we'll move forward together!"
"Idolchr_0404_A_12_00_039(0)","甘奈","うん！　えへへ……","Yeah! Hehehe ......"
"Idolchr_0404_Z_01_00_001(0)","甘奈","プロデューサーさーん、こっちこっち！
行ってみたいお店はもうちょっと先だよ","Producer, this way, this way!
The restaurant I'd like to go to is just a little further down the road."
"Idolchr_0404_Z_01_00_002(0)","Ｐ","わかったわかった。
時間はあるからそんなに急がなくてもいいぞ","All right, all right.
We have time, so don't be in such a hurry."
"Idolchr_0404_Z_01_00_003(0)","甘奈","えへへ♪　だってプロデューサーさんと一緒に
買い物できるなんてうれしいもん☆","Hehehe♪ Because I'm with the producer.
I'm so happy to be able to shop!"
"Idolchr_0404_Z_01_00_004(0)","甘奈","えっと、ほら、だってふたりで買い物ってさ、
なんか……その……","Well, you see, because we are shopping together,
Something like ...... that ......"
"Idolchr_0404_Z_01_00_005(0)","甘奈","あ、甘奈、テンション高すぎるかな？　うれしくて、
少し舞い上がっちゃってるかも……えへへ……","Oh, Amana, am I too excited? I'm so happy,
Maybe I'm getting a little carried away......hehehehe......"
"Idolchr_0404_Z_01_00_006(0)","Ｐ","いや、甘奈が元気そうで嬉しいよ","No, I'm glad Amana is doing well."
"Idolchr_0404_Z_01_00_007(0)","甘奈","ありがと。会える時間、減っちゃったし","Thank you, I don't have much time to see you anymore."
"Idolchr_0404_Z_01_00_008(0)","甘奈","だからこうやってプロデューサーさんと
一緒に過ごせるの、甘奈、うれしいんだ♪","That's why I'm doing this with the producer.
I'm so glad we get to spend time together, Amana."
"Idolchr_0404_Z_01_00_009(0)","Ｐ","そうだな、俺も甘奈と会えるのは嬉しいよ。
最近の活動はどうだ？　楽しんでるか？","Yeah, I'm glad I get to meet Amana too.
How's your activity these days? Are you having fun?"
"Idolchr_0404_Z_01_00_010(0)","甘奈","うん、もちろん！
甜花ちゃんもめっちゃかわいーし！","Yes, of course!
Tetuka-chan is also very cute!"
"Idolchr_0404_Z_01_00_011(0)","甘奈","甜花ちゃん、この前のステージとかもホントに
すごかったんだよ？　見ないと損するってくらい！","Beet, the last time you were on stage or something like that, really.
It was amazing, you know? You have to see it to believe it!"
"Idolchr_0404_Z_01_00_012(0)","Ｐ","はは、相変わらず甜花のことが大好きなんだな。
甜花も頑張っているけど、甘奈はどうなんだ？","Ha, you still love beet blossoms, don't you?
Beetika is doing well, but what about Amana?"
"Idolchr_0404_Z_01_00_013(0)","甘奈","甘奈？　甘奈も頑張ってるよー！
だって甜花ちゃんと一緒なんだから☆","Amana? Amana is doing her best too!
Because I'm with Tetuka☆."
"Idolchr_0404_Z_01_00_014(0)","甘奈","甜花ちゃんとふたりの活動も、すっごく充実してる！　
キラキラ一緒に輝けてるなーって感じるんだ","Tianhua and I are also very active together!
I feel like we're shining together."
"Idolchr_0404_Z_01_00_015(0)","甘奈","それにね……甘奈、ファンのみんなに
支えられてるんだって、ちゃんと分かったから","Besides, ...... Amana, to all my fans.
I know now that I have your support."
"Idolchr_0404_Z_01_00_016(0)","甘奈","改めてちゃんと実感できたの、
プロデューサーさんのおかげだよ☆","I could feel it again,
It's all thanks to the producer."
"Idolchr_0404_Z_01_00_017(0)","甘奈","ありがとね、プロデューサーさん。
甘奈にアイドルとして大切なこと、気づかせてくれて","Thanks, producer.
You made me realize how important it is to be an idol."
"Idolchr_0404_Z_01_00_018(0)","Ｐ","それは甘奈が元々持っていた素質だよ。
……元気にアイドルをやれているならそれが一番だ","That's a quality that Amana originally had.
...... If you're doing well and idolizing, that's the best thing you can do."
"Idolchr_0404_Z_01_00_019(0)","甘奈","えへへ……あらためてお礼言えて良かった。
今日の目標、１つ達成！","Ehehehe ...... glad I could thank you again.
Today's goal, one achieved!"
"Idolchr_0404_Z_01_00_020(0)","甘奈","さてと……じゃあもう１つの目標も
頑張らないとね……！","Okay, well, ......, so one more goal.
I'll have to work on it. ......"
"Idolchr_0404_Z_01_00_021(0)","Ｐ","目標？　一体どんな目的があるんだ？","Goals? What the hell kind of goals do you have in mind?"
"Idolchr_0404_Z_01_00_022(0)","甘奈","それはね～……
プロデューサーさんを『口説き落とす』こと！","It is - ......
To 'seduce' the producer!"
"Idolchr_0404_Z_01_00_023(0)","Ｐ","口説き落とす！？
な、なにを言ってるんだ、甘奈","Seduction!
What are you talking about, Amana?"
"Idolchr_0404_Z_01_00_024(0)","甘奈","いつかね、甘奈と甜花ちゃんのユニットを
またプロデュースしてほしいなーって思ってるんだ☆","Someday, I'd like to have a unit of Amana and Tetuka-chan.
I'm hoping you'll produce again☆."
"Idolchr_0404_Z_01_00_025(0)","甘奈","今っていうか、いつかの話だけど、
伝えておこうと思って","I'm not talking about now, I'm talking about someday,
I just thought I'd let you know."
"Idolchr_0404_Z_01_00_026(0)","甘奈","と、いうわけで～……プロデューサーさん！
これからもよろしくお願いします！","And so ~...... producer!
Thank you for your continued support!"
"Idolchr_0404_Z_01_00_027(0)","Ｐ","いい笑顔だな……うっかり口説き落とされそうだ","Nice smile. ...... I'm going to accidentally seduce you."
"Idolchr_0404_Z_01_00_028(0)","甘奈","うっかりじゃなくて、
しっかり口説き落とされてほしいな","Not inadvertently,
I hope he's seduced well."
"Idolchr_0404_Z_01_00_029(0)","甘奈","プロデューサーさんには、甘奈のこと……
甘奈が輝いてるところ、ずっと見ててほしいから！","Producers are asked to contact Amana at ......
I want you to see Amana shining all the time!"
