"id","character","source","translatedstr"
"Idolchr_0404_A_01_00_001(0)","Ｐ","（甘奈は……と。どうやら、雑誌に夢中のようだな）","(Amana is with ....... Apparently, she's obsessed with magazines.)"
"Idolchr_0404_A_01_00_002(0)","甘奈","あ、プロデューサーさんいたの！？
ごめんね、気付かなくて……！","Oh, there was a producer!
Sorry, I didn't realize that. ......"
"Idolchr_0404_A_01_00_003(0)","Ｐ","邪魔しちゃ悪いかと思ってな。
それで、何の雑誌を読んでるんだ？","I don't want to intrude.
So what magazine are you reading?"
"Idolchr_0404_A_01_00_004(0)","甘奈","ティーン向けのファッション誌だよ～！
週替わりの特集に甜花ちゃんが出てるの！","It's a teen fashion magazine!
I have a beet on my weekly feature!"
"Idolchr_0404_A_01_00_005(0)","Ｐ","どれどれ……へぇ、甜花らしいふんわりした
可愛さが伝わってくる、いい写真だな","Which one is ...... Heh, fluffy like a beet flower.
I can feel the cuteness, nice picture."
"Idolchr_0404_A_01_00_006(0)","甘奈","えへへ、そうなんだよね！　
特にこの写真、めっちゃかわいーんだ！","Heh, heh, heh!
This picture in particular is so cute!"
"Idolchr_0404_A_01_00_007(0)","甘奈","どの甜花ちゃんもかわいーけど、
やっぱり笑顔の甜花ちゃんが一番だよねっ☆","All of the beet girls are cute, though,
After all, a smiling beet is the best, isn't it☆."
"Idolchr_0404_A_01_00_008(0)","Ｐ","ああ、確かにいい笑顔だ。さすが甘奈、
甜花をいつもそばで見ているだけはあるな","Oh, she certainly has a nice smile, as one would expect from Amana,
You're just always watching the beets and flowers by your side."
"Idolchr_0404_A_01_00_009(0)","甘奈","うん！　甜花ちゃんのことだったら、
なんでも聞いてね！","Yeah! If it's about Tenka,
Ask me anything!"
"Idolchr_0404_A_01_00_010(0)","Ｐ","ああ、その時はお願いするよ","Yeah, I'll ask for your help then."
"Idolchr_0404_A_01_00_011(0)","Ｐ","……えっと、甘奈は、甜花と一緒に輝きたくて、
アイドルになったんだよな","...... Well, Amana wanted to shine with Tetuka,
You've become an idol."
"Idolchr_0404_A_01_00_012(0)","甘奈","うん、そーだよ！
一緒にキラキラ輝きたいって思ってるんだー☆","Yeah, that's right!
We want to sparkle and shine together."
"Idolchr_0404_A_01_00_013(0)","甘奈","それとね、甜花ちゃんのかわいさを、
み～んなに知ってもらいたいのっ！","And hey, how cute is Tetuka?
I want everyone to know about it!"
"Idolchr_0404_A_01_00_014(0)","Ｐ","（甘奈は甜花について、
嬉しそうに語っているが……）","(Amana is about Tenka,
(......), although he is happy to talk about it."
"Idolchr_0404_A_01_00_015(0)","","甘奈は甜花が
好きなんだな","Amana is a sugar beet.
You like it."
"Idolchr_0404_A_01_00_016(0)","","甜花も可愛いが
甘奈も可愛いぞ","The beet is lovely, but...
Amana's cute, too."
"Idolchr_0404_A_01_00_017(0)","","甘奈のことを
知りたい","I'm talking about Amana."
"Idolchr_0404_A_01_00_018(0)","Ｐ","甘奈は、本当に甜花のことが好きなんだな","Amana must really like Tetuka."
"Idolchr_0404_A_01_00_019(0)","甘奈","えへへっ！　もちろん☆","Hehehe! Of course☆!"
"Idolchr_0404_A_01_00_020(0)","甘奈","甜花ちゃんと一緒なら、
どんなことだって頑張れるよっ！","If it's with Tenka,
I can do my best in anything!"
"Idolchr_0404_A_01_00_021(0)","Ｐ","甜花も可愛いが……
甘奈も、もちろん可愛いぞ！","Tenka are cute, but ......
And Amana, of course, she's adorable!"
"Idolchr_0404_A_01_00_022(0)","甘奈","えへへ……ありがと！","Ehehe ...... thanks!"
"Idolchr_0404_A_01_00_023(0)","甘奈","褒めてくれてうれしいなっ","I'm glad you appreciate the compliment."
"Idolchr_0404_A_01_00_024(0)","Ｐ","甜花のこともいいが、甘奈のことも、
もっといろいろ教えてほしいな","I like Tenka, but also the amana,
I wish you could tell me more about it."
"Idolchr_0404_A_01_00_025(0)","甘奈","甘奈のことかぁ……。
うーん……","I think you mean Amana. ......"
"Idolchr_0404_A_01_00_026(0)","甘奈","あ！　そうだ！
色んな自撮りアプリを試すのがマイブームだよ☆","Ah! Yes, that's right!
I'm on a selfie kick, trying out all kinds of selfie apps."
"Idolchr_0404_A_01_00_027(0)","Ｐ","ルミナスの活動、大変なこともあると思うけど、
甘奈は頑張れそうか？","Luminous activity, I know it can be tough,
Can Amana hang in there?"
"Idolchr_0404_A_01_00_028(0)","甘奈","うん！　精一杯頑張るよっ！","I'll do my best!"
"Idolchr_0404_A_01_00_029(0)","甘奈","プロデューサーさん、甜花ちゃんと甘奈のこと、
よろしくお願いします！","Producers, Tetuka and Amana,
Best regards!"
"Idolchr_0404_A_02_00_001(0)","Ｐ","（甘奈の自主レッスンに付き添うことにした……）","(I decided to accompany Amana to her independent lesson: ......)"
"Idolchr_0404_A_02_00_002(0)","甘奈","うーん……もう少し指先を伸ばしながら、
全体の動きはふんわり……って感じかなぁ……","Hmmm ...... while stretching my fingertips a bit more,
I think the whole movement is like a soft ...... ......"
"Idolchr_0404_A_02_00_003(0)","甘奈","プロデューサーさんはどう思う？","What do you think, producer?"
"Idolchr_0404_A_02_00_004(0)","Ｐ","ああ、俺もその方針でいいと思う","Yeah, I think I'm okay with that policy too."
"Idolchr_0404_A_02_00_005(0)","Ｐ","甘奈は自分の魅力をよくわかっているな。
それを動きにも活かしてる……さすがだよ","Amana knows exactly what makes her so attractive.
And that's what you're doing with the movement. ...... is as good as it gets."
"Idolchr_0404_A_02_00_006(0)","甘奈","えへへ、ありがと……！　えっと……
どこが甘奈の魅力だって思ってくれたの……？","Hehe, thanks ......!
What did you think was so attractive about Amana ......?"
"Idolchr_0404_A_02_00_007(0)","Ｐ","甘奈の魅力を感じるポイントは……","The key to Amana's appeal is ......"
"Idolchr_0404_A_02_00_008(0)","タッチ","手にふれる","become someone's property (e.g. of an object)"
"Idolchr_0404_A_02_00_009(0)","タッチ","頭を撫でる","stroke a person's head"
"Idolchr_0404_A_02_00_010(0)","タッチ","その他（タッチ）","Other (touch)"
"Idolchr_0404_A_02_00_011(0)","タッチ","それ以外","otherwise"
"Idolchr_0404_A_02_00_012(0)","甘奈","手かぁ……
指先まで意識したのがよかったのかな","Hand or ......
I guess it was good that I was aware of all my fingertips."
"Idolchr_0404_A_02_00_013(0)","Ｐ","ああ、甘奈の心遣いが表れているみたいで……
とってもきれいだと思ったんだ","Oh, it's like Amana's thoughtfulness shows. ......
I thought it was very beautiful."
"Idolchr_0404_A_02_00_014(0)","甘奈","えへへ、プロデューサーさん、褒めすぎっ！
……でも、きれいって、なんだか照れちゃうね","Hehe, producer, you give too many compliments!
...... but I'm kind of embarrassed to say it's beautiful!"
"Idolchr_0404_A_02_00_015(0)","甘奈","頭撫でられるなんて久しぶりかも。
ちょっと照れちゃうな","Maybe it's been too long since I've had my head stroked.
I'm a little embarrassed."
"Idolchr_0404_A_02_00_016(0)","Ｐ","ちゃんと考えて動いているところかな。
それがより甘奈を魅力的にみせてると思うんだ","I think it's a place where they are thinking and working properly.
I think it makes Amana more attractive."
"Idolchr_0404_A_02_00_017(0)","甘奈","えへへ、そうかな？　甘奈なりに考えてたことが
ちゃんと伝わってるなら、嬉しいな♪","Heh, I don't know. I was thinking in my own way, Amana.
I'm glad you got the message right."
"Idolchr_0404_A_02_00_018(0)","甘奈","えっと、プロデューサーさん、それじゃ漠然としてて
どこがいいのか、よく分からないかも……","Um, producer, that's too vague.
Maybe I'm not sure what's better: ......"
"Idolchr_0404_A_02_00_019(0)","Ｐ","あ、そうだよな。全体的にいいと思ったんだが、
もう少し具体的に絞ったほうが良かったな","Oh, yeah, I thought the whole thing was great,
I should have narrowed it down to something a little more specific."
"Idolchr_0404_A_02_00_020(0)","甘奈","そっか、全体的にはいいんだね。
良かった……","I see, so overall it's good.
Good: ......"
"Idolchr_0404_A_02_00_021(0)","甘奈","……えっと、プロデューサーさん。
甘奈、やっぱり魅力的じゃなかったのかな？","...... Um, Producer-san.
Amana, I guess I wasn't attractive enough?"
"Idolchr_0404_A_02_00_022(0)","Ｐ","いや、そうじゃないんだけど、具体的にどこと
聞かれると、即答できなくてな……","No, I don't, but where exactly and
I couldn't give you a quick answer if you asked me. ......"
"Idolchr_0404_A_02_00_023(0)","甘奈","すぐ答えるのは難しいよね……！
困らせるようなこと聞いちゃってごめんっ！","It's hard to answer right away. ......
I'm sorry I asked you something that might have annoyed you!"
"Idolchr_0404_A_02_00_024(0)","甘奈","……ねぇ、プロデューサーさん","...... Hey, producer!"
"Idolchr_0404_A_02_00_025(0)","Ｐ","どうした？","What's up?"
"Idolchr_0404_A_02_00_026(0)","甘奈","甘奈、もっともっとアイドルのこと、
勉強しないとって思ってるんだ","Amana, more and more idols,
I'm thinking I need to study."
"Idolchr_0404_A_02_00_027(0)","甘奈","ルミナスのみんなはすごい人たちばかりだし、
甜花ちゃんもすっごく頑張ってるし……","And everyone at Luminous is amazing,
Tetuka is also doing very well. ......"
"Idolchr_0404_A_02_00_028(0)","甘奈","このままだと……
甘奈、置いていかれちゃうって思って……","As it stands, ......
Amana, I was afraid I would be left behind. ......"
"Idolchr_0404_A_02_00_029(0)","甘奈","だから、プロデューサーさんが気付いたことは
どんどん甘奈に教えてほしいのっ！","So, what the producer noticed is that
I want Amana to teach me more and more!"
"Idolchr_0404_A_02_00_030(0)","Ｐ","（甜花には甜花の、甘奈には甘奈の輝きがある。
……それは間違いない）","(A beet blossom has its beet blossom's and a sweet flower has its sweet flower's brilliance.
(...... that's for sure)"
"Idolchr_0404_A_02_00_031(0)","Ｐ","わかった。そうだな……まずはレッスンを重ねて
アイドルとしての基礎力を高めよう","All right, well, I'll start ...... with a series of lessons first.
Improve your basic skills as an idol."
"Idolchr_0404_A_02_00_032(0)","Ｐ","そうしたら、甘奈にしかできないことを
もっと見つけられると思う","Then you can do what only Amana can do.
I think we can find more."
"Idolchr_0404_A_02_00_033(0)","甘奈","甘奈にしかできないこと……","What only Amana can do: ......"
"Idolchr_0404_A_02_00_034(0)","甘奈","……ありがとうプロデューサーさん。
甘奈、レッスン頑張るねっ☆","Thank you producer at .......
Amana, good luck with your lesson☆."
"Idolchr_0404_A_02_00_035(0)","Ｐ","ああ、一緒に頑張っていこう！","Yea, let's do our best together!"
"Idolchr_0404_A_03_00_001(0)","Ｐ","（甘奈との仕事の帰り道……。
どことなく甘奈の様子が変に思える）","(On my way home from work with Amana: .......
(Somehow Amana's behavior seems strange.)"
"Idolchr_0404_A_03_00_002(0)","Ｐ","……甘奈、何かあったのか？
俺でよければ話を聞かせてくれないか","...... Amana, what's going on?
If it's okay with me, I'd like to talk to you."
"Idolchr_0404_A_03_00_003(0)","甘奈","プロデューサーさん……。
ありがと……","
Thanks ......"
"Idolchr_0404_A_03_00_004(0)","甘奈","この前、甜花ちゃんのステージを見たんだけど、
すごくキラキラしてたんだ","I saw Tetuka on stage the other day,
It was so sparkly."
"Idolchr_0404_A_03_00_005(0)","Ｐ","ああ、甜花の成長が感じられる
いいステージだったと思う","Oh, I can feel the sugar beets growing.
I think it was a good stage."
"Idolchr_0404_A_03_00_006(0)","甘奈","うん、すっごく楽しそうだった","Yeah, it looked like a lot of fun."
"Idolchr_0404_A_03_00_007(0)","甘奈","甜花ちゃんってあんなに輝けるんだね……。
どっか行っちゃいそうって怖い……かも……","Beetle can shine like that. ......
I'm afraid I'm going away. ...... or ......"
"Idolchr_0404_A_03_00_008(0)","甘奈","ねえ、プロデューサーさん……甘奈は……","Hey, producer, ...... Amana is ......"
"Idolchr_0404_A_03_00_009(0)","甘奈","甘奈はちゃんと成長できてるかな……？
甜花ちゃんの足、引っ張ってないかな……？","Is Amana growing up properly ......?
I hope I'm not dragging you down, beetroot: ......?"
"Idolchr_0404_A_03_00_010(0)","Ｐ","そんなことを考えていたのか。
そうだな……","Is that what you were thinking?"
"Idolchr_0404_A_03_00_011(0)","","甘奈のおかげだ","Thanks to Amana."
"Idolchr_0404_A_03_00_012(0)","","甘奈も成長している","Amana is growing up."
"Idolchr_0404_A_03_00_013(0)","","甘奈はこれからだ","Amana is just the beginning."
"Idolchr_0404_A_03_00_014(0)","","甜花の成長を喜ぼう","Let's rejoice in the growth of the sugar beet."
"Idolchr_0404_A_03_00_015(0)","Ｐ","甜花の成長は、甘奈のおかげだよ。お互いが刺激
しあって、ふたりともちゃんと成長していると思う","Tetsuka's growth is thanks to Amana, we inspire each other.
I think both of them are growing up well."
"Idolchr_0404_A_03_00_016(0)","甘奈","甘奈の頑張りが、甜花ちゃんの成長に……。
……えへへ……そっか……","Amana's hard work has helped Tetuka grow .......
......hehehe......I see......"
"Idolchr_0404_A_03_00_017(0)","甘奈","それなら甘奈、もっと頑張らないとだねっ！
そうしないとふたりで輝けないもん！","Then, Amana, you have to work harder!
Otherwise, we can't shine together!"
"Idolchr_0404_A_03_00_018(0)","Ｐ","甜花も成長しているけど、
甘奈だって同じくらい成長しているぞ","Tenka are growing, though,
Amana is growing up just as fast as you are."
"Idolchr_0404_A_03_00_019(0)","甘奈","ありがとう……だけどもっと練習しないとだよねっ！
甜花ちゃんに置いてかれないように……！","Thanks ...... but I need to practice more!
Don't be left behind by Tenka. ......"
"Idolchr_0404_A_03_00_020(0)","Ｐ","甜花は成長しているけど、甘奈だってこれからだ。
甘奈は、大器晩成型なんだろう","Tetuka is growing up, but even Amana has a long way to go.
Amana must be a great late bloomer."
"Idolchr_0404_A_03_00_021(0)","甘奈","甘奈は大器晩成型……。
うん……そうだったらいいな……","Amana is a great late bloomer. ......
Yeah ...... I hope so ......"
"Idolchr_0404_A_03_00_022(0)","甘奈","えへへ、ごめんね！　焦っちゃったみたい。
甘奈もちゃんと成長できるように頑張るね！","Hehehe, sorry! I guess I got impatient.
I'll do my best to make sure Amana grows up properly!"
"Idolchr_0404_A_03_00_023(0)","Ｐ","今は自分のことより、甜花の成長を喜ぼう","Let's rejoice in the growth of the sugar beets rather than ourselves right now."
"Idolchr_0404_A_03_00_024(0)","甘奈","……うん……それはもちろん……","...... yeah ...... that's of course ......"
"Idolchr_0404_A_03_00_025(0)","甘奈","けど、それなら寂しがってちゃだめだよね……。
甜花ちゃんだって頑張ってるんだし……！","But then you shouldn't be lonely. ......
Even the beet is doing her best. ......"
"Idolchr_0404_A_03_00_026(0)","甘奈","プロデューサーさん、話を聞いてくれてありがと。
甘奈、気が楽になったよ！","Thanks for listening to me, producer.
Amana, I feel much better now!"
"Idolchr_0404_A_03_00_027(0)","Ｐ","俺でよければ、いくらでも付き合うぞ。
よし、事務所に戻ろうか","If it's okay with me, I'll go out with you as much as you want.
Okay, let's go back to the office."
"Idolchr_0404_A_03_00_028(0)","甘奈","うん！　あ！　ちょっとどこか寄りたいな！
プロデューサーさんにお礼したいから☆","Yeah! Oh! I'd like to stop somewhere for a while!
Because I want to thank the producer."
"Idolchr_0404_A_03_00_029(0)","Ｐ","（甘奈には、もっと自信を持ってもらいたいな。
まずはレッスンか……）","(I wish Amana had more confidence.
(Lessons first or ......)"
"Idolchr_0404_A_04_00_001(0)","Ｐ","（甘奈と果穂、凛世の３人と事務所の備品の
買い出しにやってきた……）","(Amana, Kaho, and Rinyo and the office equipment)
(I came here to buy ......)"
"Idolchr_0404_A_04_00_002(0)","果穂","わぁ……！　人もお店もたっくさんです！
よそ見をしたら、はぐれちゃいそうです……っ！","Wow, ...... is full of people and stores!
If you look away, you might get lost. ......"
"Idolchr_0404_A_04_00_003(0)","甘奈","迷子にならないように気を付けないとね……！
果穂ちゃん、凛世ちゃん、近づいて歩こ！","We have to be careful not to get lost. ......
Kaho, Rinyo, walk closer!"
"Idolchr_0404_A_04_00_004(0)","果穂","はい、甘奈さん！","Yes, Amana!"
"Idolchr_0404_A_04_00_005(0)","凛世","はい……
人波に……飲まれぬよう……","
Don't let the crowd ...... drink you in ......"
"Idolchr_0404_A_04_00_006(0)","Ｐ","そうだな……本当に迷子になりそうだし、
ささっと買い出しを済ましてしまおう","I know, ...... I could get really lost,
Let's get your shopping done quickly!"
"Idolchr_0404_A_04_00_007(0)","甘奈","うん！　プロデューサーさんが迷子になったら
みんなで探すから、安心してね☆　","Yeah! If the producer gets lost...
We'll all look for you, so don't worry☆"
"Idolchr_0404_A_04_00_008(0)","","─１時間後─","One hour later..."
"Idolchr_0404_A_04_00_009(0)","Ｐ","これで一通りそろったな。
みんな、買い出し手伝ってくれてありがとうな","Now you've got it all in one place.
Thanks, guys, for helping me buy the stuff."
"Idolchr_0404_A_04_00_010(0)","甘奈","めっちゃ楽しかったから大丈夫！","It's okay because it was a lot of fun!"
"Idolchr_0404_A_04_00_011(0)","果穂","あたしも、みなさんとお買い物、
スッゴく楽しかったです！","I also went shopping with everyone,
It was a lot of fun!"
"Idolchr_0404_A_04_00_012(0)","凛世","はい……
凛世も……心から……","
Rinsei also ...... sincerely ......"
"Idolchr_0404_A_04_00_013(0)","Ｐ","じゃあそろそろ帰ろうか","Well, I guess it's time for us to go home."
"Idolchr_0404_A_04_00_014(0)","甘奈","あ！　プロデューサーさん！　最後に、
甜花ちゃんのお土産を買ってもいいかな……？","Ah! Producer! Finally,
Can I buy you a souvenir of your beetroot ......?"
"Idolchr_0404_A_04_00_015(0)","Ｐ","いいよ。
まだ時間も早いしな","All right.
It's still early."
"Idolchr_0404_A_04_00_016(0)","甘奈","えへへ、ありがと！　なにがいいかなー？","Hehehe, thanks! What would you like?"
"Idolchr_0404_A_04_00_017(0)","甘奈","プロデューサーさんはどんなものがいいと思う？","What do you think the producer would like?"
"Idolchr_0404_A_04_00_018(0)","Ｐ","甜花へのお土産か……","Souvenirs for the beet or ......"
"Idolchr_0404_A_04_00_019(0)","","甜花が好きなもの","What Tenka Likes"
"Idolchr_0404_A_04_00_020(0)","","甘奈が好きなもの","What Amana likes"
"Idolchr_0404_A_04_00_021(0)","","甘奈が選んだもの","Amana's Choice."
"Idolchr_0404_A_04_00_022(0)","","土産話をする","tell a tale of one's travels"
"Idolchr_0404_A_04_00_023(0)","Ｐ","甘奈が選んだものなら喜ぶと思うけど、そうだな、
甜花が好きなものが、一番喜ばれるんじゃないか？","I'm sure Amana would be happy with her choice, but yes,
I'm sure the things that Tenka likes to eat would be most appreciated."
"Idolchr_0404_A_04_00_024(0)","甘奈","えへへ、そうだよね！　ありがと！","Ehehe, you're right! Thanks!"
"Idolchr_0404_A_04_00_025(0)","甘奈","甜花ちゃんが好きなもの。
それならやっぱり……！","What beetroot likes.
Then it's still ......!"
"Idolchr_0404_A_04_00_026(0)","Ｐ","甘奈の好きなものを選んであげるのはどうだ？
オススメを渡してあげると、喜ぶんじゃないかな","How about I pick out something for you that Amana likes?
I'm sure they'll be happy to give you their recommendations."
"Idolchr_0404_A_04_00_027(0)","甘奈","甘奈が好きなもので、
甜花ちゃんも好きそうなもの？","I like Amana,
Something you might like, too, Beetika?"
"Idolchr_0404_A_04_00_028(0)","甘奈","コスメとかネイルは違うかも……。
あ！　プリンとか☆","Cosmetics and nails might be different. ......
Oh! Pudding, pudding, pudding, pudding."
"Idolchr_0404_A_04_00_029(0)","Ｐ","甜花だったら、甘奈が選んだものならなんでも
喜ぶと思うぞ","If it's a beet, whatever Amana chooses.
I think you'll be pleased."
"Idolchr_0404_A_04_00_030(0)","甘奈","……プロデューサーさんは優しいな。ありがと！","...... producers are so kind, thanks!"
"Idolchr_0404_A_04_00_031(0)","甘奈","でも、さすがになんでもは喜ばないかもだから、
もうちょっと考えてみるね！","But, as you can imagine, they might not be pleased with everything,
I'll give it some more thought!"
"Idolchr_0404_A_04_00_032(0)","Ｐ","土産話が一番だと思うぞ。
楽しかった話を聞かせてあげるといいんじゃないか？","I think you've got the best souvenir story of your life.
Why don't you tell them a story about the fun you had?"
"Idolchr_0404_A_04_00_033(0)","甘奈","うーん……お話かぁ……","Hmmm ...... story... ......"
"Idolchr_0404_A_04_00_034(0)","甘奈","できればそれだけじゃなくて、
何か持って帰ってあげたいんだけど……","Not only that, if possible,
I'd like to bring something back for you: ......"
"Idolchr_0404_A_04_00_035(0)","果穂","甘奈さん！
あれ、見てください！","Amana!
Oh, look at that!"
"Idolchr_0404_A_04_00_036(0)","甘奈","あっ、甜花ちゃんが大好きなデビ太郎だ！
エン次郎もいる！","Oh, it's Debitaro, who loves beetroot!
Enjiro is also there!"
"Idolchr_0404_A_04_00_037(0)","凛世","エン次郎……
水色の……お方でしょうか……","Enjiro ......
Is this the light blue ...... person ......"
"Idolchr_0404_A_04_00_038(0)","甘奈","うん、そうだよ。デビ太郎の仲間！
でもエン次郎のグッズはレアなんだ……！","Yes, that's right, Debitaro's friends!
But Enjiro's merchandise is rare. ......"
"Idolchr_0404_A_04_00_039(0)","果穂","そうなんですね！　それなら甜花さんも
きっとよろこんでくれると思います！","I see! Well, then, Mr. Tenka, too.
I am sure they will be pleased!"
"Idolchr_0404_A_04_00_040(0)","甘奈","そうだね、甜花ちゃんもまだ持ってないから、
これにしよう！　これなら喜んでくれそう☆","Yes, because Beetika doesn't have it yet either,
I'll take this one! I'm sure he'll be happy with this one☆."
"Idolchr_0404_A_04_00_041(0)","凛世","ふふ……
それは……何より……","Hmmm... ......
It is ...... more than anything else ......"
"Idolchr_0404_A_04_00_042(0)","甘奈","うん！
凛世ちゃん、果穂ちゃん、ありがと☆","
Thanks, Rinyo and Kaho!"
"Idolchr_0404_A_04_00_043(0)","Ｐ","甘奈が一生懸命選んだものだ。
甜花もきっと喜ぶよ","Amana worked very hard to choose the right one.
I'm sure Tenka will be pleased."
"Idolchr_0404_A_04_00_044(0)","甘奈","えへへ、うん……！
早く甜花ちゃんの喜ぶ顔、見たいなっ！","Heh, yeah. ......!
I can't wait to see Tetuka's happy face!"
"Idolchr_0404_A_04_00_045(0)","甘奈","プロデューサーさんも一緒に選んでくれてありがと。
うれしかったよ♪","Thanks to the producer for choosing with me.
I was happy."
"Idolchr_0404_A_05_00_001(0)","甘奈","ただいま……","I'm at ......"
"Idolchr_0404_A_05_00_002(0)","甜花","えと……ただいま……です……","Let's see......I'm back at ............"
"Idolchr_0404_A_05_00_003(0)","Ｐ","（甘奈と甜花、ふたりが仕事から帰ってきたが……
空気が重たいな、どうしたんだ？）","(Amana and Tetuka, they came home from work, but ......
(The air is heavy. What's going on?)"
"Idolchr_0404_A_05_00_004(0)","Ｐ","元気がないな。
仕事先でなにかあったのか？","You don't look well.
Did something happen at work?"
"Idolchr_0404_A_05_00_005(0)","甜花","え、えと、あの、その……
……なーちゃんが……","Well, uh, you know, that ......
......Na-chan is ......"
"Idolchr_0404_A_05_00_006(0)","甘奈","えへへ……ちょっとだけ……
緊張しちゃったみたい……","Ehehe ...... a little bit ......
I think I got nervous. ......"
