"id","character","source","translatedstr"
"Idolchr_0405_A_07_00_033(0)","凛世","柔軟なお心と……
広い視野を…………","Flexible minds and ......
A broader view: ............"
"Idolchr_0405_A_07_00_034(0)","Ｐ","食べ物かな。って、これは勉強とは関係ないか……。
でも、とにかく大きくて味も濃くて印象深かったな","Maybe food...or maybe this has nothing to do with studying. ......
But anyway, it was big, flavorful, and impressive."
"Idolchr_0405_A_07_00_035(0)","凛世","そうでしたか……","Was that so: ......"
"Idolchr_0405_A_07_00_036(0)","Ｐ","あっ、もちろん、ちゃんと勉強してきたんだぞ。
でも学んだことは多すぎて、語りきれないな","Oh, of course, I've studied it properly.
But there's so much I've learned, I can't even begin to tell you."
"Idolchr_0405_A_07_00_037(0)","凛世","それは……
察するに……余りあります……","
As you can guess there is more than ...... ......"
"Idolchr_0405_A_07_00_038(0)","凛世","貴重なお話を……
ありがとうございました……","Please share your valuable stories with us at ......
Thank you very much ......"
"Idolchr_0405_A_07_00_039(0)","Ｐ","でも、今はまだ目標に届かない。みんなで一緒に、
いろんなことに挑戦してお互いに成長していこう","But we're not quite at our goal right now, all together,
Let's challenge various things and grow with each other."
"Idolchr_0405_A_07_00_040(0)","凛世","プロジェクトルミナスは……
挑戦の連続……","Project Luminous is available at ......
A series of challenges: ......"
"Idolchr_0405_A_07_00_041(0)","Ｐ","ああ、いろんな挑戦を遂げて、
新しい景色をみんなで見ような","Oh, to accomplish various challenges,
Let's all see the new scenery together."
"Idolchr_0405_A_07_00_042(0)","凛世","新しい景色……
凛世にも……","New view: ......
Rinze also: ......"
"Idolchr_0405_A_07_00_043(0)","Ｐ","そのためにレッスンをして、ライブを重ねて、
ファンのみんなに喜んでもらわないとな","To achieve this, I took lessons and had a lot of live performances,
Gotta make all the fans happy."
"Idolchr_0405_A_07_00_044(0)","凛世","はい……
いっそう、精進いたします……","
We will be even more diligent. ......"
"Idolchr_0405_A_08_00_001(0)","Ｐ","（次の仕事まで時間があったので、
繁華街に寄ることにした）","(I had some time before my next job,
(Decided to stop downtown)"
"Idolchr_0405_A_08_00_002(0)","凛世","…………","…………"
"Idolchr_0405_A_08_00_003(0)","Ｐ","どうしたんだ、凛世。
ショーウィンドウの服が気になるのか？","What's wrong, Rinze?
You care about the clothes in the show window?"
"Idolchr_0405_A_08_00_004(0)","凛世","はい……
こういった洋服が、流行なのかと……","
I thought these clothes were trendy. ......"
"Idolchr_0405_A_08_00_005(0)","Ｐ","うーん……。飾られるくらいだから、
今年のトレンド？　って、やつなんだろうな","Hmmm............so much so that it's decorated,
This year's trend? I guess that's what it's called."
"Idolchr_0405_A_08_00_006(0)","凛世","トレンド……
人気ということでしょうか……","Trends: ......
I guess that means it's popular. ......"
"Idolchr_0405_A_08_00_007(0)","Ｐ","そうだろうな。ただ、人気だからトレンドなのか、
トレンドだから人気なのか……そこは分からないが","I suppose so, only it's trending because it's so popular,
I don't know if it's popular because it's trending ...... that part I don't know."
"Idolchr_0405_A_08_00_008(0)","凛世","ふふ……","Hmmm... ......"
"Idolchr_0405_A_08_00_009(0)","Ｐ","そういえば、凛世はいつも和装だけど、
ああいう服も着たいのか？","Come to think of it, Rinze is always dressed in kimono,
You want to wear clothes like that too?"
"Idolchr_0405_A_08_00_010(0)","凛世","その……
着こなせるか……どうか……","
Can you wear it ...... or not ......"
"Idolchr_0405_A_08_00_011(0)","凛世","ですが……
昨今、流行しているのであれば……","
If it's trendy these days, you can find it at ......"
"Idolchr_0405_A_08_00_012(0)","Ｐ","ん？　流行を気にしているのか？","Hmm? You care about fashion?"
"Idolchr_0405_A_08_00_013(0)","凛世","いえ……
凛世は……ただ……","No. ......
Rinze is just ...... ......"
"Idolchr_0405_A_08_00_014(0)","凛世","ファンの方が……増えるのでしたら……
ぜひ……","If you are a fan of ...... more ......
Please visit ......"
"Idolchr_0405_A_08_00_015(0)","Ｐ","ファンを増やす……。ああ、モデルの仕事をして、
活動の幅を広げてみるのもいいってことか","Increase your fan base at ....... Oh, and work on your modeling,
So you're saying it's good to try to broaden your activities."
"Idolchr_0405_A_08_00_016(0)","凛世","はい……","Yes ......"
"Idolchr_0405_A_08_00_017(0)","Ｐ","確かに、メディアに出ることは重要だな。
そうだな、凛世が着るとしたら……","Sure, it's important to be in the media.
Yes, Rinze would wear it: ......"
"Idolchr_0405_A_08_00_018(0)","選択肢","和服が一番","Japanese clothes are best"
"Idolchr_0405_A_08_00_019(0)","選択肢","洋服もいい","Clothes are good."
"Idolchr_0405_A_08_00_020(0)","選択肢","思い切ってコスプレ","Daring Cosplay"
"Idolchr_0405_A_08_00_021(0)","Ｐ","やっぱり和服が一番しっくりくるな。
凛世には着物が似合うよ","I still feel most comfortable in kimono.
Kimonos look good on Rinze."
"Idolchr_0405_A_08_00_022(0)","凛世","ふふ……
ありがとうございます……","Hmmm... ......
Thank you ......"
"Idolchr_0405_A_08_00_023(0)","Ｐ","凛世は今でも魅力的だからな。それに、トレンドに
流されないことも、個性を引き出す手段のひとつだ","Rinze's still attractive, plus she's trending.
Not being carried away is one of the ways to bring out your personality."
"Idolchr_0405_A_08_00_024(0)","凛世","流されないこと………………","Not to be swept away: .................."
"Idolchr_0405_A_08_00_025(0)","凛世","ふふ……
はい……心得ました……","Hmmm... ......
Yes, ......I know it by heart: ......"
"Idolchr_0405_A_08_00_026(0)","Ｐ","たまには洋服もいいと思うけどな。
いつも和服だから、意外性を狙えるかも","I think clothes are nice once in a while.
Since I'm always in kimono, I might be able to aim for the unexpected."
"Idolchr_0405_A_08_00_027(0)","凛世","心得ました……
そのようにすれば……ファンの方が……","I've got it in mind: ......
That way, ...... fans will be able to ......"
"Idolchr_0405_A_08_00_028(0)","Ｐ","ファンが増えるかどうか、明確な答えはないが……。
ただ、凛世の新しい一面にはなるだろうな","I don't have a definitive answer as to whether or not it will increase the number of fans, but you can find out at .......
But it would be a new aspect of Rinze."
"Idolchr_0405_A_08_00_029(0)","凛世","はい……
今後の活動の参考に……","
For future reference ......"
"Idolchr_0405_A_08_00_030(0)","Ｐ","思い切ってコスプレをしてみるか？
楽しいかもしれないぞ","Want to take the plunge and try cosplay?
Might be fun, you know."
"Idolchr_0405_A_08_00_031(0)","凛世","コスプレ……","Cosplay......"
"Idolchr_0405_A_08_00_032(0)","Ｐ","いや、ごめん。
今のはちょっと悪ノリしてしまったな","No, sorry.
Now that was a bit of a bad joke."
"Idolchr_0405_A_08_00_033(0)","凛世","いえ……
そのような手段もあるのかと……","No. ......
I was wondering if there was a way to do that: ......"
"Idolchr_0405_A_08_00_034(0)","Ｐ","凛世。もしかして、ファンを増やそうとして、
ショーウィンドウの洋服が気になったのか？","Rinse, perhaps you are trying to increase your fan base,
Were you curious about the clothes in the show window?"
"Idolchr_0405_A_08_00_035(0)","凛世","はい……
ご期待に沿えるよう……","
We hope we can meet your expectations: ......"
"Idolchr_0405_A_08_00_036(0)","Ｐ","ご期待に沿えるように……
ああ、ファンの期待にってことか","As you might expect: ......
Oh, you mean to the fans' expectations."
"Idolchr_0405_A_08_00_037(0)","凛世","それは……","It can be found at: ......"
"Idolchr_0405_A_08_00_038(0)","Ｐ","それも大事だけど、ファンのみんなが一番見たいのは
凛世が凛世らしくしている姿だと思うぞ","That's important, but what every fan wants to see the most is
I think that's Rinze being Rinze."
"Idolchr_0405_A_08_00_039(0)","凛世","はい……
お心遣いありがとうございます……","
Thank you for your consideration: ......"
"Idolchr_0405_A_08_00_040(0)","Ｐ","凛世、どうした？　何か心配事でもあるのか？","Rinze, what's wrong? What's worrying you?"
"Idolchr_0405_A_08_00_041(0)","凛世","いえ……
何も……ございません……","No. ......
There is nothing ...... ......"
"Idolchr_0405_A_08_00_042(0)","Ｐ","（凛世の表情が明らかに曇っていた。
何故だろうか……）","(Rinze's expression was clearly clouded.
(I wonder why ......)"
"Idolchr_0405_A_09_00_001(0)","凛世","…………","…………"
"Idolchr_0405_A_09_00_002(0)","Ｐ","（最近、どうも凛世の様子がおかしいような……。
気持ちを話してくれるといいんだけど……）","(Lately, Rinze seems to be acting strangely. ......
I hope you'll talk to me about how you feel (......)"
"Idolchr_0405_A_09_00_003(0)","Ｐ","仕事、お疲れ様。凛世。
少し話があるんだけどいいか？","Good job, Rinze.
Can I have a word with you?"
"Idolchr_0405_A_09_00_004(0)","凛世","はい……","Yes ......"
"Idolchr_0405_A_09_00_005(0)","Ｐ","この間、繁華街でショーウィンドウの
洋服を、一緒に眺めただろ","The other day, I was downtown and saw a show window
You've seen the clothes. We've looked at them together."
"Idolchr_0405_A_09_00_006(0)","Ｐ","あの時に、
何か感じたものがあったんじゃないか？","At that time,
You must have felt something."
"Idolchr_0405_A_09_00_007(0)","凛世","……
何か……","……
Something ......"
"Idolchr_0405_A_09_00_008(0)","Ｐ","俺の勘違いだったら、申し訳ないんだが……","If I'm wrong, I apologize. ......"
"Idolchr_0405_A_09_00_009(0)","凛世","いえ……
そのようなことは……","No. ......
You can do so at ......"
"Idolchr_0405_A_09_00_010(0)","凛世","ただ……
うまく……言葉には……","Just ......
Well ...... for the ...... word"
"Idolchr_0405_A_09_00_011(0)","Ｐ","言葉で表現しづらくて、
胸の中がモヤモヤしてる……って感じか","It's hard to express in words,
It's like a blur in my chest. ......"
"Idolchr_0405_A_09_00_012(0)","凛世","あの……
プロデューサーさま……","That ......
Dear Producer: ......"
"Idolchr_0405_A_09_00_013(0)","Ｐ","ん、どうした？","Hmm, what's wrong?"
"Idolchr_0405_A_09_00_014(0)","凛世","ルミナスの目標は……
スターリットシーズンの成功……","The goal of Luminous is to ......
Starlit Season Success ......"
"Idolchr_0405_A_09_00_015(0)","Ｐ","ああ、その通りだ。
そのために、みんな毎日頑張ってくれているぞ","Yeah, that's right.
You guys work hard every day to make that happen!"
"Idolchr_0405_A_09_00_016(0)","凛世","はい……
多くのファンの方々に喜んでもらえるよう……","
To the delight of our many fans, ......"
"Idolchr_0405_A_09_00_017(0)","凛世","凛世も……
みなさまと活動してまいりました……","Rinze also ......
We have been working with you ......"
"Idolchr_0405_A_09_00_018(0)","Ｐ","そうだな。
凛世の日々の活動に、感謝しているぞ","
Thank you for all you do on a daily basis, Rinze!"
"Idolchr_0405_A_09_00_019(0)","凛世","それは凛世も……
プロデューサーさまには感謝の気持ちしか……","That's Rinze too ......
I can only thank the producer ......"
"Idolchr_0405_A_09_00_020(0)","凛世","その気持ちに報いられるよう……
ファンのみなさまに喜んでもらおうと……","We hope to reward that feeling. ......
To please our fans, please visit ......"
"Idolchr_0405_A_09_00_021(0)","Ｐ","……ん？　ちょっと、待った！　それって、
ファンが増えれば、俺が喜ぶと思っているのか？","...... hmm? Wait, wait, wait! That's..,
You think more fans will make me happy?"
"Idolchr_0405_A_09_00_022(0)","凛世","はい……
トレンドの服を着たり……","
Wear trendy clothes and ......"
"Idolchr_0405_A_09_00_023(0)","凛世","ファンのみなさまに喜んでもらうことが……
プロデューサーさまへの恩返しかと……","Making our fans happy is what ...... is all about.
I guess I'm returning the favor to the producer. ......"
"Idolchr_0405_A_09_00_024(0)","凛世","ですがプロデューサーさまは……
凛世らしいのが一番だと……","But the producer is ......
It's best to be like Rinze. ......"
"Idolchr_0405_A_09_00_025(0)","Ｐ","そうか……。俺が凛世にかけた言葉と、
凛世の目標が矛盾していたのか……","I see. ...... and what I said to Rinze,
Was Rinze's goal inconsistent? ......"
"Idolchr_0405_A_09_00_026(0)","Ｐ","なあ、凛世。一番大切なことは、
俺やファンについて考えることじゃない","The most important thing, Rinze,
It's not about me or my fans."
"Idolchr_0405_A_09_00_027(0)","凛世","…………","…………"
"Idolchr_0405_A_09_00_028(0)","Ｐ","凛世が何をやりたいか。何に挑戦したいか。
その気持ちを大切にしてもらいたいな","What does Rinze want to do, what challenges does she want to take on?
I hope you cherish that feeling."
"Idolchr_0405_A_09_00_029(0)","凛世","凛世のやりたいこと……挑戦……
……気持ち……","What Rinze wants to do: ...... challenge: ......
...... feelings......"
"Idolchr_0405_A_09_00_030(0)","Ｐ","きっと、それはアイドルとして重要なことだから、
すぐに答えが見つかるものでもないよ","Surely, that's important as an idol,
It's not something you're going to find an answer to anytime soon."
"Idolchr_0405_A_09_00_031(0)","Ｐ","まずは、一歩を踏み出すことがいいかもな。
凛世が挑戦してみたいこと、探してみるといい","Maybe it's a good idea to take the first step.
Rinse you want to try and find out what you want to try."
"Idolchr_0405_A_09_00_032(0)","凛世","はい……
そのように……","Yes...
Just like that..."
"Idolchr_0405_A_09_00_033(0)","Ｐ","……とは言ったものの、挑戦したいことを、
すぐに見つけるのは難しいはずだ……","I said ......, but I want to challenge you,
Should be hard to find soon: ......"
"Idolchr_0405_A_09_00_034(0)","Ｐ","そういうときは……","If that's the case, please contact ......"
"Idolchr_0405_A_09_00_035(0)","選択肢","話をする","have a talk"
"Idolchr_0405_A_09_00_036(0)","選択肢","息抜きをする","Take a break"
"Idolchr_0405_A_09_00_037(0)","選択肢","考え続ける","think constantly about"
"Idolchr_0405_A_09_00_038(0)","選択肢","寝る","lie down"
"Idolchr_0405_A_09_00_039(0)","Ｐ","たくさん話をするんだ。俺でも、みんなでもいい。
話しているうちに、自分の気持ちが整理できるからな","We talk a lot, me, all of us.
I'll be able to sort out my feelings as we talk."
"Idolchr_0405_A_09_00_040(0)","凛世","はい……
みなさまのお力添えを……","
Thank you all for your help. ......"
"Idolchr_0405_A_09_00_041(0)","Ｐ","ああ、そうするといい。ルミナスのみんなは、
お互いを支え合う仲間達だからな","Oh, you will, all of you Luminas,
We're all friends who have each other's backs."
"Idolchr_0405_A_09_00_042(0)","凛世","ふふ……
頼もしき仲間達でございます……","Hmmm... ......
We are a reliable group of friends: ......"
"Idolchr_0405_A_09_00_043(0)","Ｐ","たまには、息抜きをするのがいいかもしれないな。
疲れているといい案は出ないだろう？","Maybe it's good to take a break once in a while.
You can't come up with good ideas when you're tired, can you?"
"Idolchr_0405_A_09_00_044(0)","凛世","はい……
息抜き……","
Breathless ......"
"Idolchr_0405_A_09_00_045(0)","Ｐ","悩みは一旦忘れて、美味しいものを食べたり、
友達とおしゃべりしたりするんだ","Forget your worries for a moment and eat something delicious,
I chat with my friends."
"Idolchr_0405_A_09_00_046(0)","凛世","はい……
休みの折に……試みます……","
I'll try ...... when I'm on vacation ......"
"Idolchr_0405_A_09_00_047(0)","Ｐ","考え続けるしかないかな……。
答えを出せるのは、凛世だけだから","I guess I'll just have to keep thinking about it. ......
Rinze is the only one who can give you the answer."
"Idolchr_0405_A_09_00_048(0)","凛世","……凛世だけ","Only ...... Rinze"
"Idolchr_0405_A_09_00_049(0)","Ｐ","えっと……。なんていうか、
悪い方向にとらえないでもらいたいんだが……","Let's see, ....... What can I say?
I hope you don't take this the wrong way: ......"
"Idolchr_0405_A_09_00_050(0)","Ｐ","凛世のことに一番詳しいのは、凛世自身だからな。
納得のいく答えが、見つかりやすいんじゃないか？","The person who knows the most about Rinze is Rinze herself.
It's easy to find a satisfactory answer, isn't it?"
"Idolchr_0405_A_09_00_051(0)","凛世","はい……","Yes ......"
"Idolchr_0405_A_09_00_052(0)","Ｐ","とりあえず、寝てみるといいぞ。
一晩経てば、忘れてるときもあるもんだ","In the meantime, you should try to get some sleep.
Sometimes, after a night, you just forget about it."
"Idolchr_0405_A_09_00_053(0)","凛世","そうなのですね……","I see that. ......"
"Idolchr_0405_A_09_00_054(0)","Ｐ","……ご、ごめん。軽薄なアドバイスだったな。
俺が軽く考えすぎていた……","......Google, sorry, that was frivolous advice.
I took it too lightly: ......"
"Idolchr_0405_A_09_00_055(0)","凛世","いえ……
そのようなことは……","No. ......
You can do so at ......"
"Idolchr_0405_A_09_00_056(0)","Ｐ","とにかく、凛世が何をしたいか、
その気持ちを一番に考えてごらん","Anyway, what does Rinze want to do?
Think about that feeling first."
"Idolchr_0405_A_09_00_057(0)","凛世","……凛世が望むこと……","...... what Rinze wants: ......"
"Idolchr_0405_A_09_00_058(0)","Ｐ","じっくり考えるといいよ。凛世がアイドルとして
自分を表現できることなら、何でも協力するから","You should think long and hard about Rinze as an idol.
I'll help you with anything that allows you to express yourself."
"Idolchr_0405_A_09_00_059(0)","凛世","はい……
お心遣い……痛み入ります……","
Your thoughtfulness is appreciated ......"
"Idolchr_0405_A_09_00_060(0)","凛世","凛世の意志……
お伝えできるよう……精進いたします……","The Will of Rinze: ......
We will do our best to inform you ...... ......"
"Idolchr_0405_A_09_00_061(0)","Ｐ","ああ、今日みたいに、
いつでも相談してくれていいからな！","Yeah, like today,
You can always talk to me about it!"
"Idolchr_0405_A_09_00_062(0)","Ｐ","（凛世の表情が晴れた。
凛世ならきっとすぐに答えを見つけるだろう）","(Rinze's expression cleared up.
(I'm sure Rinze will find the answer soon.)"
"Idolchr_0405_A_10_00_001(0)","Ｐ","（事務所で雑務を片付けていると、
凛世が近付いてきた）","(I was in the office getting some miscellaneous work done,
(Rinze approaching)"
"Idolchr_0405_A_10_00_002(0)","凛世","お疲れさまです……
プロデューサーさま……","Thanks for your time: ......
Dear Producer: ......"
"Idolchr_0405_A_10_00_003(0)","Ｐ","おっ、凛世。お疲れ様","Hey, Rinze, thanks for your hard work."
"Idolchr_0405_A_10_00_004(0)","凛世","お忙しいところ……
大変申し訳ございません……","Thank you for your time: ......
We are very sorry ......"
"Idolchr_0405_A_10_00_005(0)","凛世","プロデューサーさまに……
お話が……","Dear Producer: ......
The story is at ......"
"Idolchr_0405_A_10_00_006(0)","Ｐ","凛世から声をかけてくれるなんて、めずらしいな。
それで話っていうのは？","It's rare to hear from Rinze.
So what's the story?"
"Idolchr_0405_A_10_00_007(0)","凛世","はい……
プロデューサーさま……","Yes ......
Dear Producer: ......"
"Idolchr_0405_A_10_00_008(0)","凛世","突然の……不躾なお願いを……
お許しください……","Sudden ...... impolite request ......
Forgive me. ......"
"Idolchr_0405_A_10_00_009(0)","Ｐ","お願い？　俺にできることなら協力するよ。
やりたいことでもあるのか？","Please? I'll help you if I can.
Is it something you want to do?"
"Idolchr_0405_A_10_00_010(0)","凛世","はい……
凛世のライブを……","
Rinze's live show at ......"
"Idolchr_0405_A_10_00_011(0)","Ｐ","ライブをやりたいのか。
うん、いいと思うぞ。すぐに用意をしよう！","You want to do a live show?
Yeah, I think it's a good idea, let's get it ready right away!"
"Idolchr_0405_A_10_00_012(0)","Ｐ","そうだ。ただのライブじゃなくて、
凛世のソロライブなんてどうだ？","Yes, not just a gig,
How about a solo show by Rinze?"
"Idolchr_0405_A_10_00_013(0)","凛世","……！
凛世も……そのように……","......!
Rinze also ...... that way ......"
"Idolchr_0405_A_10_00_014(0)","凛世","プロデューサーさまと共に……
ひとつのライブを……","Together with the producer: ......
One live show at ......"
"Idolchr_0405_A_10_00_015(0)","Ｐ","よしっ、分かった！
凛世のソロライブを開くことにしよう！","Okay, I get it!
Let's hold a solo show of Rinze!"
"Idolchr_0405_A_10_00_016(0)","Ｐ","でも、凛世が自主的にライブをしたいなんて、
それなりの理由があるんじゃないのか？","But I can't believe Rinze wants to voluntarily perform live,
Isn't there a good reason for that?"
"Idolchr_0405_A_10_00_017(0)","凛世","はい……
凛世は知りたいのです……","
Rinse wants to know: ......"
"Idolchr_0405_A_10_00_018(0)","凛世","アイドルとして……
どうあるべきか……","As an idol ......
How it should be: ......"
"Idolchr_0405_A_10_00_019(0)","凛世","凛世自身のことを……
このライブを通して……","Rinze herself at ......
Through this live ......"
"Idolchr_0405_A_10_00_020(0)","Ｐ","確かに、これからの方向性を考える上で、
今の実力と状況を把握するのは大切だな","Certainly, in thinking about the future direction,
It's important to know what you're capable of and what's going on right now."
"Idolchr_0405_A_10_00_021(0)","凛世","それに……
確かめたいことがあるのです……","It can be found at ......
I need to make sure: ......"
"Idolchr_0405_A_10_00_022(0)","凛世","プロデューサーさまがおっしゃった……
凛世が何をしたいのか……","The producer said: ......
What Rinze wants to do: ......"
"Idolchr_0405_A_10_00_023(0)","Ｐ","強い決意だな。俺も凛世に負けないくらい
働かないと、最高のステージを用意できないな","You're so determined, I'm as determined as Rinze.
If you don't work, you're not setting the best stage."
"Idolchr_0405_A_10_00_024(0)","凛世","そのようなこと……
プロデューサーさま……","That kind of thing: ......
Dear Producer: ......"
"Idolchr_0405_A_10_00_025(0)","Ｐ","これから忙しくなるぞ。
一緒に頑張ろうな！","We're going to be busy now.
Let's work together!"
"Idolchr_0405_A_10_00_026(0)","タッチ","手を握る","hold someone's hand"
"Idolchr_0405_A_10_00_027(0)","タッチ","頭を撫でる","stroke a person's head"
"Idolchr_0405_A_10_00_028(0)","タッチ","何もしない・時間切れ","Nothing to do/time is running out"
"Idolchr_0405_A_10_00_029(0)","タッチ","その他の場所をタッチ","Touch Other Location"
"Idolchr_0405_A_10_00_030(0)","凛世","プロデューサーさま……！","Dear Producer, please contact ......!"
"Idolchr_0405_A_10_00_031(0)","Ｐ","ご、ごめん！　強く握りすぎたか？","Oh, sorry! Did I grip too hard?"
"Idolchr_0405_A_10_00_032(0)","凛世","いいえ……
大丈夫です……","No. ......
It's okay. ......"
"Idolchr_0405_A_10_00_033(0)","凛世","ふふ……
とても……心強い……","Hmmm... ......
Very ...... reassuring ......"
"Idolchr_0405_A_10_00_034(0)","凛世","プロデューサーさま……
凛世はまだ何も……","Dear Producer: ......
Rinze has yet to do anything ......"
"Idolchr_0405_A_10_00_035(0)","凛世","このように……
褒めていただけるのは……","Thus ......
You can praise us at ......"
"Idolchr_0405_A_10_00_036(0)","Ｐ","そうだな……。これはそういう意味じゃなくて、
『励まし』の意味ってことだ","Yes, ....... That's not what this is about,
I meant 'encouragement'."
"Idolchr_0405_A_10_00_037(0)","凛世","激励……","Encouragement: ......"
