"id","character","source","translatedstr"
"Idolchr_0306_C_30_01_002(0)","Ｐ","（もうこんな時間か……。
琴葉も楽しんでくれたようだな）","(Is it that time already? .......
(I see Kotoha enjoyed it as well.)"
"Idolchr_0306_C_30_01_003(0)","琴葉","今日はありがとうございました、プロデューサー。
……あの、また一緒に行きませんか？","Thank you for your time today, producer.
...... Um, would you like to go with me again?"
"Idolchr_0306_C_30_01_004(0)","琴葉","すごく楽しかったです、プロデューサー。
プロデューサーのおかげです！　ふふっ♪","It was a lot of fun, producer.
Thanks to the producer!"
"runintochr_0306_A_01_00_001(0)","琴葉","あ、プロデューサー！
おはようございます","Oh, producer!
good morning"
"runintochr_0306_A_01_00_002(0)","Ｐ","おはよう、琴葉。
今日はずいぶん早いな","Good morning, Kotoha.
You're up early today."
"runintochr_0306_A_01_00_003(0)","琴葉","はい、レッスンの復習をしようと思って。
レッスンスタジオ、使って大丈夫ですか？","Yes, I was trying to review the lesson.
Lesson studio, is it safe to use?"
"runintochr_0306_A_01_00_004(0)","Ｐ","ああ。この時間は空いているはずだから、
好きに使ってくれ","Yeah, because I should be free at this time,
Do with it what you will."
"runintochr_0306_A_01_00_005(0)","Ｐ","ところで、ルミナスの調子はどうだ？
琴葉から見たみんなの印象を聞かせてくれ","By the way, how's Luminous doing?
Let me know what everyone's impressions are from Kotoha's point of view."
"runintochr_0306_A_01_00_006(0)","琴葉","みなさん個性的で、魅力溢れるアイドルが集まった、
素敵なユニットだと思います","Everyone was full of unique and attractive idols,
I think it's a lovely unit."
"runintochr_0306_A_01_00_007(0)","琴葉","私はまだまだ未熟ですが、
少しでもみなさんの力になれるよう……頑張ります！","I am still a work in progress,
I will do my best at ...... to help you all in any way I can!"
"runintochr_0306_A_01_00_008(0)","Ｐ","そうか。ルミナスは琴葉の成長にも繋がるはずだ。
一緒に頑張っていこう！","Oh well, Luminous should help Kotoha grow as well.
Let's work hard together!"
"runintochr_0306_B_02_00_001(0)","Ｐ","ん？　あそこにいるのは……。
おーい、琴葉！","Hmm? That's ...... over there.
Hey, Kotoha!"
"runintochr_0306_B_02_00_002(0)","琴葉","あ、プロデューサー。おはようございます。
こんなところで奇遇ですね","Good morning, producer.
What a coincidence in a place like this."
"runintochr_0306_B_02_00_003(0)","Ｐ","ああ、おはよう。
琴葉は、相変わらず早いんだな？","Oh, good morning.
Kotoha is still as fast as ever?"
"runintochr_0306_B_02_00_004(0)","琴葉","はい！　みなさんとても忙しいので、
私もなにかお手伝いできればと思って","Yes! Everyone is very busy,
I was wondering if I could help in any way."
"runintochr_0306_B_02_00_005(0)","琴葉","だから早く来たんですけど……。
ふふっ、朝からプロデューサーに会えちゃいました","That's why I came early. ......
Phew, I got to meet the producer in the morning!"
"runintochr_0306_B_02_00_006(0)","琴葉","早起きは三文の徳って、本当だったんですね……♪
今日も一緒に活動を頑張りましょう！","It's true what they say, the early bird gets the worm. ......♪
Let's work together today!"
"runintochr_0306_B_02_00_007(0)","Ｐ","そうだな。
お互い充実した１日になるといいな","Yes.
I hope we both have a productive day."
"runintochr_0306_C_03_00_001(0)","琴葉","あれ？　プロデューサー……。
まだお仕事をしていたんですか？","Huh? Producer .......
Were you still working?"
"runintochr_0306_C_03_00_002(0)","Ｐ","お疲れ様。急ぎの用件があってね。
琴葉は自主レッスン終わりか？","Thanks for your help, I had some urgent business to attend to.
Is Kotoha done with her voluntary lesson?"
"runintochr_0306_C_03_00_003(0)","琴葉","あ、はい。あの……プロデューサーって、
いつも遅くまで仕事をしていますよね","Ah, yes, that ...... producer,
You always work late."
"runintochr_0306_C_03_00_004(0)","Ｐ","それは……そうだな。
ただ、好きでやっていることでもあるしな","That sounds like .......
But it's also something I like to do."
"runintochr_0306_C_03_00_005(0)","琴葉","でも、無理は禁物ですよ？　プロデューサーが
いるから、私たちはステージで輝けるんですから","But don't take it too hard, okay? The producer.
It's because of them that we can shine on stage."
"runintochr_0306_C_03_00_006(0)","Ｐ","琴葉……。心配してくれて、ありがとう。
これからはなるべく気をつけるよ","Kotoha: ....... Thanks for your concern.
I'll be as careful as possible from now on."
"runintochr_0306_C_03_00_007(0)","琴葉","はい。プロデューサーのこと頼りにしていますから。
これからも、よろしくお願いします！","Yes, I rely on my producer.
Thank you for your continued support!"
"runintochr_0306_C_03_00_008(0)","Ｐ","ああ、琴葉たちがもっと輝けるように、
プロデュースしていくからな！","Oh, so that Kotoha and others can shine more brightly,
I'm going to produce!"
"runintochr_0306_D_01_00_001(0)","琴葉","おはようございます、プロデューサー！
今日も１日、よろしくお願いします！","Good morning, producer!
I look forward to working with you all today!"
"runintochr_0306_D_01_01_001(0)","琴葉","わっ、プロデューサー！　いつからそこに……。
あっ、おはようございます！　が、先でしたね！","Wow, producer! How long have you been there .......
Oh, good morning!"
"runintochr_0306_E_02_00_001(0)","琴葉","お疲れさまです、プロデューサー！
明日もみなさんと一緒に頑張りましょうね！","Good job, producer!
I look forward to working with you all again tomorrow!"
"runintochr_0306_E_02_01_001(0)","琴葉","遅くまでお疲れさまです。プロデューサー。
夜更かしをしないで、早く休んでくださいね？","Thanks for staying up late, producer.
Don't stay up late and get some rest, okay?"
