"id","character","source","translatedstr"
"Idolchr_0404_A_08_00_026(0)","甘奈","あ！　あのルームウェアとかはどうかな？
楽そうだし気持ちよさそう～☆","Oh! How about that loungewear or something?
It looks easy and comfortable."
"Idolchr_0404_A_08_00_027(0)","甘奈","あっ……でもプロデューサーさんは、
ルームウェアとかあんまり使わないか","Oh, ...... but the producer,
I don't know if I'd use loungewear or not."
"Idolchr_0404_A_08_00_028(0)","Ｐ","あのルームウェアは甜花も好きそうだし、
甘奈も一緒に買ったらどうだ？","I think Tenka would like that loungewear,
Why don't you buy Amana with it?"
"Idolchr_0404_A_08_00_029(0)","甘奈","気持ちはうれしいけど、
今日はプロデューサーさんのお買い物だよっ！","I'm glad you feel that way,
I'm shopping for a producer today!"
"Idolchr_0404_A_08_00_030(0)","甘奈","いつも忙しいプロデューサーさんに、
お家でゆっくりできるルームウェア……","To the producer who is always busy,
Loungewear for relaxing at home: ......"
"Idolchr_0404_A_08_00_031(0)","甘奈","……ありな気がしてきたっ！","I'm starting to think there is a ......!"
"Idolchr_0404_A_08_00_032(0)","甘奈","あ、けど、プロデューサーさん、
こういうの好きじゃない……？","Oh, but, Producer-san,
Don't you like these ......?"
"Idolchr_0404_A_08_00_033(0)","甘奈","甘奈はいいかなと思うけど……
うーん……","I think Amana would be a good choice: ......"
"Idolchr_0404_A_08_00_034(0)","Ｐ","甘奈が選んでくれたものなら、喜んで使わせて
もらうよ。一生懸命考えてくれてありがとうな","If Amana picked it out for me, I'm happy to use it.
I'll take it, thanks for your hard work and thought."
"Idolchr_0404_A_08_00_035(0)","甘奈","ううん、甘奈がやりたいだけだからいいの。
……じゃあルームウェアにするね！","No, it's okay because Amana just wants to do it.
...... I'll just wear loungewear then!"
"Idolchr_0404_A_08_00_036(0)","甘奈","甜花ちゃんと甘奈とプロデューサーさん、
３人でお揃いのにしよっ！","Tetuka and Amana and the producer,
The three of us will have matching ones!"
"Idolchr_0404_A_08_00_037(0)","Ｐ","ああ、それがいいな","Yeah, I'd like that."
"Idolchr_0404_A_08_00_038(0)","甘奈","うん！　３人一緒とか絶対かわいーよね！
プロデューサーさんは何色にする？","Yeah! The three of us together is definitely cute, isn't it?
What color do you want the producer to use?"
"Idolchr_0404_A_08_00_039(0)","Ｐ","うーん、せっかくだから、甘奈が選んでくれるかな？","Hmmm, since we're here, maybe Amana can pick one out for us?"
"Idolchr_0404_A_08_00_040(0)","甘奈","わかった！　じゃあこの色♪
これでリラックスしてねっ！","All right, then, this color...
Relax with this!"
"Idolchr_0404_A_08_00_041(0)","Ｐ","ああ、ありがとう。嬉しいよ","Oh, thank you, it's my pleasure."
"Idolchr_0404_A_08_00_042(0)","甘奈","えへへ……♪
いつもありがと、プロデューサーさんっ☆","Ehehehe ......♪
Thanks for everything, producer!"
"Idolchr_0404_A_09_00_001(0)","Ｐ","（ふう、ひとまず資料整理の目処がついたか。
ここ数日はバタバタしてて、さすがに疲れたな……）","(Wind, I guess I'm on track to organize the materials at least for the time being.
I've been slammed the last few days, and I'm as tired as I can be (......)."
"Idolchr_0404_A_09_00_002(0)","Ｐ","（……眠いな。いや、甘奈を待たないと……。
けど、なんだか……意識が……）","(...... sleepy. No, we have to wait for Amana. ......
(But I'm kind of ...... conscious of ......)"
"Idolchr_0404_A_09_00_003(0)","甘奈","ただいまー……って、あれ？
プロデューサーさん……？","I'm home - ...... is that it?
Producer: ......?"
"Idolchr_0404_A_09_00_004(0)","Ｐ","…………","…………"
"Idolchr_0404_A_09_00_005(0)","甘奈","寝ちゃってる……？
……こんなところで寝てたら風邪ひいちゃう……","Have you fallen asleep ......?
......I'll catch a cold if I sleep here......"
"Idolchr_0404_A_09_00_006(0)","Ｐ","…………","…………"
"Idolchr_0404_A_09_00_007(0)","甘奈","全然起きない……それならせめて
ブランケットをかけて……うん、大丈夫","It doesn't happen at all. ...... Then at least
Put a blanket on ...... yeah, okay"
"Idolchr_0404_A_09_00_008(0)","甘奈","……机の上、書類がたくさんある……。
……これ全部ライブの資料だ……！","On ...... desk, there are a lot of papers. ......
...... All of this is live material. ......"
"Idolchr_0404_A_09_00_009(0)","甘奈","甘奈たちのために、こんなにたくさん……
お仕事、頑張ってくれて……","So much for Amana and her friends: ......
Good job, good luck with your work. ......"
"Idolchr_0404_A_09_00_010(0)","甘奈","プロデューサーさんって、いつも一番近くで
応援してくれてるんだよね……","Producers are always the closest to us.
You've got my support. ......"
"Idolchr_0404_A_09_00_011(0)","甘奈","甘奈が悩んでることにも気付いてくれて……
甘奈のこと、すごく支えてくれて……","She also noticed that Amana was having trouble ......
She was very supportive of Amana and ......"
"Idolchr_0404_A_09_00_012(0)","甘奈","……………………。
……いつも、ありがと……",".........................
...... always, thanks ......"
"Idolchr_0404_A_09_00_013(0)","Ｐ","…………ん？
って、うわっ！","............ hmm?
I mean, wow!"
"Idolchr_0404_A_09_00_014(0)","","ガタン","(with a) slamming noise (door, telephone receiver)"
"Idolchr_0404_A_09_00_015(0)","甘奈","ぷ、プロデューサーさん！？　大丈夫！？","Psst, Producer-san! Are you okay!"
"Idolchr_0404_A_09_00_016(0)","Ｐ","いてて……椅子から落ちちゃったよ……。
あれ、甘奈？　戻ってたのか","I fell out of my chair .......
Oh, Amana? You're back."
"Idolchr_0404_A_09_00_017(0)","甘奈","うん、それよりプロデューサーさん、
痛そうな音がしたけど……怪我とかしてない？","Yeah, more importantly, Producer-san,
That sounded painful. ...... Are you hurt or something?"
"Idolchr_0404_A_09_00_018(0)","Ｐ","んー……大丈夫みたいだ。
心配してくれてありがとうな","Hmmm... ...... seems to be ok.
Thanks for worrying about me."
"Idolchr_0404_A_09_00_019(0)","甘奈","よかった……。
……あの……もしかしてなんだけどね……","Good. .......
...... that ...... maybe... ......"
"Idolchr_0404_A_09_00_020(0)","甘奈","実は起きてて……聞こえちゃってたりした……？
甘奈の……独り言……","I actually woke up and heard ....... ......?
Amana's ...... soliloquy: ......"
"Idolchr_0404_A_09_00_021(0)","Ｐ","独り言？　なにか聞こえたような気はするけど……
よく覚えてないな……","Talking to myself? I think I heard something, but ......
I don't remember it well. ......"
"Idolchr_0404_A_09_00_022(0)","","なんて言ってたんだ？","What did he say?"
"Idolchr_0404_A_09_00_023(0)","","パフェ食べたいとか？","You want a parfait or something?"
"Idolchr_0404_A_09_00_024(0)","Ｐ","なんて言ってたんだ？
よかったらもう１回言ってくれるか？","What did he say?
Can you say that again if you like?"
"Idolchr_0404_A_09_00_025(0)","甘奈","あ！　ううん！
それならいいの……なんでもないから……！","Ah! Nah!
Then it's okay ...... because it's nothing. ......"
"Idolchr_0404_A_09_00_026(0)","Ｐ","教えてもらえないのか……","Can't you tell me: ......"
"Idolchr_0404_A_09_00_027(0)","甘奈","プロデューサーさんでも……教えられない……。
ごめんね……！","Even the producer can't teach ...... .......
Sorry, ......!"
"Idolchr_0404_A_09_00_028(0)","Ｐ","パフェを食べたいとかそういうのか？","You want a parfait or something like that?"
"Idolchr_0404_A_09_00_029(0)","甘奈","パフェじゃないけどね……！
うん……！　そ、そんな感じ……かな……！？","It's not a parfait, though. ......
Yeah ......! So, is it like that ...... or ......!"
"Idolchr_0404_A_09_00_030(0)","甘奈","……良かった、聞かれてなくて……","......Good, they didn't ask. ......"
"Idolchr_0404_A_09_00_031(0)","甘奈","それよりプロデューサーさん、
こんなところで寝てたら、風邪ひいちゃうよ","More importantly, Producer-san,
You'll catch a cold if you sleep here."
"Idolchr_0404_A_09_00_032(0)","甘奈","ちゃんと自分のことも大切にしてね……","Take care of yourself properly too. ......"
"Idolchr_0404_A_09_00_033(0)","甘奈","甘奈たちのことを気にかけてくれるの、うれしいけど
プロデューサーさんが倒れたら悲しいから……","I'm glad you care about Amana and her family.
I'd be sad if the producer collapsed. ......"
"Idolchr_0404_A_09_00_034(0)","Ｐ","あ、ああ、気をつけるよ。
みんな今が頑張り時だもんな","Uh, yeah, I'll be careful.
It's a good time for all of us to work hard."
"Idolchr_0404_A_09_00_035(0)","Ｐ","甘奈はもう帰るのか？
気をつけて帰るんだぞ","Is Amana leaving already?
Be careful on your way home."
"Idolchr_0404_A_09_00_036(0)","甘奈","うん、プロデューサーさんも気をつけてね！","Yeah, be careful, producer!"
"Idolchr_0404_A_09_00_037(0)","甘奈","それから……
あんまり頑張りすぎないでほしいな……","
I hope you're not trying too hard: ......"
"Idolchr_0404_A_09_00_038(0)","Ｐ","ん？　なにか言ったか？","What did you say?"
"Idolchr_0404_A_09_00_039(0)","甘奈","う、ううん、なんでもない！
……甘奈、帰るね！","Uh, no, it's nothing!
...... Amana, I'm going home!"
"Idolchr_0404_A_09_00_040(0)","甘奈","お疲れ様で～す、プロデューサーさん","Thanks for your hard work, producer!"
"Idolchr_0404_A_10_00_001(0)","Ｐ","甘奈、ちょっといいかな？","Amana, can I have a word?"
"Idolchr_0404_A_10_00_002(0)","甘奈","うん！　どうしたの？","Yeah! What's wrong?"
"Idolchr_0404_A_10_00_003(0)","Ｐ","甘奈と甜花、ふたりだけのライブをしてみないか？","Amana and Tetika, why don't we have a live show just for the two of us?"
"Idolchr_0404_A_10_00_004(0)","甘奈","え！？
甜花ちゃんと甘奈、ふたりだけの……！？","
Tetuka and Amana, just the two of you ......!"
"Idolchr_0404_A_10_00_005(0)","Ｐ","甜花には既に話していて、挑戦したいって言ってる
んだ。だから甘奈の意見を聞かせてほしい","I've already talked to Tenka and she wants to give it a shot.
So I'd like to hear what Amana has to say."
"Idolchr_0404_A_10_00_006(0)","甘奈","甜花ちゃんはやりたいって言ってくれてるんだ……
えへへ、うれしい","Beetle says she wants to do it: ......
Ehehe, I'm so happy!"
"Idolchr_0404_A_10_00_007(0)","甘奈","あ、でも……甜花ちゃんとのライブ……","Oh, but ...... live with the beet ......"
"Idolchr_0404_A_10_00_008(0)","甘奈","ひとりでもあんなに輝いてる甜花ちゃんと
甘奈が一緒に……ライブ……","With Tenka, who shines so brightly even when she's alone.
Amana together ...... live ......"
"Idolchr_0404_A_10_00_009(0)","甘奈","甘奈……
また足引っ張っちゃわないかな……","Amana ......
I wonder if I'm dragging my feet again: ......"
"Idolchr_0404_A_10_00_010(0)","Ｐ","あのな、甘奈……","You know, Amana: ......"
"Idolchr_0404_A_10_00_011(0)","","答えは１つだろう？","There's only one answer, right?"
"Idolchr_0404_A_10_00_012(0)","","失敗は次に
活かすんだろう？","Failure is the next step.
We're going to make the most of it, aren't we?"
"Idolchr_0404_A_10_00_013(0)","","甜花は
やりたがっているぞ","the ""beet"" sect (of Shin Buddhism)
They want to do it!"
"Idolchr_0404_A_10_00_014(0)","Ｐ","甘奈。
前の甘奈なら、答えは１つだったんじゃないか？","Amana.
I think the previous Amana would have had one answer."
"Idolchr_0404_A_10_00_015(0)","甘奈","前の、甘奈なら……？
……うん、そうだね。そうだった！","Previous, Amana can be found at ......?
......Yes, yes, it was!"
"Idolchr_0404_A_10_00_016(0)","甘奈","……もう悩むのはおしまいっ！
プロデューサーさん。答え、決まったよ！","......I don't want to worry about it anymore!
Producer, I've got an answer!"
"Idolchr_0404_A_10_00_017(0)","Ｐ","失敗は次に活かすんだろう？","You're going to make the most of your mistakes the next time, right?"
"Idolchr_0404_A_10_00_018(0)","甘奈","……そうだよね……！
いっぱい練習したんだから、大丈夫！","......Yes, that's right, ......!
I've practiced a lot, so I'll be fine!"
"Idolchr_0404_A_10_00_019(0)","Ｐ","甜花は甘奈と一緒にやりたがってるぞ","Beetle wants to do it with Amana."
"Idolchr_0404_A_10_00_020(0)","甘奈","甜花ちゃんがやりたいなら……ううん、ダメ。
甘奈がちゃんと決めなきゃ……","If you want to do it, Beetika, you can go to ...... No, no.
Amana has to make the right decision: ......"
"Idolchr_0404_A_10_00_021(0)","甘奈","プロデューサーさん！
甘奈、甜花ちゃんと一緒にライブがしたい！","Producer!
I would like to perform live with Amana and Tetika!"
"Idolchr_0404_A_10_00_022(0)","甘奈","成長した甜花ちゃんと
一緒にステージに立ちたい！","With a grown-up Tetu Hana-chan
I want to be on stage with you!"
"Idolchr_0404_A_10_00_023(0)","甘奈","それから……甘奈のことを見てくれる
ファンのみんなにも、ライブを見てもらいたい！","Then they can look at ...... amana
We want all of our fans to see us live!"
"Idolchr_0404_A_10_00_024(0)","甘奈","甜花ちゃんと甘奈のライブで、みんなに
キラキラを届けて、笑顔になってほしいな","Tetuka and Amana's live show for everyone.
I hope you bring sparkles and smiles to your faces."
"Idolchr_0404_A_10_00_025(0)","Ｐ","ああ、最高のライブにしような！","Yeah, let's make it a great gig!"
"Idolchr_0404_A_10_00_026(0)","甘奈","うん！　甘奈、頑張るから……
見ててね、プロデューサーさん！","Yeah! Amana, I'll do my best. ......
Watch me, producer!"
"Idolchr_0404_A_10_01_001(0)","Ｐ","（甘奈と甜花のライブは大成功に終わった！）","(Amana and Tetuka's show was a huge success!)"
"Idolchr_0404_A_10_01_002(0)","甘奈","プロデューサーさーん！ 
ライブ、すごいね！　めっちゃ楽しかった！","Producer!
The live show was amazing! It was so much fun!"
"Idolchr_0404_A_10_01_003(0)","甘奈","ね、プロデューサーさんから見てどうだった？
いいライブだったかな？","Hey, how was it from your producer's point of view?
Was it a good show?"
"Idolchr_0404_A_10_01_004(0)","Ｐ","いいもなにも……最高だった！","Good or not, ...... was the best!"
"Idolchr_0404_A_10_01_005(0)","Ｐ","ありがとう甘奈！　甜花とふたりで頑張って
素晴らしいライブを見せてくれて！","Thank you, Amana! You and Tetuka, good luck!
You gave us a great live show!"
"Idolchr_0404_A_10_01_006(0)","甘奈","えへへ……お礼を言うのは甘奈の方だよ。
最高のステージを用意してくれたんだもん☆","Ehehehe ...... it's Amana who should be thanking you.
They prepared the best stage for us."
"Idolchr_0404_A_10_01_007(0)","甘奈","それからね、プロデューサーさん。
『ふたり』じゃないよ","And, hey, producer.
It's not ""The Two."""
"Idolchr_0404_A_10_01_008(0)","甘奈","プロデューサーさんもいてくれた！
だから甘奈たち、頑張れたの！","The producer was there, too!
That's why Amana and the others were able to do their best!"
"Idolchr_0404_A_10_01_009(0)","甘奈","甜花ちゃんと一緒にステージに立てたのって、
プロデューサーさんのおかげだもん！","I was able to be on stage with Tetuka-chan,
It's all thanks to the producer!"
"Idolchr_0404_A_10_01_010(0)","Ｐ","俺は甘奈が持っている力を引き出す場所と
キッカケを用意しただけだよ","I'm a place where I can draw out the power that Amana has and
I just provided the kicker."
"Idolchr_0404_A_10_01_011(0)","Ｐ","甘奈は自分の力で輝いていたんだ。
今日のライブ、甘奈は最高に輝いていた！","Amana was shining on her own.
Today's concert, Amana was at her best!"
"Idolchr_0404_A_10_01_012(0)","甘奈","輝いてた……輝けてた……","Shining ...... shining ......"
"Idolchr_0404_A_10_01_013(0)","甘奈","……甘奈、できてたんだね……","...... Amana, you made it. ......"
"Idolchr_0404_A_10_01_014(0)","甘奈","……ありがと、プロデューサーさん","...... Thanks, producer!"
"Idolchr_0404_A_10_01_015(0)","Ｐ","うん？　悪いけどもう一度……","Yeah? I'm sorry, but I'll try again: ......"
"Idolchr_0404_A_10_01_016(0)","甜花","あ……。
なーちゃーん……！　プロデューサーさーん……！","Oh, .......
Nah-chan, ......! Producer, ......!"
"Idolchr_0404_A_10_01_017(0)","甘奈","あっ！　甜花ちゃーん！","Ah! Beet-hana-chan!"
"Idolchr_0404_A_10_01_018(0)","甘奈","最高のライブだったね！
甜花ちゃん、めっちゃ輝いてたよっ！","That was a great show!
Tetuka-chan, you were so bright!"
"Idolchr_0404_A_10_01_019(0)","甜花","に、にへへ……
そうかな……","ni, ni, ni ......
I don't think so. ......"
"Idolchr_0404_A_10_01_020(0)","甜花","あ、あのね……！
なーちゃんも、可愛くて……キラキラしてた……！","Oh, you know, ......!
Naachan was also cute and ...... sparkling ......!"
"Idolchr_0404_A_10_01_021(0)","甘奈","て、甜花ちゃんっ！　うれしい～☆
でも甜花ちゃんの方がずっとずっと最高だったよ～！","I'm so happy!
But Tetuka was much, much better than me!"
"Idolchr_0404_A_10_01_022(0)","甜花","なーちゃんのが……最高……！","Nachan's is the ...... best ......!"
"Idolchr_0404_A_10_01_023(0)","甘奈","ううん！　甜花ちゃんの方が最高！　
めーっちゃ最高！","Nah! Beetika is the best!
Superb!"
"Idolchr_0404_A_10_01_024(0)","Ｐ","甘奈も甜花も、
ふたりとも最高だった","Both amana and tetuka,
They were both great."
"Idolchr_0404_A_10_01_025(0)","甘奈","えへへ、プロデューサーさんも！
だよ！","Ehehe, the producer too!
It is!"
"Idolchr_0404_A_10_01_026(0)","甜花","て、甜花も……そう思う……！","I think so ......, and so do Tenka ......!"
"Idolchr_0404_A_10_01_027(0)","Ｐ","じゃあ３人とも最高だ！","Then all three are great!"
"Idolchr_0404_A_10_01_028(0)","甘奈","えへへー！","Ehehe!"
"Idolchr_0404_A_10_01_029(0)","甜花","にへへ……","2hehehe ......"
"Idolchr_0404_A_10_01_030(0)","甘奈","あのね、甜花ちゃん！　甘奈ね、甜花ちゃんと
一緒に行きたいお店があるんだ♪","You know, Tetuka-chan! Amana, with Tetuka-chan.
I have a restaurant I want to go to with you... ♪"
"Idolchr_0404_A_10_01_031(0)","甘奈","ライブも成功したし、そこで３人で
お祝い会とかしちゃお！？","We had a successful live show, and that's where the three of us
Let's have a celebration party or something!"
"Idolchr_0404_A_10_01_032(0)","甜花","うん……行きたい……！","Yeah I want to go to ...... ......!"
"Idolchr_0404_A_10_01_033(0)","甘奈","やったー☆　あのねあのね、パフェとかケーキとかが
めっちゃかわいー喫茶店なんだけど……","Yay☆ You know what, you know what, parfaits and cakes...
It's a really cute coffee shop. ......"
"Idolchr_0404_A_10_01_034(0)","Ｐ","（さっき聞き逃した言葉がなんだったかは
もう聞けそうにないけど……まあいいか）","(I'm not sure what the word was that I missed earlier.
(I don't think I'm going to hear it again, but ...... okay)"
"Idolchr_0404_A_10_01_035(0)","Ｐ","（こんなにもふたりが幸せそうなんだから）","(They look so happy together)"
"Idolchr_0404_A_11_00_001(0)","Ｐ","（甘奈たちとライブ成功の打ち上げをするために、
喫茶店にやってきた……）","(To launch the successful live performance with Amana and others,
(I came to a coffee shop: ......)"
"Idolchr_0404_A_11_00_002(0)","甘奈","じゃーん！　ここだよ！
ずーっと甜花ちゃんと一緒に来たかったんだ☆","Ta-da! Here we are!
I've always wanted to come here with Tenka☆."
"Idolchr_0404_A_11_00_003(0)","甘奈","パフェがめーっちゃおいしいの！","The parfait is so delicious!"
"Idolchr_0404_A_11_00_004(0)","甜花","おいしい……パフェ……！","Delicious ...... parfait ......!"
"Idolchr_0404_A_11_00_005(0)","Ｐ","今日はライブの成功のお祝いだからな、
好きなものをなんでも食べていいぞ","Today is a celebration of a successful live show,
You can eat whatever you like."
"Idolchr_0404_A_11_00_006(0)","甜花","な、なんでも……！？
じゃあ、えと、えと……あう、選びきれない……","Hey, anything ......!
Okay, uh, uh, uh ...... I can't choose ......"
"Idolchr_0404_A_11_00_007(0)","甘奈","甘奈も迷っちゃうんだよね～……
あ！　いろんなの頼んでシェアしない！？","Amana gets lost too... ......
Oh! Why don't we order different kinds of food and share them?"
"Idolchr_0404_A_11_00_008(0)","甜花","なーちゃん……天才……！","Nachan ...... genius ......!"
"Idolchr_0404_A_11_00_009(0)","甘奈","やった☆　それじゃ早速……！
今日はパンケーキとかタルトかなぁ……","Yay☆ Then please visit ...... as soon as possible!
Maybe pancakes or tarts today: ......"
"Idolchr_0404_A_11_00_010(0)","甜花","あ、でも……
甜花、振り付け……間違えた……","Ah, but ......
Tenka, choreography ...... wrong ......"
"Idolchr_0404_A_11_00_011(0)","甜花","食べる資格……ない……かも……","Eating qualifications...... not...... or ......"
"Idolchr_0404_A_11_00_012(0)","甘奈","そんなことないよ！
甜花ちゃん、すぐ振りに追いつけてたもん！","That's not true!
Beetle, you were able to catch up with the swing right away!"
"Idolchr_0404_A_11_00_013(0)","甘奈","あれって、甘奈と甜花ちゃんだからこそ
できたんじゃないかなって思うんだ","That was only because of Amana and Tetika.
I think we could have done it."
"Idolchr_0404_A_11_00_014(0)","Ｐ","どうしてそう思ったんだ？","What made you think that?"
"Idolchr_0404_A_11_00_015(0)","甘奈","だってね、プロデューサーさん、甘奈、
甜花ちゃんの動き……なんとなくわかる気がするの","Because, you know, producer, Amana,
I think I kind of know what you mean about the beet movement ......"
"Idolchr_0404_A_11_00_016(0)","甘奈","だから甜花ちゃんもそうなのかな～って思って","So I was wondering if it's the same for you, Tetuka."
"Idolchr_0404_A_11_00_017(0)","甜花","え、その……な、なんとなく、だけど……
……わかった、かも……","Well, you know, ......, sort of, but ......
...... Okay, maybe ......"
"Idolchr_0404_A_11_00_018(0)","甘奈","一緒だね☆　甘奈、そういうのってファンの
みんなにも伝わるんじゃないかって思うんだ","We are the same☆ Amana, that kind of thing is a fan's
I just think people will get the message."
"Idolchr_0404_A_11_00_019(0)","甘奈","ね、プロデューサーさんも、思うでしょ？","Hey, don't you think, producer?"
"Idolchr_0404_A_11_00_020(0)","Ｐ","そうだなぁ……",""
"Idolchr_0404_A_11_00_021(0)","","甘奈と甜花のファン
だから","Fans of Amana and Tetika"
"Idolchr_0404_A_11_00_022(0)","","生のライブだから","It's a live show."
"Idolchr_0404_A_11_00_023(0)","","ふたりが楽しそう
だから","They look like they're having fun."
"Idolchr_0404_A_11_00_024(0)","Ｐ","ああ。そういうところも含めて、甘奈と甜花の
ファンは喜んでくれるんじゃないか？","Oh, and that's part of the story of Amana and Tianhua.
I'm sure the fans would love it."
"Idolchr_0404_A_11_00_025(0)","甘奈","うん、甘奈もおんなじ気持ち！
甜花ちゃんと一緒のステージに立って感じたの","Yes, Amana feels the same way!
I felt it when I stood on stage with Tetuka."
"Idolchr_0404_A_11_00_026(0)","甘奈","みんな、甘奈と甜花ちゃん、ふたりで描く
ライブを楽しんでくれているんだって！","Everyone, Amana and Tetuka, draw them together.
She said he enjoys the live music!"
"Idolchr_0404_A_11_00_027(0)","Ｐ","そうだな。用意した映像じゃなくて、
生のライブだからこそのシーンだからな","Yes, not a prepared video,
It's a live show, it's a live scene."
"Idolchr_0404_A_11_00_028(0)","甘奈","ライブは失敗も成功も、たくさんの楽しいことも
全部一緒に体験していくんだね","Live shows can be failures, successes, and a lot of fun.
You're going to experience it all together."
