"id","character","source","translatedstr"
"Idolchr_0404_B_20_06_012(0)","Ｐ","（よし、ちゃんと当てられたみたいだ。
甘奈も自信がついたみたいだし、よかったな）","(Okay, it looks like I guessed correctly.
(Good for Amana, she's gaining confidence.)"
"Idolchr_0404_B_20_06_013(0)","Ｐ","ずばり……、菜々だな！","Zubari ......, Nana!"
"Idolchr_0404_B_20_06_014(0)","甘奈","残念でした、外れだよ～☆　プロデューサーさんが
分からないんじゃ、もっともっと練習しなきゃだね","I'm sorry, it's an outlier~☆ Producer.
If you don't know, then you need to practice a lot more."
"Idolchr_0404_B_20_06_015(0)","Ｐ","（うーん、外してしまった……。
甘奈もすこし残念そうだし、やってしまった……）","(Hmmm, I missed it. .......
Amana looks a little disappointed, too, and she did it ......)"
"Idolchr_0404_B_20_06_016(0)","Ｐ","今のモノマネは、ずばり……、未来だな！","The moniker now is Zubari ......, the future!"
"Idolchr_0404_B_20_06_017(0)","甘奈","違うよー。ううーん、
もっとしっかり観察しないとダメかなぁ","No...hmmm..,
I guess I need to observe more closely."
"Idolchr_0404_B_20_06_018(0)","Ｐ","（違ったか……。一体誰だったんだろう）","(Or not. ....... Who the hell was that?)"
"Idolchr_0404_B_20_07_001(0)","Ｐ","（どうやら今、ルミナスの中で、
モノマネが流行っているらしい……）","(Apparently, now in Luminous,
(I hear the moniker is popular: ......)"
"Idolchr_0404_B_20_07_002(0)","甘奈","プロデューサーさん！
甘奈、今からモノマネするから、誰か当ててみて☆","Producer!
Amana, I'm going to do an imitation now, so guess who it is☆."
"Idolchr_0404_B_20_07_003(0)","Ｐ","わかった。絶対に当てるぞ！
いいぞ、やってみてくれ","Okay, I'll definitely hit it!
Good, go for it."
"Idolchr_0404_B_20_07_004(0)","甘奈","いっくよ～","Here we go!"
"Idolchr_0404_B_20_07_005(0)","Ｐ","なるほど。今の仕草は、おそらく……","I see...now that gesture is probably ......"
"Idolchr_0404_B_20_07_006(0)","選択肢","甜花","Tenka"
"Idolchr_0404_B_20_07_007(0)","選択肢","雪歩","Yukiho"
"Idolchr_0404_B_20_07_008(0)","選択肢","蘭子","Ranko"
"Idolchr_0404_B_20_07_009(0)","Ｐ","分かったぞ、今の仕草、甜花のモノマネだろ！
さすが双子だな……そっくりだったぞ！","I get it, now that's a gesture, an imitation of Tenka!
You're right, twins. ...... They looked exactly alike!"
"Idolchr_0404_B_20_07_010(0)","甘奈","えへへ、大正解～☆
これだけは、誰にも負けない自信あるんだ～","Hehehe, you are so right~☆☆☆.
I'm confident that I can beat anyone at this!"
"Idolchr_0404_B_20_07_011(0)","Ｐ","（正解できてよかった。
披露できて、甘奈も上機嫌みたいだ）","(I'm glad I got it right.
(Amana seems to be in a good mood now that she has been able to show off her skills.)"
"Idolchr_0404_B_20_07_012(0)","Ｐ","今の仕草、もしかして雪歩のモノマネか？","Is that a gesture now, perhaps an imitation of Yukihos?"
"Idolchr_0404_B_20_07_013(0)","甘奈","違うよ～。けどどうしてだろう……
似てるところがあるのかな……","No - but I don't know why: ......
I wonder if there are similarities: ......"
"Idolchr_0404_B_20_07_014(0)","Ｐ","（甘奈、思ったより落ち込んでるな……。
もしかして深読みしすぎたか……？）","(Amana, you're more depressed than I thought. ......
(Perhaps I'm reading too much into this ......?)"
"Idolchr_0404_B_20_07_015(0)","Ｐ","今の仕草、もしかして蘭子のモノマネか……？","Is that gesture now an impersonation of Ranko or ......?"
"Idolchr_0404_B_20_07_016(0)","甘奈","はっずれー。ううーん、これだけは
絶対似てるって、思ったんだけどな……","Hashishoo...ummmm...only this one...
I thought for sure they look alike. ......"
"Idolchr_0404_B_20_07_017(0)","Ｐ","（うーん、違ったか。
次は正解するぞ……！）","(Hmmm, wrong.
(I'll get it right next time: ......!)"
"Idolchr_0404_B_20_08_001(0)","Ｐ","（書類の整理を終えると、甘奈が近づいてきた。
じゃんけんの相手をしてほしいらしい）","(As I finished sorting through the paperwork, Amana approached me.
(She wants you to play rock-paper-scissors-paper with her.)"
"Idolchr_0404_B_20_08_002(0)","Ｐ","ちょうどいま仕事が終わったところだから、
別にかまわないが……急にどうしたんだ？","I'm just finishing up work right now,
I don't mind, but what's up with ...... all of a sudden?"
"Idolchr_0404_B_20_08_003(0)","甘奈","疲れてる時にごめんね！
けど、どうしてもじゃんけんしてほしいの！","I'm sorry I'm so tired!
But I really want you to play rock-paper-scissors-paper with me!"
"Idolchr_0404_B_20_08_004(0)","甘奈","今度近くのゲーム屋さんでじゃんけん大会があって、
甜花ちゃんのために景品、絶対にゲットしたくて！","There is a rock-paper-scissors-paper tournament at a nearby game store,
I wanted to get the prize for Tenka, for sure!"
"Idolchr_0404_B_20_08_005(0)","Ｐ","なるほど、そのための練習がしたいんだな。
俺も全力で相手をするぞ！","I see, you want to practice for that.
I'll do my best to deal with them too!"
"Idolchr_0404_B_20_08_006(0)","Ｐ","じゃーんけーん……","Janken: ......"
"Idolchr_0404_B_20_08_007(0)","選択肢","勝ちに行く","go for the win"
"Idolchr_0404_B_20_08_008(0)","選択肢","あいこにする","do with favor (favour)"
"Idolchr_0404_B_20_08_009(0)","選択肢","勝ちを譲る","concede victory"
"Idolchr_0404_B_20_08_010(0)","Ｐ","ポンッ！
俺が勝ったのはいいが……これで練習になったのか？","Ponk!
I won, but ...... is this what you've been practicing?"
"Idolchr_0404_B_20_08_011(0)","甘奈","うん！　真剣勝負してくれたおかげで、勝ちに行く
オーラ？　みたいなのが、分かった気がするよ！","Yeah! Thanks for the serious competition, I'm going to win.
I think I know what it's like!"
"Idolchr_0404_B_20_08_012(0)","Ｐ","（……少し大人げなかった気もするが、結果的には、
甘奈に自信がついたみたいだし、よかったな）","(...... I feel like it was a little immature, but as it turns out,
(Good for Amana for gaining confidence.)"
"Idolchr_0404_B_20_08_013(0)","Ｐ","ポンッ！
あいこか……勝負がつかなかったな","Ponk!
Aikoka...... didn't win the game."
"Idolchr_0404_B_20_08_014(0)","甘奈","いい勝負だったってことだね。
プロデューサーさん！　また練習相手、お願いね！","So it was a good match.
Producer! I'm looking forward to having you as my practice partner again!"
"Idolchr_0404_B_20_08_015(0)","Ｐ","（甘奈のやる気は上がったみたいだし、
結果オーライかな）","(Amana's motivation seems to have increased,
I guess it all worked out.)"
"Idolchr_0404_B_20_08_016(0)","Ｐ","ポンッ。
よしよし、甘奈の勝ちだな","Ponk.
Okay, okay, Amana wins."
"Idolchr_0404_B_20_08_017(0)","甘奈","……プロデューサーさん、今わざと負けなかった？
手加減したらダメだよ～","...... producer, didn't you just lose on purpose?
Don't go easy on her!"
"Idolchr_0404_B_20_08_018(0)","Ｐ","（手を抜いたことが、甘奈にバレてしまった……。
甘奈はすこし不満そうだ、対応を間違えたな……）","(Amana found out that I had cut corners. ......
Amana seems a little frustrated, you handled it wrong. ......)"
"Idolchr_0404_C_30_01_001(0)","Ｐ","（甘奈の仕事終わり、
気分転換を兼ねて出かけることにした……）","(Amana's end of work,
I decided to go out for a change (......)"
"Idolchr_0404_C_30_01_002(0)","Ｐ","（もうこんな時間か……。
甘奈も楽しんでくれたようだな）","(Is it that time already? .......
(I see Amana enjoyed it as well.)"
"Idolchr_0404_C_30_01_003(0)","甘奈","プロデューサーさん、今日は楽しかったー♪
また今度、一緒に気分転換しようね☆","Producer, I had a great time today!
Let's change the mood together some other time."
"Idolchr_0404_C_30_01_004(0)","甘奈","今日は素敵なところに連れて行ってくれて
ありがとー☆　甘奈、すごくドキドキしたよ！","You took me to a wonderful place today.
Thanks ☆ Amana, I was very excited!"
"workchr_0404_A_01_00_001(0)","Ｐ","（ブティックのキャンペーン企画の仕事で、
甘奈とブティックにやってきた）","(For a campaign planning job for a boutique,
(I came to the boutique with Amana)"
"workchr_0404_A_01_00_002(0)","甘奈","……！　おしゃれな服がめっちゃいっぱい……！
これ、ぜーんぶ使っていいの！？","......! There are so many fashionable clothes at ......!
You can use all of this!"
"workchr_0404_A_01_00_003(0)","Ｐ","ああ、今日の企画は『甘奈のオススメコーデ☆』が
テーマだからな。甘奈のコーデを紹介しよう","Oh, today's project is ""Amana's Recommended Codes☆"".
That's the theme...here's some of Amana's coords."
"workchr_0404_A_01_00_004(0)","甘奈","やったぁ！
えへへ、どんなのにしよっかなぁ☆","Yay!
Hehehe, what should I make?"
"workchr_0404_A_01_00_005(0)","甘奈","……あ！　このブラウスかわいー！
トレンドも押さえてるし、色々と合わせやすそう！","...... Oh! This blouse is so cute!
It's on-trend and easy to match with many other things!"
"workchr_0404_A_01_00_006(0)","甘奈","こっちは甜花ちゃんが着たら似合いそう……！
あの帽子と一緒に……うん！　絶対かわいー！","This one would look good if Tenka-chan wore it. ......
I'm with that hat: ...... Yeah! Absolutely adorable!"
"workchr_0404_A_01_00_007(0)","甘奈","あっちは和柄だね。すっごく綺麗だけど
あんまりそういうコーデやらないから……できるかな","The other side has Japanese patterns, though they are very beautiful.
I don't do that kind of coding very often, so I wonder if I can ......"
"workchr_0404_A_01_00_008(0)","甘奈","あ、子ども用の服もあるんだ！　小さいサイズなのに
デザインもしっかりしてて、いい感じ！","Oh, they have clothes for kids, too! They're small sizes.
It's well designed and nice!"
"workchr_0404_A_01_00_009(0)","甘奈","けど、これだけ種類があると、迷っちゃうなぁ。
プロデューサーさんは、どんなコーデがいいと思う？","But with so many different kinds, I'm not sure what to do.
What do you think the producer should coordinate?"
"workchr_0404_A_01_00_010(0)","Ｐ","そうだな……。
甘奈の長所を活かせるコーデというと……","
A cord that can take advantage of Amana's strengths is ......"
"workchr_0404_A_01_00_011(0)","選択肢","甜花に似合うコーデ","Codes suitable for Tenka"
"workchr_0404_A_01_00_012(0)","選択肢","今時のＪＫコーデ","JK Codes of the moment"
"workchr_0404_A_01_00_013(0)","選択肢","子ども向けのコーデ","Codes for children"
"workchr_0404_A_01_00_014(0)","選択肢","和風コーデ","Japanese-style codecs"
"workchr_0404_A_01_00_015(0)","Ｐ","甜花に似合うコーデを、テーマにしたらどうだ？
身近な人をイメージした方が、やりやすいだろうし","Why don't you make a theme out of the codecs that would look good on Tenka?
It would be easier to do this if you imagined someone familiar to you."
"workchr_0404_A_01_00_016(0)","甘奈","さっきも甜花ちゃんに似合いそうなのは
すぐ考えられたもんね……！","I was thinking earlier that it would look good on Tenka.
You thought of it right away. ......"
"workchr_0404_A_01_00_017(0)","甘奈","ありがと！　その方法でやってみる☆
よーし、頑張るぞ～！","Thanks! I'll try it that way☆.
Okay, I'll do my best!"
"workchr_0404_A_01_00_018(0)","甘奈","どんどん思いつくよ☆
えへへ、止まらなくなっちゃうね！","I'm coming up with more and more.
Ehehe, I can't stop, can I?"
"workchr_0404_A_01_00_019(0)","Ｐ","(甘奈はマネキンが足りなくなるほどのコーデを
どんどん作り、イベントは大いに盛り上がった！）","(Amana has so many cords that she runs out of mannequins.
The event was a lot of fun!)"
"workchr_0404_A_01_00_020(0)","Ｐ","(甘奈と甜花の仲良しっぷりもネットで話題になり、
また更に仕事が増えたぞ！)","(The friendship between Amana and Tianhua also became a hot topic on the Internet,
And even more work for you!!!)"
"workchr_0404_A_01_00_021(0)","Ｐ","やっぱり今時の女の子に似合うコーデが
いいんじゃないか？　みんな参考になるしな！","After all, a cord that suits today's girls is a good choice.
That's good, isn't it? It's helpful for all of us!"
"workchr_0404_A_01_00_022(0)","甘奈","それが一番かもね……！
うん！　かわいーコーデがたくさんできそう☆","That's probably best. ......
I'm sure I'll have lots of cute outfits."
"workchr_0404_A_01_00_023(0)","甘奈","これには、これを合わせてっと……できた！
うん、ばっちり！　次、いっくよー！","I was able to ...... this together!
Yes, perfect! I'm going next time!"
"workchr_0404_A_01_00_024(0)","Ｐ","(その後も甘奈らしいコーデを作り続け、
キャンペーンも若い女の子から非常に好評だった！)","(After that, she continued to make codecs that were typical of Amana,
The campaign was also extremely well received by young girls!)"
"workchr_0404_A_01_00_025(0)","Ｐ","せっかく子ども用の服も置いてあることだし、
小さい子向けのコーデを考えてみたらどうだ？","And now that we have children's clothes, too,
Why don't you come up with some codecs for the little ones?"
"workchr_0404_A_01_00_026(0)","甘奈","子ども向けのコーデかぁ。
やってみたことないけど、チャレンジしてみようかな","Codes for children, huh?
I've never tried it, but I'll give it a shot."
"workchr_0404_A_01_00_027(0)","Ｐ","(いくつか作るものの、想定ターゲットより
大人びてしまい、イマイチな出来になってしまった)","(Although we make some of them, they are more than the expected target.
It was matured and not as good as it could have been.)"
"workchr_0404_A_01_00_028(0)","Ｐ","(その後も試行錯誤したものの納得のいくコーデが
できず、キャンペーンの評判もいまいちだった)","(After that, I was able to find a satisfactory coding despite trial and error.
It was not possible, and the campaign was not well-received.)"
"workchr_0404_A_01_00_029(0)","Ｐ","そうだな、和風のコーデにしてみたらどうだ？
新しいことに挑戦してみるのも大切だからな","Yes, why don't you try a Japanese style cord?
It's important to try new things."
"workchr_0404_A_01_00_030(0)","甘奈","うん……！
初めてだけど、頑張ってみる……！","Yeah. ......!
I'm new to this, but I'll try my best. ......"
"workchr_0404_A_01_00_031(0)","Ｐ","(その後、甘奈は慣れないコーデに苦戦してしまい、
キャンペーンの公開は延期になってしまった……)","(After that, Amana struggled with the unfamiliar cordiality,
The release of the campaign has been postponed: ......)"
"workchr_0404_A_01_00_032(0)","Ｐ","（今回の仕事は成功だ！）","(This job was a success!)"
"workchr_0404_A_01_00_033(0)","Ｐ","（今回の仕事は失敗だ。次こそは！）","（This job was a mistake...next time!)"
"workchr_0404_B_01_00_001(0)","Ｐ","甘奈のミニライブが決まったぞ！","Amana's got a mini live show coming up!"
"workchr_0404_B_01_00_002(0)","甘奈","本当！？　やったぁ！　
めーっちゃうれしい！","Really!
I am so happy!"
"workchr_0404_B_01_00_003(0)","Ｐ","しかも今回はソロだ！
それができるくらい、ファンがいるって証拠だな！","And this time it's solo!
That's proof that you have enough fans to do that!"
"workchr_0404_B_01_00_004(0)","甘奈","えへへ。
いつも応援してくれるみんなに、感謝しないとだね！","Heh heh.
I should thank everyone who always supports me!"
"workchr_0404_B_01_00_005(0)","Ｐ","そうだな。甘奈の希望も取り入れやすくなるし、
何かやりたいことがあったら、どんどん言ってくれ","Yes, it would be easier to incorporate Amana's wishes,
If there's something you want to do, just keep telling me."
"workchr_0404_B_01_00_006(0)","甘奈","ホント？　それなら早速
相談したいことがあるんだけど、いいかな？","Really? Well, then, let's get to it.
I'd like to discuss something with you, if you don't mind."
"workchr_0404_B_01_00_007(0)","Ｐ","俺でよければいくらでも聞くぞ。
どうしたんだ？","I'll ask as many questions as you want if it's okay with me."
"workchr_0404_B_01_00_008(0)","甘奈","ソロのライブって、いつも以上に
ファンのみんなとの距離感が近くなるでしょ？","Solo gigs are more than usual.
You'll feel closer to all your fans, right?"
"workchr_0404_B_01_00_009(0)","甘奈","だから、みんなで一緒のステージを
作りたいなって……。えっと……","So, we're all on stage together.
I wanted to make a ..........um........."
"workchr_0404_B_01_00_010(0)","Ｐ","ああ、なるほど
一体感のあるステージにしたいってことかな","Oh, I see.
I guess they want to create a stage of togetherness."
"workchr_0404_B_01_00_011(0)","甘奈","！　うん！","Yes, I know!"
"workchr_0404_B_01_00_012(0)","甘奈","どうしたらいいかな？
プロデューサーさん、何かアイディアある？","What should I do?
Producers, any ideas?"
"workchr_0404_B_01_00_013(0)","Ｐ","なるほど、次のミニライブの工夫か……。
それなら……","I see...the ingenuity of the next mini-live. ......"
"workchr_0404_B_01_00_014(0)","選択肢","一緒に歌う","Sing with me"
"workchr_0404_B_01_00_015(0)","選択肢","ＭＣを工夫する","Devise an MC"
"workchr_0404_B_01_00_016(0)","選択肢","たくさん歌う","sing a lot"
"workchr_0404_B_01_00_017(0)","選択肢","普段通り","as usual"
"workchr_0404_B_01_00_018(0)","Ｐ","それなら、ファンと一緒に歌うのはどうだ？
ライブはコールアンドレスポンスが大切だからな","Then how about singing along with the fans?
Live music is all about call and response."
"workchr_0404_B_01_00_019(0)","甘奈","すっごくいいかも……！　あ、それなら
セットリストも一度、甘奈が考えてみていい？","It could be very nice. ......! Oh, that's a good idea.
Can Amana come up with a set list once?"
"workchr_0404_B_01_00_020(0)","Ｐ","もちろん。協力して良いライブにしような","Sure. Let's work together to make it a good show."
"workchr_0404_B_01_00_021(0)","甘奈","えへへ♪　ありがと、プロデューサーさん！
甘奈、頑張っちゃうね☆","Ehehe♪ Thanks, producer!
Amana, I'll do my best."
"workchr_0404_B_01_00_022(0)","Ｐ","(甘奈の声掛けによって、次の曲は大合唱になった。
会場が一体となり、ライブは大いに盛り上がった！)","(Amana's call led to a big chorus for the next song.
The venue was united and the live show was a great success!)"
"workchr_0404_B_01_00_023(0)","Ｐ","(ファンは大喜びで、甘奈も満足そうだった。
次はもっと大きな会場でやれそうだ！)","(The fans were delighted, and Amana seemed satisfied.
Maybe next time we can do it in a bigger venue!)"
"workchr_0404_B_01_00_024(0)","Ｐ","それなら、ＭＣを工夫してみるのはどうだ？
トークだって甘奈の立派な武器のひとつだからな","Then how about getting creative with the MCs?
Talk is another of Amana's fine weapons."
"workchr_0404_B_01_00_025(0)","甘奈","そっか、ライブの醍醐味は歌だけじゃないもんね！
さすがプロデューサーさんだね☆","I see. The best part of a live concert is not only the singing!
That's what I'd expect from a producer."
"workchr_0404_B_01_00_026(0)","甘奈","ライブがもっと楽しくなるＭＣ、考えてみるっ！
みんな、喜んでくれるといいな♪","I'll think of an MC that will make the live show more enjoyable!
I hope you everyone are happy..."
"workchr_0404_B_01_00_027(0)","Ｐ","(ライブ当日、甘奈のＭＣで曲間も飽きることなく、
最初から最後まで楽しめる良いライブになった！)","(On the day of the concert, Amana's MC kept me going between songs,
It turned out to be a good show that I enjoyed from start to finish!)"
"workchr_0404_B_01_00_028(0)","Ｐ","それなら、みんなが楽しくなれる元気な曲を、
たくさん歌うライブにしてみよう","Then, we need energetic songs that everyone can enjoy,
Let's make it a live show with lots of singing."
"workchr_0404_B_01_00_029(0)","甘奈","うん、それならメドレーも取り入れてみようかな。
セットリストも考えてみるね！","Yeah, I'll try to incorporate a medley then.
I'll see what I can come up with for a set list!"
"workchr_0404_B_01_00_030(0)","Ｐ","(甘奈の元気な歌が多く聞けてファンは喜んだが、
後半は甘奈もみんなも疲れてしまった……)","(Fans were pleased to hear many of Amana's energetic songs, though,
Amana and everyone else got tired in the second half: ......)"
"workchr_0404_B_01_00_031(0)","Ｐ","俺は普段通りが一番だと思うぞ。それよりも、
今は歌やダンスのレッスンに集中しよう","I think it's best if things are business as usual, more than that,
Let's focus on singing and dancing lessons for now."
"workchr_0404_B_01_00_032(0)","Ｐ","(その後、甘奈は普段通りにライブをこなしたが、
甘奈自身は内容に満足できなかったみたいだ……)","(After that, Amana performed as usual, though,
Amana herself was not satisfied with the content: ......)"
"workchr_0404_B_01_00_033(0)","Ｐ","（今回の仕事は成功だ！）","(This job was a success!)"
"workchr_0404_B_01_00_034(0)","Ｐ","（今回の仕事は失敗だ。次こそは！）","（This job was a mistake...next time!)"
"workchr_0404_C_01_00_001(0)","Ｐ","（甘奈の次の仕事の打ち合わせで、
カフェに来ている……）","(At a meeting for Amana's next job,
(You're at the cafe: ......)"
"workchr_0404_C_01_00_002(0)","Ｐ","次の甘奈の仕事は、風邪予防の強化月間を
呼びかけるＣＭだな！","Next Amana's job is to strengthen Cold Prevention Month.
It's a commercial that calls for it!"
"workchr_0404_C_01_00_003(0)","甘奈","えへへ。
撮影、楽しみだな～☆","Heh heh.
I'm looking forward to the shoot!"
"workchr_0404_C_01_00_004(0)","甘奈","でも、どーして甘奈が選ばれたのかな？","But why was Amana chosen?"
"workchr_0404_C_01_00_005(0)","Ｐ","甘奈の明るくて元気なイメージが、
ＣＭの方向性と合っていたのかもしれないな","Amana's bright and cheerful image,
Maybe that was in line with the direction of the commercial."
"workchr_0404_C_01_00_006(0)","甘奈","えへへ、そうだったら
うれしーな","Heh heh, if that's the case.
I'm so happy."
"workchr_0404_C_01_00_007(0)","Ｐ","あ、そうだ。風邪の予防に関連した服なら
撮影の衣装はこっちで決めていいらしいぞ","Ah, yes, if it's clothing related to preventing colds.
They say we can decide what to wear for the shoot."
"workchr_0404_C_01_00_008(0)","甘奈","そうなんだね……うーん……。
プロデューサーさんはどんなのがいいと思う？","I see that. ...... hmmm .......
What do you think the producer would like?"
"workchr_0404_C_01_00_009(0)","Ｐ","せっかくだし、
甘奈が自由に考えてみたらどうだ？","I'm going to go out on a limb here,
Amana should feel free to think about it."
"workchr_0404_C_01_00_010(0)","甘奈","プロデューサーさんの意見を聞いてみたいな！","I'd like to hear what the producer has to say!"
"workchr_0404_C_01_00_011(0)","甘奈","たくさんのアイディアから選んだ方が、
いいものができそうだから！","You should choose from a lot of ideas,
Because I think I can make something good!"
"workchr_0404_C_01_00_012(0)","甘奈","あ！　でも、頼ってばかりはズルいね……！
とりあえず思いつくのは……","Ah! But it's not fair to rely on them all the time. ......
For now, all I can think of is ......"
"workchr_0404_C_01_00_013(0)","甘奈","まず、看護師さん！　ヒネリはないけど、
オーソドックスなの、いいと思う！","First of all, the nurses! Not a twitch, though,
Orthodox, I think it's good!"
"workchr_0404_C_01_00_014(0)","甘奈","あとは、白衣の女医さんとか、かっこいいよね！
メガネとかかけちゃってみたり！","And then there are cool things like female doctors in white coats!
I put on glasses or something!"
"workchr_0404_C_01_00_015(0)","甘奈","あとは……パジャマとか……？
いっぱい寝るのも予防だし……","And then there's ...... pajamas or ......?
It's also preventative to sleep a lot. ......"
