"id","character","source","translatedstr"
"Idolchr_0204_A_07_00_006(0)","Ｐ","何事かと思ったよ。本を読んでたのか","I wondered what was going on...you were reading a book."
"Idolchr_0204_A_07_00_007(0)","きらり","うん！　翼ちゃんに借りた少女漫画だゆ☆","I borrowed this girls' manga from Tsubasa."
"Idolchr_0204_A_07_00_008(0)","きらり","甘くってキュンキュンの展開で、きらりん、
思わず、うっきゃー！　ってなっちゃって～","It's a sweet and cuddly development, Kirarin,
I couldn't help but go ""oooooooh!"
"Idolchr_0204_A_07_00_009(0)","きらり","きらりん、うるさかったよね……。
Ｐちゃんのお仕事、邪魔しちゃってごめんねぇ","Kirarin, you were loud. ......
Sorry for interrupting your work, P-chan."
"Idolchr_0204_A_07_00_010(0)","Ｐ","そこまで謝らなくてもいいぞ……。
ただ、なんていうか。う～ん……","You don't have to apologize that much. ......
Just what can I say. hmmm ......"
"Idolchr_0204_A_07_00_011(0)","選択肢","大丈夫","It's all right."
"Idolchr_0204_A_07_00_012(0)","選択肢","もう少し抑えて","A little less."
"Idolchr_0204_A_07_00_013(0)","選択肢","うるさかった","It was loud."
"Idolchr_0204_A_07_00_014(0)","Ｐ","大丈夫、気にしなくていいよ。
それよりその漫画、よっぽど面白いみたいだな","It's okay, don't worry about it.
That cartoon sounds a lot more interesting than it is."
"Idolchr_0204_A_07_00_015(0)","きらり","うん！　すっごくキュンキュンの
キラッキラでドッキンドッキンコなんだゆ☆","Yes!
It's a glittering, thumping, thudding, thudding, thudding, thudding, thudding, thudding, thudding, thudding."
"Idolchr_0204_A_07_00_016(0)","Ｐ","それじゃあ、きらりも少女漫画みたいな、
シチュエーションに憧れたりするのか？","Then Kirari is like a shoujo manga,
Do you yearn for situations?"
"Idolchr_0204_A_07_00_017(0)","きらり","それって、きらりんが少女漫画の主人公だったら、
ってこと……？　ぽわぽわ～ん……","That is, if Kirarin were the protagonist of a shoujo manga,
Does that mean ......? Powapow~n......"
"Idolchr_0204_A_07_00_018(0)","きらり","ぴゃうー！　そんなの、想像しただけで
顔があちあちだにぃ！","Just imagine that!
My face is all over the place!"
"Idolchr_0204_A_07_00_019(0)","Ｐ","もう少し抑えてくれると助かるよ。
ちょっとびっくりするから","I'd appreciate it if you'd hold back a little more.
Because you'd be a little surprised."
"Idolchr_0204_A_07_00_020(0)","きらり","はいっ、りょーかいです！　びしぃ！
Ｐちゃんのお邪魔しないように、気を付けゆ！","Yes, it's a great honor!
Be careful not to disturb P-chan!"
"Idolchr_0204_A_07_00_021(0)","きらり","でも、キュンキュンすると、つい声が
おっきくなっちゃうんだぁ……","But when I get squeamish, I just can't stop talking.
I'm going to be a big girl. ......"
"Idolchr_0204_A_07_00_022(0)","Ｐ","そうだな……少しうるさかった、かな","Yes, ...... it was a little loud, I guess."
"Idolchr_0204_A_07_00_023(0)","きらり","うぅ……Ｐちゃんお仕事してるのに、
ごめんね……","Ugh ......P, you're working,
Sorry ......"
"Idolchr_0204_A_07_00_024(0)","きらり","お口チャックして、静かに読むね！　ちょっとは、
うぴゃーってなっちゃうかもだけど……","I'll zip up my mouth and read quietly!
I know it might make you go ""oooooh"" but ......"
"Idolchr_0204_A_07_00_025(0)","Ｐ","まあ、きらりが大声を上げている、理由がわかって
スッキリしたけど……ほどほどにな","Well, Kirari is yelling, and now I know why.
It's refreshing, but ...... in moderation."
"Idolchr_0204_A_07_00_026(0)","きらり","はぁ～い！　了解だゆ！","Yes, I got it!"
"Idolchr_0204_A_07_00_027(0)","きらり","ぴゃうー！　そ、そんなこと言われたら……！","Pyah! Well, if you say so, please visit ......!"
"Idolchr_0204_A_07_00_028(0)","きらり","きらりん、きゅんきゅんでバクハツしちゃうー！","Kirarin, kyun kyun and bakuhatsu!"
"Idolchr_0204_A_07_00_029(0)","Ｐ","（また叫んでる……。
そんなに刺激的な漫画なのかな？）","(Also screaming: .......
(Is it really that exciting a cartoon?)"
"Idolchr_0204_A_07_00_030(0)","きらり","はっ……！　ぴ、Ｐちゃん、ごめんね……。
きらり、またうるさくしちゃったよね……","Haha ......! Sorry, P. .......
Kirari, I made it loud again: ......"
"Idolchr_0204_A_07_00_031(0)","Ｐ","いいよ、大丈夫。それより、
きらりがそんなに夢中になる漫画、俺も気になるな","No, it's okay, it's okay,
I'm curious too about the manga that Kirari is so obsessed with."
"Idolchr_0204_A_07_00_032(0)","きらり","Ｐちゃんも一緒に読む？　胸がきゅんきゅーんって、
ドッキドキでハピハピになっちゃうゆ♪","P-chan, would you like to read it with me? My heart is pounding,
I'm so excited, I'm so happy!"
"Idolchr_0204_A_07_00_033(0)","Ｐ","そうか。
だったら俺も一緒に読んでもいいか？","Okay.
Then can I read it with you?"
"Idolchr_0204_A_07_00_034(0)","きらり","もっちろん！　じゃあＰちゃん、お隣にどうぞ♪
一緒にきゅんきゅん、しようにぃ♪","Of course! Well then, P-chan, come sit next to me...
Let's squeal together!"
"Idolchr_0204_A_07_00_035(0)","Ｐ","（……ページを捲るたびにきらりは声を上げている。
無事に１冊読み終えることができるのだろうか）","(......) Kirari is screaming every time she turns a page.
(Will I be able to finish reading one in one piece?)"
"Idolchr_0204_A_08_00_001(0)","Ｐ","（ソファの方から寝息が聞こえてくるな。
よく眠ってるみたいだけど……）","(You can hear her breathing in her sleep from the couch.
(She seems to sleep well. ......)"
"Idolchr_0204_A_08_00_002(0)","きらり","むむむぅ……まーた杏ちゃん、
レッスンをさぼってるにぃ！","Mmmmmm... ...... mmmm... apricot,
I'm skipping lessons!"
"Idolchr_0204_A_08_00_003(0)","きらり","そんな杏ちゃんには……こっそり近づいて、
びっくりさせちゃうんだから☆","You can sneak up on such Anzu at ......,
I'm going to surprise you."
"Idolchr_0204_A_08_00_004(0)","きらり","そーっと、そーっと……からの、
きらりんアターック☆","Gently, gently from ......,
Kirarin Atac*."
"Idolchr_0204_A_08_00_005(0)","甜花","…………っ！","............!"
"Idolchr_0204_A_08_00_006(0)","美希","あふぅ、どうしたの……？
ミキ、まだ眠いの～","Aww, what's wrong ......?
Miki, I'm still sleepy."
"Idolchr_0204_A_08_00_007(0)","きらり","にょわー！！！　甜花ちゃん！　美希ちゃん！","Nyowa!!! Beet-hana, Miki!"
"Idolchr_0204_A_08_00_008(0)","きらり","てっきり、杏ちゃんかと思って……。
びっくりさせちゃって、ごめんねぇ","I thought it was Anzu and went to .......
I'm sorry I startled you."
"Idolchr_0204_A_08_00_009(0)","甜花","甜花……心臓、バクバク……","Tenka ...... heart, bakku ......"
"Idolchr_0204_A_08_00_010(0)","美希","そーゆーことだったんだね……。
それじゃミキはお昼寝にもどるの","That's how it happened. ......
Okay, Miki, back to your nap."
"Idolchr_0204_A_08_00_011(0)","きらり","しゅ～ん。きらり、失敗しちゃった……。
Ｐちゃんは杏ちゃんじゃないって知ってたの？","Shhhh...Kirari, I screwed up. ......
Did you know that P-chan is not Anzu?"
"Idolchr_0204_A_08_00_012(0)","Ｐ","えっ、俺は……","Eh, I'm ......"
"Idolchr_0204_A_08_00_013(0)","選択肢","知らなかった","I didn't know."
"Idolchr_0204_A_08_00_014(0)","選択肢","知ってた","I knew it."
"Idolchr_0204_A_08_00_015(0)","Ｐ","知らなかったよ。仕事してたから","I didn't know, I was working."
"Idolchr_0204_A_08_00_016(0)","美希","プロデューサー、ミキたちがいたのも
気付いてなかったでしょ？","Producers, Miki and the others were there.
You didn't notice, did you?"
"Idolchr_0204_A_08_00_017(0)","きらり","そ、そうなの？
Ｐちゃん、お仕事に集中してたんだね","Oh, yeah?
P-chan, you were concentrating on your work."
"Idolchr_0204_A_08_00_018(0)","きらり","……ってことは、
きらりん、Ｐちゃんのお仕事も邪魔しちゃったのかな","...... means,
Kirarin, I wonder if I interfered with P-chan's work as well."
"Idolchr_0204_A_08_00_019(0)","Ｐ","ごめん、知ってた","Sorry, I knew."
"Idolchr_0204_A_08_00_020(0)","きらり","にょわ！　Ｐちゃんのいじわる～。
どうして教えてくれなかったのぉ","Nyowa! P-chan's teasing~!
Why didn't you tell me?"
"Idolchr_0204_A_08_00_021(0)","きらり","でも、Ｐちゃんお仕事忙しいから
きらりのことばっかり気にしてられないよねぇ……","But, P-chan, you're busy with work.
I can't keep worrying about Kirari, can I? ......"
"Idolchr_0204_A_08_00_022(0)","Ｐ","い、いや、そんなことは……","No, no, that's not what ......"
"Idolchr_0204_A_08_00_023(0)","甜花","……えっと、甜花、寝るね……","...... Well, Tenka, I'm off to bed. ......"
"Idolchr_0204_A_08_00_024(0)","美希","むにゃむにゃ……","Mushy Mushy ......"
"Idolchr_0204_A_08_00_025(0)","きらり","にょわわ……。
それじゃあ、せめてものお詫びに……コホン！","Nyowa. .......
Well then, let me at least apologize to you at ...... Kohon!"
"Idolchr_0204_A_08_00_026(0)","きらり","眠れ～眠れ～♪
すやすやハピハピな夢がみれますようにぃ～♪","Sleep~sleep~♪
May you have a peaceful and happy dream~~!"
"Idolchr_0204_A_08_00_027(0)","Ｐ","……なんのつもりだ、きらり？","......What are you trying to do, Kirari?"
"Idolchr_0204_A_08_00_028(0)","きらり","うん？　ふたりを起こしちゃったから、きらりんの
子守歌でスヤスヤしてもらおうかなって♪","I woke up the two of them.
I thought I'd let the lullaby lull me to sleep."
"Idolchr_0204_A_08_00_029(0)","甜花","こ、子守歌……甜花、大丈夫……","Ko, lullaby ...... Tenka, okay ......"
"Idolchr_0204_A_08_00_030(0)","きらり","にょにょにょわ～♪　にょにょにょわ～♪
ねんねん、にょにょわ～ん♪","Nyonyonyowa~♪ Nyonyonyowa~♪
Nenyonyo nyonyo nyonyo nyonyo nyonyo nyonyo nyonyo nyonyo nyonyo"
"Idolchr_0204_A_08_00_031(0)","美希","……ヘンテコな歌が聞こえてきたの","...... I heard a weird song."
"Idolchr_0204_A_08_00_032(0)","甜花","……歌詞、気になって……眠れない……","...... lyrics, I can't sleep ...... because I'm curious ......"
"Idolchr_0204_A_08_00_033(0)","きらり","にょわー！　じゃ、じゃあ別の子守唄にするにぃ！
えーっと、えーっと……","Well, then, I'll choose a different lullaby!
Let's see, let's see: ......"
"Idolchr_0204_A_08_00_034(0)","Ｐ","きらり、そのふたりは放っておけば、
いつの間にか眠ってるから大丈夫だぞ","Kirari, leave those two alone,
You'll be asleep before you know it. You'll be fine."
"Idolchr_0204_A_08_00_035(0)","美希","むぅ……！　なんだかテキトーな
扱いをされている気がするの","Muah ......! What a Texan!
I feel like I'm being treated"
"Idolchr_0204_A_08_00_036(0)","きらり","うにゅ。甜花ちゃん、美希ちゃん。
お昼寝の邪魔をして、ほんとにごめんねぇ……","Unyu, Tetuka, Miki.
I'm really sorry to interrupt your nap. ......"
"Idolchr_0204_A_08_00_037(0)","甜花","ううん……もう、大丈夫……
ドキドキ、おさまったから……","Nah, ...... already, I'm fine. ......
Pounding, because it's subsided: ......"
"Idolchr_0204_A_08_00_038(0)","美希","そうなの！　次は仕事をサボってお昼寝をしている
プロデューサーに、きらりんアタックをするの♪","Oh yeah! Next thing I know, I'm skipping work and taking a nap.
♪ I'm going to make a Kirarin attack on the producer ♪"
"Idolchr_0204_A_08_00_039(0)","きらり","うきゃっ☆　それは名案だゆ！
居眠りしているＰちゃんを見かけたら教えてにぃ！","That's a great idea!
If you see P-chan dozing off, let me know!"
"Idolchr_0204_A_08_00_040(0)","Ｐ","……なんでそうなるんだ？","...... Why is that?"
"Idolchr_0204_A_09_00_001(0)","Ｐ","（今回の仕事はかなりいい手応えを感じた。
きらりも晴れやかな表情だ）","(I felt a pretty good response to this job.
(Kirari also looks radiant.)"
"Idolchr_0204_A_09_00_002(0)","きらり","Ｐちゃん！
今日のお仕事、すっごくハピハピだったよね♪","P!
You had a great day at work today, didn't you?"
"Idolchr_0204_A_09_00_003(0)","Ｐ","そうだな、元気いっぱいで、
きらりらしい魅力が伝わったと思う","Yes, full of energy,
I think I conveyed Kirari's typical charm."
"Idolchr_0204_A_09_00_004(0)","きらり","うぇへへー♪　きらりね、ルミナスのみんなと
一緒に頑張ってきて、いっぱい刺激をもらったんだ","Wohehehee♪ Kirari, with everyone at Luminous!
We've worked so hard together, and I've been inspired a lot."
"Idolchr_0204_A_09_00_005(0)","きらり","いろいろあったけど、みんな一生懸命で、
もっとルミナスをおっきくしようって頑張ってるの","There was a lot going on, but everyone was working very hard,
I'm trying my best to make the luminous bigger."
"Idolchr_0204_A_09_00_006(0)","きらり","だから、みんなといると
きらりもがんばるにぃ！　って、気合が入るんだゆ☆","So, when I'm with you guys.
Kirari will do her best!"
"Idolchr_0204_A_09_00_007(0)","きらり","きらりと仲良くしてくれたみんなと、
一緒にいられるのが、すっごく嬉しいんだぁ♪","With Kirari and everyone who has been good to me,
I'm so happy to be with you!"
"Idolchr_0204_A_09_00_008(0)","Ｐ","……そうか。ルミナスがきらりの
支えになっているのなら、良かったよ","...... Okay, so Luminous is Kirari's
I'm glad you're being supportive."
"Idolchr_0204_A_09_00_009(0)","きらり","うん♪　合宿に行ったり、おしゃべりしたり♪
みんなといろんな活動をして、毎日ハピハピだよぉ♪","Yes... we go to camps, we chat...
I'm happy to do various activities with everyone."
"Idolchr_0204_A_09_00_010(0)","Ｐ","ルミナスのみんなも、きらりと一緒に
活動できて楽しんでいると思うぞ","Everyone in Luminous is also with Kirari.
I'm sure you're enjoying being active."
"Idolchr_0204_A_09_00_011(0)","きらり","にょわ～♪　みんなも同じ気持ちなら、
とーってもハピハピだにぃ☆","Nyowa~♪ If everyone feels the same way,
I'm so happy-happy!"
"Idolchr_0204_A_09_00_012(0)","きらり","うぇへへ。Ｐちゃんは～、スイーツみたい♪
いっつもきらりをハピハピにしてくれて","P-chan~ is like a sweet!
You always make Kirari happy and happy."
"Idolchr_0204_A_09_00_013(0)","Ｐ","スイーツに例えられたのは初めてだな。
でも、きらりの好きなものに例えてくれて光栄だ","This is the first time I've ever been compared to Sweets.
But I'm honored that you likened it to something Kirari likes."
"Idolchr_0204_A_09_00_014(0)","きらり","きらりもスイーツみたいになりたいなぁ☆
みんなをあまあまハピハピにしちゃうの♪","Kirari wants to be like Sweets.
I'm going to make everyone so happy-happy-happy!"
"Idolchr_0204_A_09_00_015(0)","Ｐ","きらりは十分、スイーツみたいだよ","Kirari looks like a sweetheart, enough said."
"Idolchr_0204_A_09_00_016(0)","きらり","うっきゃー☆　うれすぃ～☆
じゃあじゃあ、きらりはどんなスイーツみたい？","I'm sooooooooooooooooooooooooooo happy!
Okay, then, what kind of sweets do you like Kirari?"
"Idolchr_0204_A_09_00_017(0)","Ｐ","そうだなぁ。きらりをスイーツで例えるなら、
キラキラしているものだろうから……","Yes, if I were to compare Kirari with sweets,
Because it would be a sparkling thing: ......"
"Idolchr_0204_A_09_00_018(0)","選択肢","コットンキャンディ","cotton candy"
"Idolchr_0204_A_09_00_019(0)","選択肢","パフェ","parfait"
"Idolchr_0204_A_09_00_020(0)","選択肢","板チョコ","bar of chocolate"
"Idolchr_0204_A_09_00_021(0)","選択肢","スパンコール","sequin"
"Idolchr_0204_A_09_00_022(0)","Ｐ","コットンキャンディ……だっけ？
カラフルで優しい雰囲気がきらりみたいだな","Was it Cotton Candy ......?
Colorful and gentle, just like Kirari."
"Idolchr_0204_A_09_00_023(0)","きらり","うぴゃー！　きらりんがコットンキャンディ！？
ふわふわできゃわきゃわなアイドルってことかにぃ♪","Whaaaat! Kirarin is a cotton candy!
I mean, a fluffy and cute idol...."
"Idolchr_0204_A_09_00_024(0)","きらり","さすがＰちゃん、いろんなスイーツを知ってるにぃ☆
うぇへへ♪　Ｐちゃんに褒められてテレテレだゆ！","As expected of P-chan, you know all kinds of sweets.
I'm so excited to be praised by P-chan!"
"Idolchr_0204_A_09_00_025(0)","Ｐ","パフェなんて、きらりっぽいと思うぞ。
賑やかで楽しい気分になるからな","I think a parfait is very Kirari-like.
It's just so lively and fun to be in the mood."
"Idolchr_0204_A_09_00_026(0)","きらり","いろいろ乗ってて、ひと口ごとに違う味が楽しめて。
うん、きらりんも飽きさせないアイドルになるゆ☆","It has a variety of flavors on it, and each bite has a different taste.
Yes, Kirari will be an idol that will never bore you."
"Idolchr_0204_A_09_00_027(0)","Ｐ","板チョコ……とか？
ごめん、スイーツはよく分からなくて……","Like the chocolate board ......?
Sorry, I'm not familiar with sweets. ......"
"Idolchr_0204_A_09_00_028(0)","きらり","板チョコもお手軽でおいすぃスイーツだけど……。
板チョコっぽいアイドルってどーゆー感じかなぁ？","Chocolate boards are also an easy and delicious sweet. ......
How do you think a chocolate-board-like idol would look like?"
"Idolchr_0204_A_09_00_029(0)","Ｐ","きらりでキラキラっていったら、
スパンコールだろうな……","When I say sparkle with glitter,
I'm sure it's sequins. ......"
"Idolchr_0204_A_09_00_030(0)","きらり","スパンコールもキラキラできゃわいいけど……。
デコデコする材料でスイーツじゃないよぉ？","The sequins are sparkly and pretty, but .......
It's not a sweet with ingredients for deco-decoration, right?"
"Idolchr_0204_A_09_00_031(0)","Ｐ","まあ、例えが的確かどうかはさておき、
きらりはきらりのままでいいってことだ","Well, let's put aside whether the analogy is accurate or not,
It means Kirari can be Kirari as she is."
"Idolchr_0204_A_09_00_032(0)","Ｐ","きらりはそのままで十分、
魅力的なアイドルなんだからな","Kirari is good enough as it is,
You're an attractive idol."
"Idolchr_0204_A_09_00_033(0)","きらり","うぇへへ♪　Ｐちゃん、いつもありがと☆","Thanks for everything, P-chan!"
"Idolchr_0204_A_09_00_034(0)","きらり","Ｐちゃんがそう言ってくれるから、
きらりはもーっと頑張れちゃうゆ♪","Because P-chan says so,
Kirari can do much better"
"Idolchr_0204_A_09_00_035(0)","Ｐ","ああ、きらりにしかできないことがあるからな。
それを大切にして、きらりには活動していってほしい","Yeah, because there are things only Kirari can do.
I want Kirari to keep that in mind as she carries out her activities."
"Idolchr_0204_A_09_00_036(0)","きらり","うぇへへ♪　きらりんにしかできないことかぁ～
うん！　きらりんらしく活動していくにぃ♪","Hee hee hee......something only Kirarin can do~!
I'm going to work like Kirarin."
"Idolchr_0204_A_09_00_037(0)","きらり","だからＰちゃん、一緒に頑張ってほしいの。
よろしくおにゃーしゃー！　びしぃ！","So, P-chan, I want you to work with me.
Nice to meet you, Bishii!"
"Idolchr_0204_A_09_00_038(0)","Ｐ","こちらこそ、改めてよろしく。
これからも一緒に頑張っていこうな","Nice to meet you again, too.
Let's keep working together."
"Idolchr_0204_A_10_00_001(0)","きらりの声","すぅ……すぅ……うみゅ…………","Suu...... Suu...... Umu............"
"Idolchr_0204_A_10_00_002(0)","Ｐ","（きらりが昼寝してる？　珍しいな。
杏と一緒に寝てるのかな）","(Kirari is taking a nap? That's rare.
(Is he sleeping with Anzu?)"
"Idolchr_0204_A_10_00_003(0)","きらり","うみゅ～……すぅ……","Umu~...... suu......"
"Idolchr_0204_A_10_00_004(0)","Ｐ","（ひとりで寝てるのか。最近張り切ってるから、
疲れたんだろうな。そっとしておこう）","(Sleeping alone, since you've been on a roll lately,
(She must be tired; let's leave him alone.)"
"Idolchr_0204_A_10_00_005(0)","きらり","ふみゅ……。
どらたたたたたたたたたたたたたたっ！","Fumyu. .......
Doratatatatatatatatatatatatatatatatatatatatatatatatatatatatatatatatatatat!"
"Idolchr_0204_A_10_00_006(0)","Ｐ","な、何だ！？","Hey, what the hell?"
"Idolchr_0204_A_10_00_007(0)","きらり","ふぁ……ありゃりゃ、夢？
きらりん、今ミシンをかけてたんだけど……","Fu...... ah, a dream?
Kirarin, I was just working on my sewing machine: ......"
"Idolchr_0204_A_10_00_008(0)","Ｐ","もしかして、今の、ミシンの音だったのか？
夢でまで裁縫するなんて、本当に好きなんだな","Perhaps that was the sound of a sewing machine?
You must really love sewing, even in your dreams."
"Idolchr_0204_A_10_00_009(0)","きらり","うん！　イメージしたお洋服ができていくのって、
すっごーく、たのすぃーんだよぉ☆","Yes! It's like having an image of the clothes you're going to wear,
It's sooo fun!"
"Idolchr_0204_A_10_00_010(0)","きらり","でも、夢中になっちゃって、ついつい、
夜更かししちゃうにぃ……","But I got carried away,
I'll be up late ......"
"Idolchr_0204_A_10_00_011(0)","きらり","きゃわゆい杏ちゃんに、きゃわゆいお洋服を
着てほしくって、きらり張り切っちゃうの☆","Cute clothes for cute Anzu!
I want her to wear it, so Kirari gets all worked up."
"Idolchr_0204_A_10_00_012(0)","Ｐ","それで、夢の中でまで杏の衣装を作ってたのか？","So you were making apricot costumes even in your dreams?"
"Idolchr_0204_A_10_00_013(0)","きらり","うん！
杏ちゃんの衣装を縫い縫いしてたんだよぉ！","
I was sewing and stitching Anzu's costume!"
"Idolchr_0204_A_10_00_014(0)","きらり","上手にできたって思ったんだけど、
夢だったのかぁ……しょんぼり～","I thought I did well,
It was a dream... ...... Shonen~"
"Idolchr_0204_A_10_00_015(0)","Ｐ","でも、夜更かしはよくないぞ。無理はしないこと。
顔にも疲れが出てるじゃないか","But don't stay up too late, and don't overdo it.
You look tired."
"Idolchr_0204_A_10_00_016(0)","きらり","ふみゅ～。そうだにぃ……。
みんなにも迷惑かけちゃうし。きらり、反省……","Fumyu~ yes, I know. ......
Kirari, I'm sorry. ......"
"Idolchr_0204_A_10_00_017(0)","きらり","ねえ、Ｐちゃん。
今のきらり、そんなに疲れた顔してる？","Hey, P-chan.
Does Kirari look so tired now?"
"Idolchr_0204_A_10_00_018(0)","Ｐ","ああ、パッと見ただけでも……","Oh, just a quick glance: ......"
"Idolchr_0204_A_10_00_019(0)","選択肢","眠そうな顔してる","You look sleepy."
"Idolchr_0204_A_10_00_020(0)","選択肢","隈ができてる","It's shaded."
"Idolchr_0204_A_10_00_021(0)","選択肢","肌が荒れてる","Rough skin."
"Idolchr_0204_A_10_00_022(0)","選択肢","ヨダレのあとがある","There are drool marks."
"Idolchr_0204_A_10_00_023(0)","Ｐ","眠そうな顔してるぞ。
まだぼーっとしている感じがするな","You look sleepy.
You still seem to be in a daze."
"Idolchr_0204_A_10_00_024(0)","きらり","うぴゃ……。Ｐちゃんにはお見通しだにぃ～","Upia....... P-chan can see right through you~!"
"Idolchr_0204_A_10_00_025(0)","きらり","うぇへへ♪　Ｐちゃんって、きらりんのこと
すっごくよく見てくれてるんだにぃ☆","Eheheheh... P-chan means Kirari.
She's really paying attention to me."
"Idolchr_0204_A_10_00_026(0)","Ｐ","うっすら隈ができてるぞ","You've got some shading."
"Idolchr_0204_A_10_00_027(0)","きらり","うぴゃ、ほんとにぃ！？　お昼寝をしたら
取れるかなぁ……っと、その前に鏡、鏡～","Woopya, really! After taking a nap...
I wonder if I can get it off ...... but first, mirror, mirror~!"
"Idolchr_0204_A_10_00_028(0)","きらり","ん～……？　これくらいなら大丈夫！
……って、Ｐちゃんよく気付いたにぃ～","Hmmm... ......? This is about right!
How did you notice ......, P-chan?"
"Idolchr_0204_A_10_00_029(0)","Ｐ","肌が荒れてる気がするぞ","You're skin feels rough."
